392032107402256385,PERFECT STORM: New South Wales' Worst Fires In A Decade Could Soon Get A Whole Lot Worse - http://t.co/zYnun00Dp1 #NSWfires,Media,Other Useful Information,Related and informative,perfect storm new south wales worst fires decade could soon get whole lot worse http co zynun00dp1 nswfires,1,2,2023-01-25 17:00:00,2023-01-25 17:00:00,242.0,18.0,,789.9
392033197883543552,"This must be where all smoke blanketed Southern #Sydney coming from, even at airport its thick. #nswfires #Bushfires http://t.co/DBz14vRSMP",Eyewitness,Affected individuals,Related and informative,must smoke blanketed southern sydney coming even airport thick nswfires bushfires http co dbz14vrsmp,1,6,2023-01-25 18:00:00,2023-01-25 18:00:00,18.0,43.0,,422.6
392036079391371264,RT @larryemdur: Dear pathetic arseholes  looting houses in NSW fire zones .. You are disgusting pieces of shit !!!!,Outsiders,Sympathy and support,Related - but not informative,rt larryemdur dear pathetic arseholes looting houses nsw fire zones disgusting pieces shit,2,7,2023-01-25 19:00:00,2023-01-25 19:00:00,43.0,118.0,,449.7
392037442552741888,RT @Lee_Tennant: NSW in state of emergency amid fears of potential mega-fire http://t.co/sSF5TUs8lc   Can't wait for the next El Nino. #cli…,Outsiders,Caution and advice,Related and informative,rt lee_tennant nsw state emergency amid fears potential mega fire http co ssf5tus8lc wait next el nino cli,1,1,2023-01-25 20:00:00,2023-01-25 20:00:00,118.0,207.0,,448.7
392042572157583360,Encabezado! #RedOctober @RedSox @Cardinals WORLD SERIES COMING SOON!,Not labeled,Not labeled,Not related,encabezado redoctober redsox cardinals world series coming soon,0,0,2023-01-25 21:00:00,2023-01-25 21:00:00,207.0,169.0,,459.6
392043595563155457,RT @AlexChesser: Three big days ahead for firefighters. Help us by planning ahead &amp; knowing what you will do if threatend by #nswfires http…,Eyewitness,Caution and advice,Related and informative,rt alexchesser three big days ahead firefighters help us planning ahead amp knowing threatend nswfires http,1,1,2023-01-25 22:00:00,2023-01-25 22:00:00,169.0,127.0,,422.2
392043641704685568,RT @LC2020: If you live near a bush fire zone please put out a bucket of water for wildlife. Please retweet #nswfires #wildlife http://t.co…,Outsiders,Other Useful Information,Related and informative,rt lc2020 live near bush fire zone please put bucket water wildlife please retweet nswfires wildlife http co,1,2,2023-01-25 23:00:00,2023-01-25 23:00:00,127.0,208.0,,450.6
392046091199197185,NSW bushfires live: residents evacuate amid worst conditions in 45 years: RFS chief warns three major fires co... http://t.co/cY2o32MuP7,Media,Affected individuals,Related and informative,nsw bushfires live residents evacuate amid worst conditions 45 years rfs chief warns three major fires co http co cy2o32mup7,1,6,2023-01-26 00:00:00,2023-01-26 00:00:00,208.0,297.0,,426.0
392047634690473985,Photo | The @RBB_net show a sign of respect to the victims of the NSW fires. #GoWanderers #aleague http://t.co/74qvVM5DaY,Media,Sympathy and support,Related - but not informative,photo rbb_net show sign respect victims nsw fires gowanderers aleague http co 74qvvm5day,2,7,2023-01-26 01:00:00,2023-01-26 01:00:00,297.0,168.0,,430.0
392048364516171776,RT @WSWFCNews: Photo | The @RBB_net show a sign of respect to the victims of the NSW fires. #GoWanderers #aleague http://t.co/74qvVM5DaY,Media,Sympathy and support,Related - but not informative,rt wswfcnews photo rbb_net show sign respect victims nsw fires gowanderers aleague http co 74qvvm5day,2,7,2023-01-26 02:00:00,2023-01-26 02:00:00,168.0,166.0,,395.1
392049119465730048,Smokey @NSWHealth #nswfires #NSWRFS @DailyTelePhoto #NoFilter http://t.co/KYKcdCwXiN,Government,Not applicable,Related and informative,smokey nswhealth nswfires nswrfs dailytelephoto nofilter http co kykcdcwxin,1,5,2023-01-26 03:00:00,2023-01-26 03:00:00,166.0,226.0,,1027.2
392050230989836288,"To all my friends and acquaintances in the path of the fires or working as firefighters, stay safe today! #nswfires",Outsiders,Sympathy and support,Related - but not informative,friends acquaintances path fires working firefighters stay safe today nswfires,2,7,2023-01-26 04:00:00,2023-01-26 04:00:00,13.0,26.0,,341.5
392051057259323392,RT @9NewsSyd: UPDATE: #GreatWesternHighway open however all motorists advised to avoid non-essential travel- via: @LiveTrafficSyd #nswfires,Media,Caution and advice,Related and informative,rt 9newssyd update greatwesternhighway open however motorists advised avoid non essential travel via livetrafficsyd nswfires,1,1,2023-01-26 05:00:00,2023-01-26 05:00:00,26.0,94.0,,408.2
392053049549529088,#nswfires  bargo NSW http://t.co/ryo49qavVA,Outsiders,Other Useful Information,Related and informative,nswfires bargo nsw http co ryo49qavva,1,2,2023-01-26 06:00:00,2023-01-26 06:00:00,94.0,219.0,,612.7
392059814966087680,Kudos to N Coast Voices! It seems to have 1st spotted the mind-blowing story re bodgy Abbott #NSWFires photos http://t.co/HWgQc71sP5 #auspol,Outsiders,Other Useful Information,Related and informative,kudos n coast voices seems 1st spotted mind blowing story bodgy abbott nswfires photos http co hwgqc71sp5 auspol,1,2,2023-01-26 07:00:00,2023-01-26 07:00:00,219.0,217.0,,359.6
392063145243455488,Local RFS team advise a meeting will be held tonight at the #Blackheath Community Centre at 7:30pm #nswfires,Government,Caution and advice,Related and informative,local rfs team advise meeting held tonight blackheath community centre 7 30pm nswfires,1,1,2023-01-26 08:00:00,2023-01-26 08:00:00,217.0,31.0,,411.9
392067054309609472,RT @9NewsSyd: UPDATE: Watch &amp; Act alerts in place for #MtVictoria &amp; #Balmoral in Southern Highlands. @thetodayshow #nswfires http://t.co/j6…,Media,Caution and advice,Related and informative,rt 9newssyd update watch amp act alerts place mtvictoria amp balmoral southern highlands thetodayshow nswfires http co j6,1,1,2023-01-26 09:00:00,2023-01-26 09:00:00,31.0,215.0,,478.7
392067347923472384,#fnre #nswbushfires Regular bushfire updates available through NSW RFS http://t.co/8frNCTT684 http://t.co/3m1pYGhLoj,Government,Caution and advice,Related and informative,fnre nswbushfires regular bushfire updates available nsw rfs http co 8frnctt684 http co 3m1pyghloj,1,1,2023-01-26 10:00:00,2023-01-26 10:00:00,215.0,111.0,,2685.8
392067356295315456,#fnre #nswbushfires Regular bushfire updates available through NSW RFS http://t.co/5IPF1Hz7Cc http://t.co/mPgpipzmOh,Government,Caution and advice,Related and informative,fnre nswbushfires regular bushfire updates available nsw rfs http co 5ipf1hz7cc http co mpgpipzmoh,1,1,2023-01-26 11:00:00,2023-01-26 11:00:00,111.0,116.0,,1194.2
392068824314298368,"@Maria_Savva Great thanks, although the air in Sydney is thick with smoke from the bush fires. Hope you are well.",Eyewitness,Sympathy and support,Related - but not informative,maria_savva great thanks although air sydney thick smoke bush fires hope well,2,7,2023-01-26 12:00:00,2023-01-26 12:00:00,116.0,36.0,,409.1
392069885469028353,#fnre #nswbushfires NSW residents download 'Fires Near Me NSW' App from iTunes using link https://t.co/gZZFHH60Ws http://t.co/BlXQbYvvT5,Media,Other Useful Information,Related and informative,fnre nswbushfires nsw residents download fires near nsw app itunes using link https co gzzfhh60ws http co blxqbyvvt5,1,2,2023-01-26 13:00:00,2023-01-26 13:00:00,36.0,78.0,,414.7
392069923230330880,RT @ASNSW: SMOKE HAZE: Cover your nose and mouth with a mask designed to filter fine particles #nswfires #smokehaze,Government,Caution and advice,Related and informative,rt asnsw smoke haze cover nose mouth mask designed filter fine particles nswfires smokehaze,1,1,2023-01-26 14:00:00,2023-01-26 14:00:00,301.0,20.0,,446.0
392070321701781505,RT @australian: Fears grow blazes will form 'mega-fire': NSW fire chiefs are growing increasingly worried major bushfires in t... http://t.…,Media,Caution and advice,Related and informative,rt australian fears grow blazes form mega fire nsw fire chiefs growing increasingly worried major bushfires http,1,1,2023-01-26 15:00:00,2023-01-26 15:00:00,273.0,138.0,,326.7
392071970063679488,Fear of super-fire in Australia may force mass evacuations affecting tens of thousands of people http://t.co/oe4O1N6pfz,Media,Caution and advice,Related and informative,fear super fire australia may force mass evacuations affecting tens thousands people http co oe4o1n6pfz,1,1,2023-01-26 16:00:00,2023-01-26 16:00:00,138.0,284.0,,489.7
392072603386388480,(Video) 'We're planning for the worst but hoping for the best' ~ Australia declares fire emergency http://t.co/5UtRvzf28V,Media,Caution and advice,Related and informative,video planning worst hoping best australia declares fire emergency http co 5utrvzf28v,1,1,2023-01-26 17:00:00,2023-01-26 17:00:00,284.0,114.0,,464.9
392073169621614592,RT @9NewsSyd: CALL OUT: Is Sydney's smoke haze affecting your health today? Send an email to news@nine.com.au #9NEWSat6 #nswfires http://t.…,Media,Other Useful Information,Related and informative,rt 9newssyd call sydney smoke haze affecting health today send email news nine com au 9newsat6 nswfires http,1,2,2023-01-26 18:00:00,2023-01-26 18:00:00,114.0,245.0,,397.5
392074683744399360,Impressive interview on ABC radio this am by NSW Emergency Services Minister Michael Gallacher on the NSW bush fires. #bushfires #nswpol,Media,Other Useful Information,Related - but not informative,impressive interview abc radio nsw emergency services minister michael gallacher nsw bush fires bushfires nswpol,2,2,2023-01-26 19:00:00,2023-01-26 19:00:00,245.0,48.0,,376.8
392080677417410560,RT @UOW__: #UOW digital media student Geordie McAleer records timelapse of Blue Mountain #bushfires #NSWfires #NSWRFS http://t.co/qx7Gy43M5h,Media,Other Useful Information,Related and informative,rt uow__ uow digital media student geordie mcaleer records timelapse blue mountain bushfires nswfires nswrfs http co qx7gy43m5h,1,2,2023-01-26 20:00:00,2023-01-26 20:00:00,48.0,206.0,,402.5
392081117844492288,RT @TripleMSydney: RT: Bilpin Village - expect to become isolated with no electricity for some days due to #nswfires Prepare yourself now i…,Eyewitness,Caution and advice,Related and informative,rt triplemsydney rt bilpin village expect become isolated electricity days due nswfires prepare,1,1,2023-01-26 21:00:00,2023-01-26 21:00:00,206.0,144.0,,356.9
392081218499379201,RT @SheridaKeenan: NSW fires..#CSG SANTOS is EXEMPT from Fire Bans.??regulation called ‘SCHEDULE 15 – ..CONTINUE TO OPERATE ...NO MATTER WH…,Media,Other Useful Information,Related and informative,rt sheridakeenan nsw fires csg santos exempt fire bans regulation called schedule 15 continue operate matter wh,1,2,2023-01-26 22:00:00,2023-01-26 22:00:00,144.0,172.0,,358.4
392083277877493760,"RT @Sandra_Sully: #nswrfs - we're not planning a mass evacuation of whole Blue Mountains.. But if you don't need to be there, don't go ther…",Media,Caution and advice,Related and informative,rt sandra_sully nswrfs planning mass evacuation whole blue mountains need go ther,1,1,2023-01-26 23:00:00,2023-01-26 23:00:00,237.0,24.0,,452.4
392086121649172481,RT @newcastleherald: THANK YOU firefighters battling the #NSWbushfires. Leave your message of support here http://t.co/msCzI3x8AB Pls RT ht…,Media,Sympathy and support,Related - but not informative,rt newcastleherald thank firefighters battling nswbushfires leave message support http co msczi3x8ab pls rt ht,2,7,2023-01-27 00:00:00,2023-01-27 00:00:00,304.0,35.0,,378.0
392087866475425792,"EMERGENCY WARNING - #rfsnsw maintain emergency warning for Bell, Dargan, Clarence &amp; Bilpin http://t.co/QfMJpfZzjX #nswfires",Government,Caution and advice,Related and informative,emergency warning rfsnsw maintain emergency warning bell dargan clarence amp bilpin http co qfmjpfzzjx nswfires,1,1,2023-01-27 01:00:00,2023-01-27 01:00:00,35.0,115.0,,503.6
392088210383179776,RT @CNN: 56 fires scorch eastern Australia; state of emergency declared: http://t.co/bO2OouJMrP,Media,Caution and advice,Related and informative,rt cnn 56 fires scorch eastern australia state emergency declared http co bo2ooujmrp,1,1,2023-01-27 02:00:00,2023-01-27 02:00:00,115.0,86.0,,1228.5
392089158295883776,RT @CanberraCamper: Government instrumentalities #argh #nswfires,Not labeled,Not labeled,Not related,rt canberracamper government instrumentalities argh nswfires,0,0,2023-01-27 03:00:00,2023-01-27 03:00:00,86.0,214.0,,2712.1
392089527403024384,Hoping this is over soon for all concerned. #nswfires,Outsiders,Sympathy and support,Related - but not informative,hoping soon concerned nswfires,2,7,2023-01-27 04:00:00,2023-01-27 04:00:00,214.0,27.0,,471.1
392090353680908289,RT @marykissel: Australia's PM fights fires (literally) for 14 hours as 'volunteer firey.' Wow.  http://t.co/3EOYVaVqSZ via @australian,Outsiders,Donations and volunteering,Related and informative,rt marykissel australia pm fights fires literally 14 hours volunteer firey wow http co 3eoyvavqsz via australian,1,4,2023-01-27 05:00:00,2023-01-27 05:00:00,27.0,216.0,,419.6
392091221893455872,RT @abcnews: I've seen every major bushfire since 1963. This has potentially got to be the worst: http://t.co/ZgXizGHPXF #nswfires #knowt…,Media,Other Useful Information,Related and informative,rt abcnews seen every major bushfire since 1963 potentially got worst http co zgxizghpxf nswfires knowt,1,2,2023-01-27 06:00:00,2023-01-27 06:00:00,216.0,218.0,,359.8
392092018802839552,RT @bazarazzi: Government cut in aid 'heartless'. Appalling. Shame on you @MichaelKeenanMP. http://t.co/G5OnmYTkn6 #nswfires,Media,Sympathy and support,Related and informative,rt bazarazzi government cut aid heartless appalling shame michaelkeenanmp http co g5onmytkn6 nswfires,1,7,2023-01-27 07:00:00,2023-01-27 07:00:00,218.0,76.0,,356.6
392093566513577986,RT @Channel9: #NSWFires UPDATE: 58 fires are still burning with 14 uncontained! For emergency information on the fires call 1800 679 737 #9…,Media,Caution and advice,Related and informative,rt channel9 nswfires update 58 fires still burning 14 uncontained emergency information fires call 1800 679 737 9,1,1,2023-01-27 08:00:00,2023-01-27 08:00:00,76.0,238.0,,424.6
392098591306575872,RT @willb_photos: State mine fire WNW of Lithgow. Looks like the wind has kicked it into gear #nswfires http://t.co/QuvhRVwQik,Media,Infrastructure and utilities,Related and informative,rt willb_photos state mine fire wnw lithgow looks like wind kicked gear nswfires http co quvhrvwqik,1,3,2023-01-27 09:00:00,2023-01-27 09:00:00,238.0,50.0,,527.9
392099551781593089,RT @adam_wilkinson: Sydney fire 300km wide. Worst fire conditions in 40yrs. Katoomba preparing to evacuate &amp; state of emergency declared. S…,Media,Caution and advice,Related and informative,rt adam_wilkinson sydney fire 300km wide worst fire conditions 40yrs katoomba preparing evacuate amp state emergency declared,1,1,2023-01-27 10:00:00,2023-01-27 10:00:00,91.0,52.0,,424.1
392100344521437184,RT @NSWRFS: Watch and Act - Hall Road (Southern Highlands / Wollondilly).  http://t.co/MRi7pZuDxe Picton Rd now open #nswrfs #nswfires,Government,Caution and advice,Related and informative,rt nswrfs watch act hall road southern highlands wollondilly http co mri7pzudxe picton rd open nswrfs nswfires,1,1,2023-01-27 11:00:00,2023-01-27 11:00:00,52.0,75.0,,350.2
392111513932025857,"RT @FitzySA: Unbelievable effort by firies all across Australia trying to contain NSW fires. Such sad scenes of loss, praying for everyone …",Outsiders,Sympathy and support,Related - but not informative,rt fitzysa unbelievable effort firies across australia trying contain nsw fires sad scenes loss praying everyone,2,7,2023-01-27 12:00:00,2023-01-27 12:00:00,75.0,171.0,,397.2
392115699855810560,"RT @Jess_twitt13: Was so sad driving around seeing what the #nswfires have done around here, #wyongshire http://t.co/hNAoUEozw6",Outsiders,Sympathy and support,Related and informative,rt jess_twitt13 sad driving around seeing nswfires done around wyongshire http co hnaoueozw6,1,7,2023-01-27 13:00:00,2023-01-27 13:00:00,44.0,7.0,,380.6
392116228325527552,This map gives you a sense of how big the fires are in the Blue Mountains region. #nswfires http://t.co/D5IYn3Cchu,Media,Other Useful Information,Related and informative,map gives sense big fires blue mountains region nswfires http co d5iyn3cchu,1,2,2023-01-27 14:00:00,2023-01-27 14:00:00,256.0,1.0,,1149.5
392117788615000064,RT @EdJReporter: Fears #nswfires could join up and form a mega-blaze. Via @nswfire: @DeptDefence closely monitoring #nswfires crisis http:/…,Media,Other Useful Information,Related and informative,rt edjreporter fears nswfires could join form mega blaze via nswfire deptdefence closely monitoring nswfires crisis http,1,2,2023-01-27 15:00:00,2023-01-27 15:00:00,1.0,46.0,,448.5
392119210488258561,RT @AJELive: #Australia weather increases threat of fires http://t.co/14W5O8pAm2,Media,Other Useful Information,Related and informative,rt ajelive australia weather increases threat fires http co 14w5o8pam2,1,2,2023-01-27 16:00:00,2023-01-27 16:00:00,212.0,270.0,,328.7
392122301690310656,RT @larryemdur: Dear pathetic arseholes  looting houses in NSW fire zones .. You are disgusting pieces of shit !!!!,Outsiders,Sympathy and support,Related - but not informative,rt larryemdur dear pathetic arseholes looting houses nsw fire zones disgusting pieces shit,2,7,2023-01-27 17:00:00,2023-01-27 17:00:00,270.0,32.0,,352.3
392122528191094784,Australia weather increases threat of fires: Fifteen fires continue to burn out of control in  New South Wales... http://t.co/Y9b3bcaXtz,Media,Infrastructure and utilities,Related and informative,australia weather increases threat fires fifteen fires continue burn control new south wales http co y9b3bcaxtz,1,3,2023-01-27 18:00:00,2023-01-27 18:00:00,32.0,10.0,,406.7
392124126199939073,RT @JohnJohnsonson: EXLCUSIVE: FIRST PICS OF LUTING IN #NSWFIRES http://t.co/cyrt8AmENO,Outsiders,Affected individuals,Related and informative,rt johnjohnsonson exlcusive first pics luting nswfires http co cyrt8ameno,1,6,2023-01-27 19:00:00,2023-01-27 19:00:00,3.0,247.0,,424.5
392125422248280064,This is just horrible #nswfires http://t.co/obeebGSatV,Outsiders,Other Useful Information,Related - but not informative,horrible nswfires http co obeebgsatv,2,2,2023-01-27 20:00:00,2023-01-27 20:00:00,247.0,249.0,,609.8
392127389402013696,Sitting here inhaling the #nswbushfires smoke. Can't imagine what ppl are going through. Buy an ad this week &amp; we'll donate to the victims.,Outsiders,Donations and volunteering,Related and informative,sitting inhaling nswbushfires smoke imagine ppl going buy ad week amp donate victims,1,4,2023-01-27 21:00:00,2023-01-27 21:00:00,249.0,225.0,,515.0
392132913271013376,RT @ABCthedrum: The fires in NSW are a devastating reminder of the urgency of action on climate change | Frank Jotzo http://t.co/jRaF0NwDeL,Media,Other Useful Information,Related - but not informative,rt abcthedrum fires nsw devastating reminder urgency action climate change frank jotzo http co jraf0nwdel,2,2,2023-01-27 22:00:00,2023-01-27 22:00:00,261.0,260.0,,294.1
392136239383465985,"Fears Australia blazes could merge: Wildfires in New South Wales could merge to form a massive blaze, the fire... http://t.co/gEEPbCujsd",Media,Other Useful Information,Related and informative,fears australia blazes could merge wildfires new south wales could merge form massive blaze fire http co geepbcujsd,1,2,2023-01-27 23:00:00,2023-01-27 23:00:00,260.0,259.0,,340.6
392138995007647744,RT @Channel9: #NSWFires UPDATE: A big concern for the area of Wilton. An Emergency warning has been issued residents should seek shelter. @…,Media,Caution and advice,Related and informative,rt channel9 nswfires update big concern area wilton emergency warning issued residents seek shelter,1,1,2023-01-28 00:00:00,2023-01-28 00:00:00,259.0,103.0,,360.7
392139355730362368,BREAKING: 11yo boy now charged with lighting fires: http://t.co/iZhKm9dspR #NSWfires #sydneyfires #liveblog,Media,Other Useful Information,Related and informative,breaking 11yo boy charged lighting fires http co izhkm9dspr nswfires sydneyfires liveblog,1,2,2023-01-28 01:00:00,2023-01-28 01:00:00,103.0,302.0,,346.7
392139414463201281,The Australian Inferno: Nick Moir's photographs of the #NSWFires #Bushfires @nampix via @DrRimmer http://t.co/Sb7tlPFPOP …,Media,Other Useful Information,Related and informative,australian inferno nick moir photographs nswfires bushfires nampix via drrimmer http co sb7tlpfpop,1,2,2023-01-28 02:00:00,2023-01-28 02:00:00,302.0,104.0,,1093.8
392139951338295296,"RT @smh: New emergency warning issued. Burning embers being blown towards Wilton, @NSWRFS says: http://t.co/sNgMIGq9YA #nswfires",Media,Caution and advice,Related and informative,rt smh new emergency warning issued burning embers blown towards wilton nswrfs says http co sngmigq9ya nswfires,1,1,2023-01-28 03:00:00,2023-01-28 03:00:00,104.0,71.0,,363.7
392140530143866880,RT @NSWRFS: Hall Rd: An Emergency Alert Telephone Message has been sent to people in the Wilton Area #NSWRFS #nswfires,Government,Caution and advice,Related and informative,rt nswrfs hall rd emergency alert telephone message sent people wilton area nswrfs nswfires,1,1,2023-01-28 04:00:00,2023-01-28 04:00:00,71.0,88.0,,360.2
392140622397591552,"World gets picture as fire story shared: AS firefighters toil at the black-red coalface, the story of the NSW ... http://t.co/EnjnRMzBPo",Outsiders,Other Useful Information,Related and informative,world gets picture fire story shared firefighters toil black red coalface story nsw http co enjnrmzbpo,1,2,2023-01-28 05:00:00,2023-01-28 05:00:00,88.0,268.0,,372.8
392141691970273280,@kumitaguchi if you could use #nswfires that would be great,Eyewitness,Other Useful Information,Related - but not informative,kumitaguchi could use nswfires would great,2,2,2023-01-28 06:00:00,2023-01-28 06:00:00,268.0,240.0,,420.3
392142312727261185,RT @LauraTunstall9: Exhausted firefighters have worked through the night here in Winmalee ahead of horror weather conditions #nswfires http…,Eyewitness,Affected individuals,Related and informative,rt lauratunstall9 exhausted firefighters worked night winmalee ahead horror weather conditions nswfires http,1,6,2023-01-28 07:00:00,2023-01-28 07:00:00,240.0,9.0,,451.3
392150814568882176,Australia fires: NSW Blue Mountains fires 'could merge' - BBC News http://t.co/iI1kEp2sr6,Media,Caution and advice,Related and informative,australia fires nsw blue mountains fires could merge bbc news http co ii1kep2sr6,1,1,2023-01-28 08:00:00,2023-01-28 08:00:00,9.0,239.0,,358.1
392151418540281856,"RT @EmergencyAUS: NSW - For scale, latest #Lithgow #bushfire perimeter overlaid across #Sydney. #nswfires http://t.co/NrxKauEQ88 http://t.c…",Government,Caution and advice,Related and informative,rt emergencyaus nsw scale latest lithgow bushfire perimeter overlaid across sydney nswfires http co nrxkaueq88 http c,1,1,2023-01-28 09:00:00,2023-01-28 09:00:00,239.0,23.0,,441.0
392152081248694273,Take care with all this Bushfire smoke around: some helpful tips from Asthma Australia Foundation. #ausunions #fires http://t.co/r6QV8QLXfw,Business,Sympathy and support,Related and informative,take care bushfire smoke around helpful tips asthma australia foundation ausunions fires http co r6qv8qlxfw,1,7,2023-01-28 10:00:00,2023-01-28 10:00:00,23.0,22.0,,319.8
392152731357429761,RT @channeltennews: If you need to stay up to date with bushfire conditions – make sure you also follow @NSWRFS on twitter. #SydneyFires #n…,Media,Caution and advice,Related and informative,rt channeltennews need stay date bushfire conditions make sure also follow nswrfs twitter sydneyfires n,1,1,2023-01-28 11:00:00,2023-01-28 11:00:00,22.0,49.0,,447.5
392152962077704192,RT @newscomauHQ: #UPDATE: An 11-year-old boy has now officially been charged with lighting two fires: http://t.co/x3s4UIhXds | #nswfires,Media,Other Useful Information,Related and informative,rt newscomauhq update 11 year old boy officially charged lighting two fires http co x3s4uihxds nswfires,1,2,2023-01-28 12:00:00,2023-01-28 12:00:00,276.0,258.0,,427.0
392153104650493952,RT @RedCrossAU: It's another high risk day for #NSWfires. Donate to help affected #communities respond &amp; recover: http://t.co/ndrwPyV5yr,NGOs,Donations and volunteering,Related and informative,rt redcrossau another high risk day nswfires donate help affected communities respond amp recover http co ndrwpyv5yr,1,4,2023-01-28 13:00:00,2023-01-28 13:00:00,155.0,157.0,,353.4
392153515688484864,15:58 Oct 21 NSW #Bushfire Emergency Warning: Springwood (Blue Mountains).  Details: http://t.co/uEc8okGkqM,Media,Caution and advice,Related and informative,15 58 oct 21 nsw bushfire emergency warning springwood blue mountains details http co uec8okgkqm,1,1,2023-01-28 14:00:00,2023-01-28 14:00:00,157.0,158.0,,331.7
392153620575039488,"Fears Australia blazes could merge: Bushfires in New South Wales could merge to form a massive blaze, the fire... http://t.co/yvS1XJfGuz",Media,Other Useful Information,Related and informative,fears australia blazes could merge bushfires new south wales could merge form massive blaze fire http co yvs1xjfguz,1,2,2023-01-28 15:00:00,2023-01-28 15:00:00,158.0,286.0,,383.8
392153889014697984,RT @heldavidson: Southern Highlands bushfire upgraded to emergency warning. @guardianaus #nswfires live blog http://t.co/zzicrJMPLd,Media,Caution and advice,Related and informative,rt heldavidson southern highlands bushfire upgraded emergency warning guardianaus nswfires live blog http co zzicrjmpld,1,1,2023-01-28 16:00:00,2023-01-28 16:00:00,286.0,102.0,,330.1
