392818002506153984,Amazing and terrifying RT @workmanalice: Amazing photo from a friend in Katoomba on the road to Blackheath. #nswfires http://t.co/17TQTT40Af,Media,Other Useful Information,Related and informative,amazing terrifying rt workmanalice amazing photo friend katoomba road blackheath nswfires http co 17tqtt40af,1,2,2023-02-06 19:00:00,2023-02-06 19:00:00,217.0,98.0,,411.7
392825795531382784,RT @ShannonCarr_10: “@LittleM_BigA: Fire at minmi from edgeworth @1233newcastle #nswfires http://t.co/hHAtgLpJW0”,Media,Infrastructure and utilities,Related and informative,rt shannoncarr_10 littlem_biga fire minmi edgeworth 1233newcastle nswfires http co hhatglpjw0,1,3,2023-02-06 20:00:00,2023-02-06 20:00:00,98.0,31.0,,3.2
392833026490503168,"#nswfires ALERT  Damaging winds around 60km/h with peak gusts of 90km/h forecast for #sydney Illawarra, Southern Tablelands, Snowy Mountains",Media,Other Useful Information,Related and informative,nswfires alert damaging winds around 60km h peak gusts 90km h forecast sydney illawarra southern tablelands snowy mountains,1,2,2023-02-06 21:00:00,2023-02-06 21:00:00,217.0,46.0,,354.0
392840957927751680,RT @byers_brian: We are giving away World Series tickets for game 3. #Cardinals fans RT this to enter. #Redbirds #RedOctober,Not labeled,Not labeled,Not related,rt byers_brian giving away world series tickets game 3 cardinals fans rt enter redbirds redoctober,0,0,2023-02-06 22:00:00,2023-02-06 22:00:00,46.0,31.0,,163.6
392844892176519168,#BBC Coverage of #Australia #nswbushfires  http://t.co/6J0g5FEsgf #Support from around the #Globe,Media,Sympathy and support,Related and informative,bbc coverage australia nswbushfires http co 6j0g5fesgf support around globe,1,7,2023-02-06 23:00:00,2023-02-06 23:00:00,721.0,445.0,,0.79
392849065513213952,"RT @NSWRFS: If you find an injured native animal, call WIRES 13000WIRES or DPI for livestock.  http://t.co/JcdwqBmU4P @WIRES_NSW #nswfires",NGOs,Not applicable,Related and informative,rt nswrfs find injured native animal call wires 13000wires dpi livestock http co jcdwqbmu4p wires_nsw nswfires,1,5,2023-02-07 00:00:00,2023-02-07 00:00:00,542.0,480.0,,2.575
392852450316546048,@NSWRFS @ABCNews24  Fire advice changing by the minute here at RFS headquarters. Two emergency alerts now -Minmy and Springwood.. #nswfires,NGOs,Caution and advice,Related and informative,nswrfs abcnews24 fire advice changing minute rfs headquarters two emergency alerts minmy springwood nswfires,1,1,2023-02-07 01:00:00,2023-02-07 01:00:00,770.0,702.0,,0.926
392854996271652864,Sending love &amp; safe thoughts to my fellow #novacastrians as these #nswfires burn #keepsafe.,Outsiders,Sympathy and support,Related - but not informative,sending love amp safe thoughts fellow novacastrians nswfires burn keepsafe,2,7,2023-02-07 02:00:00,2023-02-07 02:00:00,32.0,266.0,,0.596
392855734464962561,"RT @ErinEdwards7: Horrid emergency unfolding at #faulconbridge - fire is 50m behind #springwood shs - near hundreds of homes, norman lindsa…",Eyewitness,Caution and advice,Related and informative,rt erinedwards7 horrid emergency unfolding faulconbridge fire 50m behind springwood shs near hundreds homes norman lindsa,1,1,2023-02-07 03:00:00,2023-02-07 03:00:00,34.0,56.0,,0.628
392856569148239873,"RT @9NewsSyd: 9CHOPPERCAM: Crews waterbombing #Minmi blaze, west of #Newcastle. Emergency warning in place. #nswfires http://t.co/2tjrOXHvrJ",Media,Caution and advice,Related and informative,rt 9newssyd 9choppercam crews waterbombing minmi blaze west newcastle emergency warning place nswfires http co 2tjroxhvrj,1,1,2023-02-07 04:00:00,2023-02-07 04:00:00,251.0,297.0,,0.725
392856996975628288,RT @illwah: Love your prayers in Aust for the NSW fires. Over 200 homes lost now &amp; 80 different fires burning. Pls pray for our fire fighte…,Outsiders,Sympathy and support,Related - but not informative,rt illwah love prayers aust nsw fires 200 homes lost amp 80 different fires burning pls pray fire fighte,2,7,2023-02-07 05:00:00,2023-02-07 05:00:00,233.0,41.0,,1.6130000000000002
392857508651356160,RT @AmandaGearing: Oakdale Road resident  Choppers flying over. Police doorknocking asking residents to prepare to evacuate. #nswfires #NSW…,Eyewitness,Donations and volunteering,Related and informative,rt amandagearing oakdale road resident choppers flying police doorknocking asking residents prepare evacuate nswfires nsw,1,4,2023-02-07 06:00:00,2023-02-07 06:00:00,680.0,129.0,,0.596
392857533829754880,"RT @NSWRFS: Emergency Warning: Linksview Rd, Springwood  http://t.co/l9TPwsbuM2 #nswfires #nswrfs",Government,Caution and advice,Related and informative,rt nswrfs emergency warning linksview rd springwood http co l9tpwsbum2 nswfires nswrfs,1,1,2023-02-07 07:00:00,2023-02-07 07:00:00,449.0,555.0,,3.909
392859526103195648,RT @byers_brian: We are giving away World Series tickets for game 3. #Cardinals fans RT this to enter. #Redbirds #RedOctober,Not labeled,Not labeled,Not related,rt byers_brian giving away world series tickets game 3 cardinals fans rt enter redbirds redoctober,0,0,2023-02-07 08:00:00,2023-02-07 08:00:00,871.0,763.0,,1.134
392863531688660994,RT @DaniIsdale: Thoughts with Blue Mountains communities and #NSWRFS crews as the weather turns this afternoon.,Outsiders,Sympathy and support,Related - but not informative,rt daniisdale thoughts blue mountains communities nswrfs crews weather turns afternoon,2,7,2023-02-07 09:00:00,2023-02-07 09:00:00,175.0,205.0,,1.295
392866866148171776,We're thinking of those fighting the fires in NSW and those whose homes and businesses are under threat. Stay... http://t.co/K0HG1yynyJ,Outsiders,Sympathy and support,Related and informative,thinking fighting fires nsw whose homes businesses threat stay http co k0hg1yynyj,1,7,2023-02-07 10:00:00,2023-02-07 10:00:00,739.0,241.0,,0.802
392868053160960001,"RT @7NewsSydney: CHOPPERCAM: Emergency warning issued for area of Stockrington Road, west of the M1, heading towards Minmi #NSWfires http:/…",Media,Caution and advice,Related and informative,rt 7newssydney choppercam emergency warning issued area stockrington road west m1 heading towards minmi nswfires http,1,1,2023-02-07 11:00:00,2023-02-07 11:00:00,126.0,720.0,,1.348
392868116037763073,PIC JUST NOW @NatWallaceNBN Residents waiting/ready to flee if the fire jumps the M1 #nswfires http://t.co/3QzO5Dp1fn http://t.co/D0jYUIsTKd,Outsiders,Other Useful Information,Related and informative,pic natwallacenbn residents waiting ready flee fire jumps m1 nswfires http co 3qzo5dp1fn http co d0jyuistkd,1,2,2023-02-07 12:00:00,2023-02-07 12:00:00,626.0,709.0,,0.589
392869617598623744,RT @LauraFirebirds: God bless everyone affected by the #nswbushfires and to all those courageous firies risking their lives for others safe…,Outsiders,Sympathy and support,Related - but not informative,rt laurafirebirds god bless everyone affected nswbushfires courageous firies risking lives others safe,2,7,2023-02-07 13:00:00,2023-02-07 13:00:00,97.0,397.0,,3.4210000000000003
392869852484222976,Australians evacuate homes as hot winds fan Sydney fire threat http://t.co/VxTvaaaEem,Media,Affected individuals,Related and informative,australians evacuate homes hot winds fan sydney fire threat http co vxtvaaaeem,1,6,2023-02-07 14:00:00,2023-02-07 14:00:00,222.0,734.0,,0.309
392873665127522304,RT @workmanalice: Another skyline photo from Annalise Wilson on Hat Hill Rd in Blackheath #nswfires http://t.co/hCBa2Xmjky,Eyewitness,Affected individuals,Related and informative,rt workmanalice another skyline photo annalise wilson hat hill rd blackheath nswfires http co hcba2xmjky,1,6,2023-02-07 15:00:00,2023-02-07 15:00:00,101.0,273.0,,1.445
392876068454944768,"RT @NSWRFS: UPDATE: The Gulguer Nature Reserve Fire is now contained, crews will remain on scene to patrol and black out. #nswfires #nswrfs",Government,Caution and advice,Related and informative,rt nswrfs update gulguer nature reserve fire contained crews remain scene patrol black nswfires nswrfs,1,1,2023-02-07 16:00:00,2023-02-07 16:00:00,408.0,295.0,,0.897
392876076860710912,State Mine: Photo from Mountain Lagoon Rd taken by Hawkesbury Gazette http://t.co/gQdixQfjr5 #nswfires #NSWRFS,Media,Other Useful Information,Related and informative,state mine photo mountain lagoon rd taken hawkesbury gazette http co gqdixqfjr5 nswfires nswrfs,1,2,2023-02-07 17:00:00,2023-02-07 17:00:00,509.0,697.0,,0.721
392876370465808384,"RT @FinancialReview: Horror fire conditions arrive in Sydney @NSWRFS  - 3 emergency alerts, 60 fires, 22 uncontained http://t.co/GU4Wx2waQT",Business,Caution and advice,Related and informative,rt financialreview horror fire conditions arrive sydney nswrfs 3 emergency alerts 60 fires 22 uncontained http co gu4wx2waqt,1,1,2023-02-07 18:00:00,2023-02-07 18:00:00,391.0,576.0,,4.126
392883190391521280,RT @abcnews: Prime Minister Tony Abbott has dismissed a UN assessment that the NSW fires are linked to climate change. http://t.co/dlTTNJjw…,Media,Other Useful Information,Related and informative,rt abcnews prime minister tony abbott dismissed un assessment nsw fires linked climate change http co dlttnjjw,1,2,2023-02-07 19:00:00,2023-02-07 19:00:00,506.0,822.0,,1.644
392884394131591169,RT @smh: Jittery pets takes over Penrith Stadium as owners evacuate: http://t.co/BhWlra2hVF. Photo by @mearesy #nswfires http://t.co/2ozPtG…,Not labeled,Not labeled,Not related,rt smh jittery pets takes penrith stadium owners evacuate http co bhwlra2hvf photo mearesy nswfires http co 2ozptg,0,0,2023-02-07 20:00:00,2023-02-07 20:00:00,785.0,69.0,,0.512
392884595462373376,RT @workmanalice: Amazing photo from a friend in Katoomba on the road to Blackheath. #nswfires http://t.co/7wrRgQ2f0X,Eyewitness,Other Useful Information,Related - but not informative,rt workmanalice amazing photo friend katoomba road blackheath nswfires http co 7wrrgq2f0x,2,2,2023-02-07 21:00:00,2023-02-07 21:00:00,603.0,245.0,,0.852
392885065258397696,"RT @BrianCHouston: Could you please pray for our home state in Australia, where the bush fire situation continues to worsen in treacherous …",Outsiders,Sympathy and support,Related - but not informative,rt brianchouston could please pray home state australia bush fire situation continues worsen treacherous,2,7,2023-02-07 22:00:00,2023-02-07 22:00:00,245.0,596.0,,3.851
392885958640537600,The firies seem to be doing an amazing job. Keep it up. #auspol #nswrfs,Outsiders,Sympathy and support,Related - but not informative,firies seem amazing job keep auspol nswrfs,2,7,2023-02-07 23:00:00,2023-02-07 23:00:00,35.0,841.0,,0.8440000000000001
392887804117520385,RT @ausjourno: New Dudley Bluff estate and Knoll Avenue evacuated. Fire imminent - crews in position #nswfires http://t.co/2EK5UZzgxp,Eyewitness,Caution and advice,Related and informative,rt ausjourno new dudley bluff estate knoll avenue evacuated fire imminent crews position nswfires http co 2ek5uzzgxp,1,1,2023-02-08 00:00:00,2023-02-08 00:00:00,249.0,120.0,,0.56
392889167266336768,RT @ABCNews24: #nswfires LIVE: NSW Rural Fire Service providing an update on  the #bushfires. Watch http://t.co/TtTI3ZYXOH http://t.co/p3IA…,Media,Caution and advice,Related and informative,rt abcnews24 nswfires live nsw rural fire service providing update bushfires watch http co ttti3zyxoh http co p3ia,1,1,2023-02-08 01:00:00,2023-02-08 01:00:00,134.0,263.0,,1.715
392889775436222465,It's so great to see and hear how well our country is pulling together to get through the #nswfires,Outsiders,Other Useful Information,Related - but not informative,great see hear well country pulling together get nswfires,2,2,2023-02-08 02:00:00,2023-02-08 02:00:00,448.0,638.0,,1.022
392891943912349696,RT @fadichahine: Every life is precious #nswfires http://t.co/7vdzxPPZ84,Outsiders,Other Useful Information,Related and informative,rt fadichahine every life precious nswfires http co 7vdzxppz84,1,2,2023-02-08 03:00:00,2023-02-08 03:00:00,123.0,635.0,,0.725
392892745020604416,RT @A_DarlingMP: Alex Salmond wants us to leave the Union. What assurances can he give that we won't end up on fire like Australia? http://…,Not applicable,Not applicable,Related and informative,rt a_darlingmp alex salmond wants us leave union assurances give end fire like australia http,1,5,2023-02-08 04:00:00,2023-02-08 04:00:00,635.0,155.0,,0.966
392893617439666176,New Watch and Act alert for fire at Galston Gorge. If that takes hold NW edge of Sydney is in trouble.,Outsiders,Caution and advice,Related and informative,new watch act alert fire galston gorge takes hold nw edge sydney trouble,1,1,2023-02-08 05:00:00,2023-02-08 05:00:00,656.0,748.0,,0.593
392895450350514176,"RT @MGHReeves: #NSWRFS crews working in hot, smokey and difficult conditions at Bilpin. Pic from #Inglesiderfs http://t.co/9n56IYxA6w",Outsiders,Other Useful Information,Related and informative,rt mghreeves nswrfs crews working hot smokey difficult conditions bilpin pic inglesiderfs http co 9n56iyxa6w,1,2,2023-02-08 06:00:00,2023-02-08 06:00:00,220.0,136.0,,1.796
392895848805572608,The skycrane working through the smoke at #faulconbridge Image l John Donegan http://t.co/JogpKfxJ1v,Eyewitness,Infrastructure and utilities,Related and informative,skycrane working smoke faulconbridge image l john donegan http co jogpkfxj1v,1,3,2023-02-08 07:00:00,2023-02-08 07:00:00,414.0,656.0,,5.859
392898658963709952,RT @RedCrossAU: Our hearts go out to families who have lost their homes. For tips on how to support those affected by #NSWbushfires: http:/…,NGOs,Donations and volunteering,Related and informative,rt redcrossau hearts go families lost homes tips support affected nswbushfires http,1,4,2023-02-08 08:00:00,2023-02-08 08:00:00,579.0,651.0,,3.726
392902760997216256,RT @NSWRFS: Stockrington Rd Fire: The M1 has reopened southbound. Northbound lanes remain closed. #nswfires #nswrfs,NGOs,Infrastructure and utilities,Related and informative,rt nswrfs stockrington rd fire m1 reopened southbound northbound lanes remain closed nswfires nswrfs,1,3,2023-02-08 09:00:00,2023-02-08 09:00:00,20.0,395.0,,0.402
392903553741631488,RT @TripleMSydney: PHOTOS: the real face of firefighters on the frontline @NSWRFS @QldFire @MFB_NEWS Thank you. #nswfires #heroes http://t.…,Media,Affected individuals,Related and informative,rt triplemsydney photos real face firefighters frontline nswrfs qldfire mfb_news thank nswfires heroes http,1,6,2023-02-08 10:00:00,2023-02-08 10:00:00,511.0,20.0,,0.772
392904245798002688,'Extreme fire danger' warning - An extreme fire danger warning is issued for the Sydney area. CNN's Robyn Curnow... http://t.co/Qk5YtFKsl2,Media,Caution and advice,Related and informative,extreme fire danger warning extreme fire danger warning issued sydney area cnn robyn curnow http co qk5ytfksl2,1,1,2023-02-08 11:00:00,2023-02-08 11:00:00,880.0,108.0,,0.58
392914375045947392,Thinking of all those that are afftected by the fires so sad #nswfires,Outsiders,Sympathy and support,Related - but not informative,thinking afftected fires sad nswfires,2,7,2023-02-08 12:00:00,2023-02-08 12:00:00,574.0,743.0,,0.76
392918498038398976,RT @NSWRFS: Important information about donations http://t.co/egTebLZWxk #nswfires,NGOs,Donations and volunteering,Related and informative,rt nswrfs important information donations http co egteblzwxk nswfires,1,4,2023-02-08 13:00:00,2023-02-08 13:00:00,573.0,152.0,,1.031
392919643095961600,RT @702sydney: Another shot of the cricket at #Faulconbridge A full pitch view  Photographer- @John__Donegan #nswfires @NSWRFS http://t.co/…,Media,Affected individuals,Related and informative,rt 702sydney another shot cricket faulconbridge full pitch view photographer john__donegan nswfires nswrfs http co,1,6,2023-02-08 14:00:00,2023-02-08 14:00:00,793.0,72.0,,2.219
392924500070629376,The bush fire threat to the Blue Mountains west of Sydney has been averted for the rest of today according to officials. #CroozeFmNews,Media,Infrastructure and utilities,Related and informative,bush fire threat blue mountains west sydney averted rest today according officials croozefmnews,1,3,2023-02-08 15:00:00,2023-02-08 15:00:00,446.0,793.0,,0.8
392925804524359680,Australia fire threat 'averted' http://t.co/DIrQ53cvSa,Media,Other Useful Information,Related and informative,australia fire threat averted http co dirq53cvsa,1,2,2023-02-08 16:00:00,2023-02-08 16:00:00,562.0,446.0,,1.631
392926794384285696,RT @ABCenvironment: . @TonyAbbottMHR says @CFigueres is talking through her hat for linking #NSWfires with #climate change http://t.co/l2…,Media,Other Useful Information,Related and informative,rt abcenvironment tonyabbottmhr says cfigueres talking hat linking nswfires climate change http co l2,1,2,2023-02-08 17:00:00,2023-02-08 17:00:00,317.0,679.0,,0.477
392928526619271169,RT @TheDingoTracker: Thoughts are with all the people and animals fighting and fleeing fires in NSW @NSWRFS @OEHmedia @NPWSnorthern @BMWHI,Outsiders,Sympathy and support,Related - but not informative,rt thedingotracker thoughts people animals fighting fleeing fires nsw nswrfs oehmedia npwsnorthern bmwhi,2,7,2023-02-08 18:00:00,2023-02-08 18:00:00,600.0,317.0,,0.64
392933429760634880,@Sandra_Sully: .@_AdamTodd: Bushfires at Springwood as the sun sets #nswfires #eyewitnessnews http://t.co/stbzJlm5Uy,Eyewitness,Other Useful Information,Related and informative,sandra_sully _adamtodd bushfires springwood sun sets nswfires eyewitnessnews http co stbzjlm5uy,1,2,2023-02-08 19:00:00,2023-02-08 19:00:00,585.0,36.0,,14.353
392936147657457664,RT @JezFernandezABC: It's just terrific seeing Auslan translators as a normal component of emergency mgmt procedures. Very smart. #nswfires.,Media,Other Useful Information,Related - but not informative,rt jezfernandezabc terrific seeing auslan translators normal component emergency mgmt procedures smart nswfires,2,2,2023-02-08 20:00:00,2023-02-08 20:00:00,838.0,585.0,,4.0760000000000005
392936667742351360,RT @mrslhawke: Redhead fire wind change looking worse at night@1233newcastle @nbnnews #nswfires http://t.co/KK4HvDrk5G,Media,Caution and advice,Related and informative,rt mrslhawke redhead fire wind change looking worse night 1233newcastle nbnnews nswfires http co kk4hvdrk5g,1,1,2023-02-08 21:00:00,2023-02-08 21:00:00,838.0,14.0,,0.831
392936743269576704,RT @NBCNewsWorld: Residents told to flee even as Australia fires ease http://t.co/Mu20en6Mpv,Media,Affected individuals,Related and informative,rt nbcnewsworld residents told flee even australia fires ease http co mu20en6mpv,1,6,2023-02-08 22:00:00,2023-02-08 22:00:00,812.0,19.0,,0.598
392936789377159168,"RT @RedCrossAU: Our volunteers are at #NSWbushfires evacuation centres in Springwood, Lithgow &amp; North Richmond. A friendly face during cris…",NGOs,Donations and volunteering,Related and informative,rt redcrossau volunteers nswbushfires evacuation centres springwood lithgow amp north richmond friendly face cris,1,4,2023-02-08 23:00:00,2023-02-08 23:00:00,863.0,591.0,,2.504
392942845960925184,RT @NSWRFS: Emergency Warning - Gateshead fire (Lake Macquarie) http://t.co/ODCMq9yEUD Evacs centres now open #NSWRFS #nswfires,Government,Caution and advice,Related and informative,rt nswrfs emergency warning gateshead fire lake macquarie http co odcmq9yeud evacs centres open nswrfs nswfires,1,1,2023-02-09 00:00:00,2023-02-09 00:00:00,863.0,792.0,,1.88
392943152148922368,Check out this item I found on eBay: http://t.co/wDCMq19ySt★ All proceeds go to the NSW fire Victims Pls #RT  ★TY,Outsiders,Donations and volunteering,Related - but not informative,check item found ebay http co wdcmq19yst proceeds go nsw fire victims pls rt ty,2,4,2023-02-09 01:00:00,2023-02-09 01:00:00,601.0,787.0,,1.968
392945303852032000,@BasedBieberLife Australia fire threat 'averted': Australian fire officials say the threat to the Blue Mountains west of Sy...  @deadmau5,Outsiders,Caution and advice,Related and informative,basedbieberlife australia fire threat averted australian fire officials say threat blue mountains west sy deadmau5,1,1,2023-02-09 02:00:00,2023-02-09 02:00:00,223.0,499.0,,8.095
392945333212176385,RT @pelagicpictures: Two rings of fire burn at dusk west of the Darling Causeway near Hartley Vale. @photosSMH #nswfires @NSWRFS @nswfire h…,Government,Other Useful Information,Related and informative,rt pelagicpictures two rings fire burn dusk west darling causeway near hartley vale photossmh nswfires nswrfs nswfire h,1,2,2023-02-09 03:00:00,2023-02-09 03:00:00,411.0,18.0,,0.5489999999999999
392945853272313856,LetYouKnow: Australia fire threat 'averted': Australian fire officials say the threat t... http://t.co/Qeeq7wdJqb http://t.co/vUoOtrbQ1f,Media,Caution and advice,Related and informative,letyouknow australia fire threat averted australian fire officials say threat http co qeeq7wdjqb http co vuootrbq1f,1,1,2023-02-09 04:00:00,2023-02-09 04:00:00,727.0,773.0,,0.774
392945857462415360,LetYouKnow: Australia fire threat 'averted': Australian fire officials say the threat t... http://t.co/ExUMVZCg3A http://t.co/UD6mg2UlCH,Media,Other Useful Information,Related and informative,letyouknow australia fire threat averted australian fire officials say threat http co exumvzcg3a http co ud6mg2ulch,1,2,2023-02-09 05:00:00,2023-02-09 05:00:00,178.0,407.0,,1.786
392945991701102592,Fire threat to Australia's Blue Mountains 'averted' - BBC News: Sydney Morning HeraldFire threat to Australia'... http://t.co/SMz44sSi2k,Media,Other Useful Information,Related and informative,fire threat australia blue mountains averted bbc news sydney morning heraldfire threat australia http co smz44ssi2k,1,2,2023-02-09 06:00:00,2023-02-09 06:00:00,247.0,114.0,,2.929
392947916891238400,RT @newscomauHQ: Investigations by NSW RFS fire investigators have determined the State Mine Fire... was started as a result of live ordna…,Media,Other Useful Information,Related and informative,rt newscomauhq investigations nsw rfs fire investigators determined state mine fire started result live ordna,1,2,2023-02-09 07:00:00,2023-02-09 07:00:00,247.0,605.0,,2.435
392950353756717056,NSW Fires – are the new building codes working? - The Fifth Estate « The Fifth Estate http://t.co/3sErtHjNDK,Outsiders,Infrastructure and utilities,Related and informative,nsw fires new building codes working fifth estate fifth estate http co 3serthjndk,1,3,2023-02-09 08:00:00,2023-02-09 08:00:00,705.0,619.0,,0.319
392953000366702592,@Mizz_M This is is for the fire affected areas in NSW. Apologies for any confusion. There are no silly questions:) ^SD,Outsiders,Other Useful Information,Related - but not informative,mizz_m fire affected areas nsw apologies confusion silly questions sd,2,2,2023-02-09 09:00:00,2023-02-09 09:00:00,146.0,198.0,,0.5
392953528852824064,RT @muzdog10: Water bombing at Hartley Vale this afternoon. #nswfires #Lithgow http://t.co/4VifZQlBqj,Outsiders,Not applicable,Related and informative,rt muzdog10 water bombing hartley vale afternoon nswfires lithgow http co 4vifzqlbqj,1,5,2023-02-09 10:00:00,2023-02-09 10:00:00,552.0,602.0,,0.965
392956200620290048,RT @SamEBJones: RT @MissBaileyWoof: Joey rescued after sustaining burns to his paws #nswfires http://t.co/dHTY5w0esB,Eyewitness,Other Useful Information,Related and informative,rt samebjones rt missbaileywoof joey rescued sustaining burns paws nswfires http co dhty5w0esb,1,2,2023-02-09 11:00:00,2023-02-09 11:00:00,210.0,862.0,,1.023
392960042632105984,#Sydney #fire please be over right now!! http://t.co/jkgzoUdokt,Outsiders,Other Useful Information,Related - but not informative,sydney fire please right http co jkgzoudokt,2,2,2023-02-09 12:00:00,2023-02-09 12:00:00,702.0,643.0,,0.934
392960323650482176,RT @gcnelson: A weary firefighter catches a well earned rest as the worst appears over. @abcnews #NSWfires http://t.co/3upgbLUMwL,Media,Affected individuals,Related and informative,rt gcnelson weary firefighter catches well earned rest worst appears abcnews nswfires http co 3upgblumwl,1,6,2023-02-09 13:00:00,2023-02-09 13:00:00,801.0,239.0,,0.634
392965495223119872,Wildfires threaten Sydney: More than 70 fires are raging across Australia's most populous... http://t.co/gPLyXU8dK9 #atlantacash4junkcar,Media,Other Useful Information,Related and informative,wildfires threaten sydney 70 fires raging across australia populous http co gplyxu8dk9 atlantacash4junkcar,1,2,2023-02-09 14:00:00,2023-02-09 14:00:00,686.0,721.0,,0.5529999999999999
392966132761522176,"Wildfires threaten Sydney: More than 70 fires are raging across Australia's most populous state, now threateni... http://t.co/IX1lWuQYG4",Media,Infrastructure and utilities,Related and informative,wildfires threaten sydney 70 fires raging across australia populous state threateni http co ix1lwuqyg4,1,3,2023-02-09 15:00:00,2023-02-09 15:00:00,239.0,805.0,,1.487
392966388593065985,"Wildfires threaten Sydney: More than 70 fires are raging across Australia's most populous state, now threateni... http://t.co/5sGtTu7GLp",Media,Other Useful Information,Related and informative,wildfires threaten sydney 70 fires raging across australia populous state threateni http co 5sgttu7glp,1,2,2023-02-09 16:00:00,2023-02-09 16:00:00,654.0,554.0,,0.7929999999999999
392969895027023872,RT @MarkDiStef: Defence Department has released an extended statement into @NSWRFS claims it started the State Mine Fire #nswfires http://t…,Media,Other Useful Information,Related and informative,rt markdistef defence department released extended statement nswrfs claims started state mine fire nswfires http,1,2,2023-02-09 17:00:00,2023-02-09 17:00:00,186.0,235.0,,0.66
392973233705598976,RT @DamonAM: My opinion of the @NSWRFS neatly summarised into a comic. #nswfires http://t.co/04rKF8gg4p,Outsiders,Other Useful Information,Related - but not informative,rt damonam opinion nswrfs neatly summarised comic nswfires http co 04rkf8gg4p,2,2,2023-02-09 18:00:00,2023-02-09 18:00:00,643.0,186.0,,0.226
