Tweet ID, Tweet Text, Information Source, Information Type, Informativeness,cleaned_text,informativeness_encoded,information_type_encoded,timestamp
396205490209693696,KING D ROYALTY http://t.co/eXjB4V0rbx … #LA #LAX #OAKLAND #SF #BAYAREA #VEGAS #LOSANGELES #CALI #SEO #SMM #WP #OC #MUSIC #BLOGS #TURNUP 34,Not labeled,Not labeled,Not related,king royalty http co exjb4v0rbx la lax oakland sf bayarea vegas losangeles cali seo smm wp oc music blogs turnup 34,0,0,2023-01-01 00:00:00
396263979762196480,KING D ROYALTY http://t.co/2RJIrrnlOi … #LA #LAX #OAKLAND #SF #BAYAREA #VEGAS #LOSANGELES #CALI #SEO #SMM #WP #OC #MUSIC #BLOGS #TURNUP 81,Not labeled,Not labeled,Not applicable,king royalty http co 2rjirrnloi la lax oakland sf bayarea vegas losangeles cali seo smm wp oc music blogs turnup 81,1,0,2023-01-01 01:00:00
396313082466541568,Something's happening @ #LAX rt now!! Re-tweet.,Outsiders,Other Useful Information,Related - but not informative,something happening lax rt tweet,2,1,2023-01-01 02:00:00
396313543865552896,"#KourtneyKardashian is seen arriving at #LAX airport on October 31, 2013 in Los Angeles http://t.co/NVd0gvPZy1",Not labeled,Not labeled,Not related,kourtneykardashian seen arriving lax airport october 31 2013 los angeles http co nvd0gvpzy1,0,0,2023-01-01 03:00:00
396314030383443968,"What the hell is going on at LAX, and why does something bad ALWAYS happen at an airport on days that I fly? Explain, @jonostrower.",Outsiders,Affected individuals,Related - but not informative,hell going lax something bad always happen airport days fly explain jonostrower,2,2,2023-01-01 04:00:00
396314902794498048,RT @efink: Gunfire on the tarmac. RT @CBSLA #BREAKING: #LAPD: Incident Reported In Terminal 3 At #LAX. http://t.co/cRQ5HzFgJO,Media,Affected individuals,Related and informative,rt efink gunfire tarmac rt cbsla breaking lapd incident reported terminal 3 lax http co crq5hzfgjo,3,2,2023-01-01 05:00:00
396315108311199744,Gunshots outside #LAX. Unknown if anyone is injured. Prayers go out to you all.,Outsiders,Sympathy and support,Related - but not informative,gunshots outside lax unknown anyone injured prayers go,2,3,2023-01-01 06:00:00
396315481621012480,Shooting in Terminal 3? Hard to get specifics. RT @TOPolk What the hell is going down at #LAX?,Outsiders,Sympathy and support,Related and informative,shooting terminal 3 hard get specifics rt topolk hell going lax,3,3,2023-01-01 07:00:00
396315620050223104,RT @anblanx: Breaking Shooting at LAX. Terminal 2 Sources say report 2 victims down. Suspect down.,Media,Affected individuals,Related and informative,rt anblanx breaking shooting lax terminal 2 sources say report 2 victims suspect,3,2,2023-01-01 08:00:00
396317146751307776,RT @charlescwcooke: California should pass gun control. RT @anblanx: Breaking Shooting at LAX. Terminal 2 Sources say report 2 victims down…,Outsiders,Other Useful Information,Related and informative,rt charlescwcooke california pass gun control rt anblanx breaking shooting lax terminal 2 sources say report 2 victims,3,1,2023-01-01 09:00:00
396317180309938176,RT @jforstrom: At #lax. Just had to run onto runway because of shooting in terminal 2 http://t.co/4ZHVCcVmVX,Outsiders,Affected individuals,Related and informative,rt jforstrom lax run onto runway shooting terminal 2 http co 4zhvccvmvx,3,2,2023-01-01 10:00:00
396317331330433024,"RT @NewsBreaker: EYEWITNESS: @ToryBelleci reports hearing gun shots, then everyone starting running for the door. Outside now @ #LAX http…",Eyewitness,Affected individuals,Related and informative,rt newsbreaker eyewitness torybelleci reports hearing gun shots everyone starting running door outside lax http,3,2,2023-01-01 11:00:00
396317406798553088,"Shots fired, airport evacuated at #LAX is what im seeing all over my timeline.",Outsiders,Other Useful Information,Related and informative,shots fired airport evacuated lax im seeing timeline,3,1,2023-01-01 12:00:00
396317671035129856,RT @AustinCrossCBS: Reports saying a TSA agent and the shooting suspect have been shot. #LAX,Media,Affected individuals,Related and informative,rt austincrosscbs reports saying tsa agent shooting suspect shot lax,3,2,2023-01-01 13:00:00
396317725556887552,RT @LASportsRadio: Some guy just got into the LAX airport with a rifle.  Last week LAX security confiscated my hair gel.,Media,Other Useful Information,Related and informative,rt lasportsradio guy got lax airport rifle last week lax security confiscated hair gel,3,1,2023-01-01 14:00:00
396318216299229184,RT @WLTX: #BREAKING: Gunfire reported Los Angeles airport (#LAX) terminal 3. Pic via Fox Sports reporter @foxsportsreiter http://t.co/cbPt6…,Media,Other Useful Information,Related and informative,rt wltx breaking gunfire reported los angeles airport lax terminal 3 pic via fox sports reporter foxsportsreiter http co cbpt6,3,1,2023-01-01 15:00:00
396318249870434304,"😔 RT @msnbc: BREAKING: Reports of shots fired at LAX Airport, says senior government official. Stay with @msnbc for the latest.",Media,Affected individuals,Related and informative,rt msnbc breaking reports shots fired lax airport says senior government official stay msnbc latest,3,2,2023-01-01 16:00:00
396318312759455744,RT @ABC7News: JUST IN per @911LAPD: Police are responding to a major incident at #LAX. http://t.co/sCgUph2DnU,Media,Affected individuals,Related and informative,rt abc7news per 911lapd police responding major incident lax http co scguph2dnu,3,2,2023-01-01 17:00:00
396318379906039808,RT @jforstrom: At #lax. Just had to run onto runway because of shooting in terminal 2 http://t.co/4ZHVCcVmVX,Eyewitness,Affected individuals,Related - but not informative,rt jforstrom lax run onto runway shooting terminal 2 http co 4zhvccvmvx,2,2,2023-01-01 18:00:00
396318430229315584,LAX Airport evacuated after reports of shooting http://t.co/RxZrFn8d1Q,Media,Infrastructure and utilities,Related and informative,lax airport evacuated reports shooting http co rxzrfn8d1q,3,4,2023-01-01 19:00:00
396318484759871488,"RT @msnbc: BREAKING: Reports of shots fired at LAX Airport, says senior government official. Stay with @msnbc for the latest.",Media,Affected individuals,Related and informative,rt msnbc breaking reports shots fired lax airport says senior government official stay msnbc latest,3,2,2023-01-01 20:00:00
396318660887064577,RT @CBCAlerts: Reports of gunfire at the Los Angeles airport. Police say 'major incident' underway. No word on victims. #LAX,Media,Caution and advice,Related and informative,rt cbcalerts reports gunfire los angeles airport police say major incident underway word victims lax,3,5,2023-01-01 21:00:00
396318828675616768,RT @KIRO7Seattle: RT @CBSLA: #BREAKING: #LAPD: Incident Reported In Terminal 3 At #LAX. http://t.co/qkNvtvOLpp,Media,Affected individuals,Related and informative,rt kiro7seattle rt cbsla breaking lapd incident reported terminal 3 lax http co qknvtvolpp,3,2,2023-01-01 22:00:00
396318916743811073,RT @grantimahara: Something just happened at #LAX. TSA and police running everywhere.,Eyewitness,Other Useful Information,Related and informative,rt grantimahara something happened lax tsa police running everywhere,3,1,2023-01-01 23:00:00
396319025795321858,RT @grasswire: Person on stretcher loaded into ambulance at #LAX http://t.co/25FzgNKvcn,Media,Affected individuals,Related and informative,rt grasswire person stretcher loaded ambulance lax http co 25fzgnkvcn,3,2,2023-01-02 00:00:00
396319034205274113,LAX Airport being evacuated. Shots fired. Boo.,Outsiders,Other Useful Information,Related and informative,lax airport evacuated shots fired boo,3,1,2023-01-02 01:00:00
396319071966208001,Good heavens! Hope all tuns out well at #LAX Please stay safe everyone. Also AVOID LAX airport right now! #Terminal3,Outsiders,Sympathy and support,Related - but not informative,good heavens hope tuns well lax please stay safe everyone also avoid lax airport right terminal3,2,3,2023-01-02 02:00:00
396319248101822464,DEVELOPING: There has been an incident at Los Angeles Intl Airport. Reports are there was a shooting | http://t.co/t65AUJwquP,Media,Other Useful Information,Related and informative,developing incident los angeles intl airport reports shooting http co t65aujwqup,3,1,2023-01-02 03:00:00
396319302619394049,RT @WLTX: #BREAKING: Gunfire reported Los Angeles airport (#LAX) terminal 3. Pic via Fox Sports reporter @foxsportsreiter http://t.co/cbPt6…,Media,Other Useful Information,Related and informative,rt wltx breaking gunfire reported los angeles airport lax terminal 3 pic via fox sports reporter foxsportsreiter http co cbpt6,3,1,2023-01-02 04:00:00
396319336178401281,RT @CBSLA: #UPDATE: Arrival/departure roads closed at #LAX after reports of shots fired in Terminal 3. http://t.co/1bu3zuzflK,Media,Infrastructure and utilities,Related and informative,rt cbsla update arrival departure roads closed lax reports shots fired terminal 3 http co 1bu3zuzflk,3,4,2023-01-02 05:00:00
396319382345097216,RT @pornlaw: Shooting at LAX... TSA employee shot. News is reporting that the shooter might have a machine gun/assault rifle....,Media,Affected individuals,Related and informative,rt pornlaw shooting lax tsa employee shot news reporting shooter might machine gun assault rifle,3,2,2023-01-02 06:00:00
396319390729138176,RT @katemather: En route to #LAX. Updates as they come @LANow.,Media,Not applicable,Related - but not informative,rt katemather en route lax updates come lanow,2,6,2023-01-02 07:00:00
396319441031811072,RT @thinkprogress: Early reports indicate there were two victims down in Terminal 3 at LAX shooting http://t.co/GORdwvqYdS,Media,Affected individuals,Related and informative,rt thinkprogress early reports indicate two victims terminal 3 lax shooting http co gordwvqyds,3,2,2023-01-02 08:00:00
396319445259284481,RT @thinkprogress: REPORT: Shooting at Los Angeles airport http://t.co/A9Ad45coky,Media,Affected individuals,Related and informative,rt thinkprogress report shooting los angeles airport http co a9ad45coky,3,2,2023-01-02 09:00:00
396319692694233088,RT @CaptDaveOnAir: Reports of man with rifle opened fire in terminal 3 at #LAX,Outsiders,Affected individuals,Related and informative,rt captdaveonair reports man rifle opened fire terminal 3 lax,3,2,2023-01-02 10:00:00
396319856275906560,"How did he get a rifle past security? He SHOT his way through, obviously. #LAX",Outsiders,Other Useful Information,Related - but not informative,get rifle past security shot way obviously lax,2,1,2023-01-02 11:00:00
396320019857944576,Reported: Shots fired at LAX...wounded shown leaving airport http://t.co/t5znwUcrMb,Media,Affected individuals,Related and informative,reported shots fired lax wounded shown leaving airport http co t5znwucrmb,3,2,2023-01-02 12:00:00
396320032461836289,"RT @LATimescitybeat: Frightening scene at LAX, with TSA agent shot, suspect wounded, according to sources. http://t.co/t29Dw05cXQ",Media,Affected individuals,Related and informative,rt latimescitybeat frightening scene lax tsa agent shot suspect wounded according sources http co t29dw05cxq,3,2,2023-01-02 13:00:00
396320065982705665,#LAX: Passengers at Terminal 3 of Los Angeles airport evacuated shortly after 9 am local time http://t.co/EqIBSayi5g http://t.co/3Lmnjdv6Wq,Media,Affected individuals,Related and informative,lax passengers terminal 3 los angeles airport evacuated shortly 9 local time http co eqibsayi5g http co 3lmnjdv6wq,3,2,2023-01-02 14:00:00
396320086950019072,RT @EdJoyce: Los Angeles Airport Police Friday confirmed a shooting took place in Terminal 3 at LAX. Via @CBSLA  http://t.co/ow4OlbjxZS #br…,Media,Affected individuals,Related and informative,rt edjoyce los angeles airport police friday confirmed shooting took place terminal 3 lax via cbsla http co ow4olbjxzs br,3,2,2023-01-02 15:00:00
396320099537137664,RT @GeekNation: Early reports of a shooting at LAX. Terminal being evacuated and all flights postponed.  #LAX,Media,Caution and advice,Related and informative,rt geeknation early reports shooting lax terminal evacuated flights postponed lax,3,5,2023-01-02 16:00:00
396320158261592065,RT @NBCNews: More: Two victims shot by suspect in LAX reportedly using a rifle,Media,Affected individuals,Related and informative,rt nbcnews two victims shot suspect lax reportedly using rifle,3,2,2023-01-02 17:00:00
396320305083211776,"My dad and my uncle spend so much time at the airport, I'm so thankful they were both home and safe during the LAX shooting",Outsiders,Sympathy and support,Related - but not informative,dad uncle spend much time airport thankful home safe lax shooting,2,3,2023-01-02 18:00:00
396320422507315200,RT @Mediaite: WATCH LIVE: Terminal 3 Evacuated After Shooting Incident Reported at LAX Airport http://t.co/nCkHRaYmZs via @mediaite,Media,Other Useful Information,Related and informative,rt mediaite watch live terminal 3 evacuated shooting incident reported lax airport http co nckhraymzs via mediaite,3,1,2023-01-02 19:00:00
396320472864129024,"RT @msnbc: BREAKING: Reports of shots fired at LAX Airport, says senior government official. Stay with @msnbc for the latest.",Media,Affected individuals,Related and informative,rt msnbc breaking reports shots fired lax airport says senior government official stay msnbc latest,3,2,2023-01-02 20:00:00
396320724509790208,RT @TheAtlanticWire: Live: Shooting reported at Los Angeles International Airport http://t.co/CFOXiFrCOv,Media,Infrastructure and utilities,Related and informative,rt theatlanticwire live shooting reported los angeles international airport http co cfoxifrcov,3,4,2023-01-02 21:00:00
396320976155475968,RT @PzFeed: BREAKING NEWS: AT LEAST 2 PEOPLE SHOT AT LAX AIRPORT TERMINAL 3. SUSPECT USED A RIFLE. MAJOR CRIME SCENE.,Media,Affected individuals,Related and informative,rt pzfeed breaking news least 2 people shot lax airport terminal 3 suspect used rifle major crime scene,3,2,2023-01-02 22:00:00
396320992936460288,RT @nbcnightlynews: BREAKING: Shooting reported at Los Angeles Int'l Airport Terminal 3; WATCH LIVE coverage via @NBCLA http://t.co/x1nQ14V…,Media,Caution and advice,Related and informative,rt nbcnightlynews breaking shooting reported los angeles int l airport terminal 3 watch live coverage via nbcla http co x1nq14v,3,5,2023-01-02 23:00:00
396321081021435905,RT @LANow: LAX shooting: 1 TSA agent has been shot and a suspect has been wounded according to sources. http://t.co/6LqVr2AoG4,Media,Affected individuals,Related and informative,rt lanow lax shooting 1 tsa agent shot suspect wounded according sources http co 6lqvr2aog4,3,2,2023-01-03 00:00:00
396321135538606080,KTLA news reporting shooting victim at LAX appears to be TSA agent. Anchor: Not clear motive or number of suspects. Rapidly unfolding #LAX,Media,Affected individuals,Related and informative,ktla news reporting shooting victim lax appears tsa agent anchor clear motive number suspects rapidly unfolding lax,3,2,2023-01-03 01:00:00
396321395581272064,RT @LAX_Official: Airport officials confirm police incident began at 9:30 a.m. @ Terminal 3 at LAX. More info to come.,Government,Other Useful Information,Related and informative,rt lax_official airport officials confirm police incident began 9 30 terminal 3 lax info come,3,1,2023-01-03 02:00:00
396321684992434176,RT @News1130radio: UPDATE: There are unconfirmed reports a TSA agent was shot at #LAX. Terminals evacuated.,Media,Affected individuals,Related and informative,rt news1130radio update unconfirmed reports tsa agent shot lax terminals evacuated,3,2,2023-01-03 03:00:00
396321693368856576,Thoughts and prayers to any possible victims at LAX,Outsiders,Sympathy and support,Related - but not informative,thoughts prayers possible victims lax,2,3,2023-01-03 04:00:00
396321722754142208,"RT @BBCBreaking: Police responding to incident at Terminal 3 of Los Angeles #LAX airport in US, @LAX_Official says",Media,Other Useful Information,Related and informative,rt bbcbreaking police responding incident terminal 3 los angeles lax airport us lax_official says,3,1,2023-01-03 05:00:00
396321735340867585,Thoughts and prayers go out to everyone involved in the ongoing shooting at the LAX Airport. Unfortunate  situation! #StayStrong,Outsiders,Sympathy and support,Related - but not informative,thoughts prayers go everyone involved ongoing shooting lax airport unfortunate situation staystrong,2,3,2023-01-03 06:00:00
396321789858836480,RT @IglooMediaBase: Shots fired at the LAX international airport which is now being evacuated,Media,Caution and advice,Related and informative,rt igloomediabase shots fired lax international airport evacuated,3,5,2023-01-03 07:00:00
396322108625936384,RT @LAX_Official: Airport officials confirm police incident began at 9:30 a.m. @ Terminal 3 at LAX. More info to come.,Government,Other Useful Information,Related and informative,rt lax_official airport officials confirm police incident began 9 30 terminal 3 lax info come,3,1,2023-01-03 08:00:00
396322142184169472,RT @USATODAY: MT @911LAPD: “@CHPsouthern: Avoid #LAX at this time. Century Blvd. closed prior to airport entrance. Call airline for info” #…,Media,Infrastructure and utilities,Related and informative,rt usatoday mt 911lapd chpsouthern avoid lax time century blvd closed prior airport entrance call airline info,3,4,2023-01-03 09:00:00
396322255434960897,"RT @kron4news: BREAKING: LAPD say shots were fired at #LAX, multiple people injured. http://t.co/SIXzgjJ2S8",Media,Affected individuals,Related and informative,rt kron4news breaking lapd say shots fired lax multiple people injured http co sixzgjj2s8,3,2,2023-01-03 10:00:00
396322267988107264,Just heard the news about #LAX. This is insane.,Outsiders,Sympathy and support,Related - but not informative,heard news lax insane,2,3,2023-01-03 11:00:00
396322683257774081,RT @RickMontanez: #BREAKING: Witness on-air now on @abc7 says he heard three shots at #LAX. Live coverage on @abc30's website. http://t.co/…,Eyewitness,Affected individuals,Related and informative,rt rickmontanez breaking witness air abc7 says heard three shots lax live coverage abc30 website http co,3,2,2023-01-03 12:00:00
396322691629977600,Shooting Prompts Evacuation Of Terminal 3 At #LAX http://t.co/Ysrnvk8nlP #NEWS,Media,Infrastructure and utilities,Related and informative,shooting prompts evacuation terminal 3 lax http co ysrnvk8nlp news,3,4,2023-01-03 13:00:00
396322989416800258,RT @PzFeed: SHOOTING AT LAX AIRPORT: -AT LEAST 2 PEOPLE SHOT -8-10 SHOTS FIRED -SUSPECT HAD A RIFLE -TERMINAL 3 EVACUATED,Media,Affected individuals,Related and informative,rt pzfeed shooting lax airport least 2 people shot 8 10 shots fired suspect rifle terminal 3 evacuated,3,2,2023-01-03 14:00:00
396323056534421504,Trying to find out what happened at #LAX. Apparently there was a shooting,Outsiders,Other Useful Information,Related - but not informative,trying find happened lax apparently shooting,2,1,2023-01-03 15:00:00
396323064935227393,RT @W7VOA: #LAX is NOT shut down. You can listen to various tower/ground control traffic here: http://t.co/A5NzFx7Jee,Media,Infrastructure and utilities,Related and informative,rt w7voa lax shut listen various tower ground control traffic http co a5nzfx7jee,3,4,2023-01-03 16:00:00
396323215934386176,@piersmorgan so gun control again today? #LAXshooting,Outsiders,Other Useful Information,Related - but not informative,piersmorgan gun control today laxshooting,2,1,2023-01-03 17:00:00
396323396264660993,Hope u r not trying to fly in or out of #LAX right now...shots fired at security check point right… http://t.co/07Kh3H0M6D,Eyewitness,Sympathy and support,Related and informative,hope u r trying fly lax right shots fired security check point right http co 07kh3h0m6d,3,3,2023-01-03 18:00:00
396323475981598720,So my friends were at the lax airport when the jolting happened like an hour ago whaaaaat,Not labeled,Not labeled,Not related,friends lax airport jolting happened like hour ago whaaaaat,0,0,2023-01-03 19:00:00
396323685671264256,"CNN Airport officials said a police incident began about 9:30 a.m. at Terminal 3 at #LAX, airport spokeswoman @News12LI",Media,Affected individuals,Related and informative,cnn airport officials said police incident began 9 30 terminal 3 lax airport spokeswoman news12li,3,2,2023-01-03 20:00:00
396323723428368384,"RT @ABC: Condition of victims at LAX unknown, says LAPD - live coverage: http://t.co/dseRaZYiuP",Media,Affected individuals,Related and informative,rt abc condition victims lax unknown says lapd live coverage http co dserazyiup,3,2,2023-01-03 21:00:00
396323748581617664,The was a shooting in the LAX airport,Outsiders,Other Useful Information,Related - but not informative,shooting lax airport,2,1,2023-01-03 22:00:00
396323811521736704,RT @RobertTaylors: Shooting Reported at Los Angeles International Airport: There are reports of a shooting incident Friday mornin... http:/…,Media,Other Useful Information,Related and informative,rt roberttaylors shooting reported los angeles international airport reports shooting incident friday mornin http,3,1,2023-01-03 23:00:00
396323983475609600,RT @ScottHanson: Shooting at LAX.  Terrible.  Hope the authorities got shooter immediately.  Many @nflnetwork colleagues flying back to LAX…,Outsiders,Sympathy and support,Related - but not informative,rt scotthanson shooting lax terrible hope authorities got shooter immediately many nflnetwork colleagues flying back lax,2,3,2023-01-04 00:00:00
396324021211762688,RT @grasswire: #LAX UPDATE: Several people have been shot according to LAPD police scanner. Citywide tactical alert declared,Government,Affected individuals,Related and informative,rt grasswire lax update several people shot according lapd police scanner citywide tactical alert declared,3,2,2023-01-04 01:00:00
396324054774599680,RT @nypost: TSA person yells there is someone shooting. We sprint into runway - #LAX eyewitness accounts from @jforstrom...,Media,Affected individuals,Related and informative,rt nypost tsa person yells someone shooting sprint runway lax eyewitness accounts jforstrom,3,2,2023-01-04 02:00:00
396324151243587584,Wow another shooting in an airport in LA,Outsiders,Sympathy and support,Related - but not informative,wow another shooting airport la,2,3,2023-01-04 03:00:00
396324285478084608,LA Airport 'Shooting' Prompts Evacuation http://t.co/EBTBxUNWmO,Media,Caution and advice,Related and informative,la airport shooting prompts evacuation http co ebtbxunwmo,3,5,2023-01-04 04:00:00
396324432278716416,RT @Michael_Tonge: Prayers up.. Jeez. #laxshooting,Outsiders,Sympathy and support,Related - but not informative,rt michael_tonge prayers jeez laxshooting,2,3,2023-01-04 05:00:00
396324432287121408,RT @SandraFluke: Frightening shooting here in #LosAngeles @ #LAX. Victims need our prayers now.,Outsiders,Sympathy and support,Related and informative,rt sandrafluke frightening shooting losangeles lax victims need prayers,3,3,2023-01-04 06:00:00
396324470022864896,"RT @BradLtv: #LAX UPDATE: Ground stop now in effect for traffic arriving at Los Angeles Int'l Airport, FAA says -@nbcnightlynews",Government,Infrastructure and utilities,Related and informative,rt bradltv lax update ground stop effect traffic arriving los angeles int l airport faa says nbcnightlynews,3,4,2023-01-04 07:00:00
396324549710839809,RT @CBSEveningNews: NOW: We're on the air for a @CBSNews special report on the #LAXShooting. @JeffGlor anchors.,Media,Other Useful Information,Related - but not informative,rt cbseveningnews air cbsnews special report laxshooting jeffglor anchors,2,1,2023-01-04 08:00:00
396324570682372096,@BloombergNews reports FAA has suspended flights into LAX. #LAXShooting,Media,Infrastructure and utilities,Related and informative,bloombergnews reports faa suspended flights lax laxshooting,3,4,2023-01-04 09:00:00
396324683924008961,"If you #Follow #LAX make sure you are RT official guidance; verify x 2, tweet once.",Not labeled,Not labeled,Not related,follow lax make sure rt official guidance verify x 2 tweet,0,0,2023-01-04 10:00:00
396324780393385984,"RT @TheSportsStreet: Breaking: (Non Sports Relating): Shooting at LAX airport, wow.",Media,Affected individuals,Related - but not informative,rt thesportsstreet breaking non sports relating shooting lax airport wow,2,2,2023-01-04 11:00:00
396324801360322560,2nd shooter-WTF?? @LAScanner: LAX *Update: Report of 2nd suspected shooter in custody. LAFD reports total of 4 GSW patients at this time.,Outsiders,Affected individuals,Related and informative,2nd shooter wtf lascanner lax update report 2nd suspected shooter custody lafd reports total 4 gsw patients time,3,2,2023-01-04 12:00:00
396324805554622464,Reports: TSA agent and alleged gunman wounded in shooting at Los Angeles Airport. #LAX http://t.co/b2JGQEhgSO,Media,Affected individuals,Related and informative,reports tsa agent alleged gunman wounded shooting los angeles airport lax http co b2jgqehgso,3,2,2023-01-04 13:00:00
396324830725033985,#FAA halts flights heading into #LAX (@KTVU),Government,Infrastructure and utilities,Related and informative,faa halts flights heading lax ktvu,3,4,2023-01-04 14:00:00
396324943991808000,RT @NBCNews: Sources: Suspect opened fire with rifle at document checkpoint in Terminal 3 at LAX,Media,Other Useful Information,Related and informative,rt nbcnews sources suspect opened fire rifle document checkpoint terminal 3 lax,3,1,2023-01-04 15:00:00
396324956537368576,#BREAKING NEWS: CBS REPORTS A SECOND ARMED MAN IN CUSTODY AT #LAX AIRPORT.,Media,Other Useful Information,Related and informative,breaking news cbs reports second armed man custody lax airport,3,1,2023-01-04 16:00:00
396325015273996288,"RT @ABC Full story: Several people shot at LAX, one suspect in custody http://t.co/3fl59B4Gg1",Media,Affected individuals,Related and informative,rt abc full story several people shot lax one suspect custody http co 3fl59b4gg1,3,2,2023-01-04 17:00:00
