396665974432497664,"RT @jricole: So shooting down people at an airport is *not* terrorism, but carrying a flashdrive with evidence of gov't wrongdoing *is* ter…",Outsiders,Sympathy and support,Related - but not informative,rt jricole shooting people airport terrorism carrying flashdrive evidence gov wrongdoing ter,2,3,2023-02-02 08:00:00
396675533268058112,LAX shooting suspect in custody; TSA officer killed - Salt Lake Tribune http://t.co/BW6Cv6v6A4 (Latest) #usaf #usmc,Media,Affected individuals,Related and informative,lax shooting suspect custody tsa officer killed salt lake tribune http co bw6cv6v6a4 latest usaf usmc,3,2,2023-02-02 09:00:00
396676867039563777,Gunman targets TSA in Los Angeles airport shooting http://t.co/zP3ikL5Bya,Media,Affected individuals,Related and informative,gunman targets tsa los angeles airport shooting http co zp3ikl5bya,3,2,2023-02-02 10:00:00
396683443729223680,"RT @ChicoDelainky: The #LAX shooter referred to himself as a pissed-off patriot” Come on! If that’s not a #teaparty member, I don’t know w…",Outsiders,Affected individuals,Related and informative,rt chicodelainky lax shooter referred pissed patriot come teaparty member know w,3,2,2023-02-02 11:00:00
396685436027797504,Travelers Use Los Angeles International Airport Day After Shooting Killed One ... - Getty Images http://t.co/To9ue0za6d,Media,Infrastructure and utilities,Related and informative,travelers use los angeles international airport day shooting killed one getty images http co to9ue0za6d,3,4,2023-02-02 12:00:00
396686513930780672,"RT @Deanofcomedy: Why are all Muslims responsible for every bad one but White peeps not responsible for every school gunmen, LAX shooter, W…",Outsiders,Other Useful Information,Related - but not informative,rt deanofcomedy muslims responsible every bad one white peeps responsible every school gunmen lax shooter w,2,1,2023-02-02 13:00:00
396686622982283264,Los Angeles Airport Partly Closed After Shooting: Federal agents combed the airport for clues about a man wiel... http://t.co/Z0UCeyZsj8,Media,Infrastructure and utilities,Related and informative,los angeles airport partly closed shooting federal agents combed airport clues man wiel http co z0uceyzsj8,3,4,2023-02-02 14:00:00
396688791450042368,#LAXSHOOTING UPDATE; LAX is OPEN. All terminals and roadways OPEN. Terminal 3 ticket counters only OPEN except for rest of the terminal,Outsiders,Infrastructure and utilities,Related and informative,laxshooting update lax open terminals roadways open terminal 3 ticket counters open except rest terminal,3,4,2023-02-02 15:00:00
396708211064975360,#news: Los Angeles airport terminal still closed after fatal shooting rampage: Authorities inve... http://t.co/Yt5mUyJTAb #guardianudate,Media,Infrastructure and utilities,Related and informative,news los angeles airport terminal still closed fatal shooting rampage authorities inve http co yt5muyjtab guardianudate,3,4,2023-02-02 16:00:00
396720093549166592,LAX rampage suspect called former Homeland Security secretary Secretary Janet Napolitano a 'bull d***': Offici... http://t.co/j3zO5Ds0GJ,Media,Affected individuals,Related and informative,lax rampage suspect called former homeland security secretary secretary janet napolitano bull offici http co j3zo5ds0gj,3,2,2023-02-02 17:00:00
396729572676231168,"#LAXShooting We are expect to reopen Terminal 3 later this afternoon, LAWA Executive Director Gina Marie Lindsey. http://t.co/Wiw82NqOim",Government,Infrastructure and utilities,Related and informative,laxshooting expect reopen terminal 3 later afternoon lawa executive director gina marie lindsey http co wiw82nqoim,3,4,2023-02-02 18:00:00
396730042442473472,#LosAngeles airport partly closed as shooting probe continues.  http://t.co/5urMWY1ZhC,Outsiders,Infrastructure and utilities,Related and informative,losangeles airport partly closed shooting probe continues http co 5urmwy1zhc,3,4,2023-02-02 19:00:00
396733460800626689,LAX suspect texted 'worrisome' message prior to shooting - CANOE http://t.co/R1ItuA92RR (Latest) #patriots,Media,Other Useful Information,Related and informative,lax suspect texted worrisome message prior shooting canoe http co r1itua92rr latest patriots,3,1,2023-02-02 20:00:00
396737688646066177,Flight delays continue across US after LAX shooting: Flights to and from Los Angeles International Airport con... http://t.co/VTE9baU6iQ,Media,Infrastructure and utilities,Related and informative,flight delays continue across us lax shooting flights los angeles international airport con http co vte9bau6iq,3,4,2023-02-02 21:00:00
396737827066499072,RT @April_MG: How convenient that Obama gets immediately briefed on #LAXShooting yet remains totally ignorant of his own scandals. #TCOT #T…,Outsiders,Other Useful Information,Related - but not informative,rt april_mg convenient obama gets immediately briefed laxshooting yet remains totally ignorant scandals tcot,2,1,2023-02-02 22:00:00
396746316329414656,LA airport reopens after shooting http://t.co/Jkpsa3MuWD,Media,Infrastructure and utilities,Related and informative,la airport reopens shooting http co jkpsa3muwd,3,4,2023-02-02 23:00:00
396748350571024384,LA airport reopens after shooting: Los Angeles International Airport reopens fully after Friday's attack which saw a US security agen...,Outsiders,Caution and advice,Related and informative,la airport reopens shooting los angeles international airport reopens fully friday attack saw us security agen,3,5,2023-02-03 00:00:00
396752213512822784,"RT @MsEntropy: Okay, so have any moderate white people bothered to apologize for #LAX yet?",Outsiders,Not applicable,Related - but not informative,rt msentropy okay moderate white people bothered apologize lax yet,2,6,2023-02-03 01:00:00
396753572488294401,RT @El_Grillo1: LAX Shooter:  Ciancia's note and rifle each had orange TSA inspection stickers on them.http://t.co/46jdfWFC4I,Media,Other Useful Information,Related and informative,rt el_grillo1 lax shooter ciancia note rifle orange tsa inspection stickers http co 46jdfwfc4i,3,1,2023-02-03 02:00:00
396756009386901505,RT @NewsBreaker: Note found in LAX shooting suspect's bag said he wanted to kill at least one TSA officer: http://t.co/FINpMcCUvq - @AP,Media,Other Useful Information,Related and informative,rt newsbreaker note found lax shooting suspect bag said wanted kill least one tsa officer http co finpmccuvq ap,3,1,2023-02-03 03:00:00
396757246673039360,.@deadmau5 LA airport reopens after shooting: Los Angeles International Airport reopens fully after Friday's attack ...  @BasedBieberLife,Media,Infrastructure and utilities,Related and informative,deadmau5 la airport reopens shooting los angeles international airport reopens fully friday attack basedbieberlife,3,4,2023-02-03 04:00:00
396758819553804288,You're such a reporter! RT @stephkbarnes Displaced baggage due to yesterday's #LAXShooting being sorted. @NBCLA http://t.co/Jz2xiyINv1,Media,Affected individuals,Related and informative,reporter rt stephkbarnes displaced baggage due yesterday laxshooting sorted nbcla http co jz2xiyinv1,3,2,2023-02-03 05:00:00
396765928920076288,KING D ROYALTY http://t.co/eXjB4V0rbx … #LA #LAX #OAKLAND #SF #BAYAREA #VEGAS #LOSANGELES #CALI #SEO #SMM #WP #OC #MUSIC #BLOGS #TURNUP 23,Not labeled,Not labeled,Not related,king royalty http co exjb4v0rbx la lax oakland sf bayarea vegas losangeles cali seo smm wp oc music blogs turnup 23,0,0,2023-02-03 06:00:00
396768109932974080,Suspected LAX shooter's note revealed http://t.co/Hva2t8nbPO,Outsiders,Other Useful Information,Related and informative,suspected lax shooter note revealed http co hva2t8nbpo,3,1,2023-02-03 07:00:00
396770249015848961,RT @FOX29philly: VIDEO: Details Emerge about LAX Shooter.  http://t.co/JbyrHpLXdb,Media,Affected individuals,Related and informative,rt fox29philly video details emerge lax shooter http co jbyrhplxdb,3,2,2023-02-03 08:00:00
396770970452516864,LAX: Los Angeles airport reopens after TSA agent killed - BBC News http://t.co/xw49wJ1N9y #news,Media,Infrastructure and utilities,Related and informative,lax los angeles airport reopens tsa agent killed bbc news http co xw49wj1n9y news,3,4,2023-02-03 09:00:00
396772451062775808,RT @SEBHEUPDATE: LA airport reopens after shooting http://t.co/8yJKYpXgFJ #SEBHEUPDATE,Media,Infrastructure and utilities,Related and informative,rt sebheupdate la airport reopens shooting http co 8yjkypxgfj sebheupdate,3,4,2023-02-03 10:00:00
396775009555062784,LAX suspect had note saying he wanted to kill TSA - http://t.co/wXuU0JIQBk http://t.co/zd757LbhDV (Latest) #obama #p2,Media,Affected individuals,Related and informative,lax suspect note saying wanted kill tsa http co wxuu0jiqbk http co zd757lbhdv latest obama p2,3,2,2023-02-03 11:00:00
396778029470322688,US Atty for LA Andre Birotte said LAX  gunman faces 2 federal counts: Murder of a federal officer &amp; commission of crime at an airport.,Government,Affected individuals,Related and informative,us atty la andre birotte said lax gunman faces 2 federal counts murder federal officer amp commission crime airport,3,2,2023-02-03 12:00:00
396786384515911680,"STORY: LAX shooting suspect charged with murder, commission of violence at an international airport http://t.co/ljmQajYSUt",Media,Affected individuals,Related and informative,story lax shooting suspect charged murder commission violence international airport http co ljmqajysut,3,2,2023-02-03 13:00:00
396787139511611392,LAX Shooting Suspect Charged With Murder http://t.co/vTcJlisowg - #Fanuendo,Media,Affected individuals,Related and informative,lax shooting suspect charged murder http co vtcjlisowg fanuendo,3,2,2023-02-03 14:00:00
396787340842004480,RT @CBSNews: STORY: LAX shooting suspect charged with murder in rampage http://t.co/eu5zeHUC8A,Media,Affected individuals,Related and informative,rt cbsnews story lax shooting suspect charged murder rampage http co eu5zehuc8a,3,2,2023-02-03 15:00:00
396787437294608384,Police probe motive after deadly LA airport shooting http://t.co/ncH5X6Oxd4 #AFP #video,Media,Affected individuals,Related and informative,police probe motive deadly la airport shooting http co nch5x6oxd4 afp video,3,2,2023-02-03 16:00:00
396789198914473984,Link to Greg W Howard? RT @CrankItUp6: SPLC: LAX-shooter Manifesto...ConspTheorist Patriot http://t.co/oOzCFDpB9z #p2 #tcot #opslam,Outsiders,Affected individuals,Related and informative,link greg w howard rt crankitup6 splc lax shooter manifesto consptheorist patriot http co oozcfdpb9z p2 tcot opslam,3,2,2023-02-03 17:00:00
396792139117375488,Note found at #LAXShooting scene says he wanted to instill fear into their traitorous minds of the TSA.,Outsiders,Affected individuals,Related and informative,note found laxshooting scene says wanted instill fear traitorous minds tsa,3,2,2023-02-03 18:00:00
396794294969044993,RT @PzFeed: FBI: 'SOMEBODY GAVE THE LAX GUNMAN A RIDE TO THE AIRPORT.' FBI URGES ANYONE WITH PICTURES AND VIDEOS TO PROVIDE HERE http://t.c…,Media,Affected individuals,Related and informative,rt pzfeed fbi somebody gave lax gunman ride airport fbi urges anyone pictures videos provide http c,3,2,2023-02-03 19:00:00
396796102722478081,Update: LAX suspect shot slain TSA officer two times: http://t.co/PAcMYrH9z0,Outsiders,Affected individuals,Related and informative,update lax suspect shot slain tsa officer two times http co pacmyrh9z0,3,2,2023-02-03 20:00:00
396798535426797568,"RT @FoxNews: UPDATE: Suspect in LAX shooting wrote note telling of intent to kill TSA employees, report says http://t.co/oGXN1kC2q8",Media,Affected individuals,Related and informative,rt foxnews update suspect lax shooting wrote note telling intent kill tsa employees report says http co ogxn1kc2q8,3,2,2023-02-03 21:00:00
396801362383486977,"RT @jricole: So shooting down people at an airport is *not* terrorism, but carrying a flashdrive with evidence of gov't wrongdoing *is* ter…",Outsiders,Sympathy and support,Related - but not informative,rt jricole shooting people airport terrorism carrying flashdrive evidence gov wrongdoing ter,2,3,2023-02-03 22:00:00
396801718912290816,"LAX #Suspect #Paul Ciancia Charged, Could Face #Death Penalty - Nov 2 @ 8:51 PM ET http://t.co/f5TGlvcBhH",Media,Other Useful Information,Related and informative,lax suspect paul ciancia charged could face death penalty nov 2 8 51 pm et http co f5tglvcbhh,3,1,2023-02-03 23:00:00
396802985583333377,"LAX suspect shot TSA officer, walked away, then returned to shoot him again - CNN International  http://t.co/CGQAJc3BJ0",Media,Affected individuals,Related and informative,lax suspect shot tsa officer walked away returned shoot cnn international http co cgqajc3bj0,3,2,2023-02-04 00:00:00
396803027522187265,".@deadmau5 LAX suspect set out to kill, scare TSA officers:   @BasedBieberLife",Outsiders,Other Useful Information,Related and informative,deadmau5 lax suspect set kill scare tsa officers basedbieberlife,3,1,2023-02-04 01:00:00
396803522433269761,Police: LAX shooting suspect carried note about ‘New World Order’ during attack | The Raw Story http://t.co/nQt02lSid8,Media,Affected individuals,Related and informative,police lax shooting suspect carried note new world order attack raw story http co nqt02lsid8,3,2,2023-02-04 02:00:00
396807226033061888,#us Details surrounding LAX shooter beginning to emerge; charged with murdering a federal officer: Paul Anthon... http://t.co/jmiuoOc2Ed,Media,Affected individuals,Related and informative,us details surrounding lax shooter beginning emerge charged murdering federal officer paul anthon http co jmiuooc2ed,3,2,2023-02-04 03:00:00
396810459845636096,"Other News LAX suspect set out to kill, scare TSA officers: The unemployed motorcycle mechanic suspected of ca... http://t.co/ZrxLhUsopz",Media,Affected individuals,Related and informative,news lax suspect set kill scare tsa officers unemployed motorcycle mechanic suspected ca http co zrxlhusopz,3,2,2023-02-04 04:00:00
396810828936409088,Los Angeles Airport terminal re-opens as shooting probed http://t.co/2RfcrNGDZq via ABS-CBN,Media,Affected individuals,Related and informative,los angeles airport terminal opens shooting probed http co 2rfcrngdzq via abs cbn,3,2,2023-02-04 05:00:00
396811827150991360,"LAX suspect set out to kill, scare TSA officers: The unemployed motorcycle mechanic suspected of ca... http://t.co/7OrvnQEeZf #charlotte",Media,Other Useful Information,Related and informative,lax suspect set kill scare tsa officers unemployed motorcycle mechanic suspected ca http co 7orvnqeezf charlotte,3,1,2023-02-04 06:00:00
396813588771250177,LAX shooting suspect charged with murder http://t.co/zGVQU23dGf,Media,Other Useful Information,Related and informative,lax shooting suspect charged murder http co zgvqu23dgf,3,1,2023-02-04 07:00:00
396815526531309568,RT @hashbrownharst: ジェームズ・フランコが昨日のLAX空港銃撃事件の時着陸した飛行機に乗っていて空港封鎖で足止めされた様子を実況ツィートしていたことが話題に @JamesFrancoTV: #Lax -  http://t.co/Zwxs1siKCf,Not labeled,Not labeled,Not applicable,rt hashbrownharst ジェームズ フランコが昨日のlax空港銃撃事件の時着陸した飛行機に乗っていて空港封鎖で足止めされた様子を実況ツィートしていたことが話題に jamesfrancotv lax http co zwxs1sikcf,1,0,2023-02-04 08:00:00
396818827473739776,RT @GayCarBoys: guns havent made the USA safer: Gunman kills one and injures others at LAX airport  http://t.co/TFs9CiotQW via @guardian #A…,Media,Affected individuals,Related and informative,rt gaycarboys guns havent made usa safer gunman kills one injures others lax airport http co tfs9ciotqw via guardian,3,2,2023-02-04 09:00:00
396822753351061504,Here's the issue of the moment! LAX shooting suspect Paul Ciancia charged with murder - USA TODAY,Media,Affected individuals,Related and informative,issue moment lax shooting suspect paul ciancia charged murder usa today,3,2,2023-02-04 10:00:00
396829590045196288,Accused LAX shooter Paul Ciancia an unknown in his hometown: Official says Paul Ciancia's family doesn't know ... http://t.co/dFw1thbhJw,Media,Affected individuals,Related and informative,accused lax shooter paul ciancia unknown hometown official says paul ciancia family know http co dfw1thbhjw,3,2,2023-02-04 11:00:00
396830890263072768,"RT @ABC: LAX Suspect Paul Ciancia Charged, Could Face Death Penalty - but Is Wounded and Unresponsive http://t.co/4H8eYjM6TC",Media,Affected individuals,Related and informative,rt abc lax suspect paul ciancia charged could face death penalty wounded unresponsive http co 4h8eyjm6tc,3,2,2023-02-04 12:00:00
396831880151977984,"The pylons at Los Angeles International Airport (LAX) have been lighted in blue to honor Gerardo I. Hernandez,... http://t.co/RcqhvRYMbi",Media,Sympathy and support,Related and informative,pylons los angeles international airport lax lighted blue honor gerardo hernandez http co rcqhvrymbi,3,3,2023-02-04 13:00:00
396832219870003201,The LAX Airport Shooter is a Terrorist http://t.co/I8Wuiw4UVS,Media,Other Useful Information,Related and informative,lax airport shooter terrorist http co i8wuiw4uvs,3,1,2023-02-04 14:00:00
396837190145019904,"RT @Mark_JekyllHyde: Here we go, FBI refers to LAX shooter as angry patriot Armed with assault weapon. Goal is to paint patriots &amp; Tea Part…",Outsiders,Affected individuals,Related and informative,rt mark_jekyllhyde go fbi refers lax shooter angry patriot armed assault weapon goal paint patriots amp tea part,3,2,2023-02-04 15:00:00
396838607803011072,"RT @cnnbrk: Wife: #LAX victim Gerardo Hernandez was wonderful husband, father, brother, son and friend. http://t.co/6jB1OgSOQr http://t.c…",Media,Affected individuals,Related and informative,rt cnnbrk wife lax victim gerardo hernandez wonderful husband father brother son friend http co 6jb1ogsoqr http c,3,2,2023-02-04 16:00:00
396840109372624896,"RT @cnnbrk: Wife: #LAX victim Gerardo Hernandez was wonderful husband, father, brother, son and friend. http://t.co/6jB1OgSOQr http://t.c…",Media,Affected individuals,Related and informative,rt cnnbrk wife lax victim gerardo hernandez wonderful husband father brother son friend http co 6jb1ogsoqr http c,3,2,2023-02-04 17:00:00
396841225061298176,LAX suspect set out to kill multiple TSA officers  http://t.co/xRJoXhmV9a,Media,Affected individuals,Related and informative,lax suspect set kill multiple tsa officers http co xrjoxhmv9a,3,2,2023-02-04 18:00:00
396858291684663296,LAX shooting suspect Paul Ciancia charged with murder - USA TODAY http://t.co/BW6Cv6v6A4 (Latest) #usaf #usmc,Media,Affected individuals,Related and informative,lax shooting suspect paul ciancia charged murder usa today http co bw6cv6v6a4 latest usaf usmc,3,2,2023-02-04 19:00:00
396860019729129472,@BasedBieberLife LAX suspect set out to kill multiple TSA officers:   @deadmau5,Outsiders,Affected individuals,Related and informative,basedbieberlife lax suspect set kill multiple tsa officers deadmau5,3,2,2023-02-04 20:00:00
396860430775496704,"LAX suspect set out to kill, scare TSA officers",Outsiders,Other Useful Information,Related and informative,lax suspect set kill scare tsa officers,3,1,2023-02-04 21:00:00
396861227697451008,I heard Eminem is wearing camouflage in support of the LAX shooter. #SNL,Outsiders,Sympathy and support,Related - but not informative,heard eminem wearing camouflage support lax shooter snl,2,3,2023-02-04 22:00:00
396864532787650561,http://t.co/Gohp2NqBTS #rent A cute room with large window and panoramic v (Hollywood near Vi http://t.co/AhMVnN3sDw #LAX #losangeles #CA,Not labeled,Not labeled,Not related,http co gohp2nqbts rent cute room large window panoramic v hollywood near vi http co ahmvnn3sdw lax losangeles ca,0,0,2023-02-04 23:00:00
396865631712456704,Los Angeles airport shooting suspect on murder charge - Radio New Zealand http://t.co/Lh4MVd3ziR (Latest) #Army #Navy #pjnet,Media,Affected individuals,Related and informative,los angeles airport shooting suspect murder charge radio new zealand http co lh4mvd3zir latest army navy pjnet,3,2,2023-02-05 00:00:00
396866512490741760,Murder charge filed against LAX shooting suspect http://t.co/fwe6mCNqX3,Media,Other Useful Information,Related and informative,murder charge filed lax shooting suspect http co fwe6mcnqx3,3,1,2023-02-05 01:00:00
396867498169352192,"RT @BreakingNews: Los Angeles shooting suspect charged with murder of federal officer, commission of violence at international airport - @A…",Media,Affected individuals,Related and informative,rt breakingnews los angeles shooting suspect charged murder federal officer commission violence international airport,3,2,2023-02-05 02:00:00
396889270796832768,"LAX SHOOTING: Suspect charged with murder, may face death penalty http://t.co/Eiyl5dZGNu",Media,Other Useful Information,Related and informative,lax shooting suspect charged murder may face death penalty http co eiyl5dzgnu,3,1,2023-02-05 03:00:00
396908589769424897,LAX shooting suspect was troubled http://t.co/3iMEvYKRTw,Media,Other Useful Information,Related and informative,lax shooting suspect troubled http co 3imevykrtw,3,1,2023-02-05 04:00:00
396912519832301568,"LAX suspect charged with murder: The suspected Los Angeles airport gunman shot a TSA officer, walked away, then returned to shoot his...",Outsiders,Affected individuals,Related and informative,lax suspect charged murder suspected los angeles airport gunman shot tsa officer walked away returned shoot,3,2,2023-02-05 05:00:00
396932363080318976,TSA agent killed in Los Angeles airport shooting  http://t.co/qOArJACJeW,Media,Affected individuals,Related and informative,tsa agent killed los angeles airport shooting http co qoarjacjew,3,2,2023-02-05 06:00:00
396936871944536064,Suspect in LAX Shooting Spree Targeted TSA - ABC News http://t.co/ijShPjwB3A,Media,Affected individuals,Related and informative,suspect lax shooting spree targeted tsa abc news http co ijshpjwb3a,3,2,2023-02-05 07:00:00
396938071540633601,"RT @EndNRA: LAX Shooting Suspect Sent Worrisome Message, Father Sought Authorities' Help: Cops http://t.co/plAtJqrspW #ENDTHENRA",Outsiders,Other Useful Information,Related and informative,rt endnra lax shooting suspect sent worrisome message father sought authorities help cops http co platjqrspw endthenra,3,1,2023-02-05 08:00:00
396943926763847680,LAX suspect faces charge of murder of federal official http://t.co/WqGpQR2AkG,Media,Affected individuals,Related and informative,lax suspect faces charge murder federal official http co wqgpqr2akg,3,2,2023-02-05 09:00:00
396946984403083264,"Prosecutors say LAX shooting suspect turned back to kill TSA officer: According to federal prosecutors, 23-yea... http://t.co/Yhg0pjBdrI",Media,Affected individuals,Related and informative,prosecutors say lax shooting suspect turned back kill tsa officer according federal prosecutors 23 yea http co yhg0pjbdri,3,2,2023-02-05 10:00:00
396959017873854465,LAX SHOOTING: Feds say suspect went back to kill TSA officer http://t.co/4kz4ueItep,Media,Affected individuals,Related and informative,lax shooting feds say suspect went back kill tsa officer http co 4kz4ueitep,3,2,2023-02-05 11:00:00
396959294697902080,Los Angeles airport shooting suspect charged with murder http://t.co/CccmSnkQxm via @ndtv,Media,Affected individuals,Related and informative,los angeles airport shooting suspect charged murder http co cccmsnkqxm via ndtv,3,2,2023-02-05 12:00:00
396977430885572608,"RT @Mark_JekyllHyde: Here we go, FBI refers to LAX shooter as angry patriot Armed with assault weapon. Goal is to paint patriots &amp; Tea Part…",Outsiders,Other Useful Information,Related - but not informative,rt mark_jekyllhyde go fbi refers lax shooter angry patriot armed assault weapon goal paint patriots amp tea part,2,1,2023-02-05 13:00:00
396978819179233280,"FBI: Suspect shot LAX TSA officer before returning, shooting again - USA TODAY http://t.co/Lh4MVd3ziR (Latest) #Army #Navy #pjnet",Media,Affected individuals,Related and informative,fbi suspect shot lax tsa officer returning shooting usa today http co lh4mvd3zir latest army navy pjnet,3,2,2023-02-05 14:00:00
396992186417704960,NJ-born suspect in LAX shooting spree targeted TSA - Burlington County Times http://t.co/Ph8cAeoW06 (Latest) #Giants #RedSkins,Media,Other Useful Information,Related and informative,nj born suspect lax shooting spree targeted tsa burlington county times http co ph8caeow06 latest giants redskins,3,1,2023-02-05 15:00:00
397009999664148481,RT @AliAbunimah: Alleged Boston bombers never provided political motive. #LAXshooting suspect reportedly did. So why are only former termed…,Outsiders,Other Useful Information,Related and informative,rt aliabunimah alleged boston bombers never provided political motive laxshooting suspect reportedly former termed,3,1,2023-02-05 16:00:00
397014957327278081,Paul Anthony Ciancia Identified As LAX Shooting Suspect http://t.co/isq948IS3W #ENDTHENRA,Media,Affected individuals,Related and informative,paul anthony ciancia identified lax shooting suspect http co isq948is3w endthenra,3,2,2023-02-05 17:00:00
397040437728247808,@BasedBieberLife Suspect in LAX shooting spree targeted TSA:   @deadmau5,Outsiders,Affected individuals,Related and informative,basedbieberlife suspect lax shooting spree targeted tsa deadmau5,3,2,2023-02-05 18:00:00
397046183895769088,LAX shooter.  Enjoy. http://t.co/W6hISsMr6k,Outsiders,Other Useful Information,Related and informative,lax shooter enjoy http co w6hissmr6k,3,1,2023-02-05 19:00:00
397047379263643648,"#news Prosecutor: LAX suspect shot TSA officer, left, returned to shoot him again - CNN: ABC NewsProsecutor: L... http://t.co/x3onPySPH1",Media,Affected individuals,Related and informative,news prosecutor lax suspect shot tsa officer left returned shoot cnn abc newsprosecutor l http co x3onpysph1,3,2,2023-02-05 20:00:00
