324008067211608064,RT @soutik: #Boston blasts ~ Twitter ravings and conspiracy theories begin http://t.co/KR1qVxQrQv BostonMarathon #terrorism,Outsiders,Other Useful Information,Related - but not informative,rt soutik boston blasts twitter ravings conspiracy theories begin http co kr1qvxqrqv bostonmarathon terrorism,2,1,2023-01-20 06:00:00,2023-01-20 06:00:00,312513.0,312514.0,0.895,
324011993096921088,RT @Soy_Brent: #prayforboston http://t.co/GWWUeFi65U,Outsiders,Sympathy and support,Related - but not informative,rt soy_brent prayforboston http co gwwuefi65u,2,2,2023-01-20 07:00:00,2023-01-20 07:00:00,312513.0,315853.0,0.895,
324012144070914049,#PrayForBoston :( http://t.co/vFHSDCBdpe,Outsiders,Sympathy and support,Related - but not informative,prayforboston http co vfhsdcbdpe,2,2,2023-01-20 08:00:00,2023-01-20 08:00:00,315852.0,312514.0,0.895,
324014492885327873,"@chrismurphys In the chaos if it all, a cop with his weapon drawn advances towards the blast area before turning and running #BostonMarathon",Outsiders,Other Useful Information,Related and informative,chrismurphys chaos cop weapon drawn advances towards blast area turning running bostonmarathon,1,1,2023-01-20 09:00:00,2023-01-20 09:00:00,315852.0,315853.0,0.895,
324015960912719872,“@AngeloGuligado: “@ANCALERTS: Please beware of this fake Boston Marathon tweet 2/2:  http://t.co/H7QKY26pmb”” #bostonmarathon,Not labeled,Not labeled,Not related,angeloguligado ancalerts please beware fake boston marathon tweet 2 2 http co h7qky26pmb bostonmarathon,0,0,2023-01-20 10:00:00,2023-01-20 10:00:00,312514.0,312520.0,0.319,
324016153859088384,RT @EbenOfficial: Continue to keep the people and their families involved in the Boston bombing in your prayers and thoughts #PrayForBoston,Outsiders,Sympathy and support,Related - but not informative,rt ebenofficial continue keep people families involved boston bombing prayers thoughts prayforboston,2,2,2023-01-20 11:00:00,2023-01-20 11:00:00,312514.0,315873.0,0.319,
324017340826144769,RT @JackLindstrom94: People can chill about Boston Marathon. More people have got injured from Justin bieber smoking pot so cool that shit.,Outsiders,Other Useful Information,Related - but not informative,rt jacklindstrom94 people chill boston marathon people got injured justin bieber smoking pot cool shit,2,1,2023-01-20 12:00:00,2023-01-20 12:00:00,315853.0,312520.0,0.319,
324022776639930368,Super tired and going to bed!! Night everyone!! #BostonMarathon #heartbroken #PrayForBoston,Outsiders,Sympathy and support,Related - but not informative,super tired going bed night everyone bostonmarathon heartbroken prayforboston,2,2,2023-01-20 13:00:00,2023-01-20 13:00:00,315853.0,315873.0,0.319,
324024886366445568,Photoset: usatodaysports: Examples of overwhelming kindness following the Boston Marathon explosions. http://t.co/a78PlMlDcZ,Media,Sympathy and support,Related and informative,photoset usatodaysports examples overwhelming kindness following boston marathon explosions http co a78plmldcz,1,2,2023-01-20 14:00:00,2023-01-20 14:00:00,312517.0,318028.0,0.96,
324029118419189760,"RT @BobbyLeeGarza1: RIP to the 8 yr. old girl who died in the #BostonMarathon explosions, while running for Sandy Hook. #PrayForBoston h ...",Outsiders,Sympathy and support,Related and informative,rt bobbyleegarza1 rip 8 yr old girl died bostonmarathon explosions running sandy hook prayforboston h,1,2,2023-01-20 15:00:00,2023-01-20 15:00:00,312517.0,318029.0,0.96,
324030670328451072,@CraigyFerg loving your show for the Boston marathon atrocities. I don't like any other late show. Mostly because you are honest. Awesome,Outsiders,Sympathy and support,Related - but not informative,craigyferg loving show boston marathon atrocities like late show mostly honest awesome,2,2,2023-01-20 16:00:00,2023-01-20 16:00:00,315824.0,318028.0,0.96,
324032478090244096,"RT @Ch3ls3aT: R.I.P. to the 8 year-old girl who died in Boston's explosions, running for the Sandy Hook kids. http://t.co/k7f41txh30” br ...",Outsiders,Sympathy and support,Related - but not informative,rt ch3ls3at r p 8 year old girl died boston explosions running sandy hook kids http co k7f41txh30 br,2,2,2023-01-20 17:00:00,2023-01-20 17:00:00,315824.0,318029.0,0.96,
324033220482068480,RT @davie_ferguson: We live in a sick world #prayforboston,Outsiders,Sympathy and support,Related - but not informative,rt davie_ferguson live sick world prayforboston,2,2,2023-01-20 18:00:00,2023-01-20 18:00:00,312520.0,312523.0,0.813,
324033522438377472,RT @LiifeSentencess: #prayforboston ! http://t.co/3OWaZ6bohP,Outsiders,Sympathy and support,Related - but not informative,rt liifesentencess prayforboston http co 3owaz6bohp,2,2,2023-01-20 19:00:00,2023-01-20 19:00:00,312520.0,315854.0,0.813,
324035342766321664,"3 killed, more than 100 injured in #BostonMarathon blast http://t.co/XkwL2wa8yy via @BostonDotCom",Media,Affected individuals,Related and informative,3 killed 100 injured bostonmarathon blast http co xkwl2wa8yy via bostondotcom,1,3,2023-01-20 20:00:00,2023-01-20 20:00:00,315873.0,312523.0,0.813,
324035535716880384,Saddened by the bombs that exploded in the crowded streets near the finish line of the Boston Marathon yesterday; Love to all those affected,Outsiders,Sympathy and support,Related - but not informative,saddened bombs exploded crowded streets near finish line boston marathon yesterday love affected,2,2,2023-01-20 21:00:00,2023-01-20 21:00:00,315873.0,315854.0,0.813,
324041357402443776,RT @MiszAliyaDattu: Bombing in Iraq &amp; Boston today? What is going on?!,Outsiders,Other Useful Information,Related - but not informative,rt miszaliyadattu bombing iraq amp boston today going,2,1,2023-01-20 22:00:00,2023-01-20 22:00:00,318035.0,312517.0,1.13,
324050916221259778,RT @NiamsNinja: I'm sorry for him. I feel his hurt. #prayforboston http://t.co/5HmdNpuj4o,Outsiders,Sympathy and support,Related - but not informative,rt niamsninja sorry feel hurt prayforboston http co 5hmdnpuj4o,2,2,2023-01-20 23:00:00,2023-01-20 23:00:00,318035.0,315824.0,1.13,
324052174512459776,"RT @xcanadjanboy: #prayforboston un bambino di 8 anni aspettava il padre al traguardo,a braccia aperte. non sa ancora che il padre non t ...",Not applicable,Sympathy and support,Related and informative,rt xcanadjanboy prayforboston un bambino di 8 anni aspettava il padre al traguardo braccia aperte non sa ancora che il padre non,1,2,2023-01-21 00:00:00,2023-01-21 00:00:00,318036.0,312517.0,1.13,
324052682048421890,"Photo: copsandrobert: weird-happenings: Two days ago, a page was created on Facebook for the Boston Marathon... http://t.co/omuJJ5cTbc",Media,Other Useful Information,Related - but not informative,photo copsandrobert weird happenings two days ago page created facebook boston marathon http co omujj5ctbc,2,1,2023-01-21 01:00:00,2023-01-21 01:00:00,318036.0,315824.0,1.13,
324054137450926080,RT @prayforbst: They're all happy running for finish line but suddenly someone ruined the marathon. #prayforboston http://t.co/uL2KSS16PV,Outsiders,Sympathy and support,Related - but not informative,rt prayforbst happy running finish line suddenly someone ruined marathon prayforboston http co ul2kss16pv,2,2,2023-01-21 02:00:00,2023-01-21 02:00:00,312523.0,312525.0,0.587,
324055051825979392,"RT @DailyMailUS: At least 17 injured in Boston bombing are in critical condition, some not expected to survive the night http://t.co/yt9 ...",Media,Affected individuals,Related and informative,rt dailymailus least 17 injured boston bombing critical condition expected survive night http co yt9,1,3,2023-01-21 03:00:00,2023-01-21 03:00:00,312523.0,315855.0,0.587,
324057765511315456,"POLICE NEEDS TO SEE THIS,IM SERIOUS. #prayforboston http://t.co/FwMcDbRcVj",Outsiders,Sympathy and support,Related - but not informative,police needs see im serious prayforboston http co fwmcdbrcvj,2,2,2023-01-21 04:00:00,2023-01-21 04:00:00,315854.0,312525.0,0.587,
324058965115822081,Què triste y horrible lo ocurrido en Boston! Estoy con Todos de esos areas. #PrayForBoston,Outsiders,Not applicable,Related - but not informative,què triste horrible lo ocurrido en boston estoy con todos de esos areas prayforboston,2,7,2023-01-21 05:00:00,2023-01-21 05:00:00,315854.0,315855.0,0.587,
324061297119465472,RT @BieberGuitar: #PrayForBoston x,Outsiders,Sympathy and support,Related - but not informative,rt bieberguitar prayforboston x,2,2,2023-01-21 06:00:00,2023-01-21 06:00:00,312525.0,312527.0,0.346,
324072244278083585,Explosions at the Boston Marathon: http://t.co/4MGa4xftJD на @YouTube,Media,Other Useful Information,Related and informative,explosions boston marathon http co 4mga4xftjd на youtube,1,1,2023-01-21 07:00:00,2023-01-21 07:00:00,312525.0,315856.0,0.346,
324076254032703488,"RT @Keegxn: C'est la fille de 8 ans qu'est morte à Boston ce soir, j'ai pas de mot. #PrayForBoston http://t.co/EuUDv7xjoK",Not labeled,Not labeled,Not applicable,rt keegxn c est la fille de 8 ans qu est morte à boston ce soir j ai pas de mot prayforboston http co euudv7xjok,3,0,2023-01-21 08:00:00,2023-01-21 08:00:00,315855.0,312527.0,0.346,
324078988702146560,With Big Support from my heart #BostonMarathon !!! Only #Peace,Outsiders,Sympathy and support,Related - but not informative,big support heart bostonmarathon peace,2,2,2023-01-21 09:00:00,2023-01-21 09:00:00,315855.0,315856.0,0.346,
324079735279869952,"RT @llama_ajol: The world is a dark place, lets be the light #prayforboston",Outsiders,Sympathy and support,Related - but not informative,rt llama_ajol world dark place lets light prayforboston,2,2,2023-01-21 10:00:00,2023-01-21 10:00:00,313144.0,318035.0,0.45,
324088954368446464,RT @blindevei: Forferdelig. #prayforboston http://t.co/PKATwq948Q,Outsiders,Sympathy and support,Related - but not informative,rt blindevei forferdelig prayforboston http co pkatwq948q,2,2,2023-01-21 11:00:00,2023-01-21 11:00:00,313144.0,318036.0,0.45,
324091047326126080,"RT @HafizSam: Terrorists do bombings, not Muslims. Open your eyes America. Don't be an idiot. Know the facts first. #PrayForBoston. http ...",Outsiders,Sympathy and support,Related - but not informative,rt hafizsam terrorists bombings muslims open eyes america idiot know facts first prayforboston http,2,2,2023-01-21 12:00:00,2023-01-21 12:00:00,315858.0,318035.0,0.45,
324094004323024898,RT @steveaoki: sending love to everyone in boston... this is a horrible tragedy but amazing to hear how many people came out helping eac ...,Outsiders,Sympathy and support,Related - but not informative,rt steveaoki sending love everyone boston horrible tragedy amazing hear many people came helping eac,2,2,2023-01-21 13:00:00,2023-01-21 13:00:00,315858.0,318036.0,0.45,
324095958864502784,Why are there people on this world who wants to hurt other people? I don't get it why do you want to make people sad and cry? #prayforboston,Outsiders,Sympathy and support,Related - but not informative,people world wants hurt people get want make people sad cry prayforboston,2,2,2023-01-21 14:00:00,2023-01-21 14:00:00,312530.0,313144.0,1.233,
324101763772870657,"RT @StrifyLoveless: #prayforboston  боже , каким же чудовищем надо быть чтобы совершить такое  просматриваю фото и у меня просто шок :с",Not applicable,Sympathy and support,Related - but not informative,rt strifyloveless prayforboston боже каким же чудовищем надо быть чтобы совершить такое просматриваю фото и у меня просто шок с,2,2,2023-01-21 15:00:00,2023-01-21 15:00:00,312530.0,315858.0,1.233,
324105169551912960,RT @magnodetri: Not just boston had bombs today. Iraq did too. #prayforboston #prayforiraq http://t.co/yQdcn6kLuO,Outsiders,Sympathy and support,Related - but not informative,rt magnodetri boston bombs today iraq prayforboston prayforiraq http co yqdcn6kluo,2,2,2023-01-21 16:00:00,2023-01-21 16:00:00,315857.0,313144.0,1.233,
324105719001534465,RT @garrettgee: Creeepy pic from the Boston Marathon. Bomber?? http://t.co/IRfQWGHZ4K,Outsiders,Other Useful Information,Related - but not informative,rt garrettgee creeepy pic boston marathon bomber http co irfqwghz4k,2,1,2023-01-21 17:00:00,2023-01-21 17:00:00,315857.0,315858.0,1.233,
324107807760723968,RT @luv1Dglee: #prayforboston ボストンの方々にとどきますように。 http://t.co/2s6vr4Gb5K,Not labeled,Not labeled,Not applicable,rt luv1dglee prayforboston ボストンの方々にとどきますように http co 2s6vr4gb5k,3,0,2023-01-21 18:00:00,2023-01-21 18:00:00,317895.0,313144.0,1.233,
324111284847144960,"RT @afowler06: R.I.P. to the 8 yr old boy who died in Boston's explosions, while running for the Sandy Hook kids. #PrayForBoston http:// ...",Outsiders,Affected individuals,Related - but not informative,rt afowler06 r p 8 yr old boy died boston explosions running sandy hook kids prayforboston http,2,3,2023-01-21 19:00:00,2023-01-21 19:00:00,317895.0,315858.0,1.233,
324112132117512192,RT @team_world: #prayforboston non ci sono parole.,Outsiders,Sympathy and support,Related - but not informative,rt team_world prayforboston non ci sono parole,2,2,2023-01-21 20:00:00,2023-01-21 20:00:00,317896.0,313144.0,1.233,
324115873398927362,RT @LeRon__James: @neggerQ: Est-ce Brody ou Abu Nazie qui a frappé ?? Ce monde est fou on se croirait dans un film.. #prayforboston lo ...,Not labeled,Not labeled,Not applicable,rt leron__james neggerq est ce brody ou abu nazie qui frappé ce monde est fou se croirait dans un film prayforboston lo,3,0,2023-01-21 21:00:00,2023-01-21 21:00:00,317896.0,315858.0,1.233,
324115969880510464,"RT @DrHalina: Boston kena bomb, 2 org mati.. macam nak kiamat masuk berita. Iraq kena bomb dah 30 orang mati.. Ada orang peduli? Aper la ...",Not labeled,Not labeled,Not applicable,rt drhalina boston kena bomb 2 org mati macam nak kiamat masuk berita iraq kena bomb dah 30 orang mati ada orang peduli aper la,3,0,2023-01-21 22:00:00,2023-01-21 22:00:00,312527.0,312562.0,1.873,
324128770908905473,RT @GabrielMacht: Sending love to the victims and their families/friends that were affected by the explosion at the Boston Marathon. Ble ...,Outsiders,Sympathy and support,Related - but not informative,rt gabrielmacht sending love victims families friends affected explosion boston marathon ble,2,2,2023-01-21 23:00:00,2023-01-21 23:00:00,312527.0,315825.0,1.873,
324134936527380480,Joe Andruzzi helps Boston Marathon bombing victims - NFL News http://t.co/aIzsoxlWAI #sports,Media,Donations and volunteering,Related and informative,joe andruzzi helps boston marathon bombing victims nfl news http co aizsoxlwai sports,1,5,2023-01-22 00:00:00,2023-01-22 00:00:00,315856.0,312562.0,1.873,
324138099040980992,"RT @YourAnonNews: #BostonMarathon Update: 8 children injured, including a two-year-old boy in ICU with head injuries. 10 people have had ...",Media,Affected individuals,Related and informative,rt youranonnews bostonmarathon update 8 children injured including two year old boy icu head injuries 10 people,1,3,2023-01-22 01:00:00,2023-01-22 01:00:00,315856.0,315825.0,1.873,
324138187100397568,"RT @TheRock: Strength &amp; prayers to those in Boston impacted by the cowardly attack. People of Boston are proud, tough &amp; resilien ...",Outsiders,Sympathy and support,Related - but not informative,rt therock strength amp prayers boston impacted cowardly attack people boston proud tough amp resilien,2,2,2023-01-22 02:00:00,2023-01-22 02:00:00,312562.0,318565.0,0.348,
324138401014095872,"An explosion in Boston and Iraq, an earthquake in Iran, the crisis in Syria, the crisis in Palestine.... Wtf is happening to the world?",Outsiders,Sympathy and support,Related - but not informative,explosion boston iraq earthquake iran crisis syria crisis palestine wtf happening world,2,2,2023-01-22 03:00:00,2023-01-22 03:00:00,312562.0,318566.0,0.348,
324141173444849665,RT @sinchaasunshine: #PrayForBoston http://t.co/TWQLS7K29t,Outsiders,Sympathy and support,Related - but not informative,rt sinchaasunshine prayforboston http co twqls7k29t,2,2,2023-01-22 04:00:00,2023-01-22 04:00:00,315825.0,318565.0,0.348,
324141181846028289,RT @nextodrew: è morto un bimbo di 8 anni mentre aspettava di abbracciare suo padre al traguardo. #PrayForBoston,Not labeled,Not labeled,Not applicable,rt nextodrew è morto un bimbo di 8 anni mentre aspettava di abbracciare suo padre al traguardo prayforboston,3,0,2023-01-22 05:00:00,2023-01-22 05:00:00,315825.0,318566.0,0.348,
324141634818293760,RT @EmmittSmith22: Sending love and prayers to those affected by today's tragedy in Boston...just terrible,Outsiders,Sympathy and support,Related - but not informative,rt emmittsmith22 sending love prayers affected today tragedy boston terrible,2,2,2023-01-22 06:00:00,2023-01-22 06:00:00,312564.0,312530.0,1.343,
324141878113099776,"#VMGuru:  Sports: LeBron, Kobe, RG3, Mayweather &amp; Many More React To Marathon Tragedy in… http://t.co/o05IP5aES4",Outsiders,Sympathy and support,Related - but not informative,vmguru sports lebron kobe rg3 mayweather amp many react marathon tragedy http co o05ip5aes4,2,2,2023-01-22 07:00:00,2023-01-22 07:00:00,312564.0,315857.0,1.343,
324142373015781377,RT @EsmeraldaKiczek: The Lord is close to the brokenhearted and saves those who are crushed in spirit. ~Psalm 34:18 #PrayforBoston,Outsiders,Sympathy and support,Related - but not informative,rt esmeraldakiczek lord close brokenhearted saves crushed spirit psalm 34 18 prayforboston,2,2,2023-01-22 08:00:00,2023-01-22 08:00:00,312564.0,317895.0,1.343,
324143761342988288,RT @nprnews: Boston Marathon Explosions: Latest Developments http://t.co/J9lEyrIhjX,Media,Other Useful Information,Related and informative,rt nprnews boston marathon explosions latest developments http co j9leyrihjx,1,1,2023-01-22 09:00:00,2023-01-22 09:00:00,312564.0,317896.0,1.343,
324144176570724352,RT @MAlGhosoon: We are as muslims against what happened in Boston  This a photo from our Holy Book #prayforboston #BostonMarathon http:/ ...,Outsiders,Sympathy and support,Related - but not informative,rt malghosoon muslims happened boston photo holy book prayforboston bostonmarathon http,2,2,2023-01-22 10:00:00,2023-01-22 10:00:00,315874.0,312530.0,1.343,
324144453390594049,RT @Jaredthecarrot: She lost her life in the Boston marathon . #rip . #rt . #respect . :') 8 years old girl :') . http://t.co/4v5eiCgrY2,Outsiders,Sympathy and support,Related - but not informative,rt jaredthecarrot lost life boston marathon rip rt respect 8 years old girl http co 4v5eicgry2,2,2,2023-01-22 11:00:00,2023-01-22 11:00:00,315874.0,315857.0,1.343,
324144587637678081,From South Africa stay strong Boston Lots of Love and Support #prayforboston #southafrica,Outsiders,Sympathy and support,Related - but not informative,south africa stay strong boston lots love support prayforboston southafrica,2,2,2023-01-22 12:00:00,2023-01-22 12:00:00,315874.0,317895.0,1.343,
324147586548248577,"RT @3PennyMovies “@HuffPostCanada: 'We hurt together, we help each other together' #BostonMarathon #bostonstrong”",Outsiders,Sympathy and support,Related - but not informative,rt 3pennymovies huffpostcanada hurt together help together bostonmarathon bostonstrong,2,2,2023-01-22 13:00:00,2023-01-22 13:00:00,315874.0,317896.0,1.343,
324148022760071168,#PrayForBoston Я в шоке!,Outsiders,Sympathy and support,Related - but not informative,prayforboston я в шоке,2,2,2023-01-22 14:00:00,2023-01-22 14:00:00,312566.0,312564.0,0.941,
324149574648344576,RT @HaiMagazine: Fall Out Boy Sumbang Hasil Konser untuk Korban Boston Marathon. Salut! #prayforboston http://t.co/17YLva1gbw,Not labeled,Not labeled,Not applicable,rt haimagazine fall boy sumbang hasil konser untuk korban boston marathon salut prayforboston http co 17ylva1gbw,3,0,2023-01-22 15:00:00,2023-01-22 15:00:00,312566.0,315874.0,0.941,
324153877991653379,RT @BuzzFeed: Boston Marathon tragedy met with unbelievable acts of kindness http://t.co/TD7ivgKCer http://t.co/eU2uhFtq23,Media,Sympathy and support,Related and informative,rt buzzfeed boston marathon tragedy met unbelievable acts kindness http co td7ivgkcer http co eu2uhftq23,1,2,2023-01-22 16:00:00,2023-01-22 16:00:00,315875.0,312564.0,0.941,
324155304055037954,RT @centrepointuk: London Marathon runners are urged to cross the line on Sunday with their #handsoverhearts in tribute to the Boston bo ...,Outsiders,Sympathy and support,Related - but not informative,rt centrepointuk london marathon runners urged cross line sunday handsoverhearts tribute boston bo,2,2,2023-01-22 17:00:00,2023-01-22 17:00:00,315875.0,315874.0,0.941,
324156826595766272,Menino: Boston will overcome.  #BostonMarathon #bostonstrong,Outsiders,Sympathy and support,Related - but not informative,menino boston overcome bostonmarathon bostonstrong,2,2,2023-01-22 18:00:00,2023-01-22 18:00:00,318565.0,318575.0,0.942,
324157313151819776,"Boston Bomb Update: FBI Special Agent Mission is clear, to bring to justice those responsible for the marathon bombing. No known...",Government,Other Useful Information,Related and informative,boston bomb update fbi special agent mission clear bring justice responsible marathon bombing known,1,1,2023-01-22 19:00:00,2023-01-22 19:00:00,318565.0,318576.0,0.942,
324166335091318786,Boston marathon: Arsenal v Everton minute's silence http://t.co/1AsBxR9pUy #arsenor #afc #arsenal,Not labeled,Not labeled,Not related,boston marathon arsenal v everton minute silence http co 1asbxr9puy arsenor afc arsenal,0,0,2023-01-22 20:00:00,2023-01-22 20:00:00,318566.0,318575.0,0.942,
324166557368471553,"RT @BostonMarathons: For each RT this gets, $1 will be donated to the victims of the Boston Marathon Explosions. #DonateToBoston",NGOs,Donations and volunteering,Related and informative,rt bostonmarathons rt gets 1 donated victims boston marathon explosions donatetoboston,1,5,2023-01-22 21:00:00,2023-01-22 21:00:00,318566.0,318576.0,0.942,
324167417217564674,RT @RottenAppleTV: *A SENSELESS ACT OF VIOLENCE* THE BOSTON MARATHON EXPLOSION! [RAW VIDEO FOOTAGE OF EXPLOSION]... http://t.co/jsMPQ5SnPa,Media,Infrastructure and utilities,Related and informative,rt rottenappletv senseless act violence boston marathon explosion raw video footage explosion http co jsmpq5snpa,1,4,2023-01-22 22:00:00,2023-01-22 22:00:00,318575.0,313956.0,0.847,
324170869150720000,RT @blackpumahat: Most inspiring thing  - News stations reporting racers from #bostonmarathon running from finish line to nearby hospita ...,Outsiders,Other Useful Information,Related - but not informative,rt blackpumahat inspiring thing news stations reporting racers bostonmarathon running finish line nearby hospita,2,1,2023-01-22 23:00:00,2023-01-22 23:00:00,318575.0,315879.0,0.847,
324171716383371264,RT @DannyAmendola: I will DONATE $100 for EVERY pass I catch next season to whatever Boston Marathon Relief Fund there is. And $200 fo ...,Outsiders,Donations and volunteering,Related and informative,rt dannyamendola donate 100 every pass catch next season whatever boston marathon relief fund 200 fo,1,5,2023-01-23 00:00:00,2023-01-23 00:00:00,318576.0,313956.0,0.847,
324174069371121665,RT @WeAreBruinsFans: Thank you Chicago. One of the most classiest things I've seen in a while.  #PrayForBoston http://t.co/2ZeLK2Sja5,Outsiders,Sympathy and support,Related - but not informative,rt wearebruinsfans thank chicago one classiest things seen prayforboston http co 2zelk2sja5,2,2,2023-01-23 01:00:00,2023-01-23 01:00:00,318576.0,315879.0,0.847,
324175336059314176,RT @dpshow: Dan's Opening Monologue on Boston Tragedy http://t.co/EeaGt06ULa,Outsiders,Other Useful Information,Related - but not informative,rt dpshow dan opening monologue boston tragedy http co eeagt06ula,2,1,2023-01-23 02:00:00,2023-01-23 02:00:00,312852.0,312566.0,0.73,
324180562166304769,RT @ryanpbroderick: People Are Currently Auctioning Off Their Boston Marathon Finishers Medals On eBay http://t.co/hGSDllrrgE via @buzzf ...,Media,Donations and volunteering,Related - but not informative,rt ryanpbroderick people currently auctioning boston marathon finishers medals ebay http co hgsdllrrge via buzzf,2,5,2023-01-23 03:00:00,2023-01-23 03:00:00,312852.0,315875.0,0.73,
324182755770523650,RT @kidrauhlavons: ashamed to be part of this world when inhumane things like this happen #PrayForBoston,Outsiders,Sympathy and support,Related - but not informative,rt kidrauhlavons ashamed part world inhumane things like happen prayforboston,2,2,2023-01-23 04:00:00,2023-01-23 04:00:00,315861.0,312566.0,0.73,
324183624008220674,The Boston Bombing Produces Familiar and Revealing Reactions:                       Glenn Gre... http://t.co/9t6AbasJuH,Media,Other Useful Information,Related - but not informative,boston bombing produces familiar revealing reactions glenn gre http co 9t6abasjuh,2,1,2023-01-23 05:00:00,2023-01-23 05:00:00,315861.0,315875.0,0.73,
324183707898478593,"RT @biggangVH1: Everyone pray for people in Boston. This was a tragic event that no one deserves, I'm praying for all of you http://t.co ...",Outsiders,Sympathy and support,Related - but not informative,rt biggangvh1 everyone pray people boston tragic event one deserves praying http co,2,2,2023-01-23 06:00:00,2023-01-23 06:00:00,316429.0,312566.0,0.73,
324188384526471172,RT @rtlinfo: Explosions à Boston: la famille de Bill le marathonien décimée http://t.co/IONYRKVwXo,Not labeled,Not labeled,Not applicable,rt rtlinfo explosions à boston la famille de bill le marathonien décimée http co ionyrkvwxo,3,0,2023-01-23 07:00:00,2023-01-23 07:00:00,316429.0,315875.0,0.73,
324190376829284352,"We feel sorrow and anger for what happened in Boston, but people killed in dozens in Syria  daily  #bostonmarathon  #Sryia #BostonExplosion",Outsiders,Sympathy and support,Related - but not informative,feel sorrow anger happened boston people killed dozens syria daily bostonmarathon sryia bostonexplosion,2,2,2023-01-23 08:00:00,2023-01-23 08:00:00,314013.0,314025.0,0.252,
