Tweet ID, Tweet Text, Information Source, Information Type, Informativeness,cleaned_text,informativeness_encoded,information_type_encoded,timestamp,datetime,from,to,distance,cost
323808103780990976,RT @VitoCaro7: Good luck to @kyle_piersma today! It seems like just yesterday I beat you in the river bank run #bostonmarathon,Not labeled,Not labeled,Not related,rt vitocaro7 good luck kyle_piersma today seems like yesterday beat river bank run bostonmarathon,0,0,2023-01-01 00:00:00,2023-01-01 00:00:00,317842.0,318711.0,0.872,
323873597825355778,RT @DianneG: wow. RT @AntDeRosa Photo captures Boston Marathon explosion RT @Boston_to_a_T: Explosion at coply http://t.co/hWhSpoyRfB,Outsiders,Other Useful Information,Related and informative,rt dianneg wow rt antderosa photo captures boston marathon explosion rt boston_to_a_t explosion coply http co hwhspoyrfb,1,1,2023-01-01 01:00:00,2023-01-01 01:00:00,318721.0,315955.0,1.322,
323874466063085568,Awful scenes at the #BostonMarathon. The photo doing the rounds is pretty horrid...,Not applicable,Other Useful Information,Related - but not informative,awful scenes bostonmarathon photo rounds pretty horrid,2,1,2023-01-01 02:00:00,2023-01-01 02:00:00,315927.0,318236.0,1.222,
323874558325161984,Holy shit RT @theoriginalwak: What the fuck just happened?  #bostonmarathon http://t.co/dPh7lvZoxl,Outsiders,Other Useful Information,Related - but not informative,holy shit rt theoriginalwak fuck happened bostonmarathon http co dph7lvzoxl,2,1,2023-01-01 03:00:00,2023-01-01 03:00:00,318711.0,318721.0,0.233,
323875384603058176,RT @russian_market: BOMB EXPLOSION IN BOSTON (via @samsteinhp @jonward11 @nightshiftpol) http://t.co/MbDcEEQ1a2,Media,Other Useful Information,Related and informative,rt russian_market bomb explosion boston via samsteinhp jonward11 nightshiftpol http co mbdceeq1a2,1,1,2023-01-01 04:00:00,2023-01-01 04:00:00,318236.0,317843.0,1.22,
323875502056161281,RT @Lana: oh my god... RT @theoriginalwak: What the fuck just happened?  #bostonmarathon http://t.co/T34ZfIhE4p,Outsiders,Sympathy and support,Related - but not informative,rt lana oh god rt theoriginalwak fuck happened bostonmarathon http co t34zfihe4p,2,2,2023-01-01 05:00:00,2023-01-01 05:00:00,315955.0,315938.0,0.239,
323875539788128256,RT @alertnewengland: Boston Marathon is being shut down. Serious injuries being reported as well as possible fatalities.,Media,Affected individuals,Related and informative,rt alertnewengland boston marathon shut serious injuries reported well possible fatalities,1,3,2023-01-01 06:00:00,2023-01-01 06:00:00,315969.0,315927.0,0.256,
323876328342446083,Explosion at the Boston marathon.,Outsiders,Other Useful Information,Related - but not informative,explosion boston marathon,2,1,2023-01-01 07:00:00,2023-01-01 07:00:00,312346.0,312326.0,0.255,
323876642911031297,#BREAKING @WBZ reporting several people injured after explosion at Boston Marathon finish line. ..   http://t.co/jWqVOcuUzw,Media,Affected individuals,Related and informative,breaking wbz reporting several people injured explosion boston marathon finish line http co jwqvocuuzw,1,3,2023-01-01 08:00:00,2023-01-01 08:00:00,312343.0,312439.0,0.283,
323877448204836864,NOS 21.10 Bij de finish van de marathon van Boston hebben zich twee explosies voorgedaan. De eerste berichten spreken van meerdere gewonden.,Not labeled,Not labeled,Not applicable,nos 21 10 bij de finish van de marathon van boston hebben zich twee explosies voorgedaan de eerste berichten spreken van meerdere gewonden,3,0,2023-01-01 09:00:00,2023-01-01 09:00:00,312439.0,313114.0,1.85,
323877544694784000,O.O Oh no! :( RT @alicegoldfuss: Explosions at the Boston Marathon. Warning: blood. https://t.co/p9Yn9mknIT (via @theoriginalwak),Outsiders,Sympathy and support,Related and informative,oh rt alicegoldfuss explosions boston marathon warning blood https co p9yn9mknit via theoriginalwak,1,2,2023-01-01 10:00:00,2023-01-01 10:00:00,313111.0,317853.0,1.031,
323877624382373888,RT @RobGronkowski: Wow can't believe what just happened at the Boston Marathon. Praying for everyone down there.,Outsiders,Sympathy and support,Related - but not informative,rt robgronkowski wow believe happened boston marathon praying everyone,2,2,2023-01-01 11:00:00,2023-01-01 11:00:00,313114.0,313111.0,0.218,
323877825696366592,RT @BostonDotCom: BREAKING NEWS: Multiple people injured near the Boston Marathon finish line after explosion”,Media,Affected individuals,Related and informative,rt bostondotcom breaking news multiple people injured near boston marathon finish line explosion,1,3,2023-01-01 12:00:00,2023-01-01 12:00:00,317852.0,312346.0,3.208,
323877985088331778,RT @lindsaylohan: Sending prayers to everyone who was/is at the #bostonmarathon,Outsiders,Sympathy and support,Related - but not informative,rt lindsaylohan sending prayers everyone bostonmarathon,2,2,2023-01-01 13:00:00,2023-01-01 13:00:00,316174.0,317852.0,0.557,
323878136091639809,RT @CMichaelGibson: Pictures of explosion at finish line of Boston Marathon http://t.co/PZ26lCa3J5,Media,Affected individuals,Related and informative,rt cmichaelgibson pictures explosion finish line boston marathon http co pz26lca3j5,1,3,2023-01-01 14:00:00,2023-01-01 14:00:00,317853.0,313132.0,0.751,
323878727488516096,RT @RunCompetitor: A major explosion went off next to Marathon Sports store on Boylston Street near to the Boston Marathon finish line.  ...,Outsiders,Infrastructure and utilities,Related and informative,rt runcompetitor major explosion went next marathon sports store boylston street near boston marathon finish line,1,4,2023-01-01 15:00:00,2023-01-01 15:00:00,316085.0,316174.0,1.369,
323878794576412672,Jesus fucking Christ. Those poor people at Boston marathon. I feel sick.,Outsiders,Sympathy and support,Related - but not informative,jesus fucking christ poor people boston marathon feel sick,2,2,2023-01-01 16:00:00,2023-01-01 16:00:00,313132.0,316084.0,1.171,
323878853292457985,Breaking news: Blast rocks Boston Marathon --...,Media,Other Useful Information,Related and informative,breaking news blast rocks boston marathon,1,1,2023-01-01 17:00:00,2023-01-01 17:00:00,315982.0,316085.0,1.095,
323879075607363585,Bombing in Boston?😔,Outsiders,Other Useful Information,Related - but not informative,bombing boston,2,1,2023-01-01 18:00:00,2023-01-01 18:00:00,316084.0,315993.0,1.108,
323879083995983872,Hope everyone is ok at the Boston Marathon.,Outsiders,Sympathy and support,Related - but not informative,hope everyone ok boston marathon,2,2,2023-01-01 19:00:00,2023-01-01 19:00:00,315993.0,316009.0,0.255,
323879344042815488,Horrible news about Boston Marathon. Live feed on Fox News showed spectators saying they say dead bodies.,Media,Other Useful Information,Related - but not informative,horrible news boston marathon live feed fox news showed spectators saying say dead bodies,2,1,2023-01-01 20:00:00,2023-01-01 20:00:00,316001.0,315982.0,0.17,
323879495041966080,RT @itvnews: An explosion has been reported near the finish line of the Boston Marathon in the US http://t.co/nmD9ZopaSE,Media,Other Useful Information,Related and informative,rt itvnews explosion reported near finish line boston marathon us http co nmd9zopase,1,1,2023-01-01 21:00:00,2023-01-01 21:00:00,316009.0,316018.0,0.782,
323879553741234176,People injured in explosions near Boston Marathon finish line: Two explosions at the finish line of the Boston... http://t.co/h3iaFxQv6D,Outsiders,Affected individuals,Related and informative,people injured explosions near boston marathon finish line two explosions finish line boston http co h3iafxqv6d,1,3,2023-01-01 22:00:00,2023-01-01 22:00:00,316009.0,316019.0,0.782,
323879717306507264,RT @michellemalkin: RT @JimArmstrongWBZ Entire Copley square area being evacuated. I'm being moved to Clarendon street. #wbz #bostonmarathon,Media,Infrastructure and utilities,Related and informative,rt michellemalkin rt jimarmstrongwbz entire copley square area evacuated moved clarendon street wbz bostonmarathon,1,4,2023-01-01 23:00:00,2023-01-01 23:00:00,316032.0,316001.0,1.493,
323879759278923777,"RT @RichelleCarey: BREAKING “@cnnbrk: Explosion reported near Boston Marathon finish line, CNN affiliate WCVB reports. http://t.co/PUl2j ...",Media,Other Useful Information,Related and informative,rt richellecarey breaking cnnbrk explosion reported near boston marathon finish line cnn affiliate wcvb reports http co pul2j,1,1,2023-01-02 00:00:00,2023-01-02 00:00:00,316018.0,316045.0,0.795,
323879973188419584,RT @mjbrender: All those concerned for loved ones in the #BostonMarathon - you can see where they last checked in here: http://t.co/gQT2 ...,Outsiders,Affected individuals,Related and informative,rt mjbrender concerned loved ones bostonmarathon see last checked http co gqt2,1,3,2023-01-02 01:00:00,2023-01-02 01:00:00,316019.0,316045.0,0.795,
323880027697582080,Thoughts and prayers to everyone affected by the Boston Marathon explosion today,Outsiders,Sympathy and support,Related - but not informative,thoughts prayers everyone affected boston marathon explosion today,2,2,2023-01-02 02:00:00,2023-01-02 02:00:00,313487.0,316032.0,1.195,
323880044462219264,I hope everyone in Boston is ok and I'm gonna pray for all the marathon runners.,Outsiders,Sympathy and support,Related - but not informative,hope everyone boston ok gon na pray marathon runners,2,2,2023-01-02 03:00:00,2023-01-02 03:00:00,317064.0,316032.0,1.195,
323880602321448961,RT @awmannes: This pic sure doesn't look good - “@thedailybeast: aftermath of the Boston Marathon bombing (via @brm90) http://t.co/jKO2o ...,Outsiders,Affected individuals,Related - but not informative,rt awmannes pic sure look good thedailybeast aftermath boston marathon bombing via brm90 http co jko2o,2,3,2023-01-02 04:00:00,2023-01-02 04:00:00,316045.0,316063.0,1.275,
323880610726834178,RT @maevejrolf: I hope everyone is okay😔🙏 #PrayForBoston,Outsiders,Sympathy and support,Related - but not informative,rt maevejrolf hope everyone okay prayforboston,2,2,2023-01-02 05:00:00,2023-01-02 05:00:00,316045.0,316064.0,1.275,
323880648479748096,RT @markweaver: Live updates of the Boston Marathon bomb http://t.co/FkNJHdSHZC,Media,Other Useful Information,Related and informative,rt markweaver live updates boston marathon bomb http co fknjhdshzc,1,1,2023-01-02 06:00:00,2023-01-02 06:00:00,314165.0,313487.0,1.749,
323880942081040384,RT @FamousNobodies: #PrayforBoston  http://t.co/gI43vojykl,Outsiders,Sympathy and support,Related - but not informative,rt famousnobodies prayforboston http co gi43vojykl,2,2,2023-01-02 07:00:00,2023-01-02 07:00:00,314165.0,317064.0,1.749,
323881336316243968,Live footage Boston marathon explosion http://t.co/CWoxLcc54x,Eyewitness,Other Useful Information,Related and informative,live footage boston marathon explosion http co cwoxlcc54x,1,1,2023-01-02 08:00:00,2023-01-02 08:00:00,315880.0,313487.0,1.749,
323881852215631873,"RT @spj_tweets: Social media chaos re: #BostonMarathon. Live video + lots of photos. Exercise ethics, journalists. It looks gruesome.",Outsiders,Infrastructure and utilities,Related and informative,rt spj_tweets social media chaos bostonmarathon live video lots photos exercise ethics journalists looks gruesome,1,4,2023-01-02 09:00:00,2023-01-02 09:00:00,315880.0,317064.0,1.749,
323882229707202561,RT @QuotationMarks1: Please take a moment to pray for Boston. 2 bombs exploded near the marathon finish line with multiple causalities.,Outsiders,Sympathy and support,Related and informative,rt quotationmarks1 please take moment pray boston 2 bombs exploded near marathon finish line multiple causalities,1,2,2023-01-02 10:00:00,2023-01-02 10:00:00,316063.0,316387.0,2.373,
323882317791756288,Thoughts &amp; prayers go out the victims of the Boston Marathon Explosion. So sad :( What's wrong with the world?,Outsiders,Sympathy and support,Related - but not informative,thoughts amp prayers go victims boston marathon explosion sad wrong world,2,2,2023-01-02 11:00:00,2023-01-02 11:00:00,316063.0,316388.0,2.373,
323882661720510464,RT @Ken_Rosenthal: Thoughts and prayers for all those affected by the tragedy in Boston…just awful.,Outsiders,Sympathy and support,Related - but not informative,rt ken_rosenthal thoughts prayers affected tragedy boston awful,2,2,2023-01-02 12:00:00,2023-01-02 12:00:00,316064.0,316387.0,2.373,
323882925982629888,RT @msnbc: LIVE VIDEO: Explosion at Boston Marathon http://t.co/qTDvK2oRUc,Media,Other Useful Information,Related and informative,rt msnbc live video explosion boston marathon http co qtdvk2oruc,1,1,2023-01-02 13:00:00,2023-01-02 13:00:00,316064.0,316388.0,2.373,
323882946933178368,Two explosions at Boston marathon finish line - Yahoo! News http://t.co/4Myds117tf via @YahooNews,Media,Other Useful Information,Related and informative,two explosions boston marathon finish line yahoo news http co 4myds117tf via yahoonews,1,1,2023-01-02 14:00:00,2023-01-02 14:00:00,314491.0,314165.0,2.439,
323883236331761665,RT @TeamRunner4Life: Thoughts &amp; prayers to everyone that was near the explosion by the Boston Marathon finish line. scary #BostonMar ...,Outsiders,Sympathy and support,Related - but not informative,rt teamrunner4life thoughts amp prayers everyone near explosion boston marathon finish line scary bostonmar,2,2,2023-01-02 15:00:00,2023-01-02 15:00:00,314491.0,315880.0,2.439,
323883693527674881,RT @AARONS_WORLD: North Korea said they were going to strike the USA today and there goes an explosion at the Boston Marathon... SMH.,Outsiders,Other Useful Information,Related - but not informative,rt aarons_world north korea said going strike usa today goes explosion boston marathon smh,2,1,2023-01-02 16:00:00,2023-01-02 16:00:00,315882.0,314165.0,2.439,
323883827762180097,RT @tim_brannigan: Photo of the bomb actually exploding in the distance at #Boston marathon http://t.co/LA8LhMQVnF,Eyewitness,Other Useful Information,Related and informative,rt tim_brannigan photo bomb actually exploding distance boston marathon http co la8lhmqvnf,1,1,2023-01-02 17:00:00,2023-01-02 17:00:00,315882.0,315880.0,2.439,
323884020666626048,RT @i0beyStyles: THERE WAS A FUCKIN EXPLOSION IN BOSTON AND HALF OF U MOTHERFUCKERS ARE DOING 5RTS ARE U FUCKIN KIDDING ME,Outsiders,Sympathy and support,Related - but not informative,rt i0beystyles fuckin explosion boston half u motherfuckers 5rts u fuckin kidding,2,2,2023-01-02 18:00:00,2023-01-02 18:00:00,316387.0,316328.0,1.687,
323884519788789760,RT @SportsCenter: BREAKING: Authorities are investigating a report of two explosions at the finish line of the Boston Marathon.,Media,Other Useful Information,Related and informative,rt sportscenter breaking authorities investigating report two explosions finish line boston marathon,1,1,2023-01-02 19:00:00,2023-01-02 19:00:00,316387.0,317168.0,1.687,
323884582703345665,RT @Pink: Our thoughts and prayers are with everyone affected by the explosions in Boston. 😢,Outsiders,Sympathy and support,Related - but not informative,rt pink thoughts prayers everyone affected explosions boston,2,2,2023-01-02 20:00:00,2023-01-02 20:00:00,316388.0,316328.0,1.687,
323884641419415554,"RT @lauren11708: explosion in Boston , whyyy . when is this unnecessary violence ever going to end , on some real shit.. smh",Outsiders,Sympathy and support,Related - but not informative,rt lauren11708 explosion boston whyyy unnecessary violence ever going end real shit smh,2,2,2023-01-02 21:00:00,2023-01-02 21:00:00,316388.0,317168.0,1.687,
323884742107873280,RT @WSJ: Follow live coverage of the aftermath of two explosions at the finish line of the Boston Marathon: http://t.co/48ZPPOXJ6I,Media,Other Useful Information,Related and informative,rt wsj follow live coverage aftermath two explosions finish line boston marathon http co 48zppoxj6i,1,1,2023-01-02 22:00:00,2023-01-02 22:00:00,314485.0,314491.0,0.221,
323885052498960384,#prayforboston bless their hearts!,Outsiders,Sympathy and support,Related - but not informative,prayforboston bless hearts,2,2,2023-01-02 23:00:00,2023-01-02 23:00:00,314485.0,315882.0,0.221,
323885169922695168,RT @BBCBreaking: WATCH LIVE: Two explosions near finish line of Boston Marathon leave unknown number of people injured http://t.co/X3ITf ...,Media,Affected individuals,Related and informative,rt bbcbreaking watch live two explosions near finish line boston marathon leave unknown number people injured http co x3itf,1,3,2023-01-03 00:00:00,2023-01-03 00:00:00,315883.0,314491.0,0.221,
323885429977911296,Please don't let this be terrorists... #BostonMarathon #PrayforBoston,Outsiders,Sympathy and support,Related - but not informative,please let terrorists bostonmarathon prayforboston,2,2,2023-01-03 01:00:00,2023-01-03 01:00:00,315883.0,315882.0,0.221,
323885442556637185,RT @rob_bieber: Finish Line Boston Marathon after explosion (second explosion seen in ba...: http://t.co/wCJi6hsjk0 via @youtube,Media,Affected individuals,Related and informative,rt rob_bieber finish line boston marathon explosion second explosion seen ba http co wcji6hsjk0 via youtube,1,3,2023-01-03 02:00:00,2023-01-03 02:00:00,316328.0,316314.0,0.294,
323885576761794561,Boston you're my home! My thoughts to those involved with this tragedy! I hope everyone is okay!!!,Outsiders,Sympathy and support,Related - but not informative,boston home thoughts involved tragedy hope everyone okay,2,2,2023-01-03 03:00:00,2023-01-03 03:00:00,316328.0,317171.0,0.294,
323885803266797568,RT @BigBootyProbs: #PrayForBoston http://t.co/rVpnX46oSE,Outsiders,Sympathy and support,Related - but not informative,rt bigbootyprobs prayforboston http co rvpnx46ose,2,2,2023-01-03 04:00:00,2023-01-03 04:00:00,317168.0,316314.0,0.294,
323885849412521985,RT @Hobbknob: Watching the sky news video clip of the bomb going off in Boston. Absolutely mental scenes......,Outsiders,Other Useful Information,Related - but not informative,rt hobbknob watching sky news video clip bomb going boston absolutely mental scenes,2,1,2023-01-03 05:00:00,2023-01-03 05:00:00,317168.0,317171.0,0.294,
323885861991243776,Deux explosions lors du marathon de Boston ont blessé de nombreuses personnes. Toutes nos pensées aux victimes. #sadnews,Outsiders,Other Useful Information,Related - but not informative,deux explosions lors du marathon de boston ont blessé de nombreuses personnes toutes nos pensées aux victimes sadnews,2,1,2023-01-03 06:00:00,2023-01-03 06:00:00,314433.0,314485.0,2.939,
323886004593385472,Boston hasn't seen a tragedy like this since the Boston Tea Party.,Outsiders,Other Useful Information,Related - but not informative,boston seen tragedy like since boston tea party,2,1,2023-01-03 07:00:00,2023-01-03 07:00:00,314433.0,315883.0,2.939,
323886050709737472,#PrayForBoston.. this is so sad.. :( my prayers are with all of them,Outsiders,Sympathy and support,Related - but not informative,prayforboston sad prayers,2,2,2023-01-03 08:00:00,2023-01-03 08:00:00,315886.0,314485.0,2.939,
323886088483643393,RT @dailydot: 3 reported dead at Boston Marathon: http://t.co/MCbCE8uh9I,Media,Affected individuals,Related and informative,rt dailydot 3 reported dead boston marathon http co mcbce8uh9i,1,3,2023-01-03 09:00:00,2023-01-03 09:00:00,315886.0,315883.0,2.939,
323886226878902272,"RT @cnnbrk: Two blasts at #Boston Marathon have injured at least 6 people,some seriously; situation still developing. http://t.co/rCfe7P4JyR",Media,Affected individuals,Related and informative,rt cnnbrk two blasts boston marathon injured least 6 people seriously situation still developing http co rcfe7p4jyr,1,3,2023-01-03 10:00:00,2023-01-03 10:00:00,316314.0,314460.0,2.861,
323886243681284097,RT @piersmorgan: BREAKING: CNN reports counter-terrorist cops now patrolling major landmarks here in NY after #BostonMarathon explosions.,Media,Other Useful Information,Related and informative,rt piersmorgan breaking cnn reports counter terrorist cops patrolling major landmarks ny bostonmarathon explosions,1,1,2023-01-03 11:00:00,2023-01-03 11:00:00,316314.0,315866.0,2.861,
323886612754870273,I'm going to be raising money for #BostonMarathon it's not fair what happens to good people,Outsiders,Donations and volunteering,Related - but not informative,going raising money bostonmarathon fair happens good people,2,5,2023-01-03 12:00:00,2023-01-03 12:00:00,317171.0,314460.0,2.861,
323886671491915776,RT @LauraLaneNYC: Three friends running in the Boston Marathon today. Thinking of them and their fellow runners and hoping everyone is safe.,Eyewitness,Sympathy and support,Related - but not informative,rt lauralanenyc three friends running boston marathon today thinking fellow runners hoping everyone safe,2,2,2023-01-03 13:00:00,2023-01-03 13:00:00,317171.0,315866.0,2.861,
323886994457501696,RT @Podolski10: Praying for everyone at Boston Marathon!! #Bostonmarathon #Pray,Outsiders,Sympathy and support,Related - but not informative,rt podolski10 praying everyone boston marathon bostonmarathon pray,2,2,2023-01-03 14:00:00,2023-01-03 14:00:00,314460.0,314446.0,0.259,
323887120261468160,RT @MarissaNBCLA: #BREAKING #BOSTONMARATHON former LAPD Chief William Bratton live on NBC News right now said one of his sources estimat ...,Media,Other Useful Information,Related and informative,rt marissanbcla breaking bostonmarathon former lapd chief william bratton live nbc news right said one sources estimat,1,1,2023-01-03 15:00:00,2023-01-03 15:00:00,314460.0,315867.0,0.259,
323887153811705858,RT @cnnbrk: New York City has tightened security in wake of explosions at #Boston Marathon. We don't know extent of casualties. http://t ...,Media,Caution and advice,Related and informative,rt cnnbrk new york city tightened security wake explosions boston marathon know extent casualties http,1,6,2023-01-03 16:00:00,2023-01-03 16:00:00,315866.0,314446.0,0.259,
323887460008468480,RT @KCRG: ABC News is reporting that air quality experts have been brought into Boston to ensure explosions were not a chemical attack.,Media,Other Useful Information,Related and informative,rt kcrg abc news reporting air quality experts brought boston ensure explosions chemical attack,1,1,2023-01-03 17:00:00,2023-01-03 17:00:00,315866.0,315867.0,0.259,
323887648764735489,RT @KaraKrystel: My heart goes out to all that were affected by the explosion in Boston.,Outsiders,Sympathy and support,Related - but not informative,rt karakrystel heart goes affected explosion boston,2,2,2023-01-03 18:00:00,2023-01-03 18:00:00,314419.0,314433.0,0.249,
323887661318303744,RT @ItsJennaMarbles: #PrayForBoston http://t.co/JeZrZhsETU,Outsiders,Sympathy and support,Related - but not informative,rt itsjennamarbles prayforboston http co jezrzhsetu,2,2,2023-01-03 19:00:00,2023-01-03 19:00:00,314419.0,315886.0,0.249,
323887665546149888,#PrayForBoston 🙌🙏🙌🙏🙏,Outsiders,Sympathy and support,Related - but not informative,prayforboston,2,2,2023-01-03 20:00:00,2023-01-03 20:00:00,315887.0,314433.0,0.249,
323887711649923074,RT @WhiteGinga1999: #PrayForBoston Crazy bastards...........,Outsiders,Sympathy and support,Related - but not informative,rt whiteginga1999 prayforboston crazy bastards,2,2,2023-01-03 21:00:00,2023-01-03 21:00:00,315887.0,315886.0,0.249,
323888097551077377,New York Post reports 12 runners were killed in Boston marathon bombings.,Media,Affected individuals,Related and informative,new york post reports 12 runners killed boston marathon bombings,1,3,2023-01-03 22:00:00,2023-01-03 22:00:00,313438.0,314419.0,3.248,
323888118535163905,wow. wow. wow. Praying for everyone in Boston. absolutely horrific. Speluation that it was a terrorist =-O,Outsiders,Sympathy and support,Related - but not informative,wow wow wow praying everyone boston absolutely horrific speluation terrorist,2,2,2023-01-03 23:00:00,2023-01-03 23:00:00,313438.0,315887.0,3.248,
323888181441351681,RT @BethanSheeran: woah oh my god this is horrible #prayforboston,Outsiders,Sympathy and support,Related - but not informative,rt bethansheeran woah oh god horrible prayforboston,2,2,2023-01-04 00:00:00,2023-01-04 00:00:00,315891.0,314419.0,3.248,
323888198226956289,Vice President just described on CNN a bombing not an explosion #Boston,Outsiders,Other Useful Information,Related and informative,vice president described cnn bombing explosion boston,1,1,2023-01-04 01:00:00,2023-01-04 01:00:00,315891.0,315887.0,3.248,
323888298886041601,"RT @mufc_blog: #prayforboston shocking scenes, tragic for everyone involved :(",Media,Sympathy and support,Related - but not informative,rt mufc_blog prayforboston shocking scenes tragic everyone involved,2,2,2023-01-04 02:00:00,2023-01-04 02:00:00,313450.0,313438.0,0.313,
323888353391042561,RT @DapDMoney: Ok so about these explosions in Boston?!,Outsiders,Other Useful Information,Related - but not informative,rt dapdmoney ok explosions boston,2,1,2023-01-04 03:00:00,2023-01-04 03:00:00,313450.0,315891.0,0.313,
323888378577817600,RT @TheFireTracker2: Boston authorities asking people to limit cell phone use. Systems overloading #BostonMarathon #boston #UseText,Media,Caution and advice,Related and informative,rt thefiretracker2 boston authorities asking people limit cell phone use systems overloading bostonmarathon boston usetext,1,6,2023-01-04 04:00:00,2023-01-04 04:00:00,315892.0,313438.0,0.313,
323888458269614082,RT @BostonGlobe: BREAKING NEWS: Two powerful explosions detonated in quick succession right next to the Boston Marathon finsh line this  ...,Media,Other Useful Information,Related and informative,rt bostonglobe breaking news two powerful explosions detonated quick succession right next boston marathon finsh line,1,1,2023-01-04 05:00:00,2023-01-04 05:00:00,315892.0,315891.0,0.313,
