323909568176472064,"RT @FoxNews: BREAKING: Boston Marathon HQ locked down after report of explosion, spokesman says  http://t.co/hDXhR7S2GN  #Bostonmarathon",Media,Infrastructure and utilities,Related and informative,rt foxnews breaking boston marathon hq locked report explosion spokesman says http co hdxhr7s2gn bostonmarathon,1,4,2023-01-10 19:00:00,2023-01-10 19:00:00,314013.0,314013.0,0.0,
323909580784533505,RT @BostonTweet: Google has created a Person Finder for those affected by the #BostonMarathon explosions. http://t.co/2AH3ysDJEh,Media,Affected individuals,Related and informative,rt bostontweet google created person finder affected bostonmarathon explosions http co 2ah3ysdjeh,1,3,2023-01-10 20:00:00,2023-01-10 20:00:00,314994.0,315042.0,0.922,
323909673029873665,RT @subaru_usa: Our thoughts are with everyone affected by the tragic events unfolding in Boston today.,Business,Sympathy and support,Related - but not informative,rt subaru_usa thoughts everyone affected tragic events unfolding boston today,2,2,2023-01-10 21:00:00,2023-01-10 21:00:00,312134.0,312133.0,1.771,
323909735965409280,"So in light of new information, this IS an organized terrorist attack. So sad and screwed up. Stay safe and stay strong, Boston residents.",Not applicable,Sympathy and support,Related - but not informative,light new information organized terrorist attack sad screwed stay safe stay strong boston residents,2,2,2023-01-10 22:00:00,2023-01-10 22:00:00,315060.0,312132.0,2.068,
323910134399115265,@kwild: RT @emamd: Google has a person finder up for the #boston explosions http://t.co/bmUEoILV0F,NGOs,Affected individuals,Related and informative,kwild rt emamd google person finder boston explosions http co bmueoilv0f,1,3,2023-01-10 23:00:00,2023-01-10 23:00:00,313552.0,314379.0,3.082,
323910302188064769,I JUST SAW THIS VIDEO OF BOSTON AND IM LEGTLY CRYING RN #prayforboston https://t.co/mXXSylkBr4,Outsiders,Sympathy and support,Related - but not informative,saw video boston im legtly crying rn prayforboston https co mxxsylkbr4,2,2,2023-01-11 00:00:00,2023-01-11 00:00:00,313552.0,315903.0,3.082,
323910432228253696,RT @google: Let your friends &amp; family know you're OK or locate your loved ones w/ Person Finder for the Boston explosions: http://t. ...,Business,Affected individuals,Related and informative,rt google let friends amp family know ok locate loved ones w person finder boston explosions http,1,3,2023-01-11 01:00:00,2023-01-11 01:00:00,315901.0,314379.0,3.082,
323911141036290048,@iiTalk_uDont: “@DrayaFace: God bless the victims and families of the #BostonMarathon tragedy.”,Outsiders,Sympathy and support,Related - but not informative,iitalk_udont drayaface god bless victims families bostonmarathon tragedy,2,2,2023-01-11 02:00:00,2023-01-11 02:00:00,315901.0,315903.0,3.082,
323911216546332673,AP: Mobilfunknetz in Boston abgeschaltet um Fernzündungen zu verhindern http://t.co/NdZj7B3CrQ #Boston #BostonMarathon,Not labeled,Not labeled,Not applicable,ap mobilfunknetz boston abgeschaltet um fernzündungen zu verhindern http co ndzj7b3crq boston bostonmarathon,3,0,2023-01-11 03:00:00,2023-01-11 03:00:00,314241.0,313349.0,3.383,
323911224930750464,#PrayForBoston such a sick world we live in!!,Outsiders,Sympathy and support,Related - but not informative,prayforboston sick world live,2,2,2023-01-11 04:00:00,2023-01-11 04:00:00,314241.0,315910.0,3.383,
323911304639295489,RT @BostonGlobe: Google has created a Boston Marathon Explosion person finder http://t.co/SCeMAPAYMx  h/t @cmcloutier,Media,Affected individuals,Related and informative,rt bostonglobe google created boston marathon explosion person finder http co scemapaymx h cmcloutier,1,3,2023-01-11 05:00:00,2023-01-11 05:00:00,315908.0,313349.0,3.383,
323911359156871170,@seanwbu: April 15th: Titanic sunk April 15th: Hillsborough Disaster April 15th: Boston Explosion. Holy shit and my mums birthday!!,Outsiders,Sympathy and support,Related - but not informative,seanwbu april 15th titanic sunk april 15th hillsborough disaster april 15th boston explosion holy shit mums birthday,2,2,2023-01-11 06:00:00,2023-01-11 06:00:00,315908.0,315910.0,3.383,
323911690502696960,RT @google: Let your friends &amp; family know you're OK or locate your loved ones w/ Person Finder for the Boston explosions: http://t. ...,Business,Affected individuals,Related and informative,rt google let friends amp family know ok locate loved ones w person finder boston explosions http,1,3,2023-01-11 07:00:00,2023-01-11 07:00:00,318550.0,313551.0,3.753,
323911736656793601,RT @AnnCurry: For families in search of loved ones:  1-617-635-4520 #BostonMarathon,Outsiders,Affected individuals,Related and informative,rt anncurry families search loved ones 1 617 635 4520 bostonmarathon,1,3,2023-01-11 08:00:00,2023-01-11 08:00:00,318550.0,315900.0,3.753,
323911749231312896,RT @Cadizzlemore: My thoughts and prayers go out to those affected by the bombs in Boston... this is all just so horrible. #prayforboston,Outsiders,Sympathy and support,Related - but not informative,rt cadizzlemore thoughts prayers go affected bombs boston horrible prayforboston,2,2,2023-01-11 09:00:00,2023-01-11 09:00:00,318551.0,313551.0,3.753,
323912126710312962,RT @YahooNews: Photos of the aftermath of the Boston Marathon explosions from a witness at the scene: http://t.co/cmdLUBykGo,Media,Affected individuals,Related and informative,rt yahoonews photos aftermath boston marathon explosions witness scene http co cmdlubykgo,1,3,2023-01-11 10:00:00,2023-01-11 10:00:00,318551.0,315900.0,3.753,
323912135103102977,#prayforboston what's going on in this world?!?!,Outsiders,Sympathy and support,Related - but not informative,prayforboston going world,2,2,2023-01-11 11:00:00,2023-01-11 11:00:00,313344.0,313339.0,3.375,
323912177029378048,RT @MyJustinQuotes: THE MARATHON WAS FOR THE CHILDREN WHO DIED IN NEWTON AND YOU FUCKING BOMB THE MARATHON? OMFG THIS IS TO MUCH.. #pray ...,Outsiders,Sympathy and support,Related - but not informative,rt myjustinquotes marathon children died newton fucking bomb marathon omfg much pray,2,2,2023-01-11 12:00:00,2023-01-11 12:00:00,313344.0,315913.0,3.375,
323912302883639296,RT @franagudo: #PrayforBoston #PrayforBoston #PrayforBoston #PrayforBoston #PrayforBoston #PrayforBoston #PrayforBoston #PrayforBoston,Outsiders,Sympathy and support,Related - but not informative,rt franagudo prayforboston prayforboston prayforboston prayforboston prayforboston prayforboston prayforboston prayforboston,2,2,2023-01-11 13:00:00,2023-01-11 13:00:00,315911.0,313339.0,3.375,
323912617443872769,RT @emitoms: There are reports of Boston Marathon runners crossing finish line and continuing to run to the Hospital to give blood to v ...,Outsiders,Other Useful Information,Related and informative,rt emitoms reports boston marathon runners crossing finish line continuing run hospital give blood v,1,1,2023-01-11 14:00:00,2023-01-11 14:00:00,315911.0,315913.0,3.375,
323912927822360578,No puedo creer lo que esta pasando!!  #prayforboston,Not labeled,Not labeled,Not applicable,puedo creer lo que esta pasando prayforboston,3,0,2023-01-11 15:00:00,2023-01-11 15:00:00,316271.0,318550.0,1.341,
323913158492303360,RT @Connor_Eli: Go to a movie? Get shot. Go to school? Get shot. Run a marathon? Get bombed. Such a selfish world this is. #PrayForBoston,Outsiders,Sympathy and support,Related - but not informative,rt connor_eli go movie get shot go school get shot run marathon get bombed selfish world prayforboston,2,2,2023-01-11 16:00:00,2023-01-11 16:00:00,316271.0,318551.0,1.341,
323913187856613377,RT @todayshow: Pres. Obama receives an update from the FBI director on #BostonMarathon blasts. (Credit: Pete Souza / White House) http:/ ...,Media,Other Useful Information,Related and informative,rt todayshow pres obama receives update fbi director bostonmarathon blasts credit pete souza white house http,1,1,2023-01-11 17:00:00,2023-01-11 17:00:00,316280.0,318550.0,1.341,
323913577922715648,RT @inecascos: que huevos hacer estoy en una maratón #PrayForBoston http://t.co/kbsJTZ1mNw,Outsiders,Not applicable,Related - but not informative,rt inecascos que huevos hacer estoy en una maratón prayforboston http co kbsjtz1mnw,2,7,2023-01-11 18:00:00,2023-01-11 18:00:00,316280.0,318551.0,1.341,
323913603109490688,RT @Josh_Vintson: This is terrifying http://t.co/bxU3U3W0TA #PrayForBoston,Outsiders,Sympathy and support,Related - but not informative,rt josh_vintson terrifying http co bxu3u3w0ta prayforboston,2,2,2023-01-11 19:00:00,2023-01-11 19:00:00,313339.0,316279.0,1.329,
323913829601914881,RT @we_believejb: Help this girl find her family. Please RT and spread the word. #prayforboston http://t.co/ljlyC3pkFF,Outsiders,Other Useful Information,Related - but not informative,rt we_believejb help girl find family please rt spread word prayforboston http co ljlyc3pkff,2,1,2023-01-11 20:00:00,2023-01-11 20:00:00,313339.0,316281.0,1.329,
323913858949472256,"“@GordonEdes: Asked if this was the work of terrorists, Boston police commissioner Ed Davis said you can draw your own conclusions.”",Media,Other Useful Information,Related and informative,gordonedes asked work terrorists boston police commissioner ed davis said draw conclusions,1,1,2023-01-11 21:00:00,2023-01-11 21:00:00,315913.0,316279.0,1.329,
323914110620274688,RT @TheCoachESPN: If you are trying to find a loved one in boston call 617-635-4500. If you have any info on the explosions call 1800-49 ...,Media,Affected individuals,Related and informative,rt thecoachespn trying find loved one boston call 617 635 4500 info explosions call 1800 49,1,3,2023-01-11 22:00:00,2023-01-11 22:00:00,315913.0,316281.0,1.329,
323914479706464256,RT @glvredcross: American Red Cross Statement on Boston Marathon Explosions  http://t.co/oHSN4hQC5w,NGOs,Donations and volunteering,Related and informative,rt glvredcross american red cross statement boston marathon explosions http co ohsn4hqc5w,1,5,2023-01-11 23:00:00,2023-01-11 23:00:00,313055.0,316271.0,0.496,
323915029168672768,RT @snugglinghazza: honestly everyone retweet this you could save a life please read #prayforboston http://t.co/hZq8j4S6p0,Outsiders,Sympathy and support,Related - but not informative,rt snugglinghazza honestly everyone retweet could save life please read prayforboston http co hzq8j4s6p0,2,2,2023-01-12 00:00:00,2023-01-12 00:00:00,313055.0,316280.0,0.496,
323915171770798080,heart wrenching photo RT “@CBSSports: PHOTO: A bystander comforts a victim of today's attack in Boston. http://t.co/PxFr8gC9eE”,Media,Other Useful Information,Related and informative,heart wrenching photo rt cbssports photo bystander comforts victim today attack boston http co pxfr8gc9ee,1,1,2023-01-12 01:00:00,2023-01-12 01:00:00,316279.0,313082.0,0.486,
323915247259877377,RT @samantha_june3: 😭🙏RT @Darkskin: IN BOSTON: He ran in dedication of the newtown kids and now he won't ever walk again #prayforboston  ...,Outsiders,Affected individuals,Related - but not informative,rt samantha_june3 rt darkskin boston ran dedication newtown kids ever walk prayforboston,2,3,2023-01-12 02:00:00,2023-01-12 02:00:00,316279.0,315914.0,0.486,
323915364717195264,RT @emitoms: There are reports of Boston Marathon runners crossing finish line and continuing to run to the Hospital to give blood to v ...,Outsiders,Donations and volunteering,Related and informative,rt emitoms reports boston marathon runners crossing finish line continuing run hospital give blood v,1,5,2023-01-12 03:00:00,2023-01-12 03:00:00,316281.0,313082.0,0.486,
323915398288379905,RT @JMaxey97: What a damn shame #prayforboston,Outsiders,Sympathy and support,Related - but not informative,rt jmaxey97 damn shame prayforboston,2,2,2023-01-12 04:00:00,2023-01-12 04:00:00,316281.0,315914.0,0.486,
323915771543683073,RT @hannadianee: Hope everyone's ok #prayforboston,Outsiders,Sympathy and support,Related - but not informative,rt hannadianee hope everyone ok prayforboston,2,2,2023-01-12 05:00:00,2023-01-12 05:00:00,313082.0,313080.0,0.231,
323915851252248577,Sickened and saddened by the news of events in Boston today. #prayforboston,Outsiders,Sympathy and support,Related - but not informative,sickened saddened news events boston today prayforboston,2,2,2023-01-12 06:00:00,2023-01-12 06:00:00,313082.0,315915.0,0.231,
323915863851937792,"RT @BiebersRobot: People at the Boston marathon are having a blast WHAT IS WRONG WITH YOU, SICK MINDED PEOPLE. INNOCENT LIVES HAVE BEE ...",Outsiders,Other Useful Information,Related - but not informative,rt biebersrobot people boston marathon blast wrong sick minded people innocent lives bee,2,1,2023-01-12 07:00:00,2023-01-12 07:00:00,315914.0,313080.0,0.231,
323915943526932482,Google Has Created A Person Finder For The Boston Marathon - digg: Pass it on. http://t.co/EiR1eg0Arw,NGOs,Affected individuals,Related and informative,google created person finder boston marathon digg pass http co eir1eg0arw,1,3,2023-01-12 08:00:00,2023-01-12 08:00:00,315914.0,315915.0,0.231,
323916086116487168,"RT @NBCLA: At 3:10pm PT, Pres. Obama will address the nation about the #BostonMarathon explosions. We'll be livestreaming here: http://t ...",Media,Other Useful Information,Related and informative,rt nbcla 3 10pm pt pres obama address nation bostonmarathon explosions livestreaming http,1,1,2023-01-12 09:00:00,2023-01-12 09:00:00,313080.0,313037.0,7.58,
323916149039452160,"RT @BryanJacoutot: 96 countries were represented at Boston Marathon today. This was an attack on the world. Not just Boston, not just Am ...",Outsiders,Sympathy and support,Related and informative,rt bryanjacoutot 96 countries represented boston marathon today attack world boston,1,2,2023-01-12 10:00:00,2023-01-12 10:00:00,315915.0,313037.0,7.58,
323916216148295683,The boston marathon bombing photos and clips made me sick to my stomach. How could anyone do that to another human being #prayforboston,Outsiders,Sympathy and support,Related - but not informative,boston marathon bombing photos clips made sick stomach could anyone another human prayforboston,2,2,2023-01-12 11:00:00,2023-01-12 11:00:00,313037.0,313035.0,0.257,
323916316836765697,BOSTON: TERRORIST ATTACK! CNN AND CBS ARE OFFICIALLY CALLING THIS A TERRORIST ATTACK! #911BUFF,Outsiders,Other Useful Information,Related - but not informative,boston terrorist attack cnn cbs officially calling terrorist attack 911buff,2,1,2023-01-12 12:00:00,2023-01-12 12:00:00,314042.0,314036.0,0.181,
323916459417931779,RT @Jades_BowtiesLM: “@definitelylouis: RT THIS GUYS ITS REALLY IMPORTANT #PrayforBoston http://t.co/eO1UNmdg9A”,Outsiders,Sympathy and support,Related - but not informative,rt jades_bowtieslm definitelylouis rt guys really important prayforboston http co eo1unmdg9a,2,2,2023-01-12 13:00:00,2023-01-12 13:00:00,314042.0,315895.0,0.181,
323916702704365568,#prayforboston estou chocada não sabia que era tão grave,Not labeled,Not labeled,Not applicable,prayforboston estou chocada não sabia que era tão grave,3,0,2023-01-12 14:00:00,2023-01-12 14:00:00,315894.0,314036.0,0.181,
323917138886815744,RT @mylifeasafemale: My hearts go out to all those who are affected by this senseless tragedy 💔 #prayforboston,Outsiders,Sympathy and support,Related - but not informative,rt mylifeasafemale hearts go affected senseless tragedy prayforboston,2,2,2023-01-12 15:00:00,2023-01-12 15:00:00,315894.0,315895.0,0.181,
323917407322247168,#prayforboston Todo mi apoyo para Boston.,Not labeled,Not labeled,Not applicable,prayforboston todo mi apoyo para boston,3,0,2023-01-12 16:00:00,2023-01-12 16:00:00,314036.0,313055.0,5.195,
323917424112054275,RT @twhiddleston: The Boston Marathon bombing is horrifying and chilling. My thoughts and prayers are with victims and families.,Outsiders,Sympathy and support,Related - but not informative,rt twhiddleston boston marathon bombing horrifying chilling thoughts prayers victims families,2,2,2023-01-12 17:00:00,2023-01-12 17:00:00,315895.0,313055.0,5.195,
323917612864114688,RT @HuffingtonPost: How to help victims of the Boston Marathon bombings http://t.co/dUFWFcNH62,Media,Donations and volunteering,Related and informative,rt huffingtonpost help victims boston marathon bombings http co dufwfcnh62,1,5,2023-01-12 18:00:00,2023-01-12 18:00:00,313658.0,314042.0,3.862,
323917763850686464,"RT @KrisSanchez: Video of the explosion at the #BostonMarathon - Seriously, there's way too much violence and hate in our world.  http:/ ...",Media,Sympathy and support,Related and informative,rt krissanchez video explosion bostonmarathon seriously way much violence hate world http,1,2,2023-01-12 19:00:00,2023-01-12 19:00:00,313658.0,315894.0,3.862,
323917780619513857,Heart and prayers to folks in Boston. #BostonMarathon,Outsiders,Sympathy and support,Related - but not informative,heart prayers folks boston bostonmarathon,2,2,2023-01-12 20:00:00,2023-01-12 20:00:00,313035.0,313010.0,2.027,
323917910642946048,RT @Karan1095: Lets #PrayForBoston.   Lets also #PrayForSyria #PrayForIraq #PrayForAfghanistan and all the others.  #RESPECT,Outsiders,Sympathy and support,Related - but not informative,rt karan1095 lets prayforboston lets also prayforsyria prayforiraq prayforafghanistan others respect,2,2,2023-01-12 21:00:00,2023-01-12 21:00:00,313010.0,312188.0,2.308,
323918019690639360,RT @LovendPeace: #prayforboston 🙏👼,Outsiders,Sympathy and support,Related - but not informative,rt lovendpeace prayforboston,2,2,2023-01-12 22:00:00,2023-01-12 22:00:00,312188.0,313005.0,0.478,
323918116163813376,"RT @DemetriaSing: #PrayForBoston #PrayForNewYork #PrayForDC Please everyone stay safe, please make it home safely &lt;3",Outsiders,Sympathy and support,Related - but not informative,rt demetriasing prayforboston prayfornewyork prayfordc please everyone stay safe please make home safely lt 3,2,2,2023-01-12 23:00:00,2023-01-12 23:00:00,312188.0,318742.0,0.478,
323918330094317568,RT @BostonGlobe: Globe videos from the #BostonMarathon explosions. http://t.co/UgmAEzzH59,Media,Other Useful Information,Related and informative,rt bostonglobe globe videos bostonmarathon explosions http co ugmaezzh59,1,1,2023-01-13 00:00:00,2023-01-13 00:00:00,314668.0,313658.0,3.695,
323918434960293888,@joshhenderson: Just hearing about the explosions in Boston. Prayers going out to the victims and families. So sad..,Outsiders,Sympathy and support,Related - but not informative,joshhenderson hearing explosions boston prayers going victims families sad,2,2,2023-01-13 01:00:00,2023-01-13 01:00:00,313005.0,313003.0,0.152,
323918611121061888,RT @BMW_LifeMorals: Love is real and we have to do everything we can to keep it alive. - Topanga Lawrence #lifemorals #PrayforBoston,Business,Sympathy and support,Related - but not informative,rt bmw_lifemorals love real everything keep alive topanga lawrence lifemorals prayforboston,2,2,2023-01-13 02:00:00,2023-01-13 02:00:00,313005.0,318744.0,0.152,
323918749499551745,"Lord, our world really needs your help...😔 #prayforboston",Outsiders,Sympathy and support,Related - but not informative,lord world really needs help prayforboston,2,2,2023-01-13 03:00:00,2023-01-13 03:00:00,318742.0,313003.0,0.152,
323918808219799552,"I close my eyes... And I can see a better day.. I close my eyes, and pray. #PrayForBoston.",Outsiders,Sympathy and support,Related - but not informative,close eyes see better day close eyes pray prayforboston,2,2,2023-01-13 04:00:00,2023-01-13 04:00:00,318742.0,318744.0,0.152,
323918841799376896,Boston Police Commissioner Ed Davis: There is no suspect in custody. Stay with @CNNLive for continuing coverage #BostonMarathon @CNN,Government,Other Useful Information,Related and informative,boston police commissioner ed davis suspect custody stay cnnlive continuing coverage bostonmarathon cnn,1,1,2023-01-13 05:00:00,2023-01-13 05:00:00,314711.0,314668.0,0.181,
323918879527161857,RT @goldnKATEbridge: Never wanted my city to be trending for such a bad reason #PrayForBoston,Outsiders,Sympathy and support,Related - but not informative,rt goldnkatebridge never wanted city trending bad reason prayforboston,2,2,2023-01-13 06:00:00,2023-01-13 06:00:00,314712.0,314668.0,0.181,
323918921465999362,RT @abyjavaadmalik: EVERYONE TWETT THIS PICTURE SO EVERYONE CAN SEE IT. #prayforboston #boston #BostonMarathon http://t.co/VVM4wYM6I2,Outsiders,Sympathy and support,Related - but not informative,rt abyjavaadmalik everyone twett picture everyone see prayforboston boston bostonmarathon http co vvm4wym6i2,2,2,2023-01-13 07:00:00,2023-01-13 07:00:00,313003.0,318218.0,1.047,
323919135400665088,My prayers go out to the Boston Marathon victims today. #rip,Outsiders,Sympathy and support,Related - but not informative,prayers go boston marathon victims today rip,2,2,2023-01-13 08:00:00,2023-01-13 08:00:00,318744.0,318218.0,1.047,
323919470944993280,"Perpustakaan JFK, Lokasi Ledakan Ketiga di Boston: Menyusul dua ledakan di dekat garis finish Boston Marathon, dua peledak te...  #TLNews",Not labeled,Not labeled,Not applicable,perpustakaan jfk lokasi ledakan ketiga di boston menyusul dua ledakan di dekat garis finish boston marathon dua peledak te tlnews,3,0,2023-01-13 09:00:00,2023-01-13 09:00:00,313852.0,314711.0,1.008,
323919605171122177,"RT @aceYthekidd: Us: You hear bout that shit in Boston? Co-Worker: Nah what? Us: Bombs at the marathon, folks dying. Co-Worker: I ...",Outsiders,Sympathy and support,Related - but not informative,rt aceythekidd us hear bout shit boston co worker nah us bombs marathon folks dying co worker,2,2,2023-01-13 10:00:00,2023-01-13 10:00:00,313852.0,314712.0,1.008,
323919680672763906,RT @GovBrewer: My prayers and those of #Arizona go out to the victims of today's explosion in #Boston: http://t.co/RhIUvysCPQ,Government,Sympathy and support,Related - but not informative,rt govbrewer prayers arizona go victims today explosion boston http co rhiuvyscpq,2,2,2023-01-13 11:00:00,2023-01-13 11:00:00,318218.0,313846.0,0.035,
323919881999380480,#PrayForBoston 😢people are really  screwed up  #PrayForBoston,Outsiders,Sympathy and support,Related - but not informative,prayforboston people really screwed prayforboston,2,2,2023-01-13 12:00:00,2023-01-13 12:00:00,318528.0,313000.0,0.202,
323919991013527552,"Boston Marathon Explosion Pictures and Video Released, Gets Live Internet Coverage http://t.co/SbNUzrzQzf #videos #world",Eyewitness,Other Useful Information,Related and informative,boston marathon explosion pictures video released gets live internet coverage http co sbnuzrzqzf videos world,1,1,2023-01-13 13:00:00,2023-01-13 13:00:00,312133.0,317814.0,0.887,
323920167178493953,"RT @Jenna_Marbles: Absolutely shocked and horrified about the Boston Marathon today.  My thoughts and prayers are with my family, friend ...",Outsiders,Sympathy and support,Related - but not informative,rt jenna_marbles absolutely shocked horrified boston marathon today thoughts prayers family friend,2,2,2023-01-13 14:00:00,2023-01-13 14:00:00,317815.0,315060.0,0.883,
323920792150761472,RT @DanielMartinAdv: Most inspiring story from #BostonMarathon: runners who finished the 26.2 miles and then ran over to Mass General Ho ...,Media,Affected individuals,Related - but not informative,rt danielmartinadv inspiring story bostonmarathon runners finished 26 2 miles ran mass general ho,2,3,2023-01-13 15:00:00,2023-01-13 15:00:00,317814.0,313159.0,0.861,
323920980898631680,RT @shagcaster: @_bal_ Yup. But I live in motherfucking Washington state. THOUSANDS OF MILES AWAY. I doubt that'll set a bomb in Boston off.,Outsiders,Other Useful Information,Related - but not informative,rt shagcaster _bal_ yup live motherfucking washington state thousands miles away doubt set bomb boston,2,1,2023-01-13 16:00:00,2023-01-13 16:00:00,314652.0,317815.0,0.859,
323921001861746689,"@gchaverri1 Vale, #prayforboston y, #prayforgaza #prayforbagdad #prayforkabul etc?¿? Ah no, que no importan. Menuda cabeza la mia...",Not labeled,Not labeled,Not applicable,gchaverri1 vale prayforboston prayforgaza prayforbagdad prayforkabul etc ah que importan menuda cabeza la mia,3,0,2023-01-13 17:00:00,2023-01-13 17:00:00,313159.0,314876.0,4.522,
323921178026721280,“@corien_xxx: RT @larrys_condom_ The child is so young this is disgraceful #PrayForBoston http://t.co/IccVB5yOHS” :'(,Outsiders,Sympathy and support,Related - but not informative,corien_xxx rt larrys_condom_ child young disgraceful prayforboston http co iccvb5yohs,2,2,2023-01-13 18:00:00,2023-01-13 18:00:00,314877.0,314652.0,4.511,
323922037854855168,"RT @Megan_Miller_23: Please retweet this, no matter who you are. It could save lives. Spread the word. And stay safe! #PrayForBoston htt ...",Outsiders,Sympathy and support,Related - but not informative,rt megan_miller_23 please retweet matter could save lives spread word stay safe prayforboston htt,2,2,2023-01-13 19:00:00,2023-01-13 19:00:00,314876.0,314886.0,0.263,
323922209817120768,"RT @cnnbrk: Explosion reported near Boston Marathon finish line, CNN affiliate WCVB reports. http://t.co/vvz4S6DdCR",Media,Other Useful Information,Related and informative,rt cnnbrk explosion reported near boston marathon finish line cnn affiliate wcvb reports http co vvz4s6ddcr,1,1,2023-01-13 20:00:00,2023-01-13 20:00:00,314886.0,314899.0,1.412,
323922411126939648,RT @eNCAnews: US President Barack Obama: says police and emergency services responded heroically to this tragedy. #BostonMarathon,Media,Other Useful Information,Related and informative,rt encanews us president barack obama says police emergency services responded heroically tragedy bostonmarathon,1,1,2023-01-13 21:00:00,2023-01-13 21:00:00,314899.0,314909.0,0.47,
