325356330418315265,I rly hope they find Dzhokhar Tsarnaev ALIVE so they can blow his ass up with his own pressure cooker bomb. #MSNBC #THIRTYSIXHOURSSTRAIGHT,Outsiders,Other Useful Information,Related - but not informative,rly hope find dzhokhar tsarnaev alive blow ass pressure cooker bomb msnbc thirtysixhoursstraight,2,1,2023-02-01 13:00:00,2023-02-01 13:00:00,200.0,199.0,,317.7
325360726082461697,RT @domf_says: someone called the police to my house because they thought I was the Boston marathon bomber.....I just was interrogated. #ho…,Outsiders,Affected individuals,Related and informative,rt domf_says someone called police house thought boston marathon bomber interrogated ho,1,3,2023-02-01 14:00:00,2023-02-01 14:00:00,199.0,197.0,,309.3
325368292598489090,"RT @OurGreatAmerica: Dzhokhar Tsarnaev,   I have bad news for you. We never lose at Hide and Seek, just ask Bin Laden and Saddam. Good Luck…",Outsiders,Other Useful Information,Related - but not informative,rt ourgreatamerica dzhokhar tsarnaev bad news never lose hide seek ask bin laden saddam good luck,2,1,2023-02-01 15:00:00,2023-02-01 15:00:00,197.0,195.0,,313.3
325371509625454592,RT @Deadspin: VIDEO: CNN on an empty Boston: It's as though a bomb had dropped. Oh? http://t.co/NqkoDGYd2s,Media,Other Useful Information,Related - but not informative,rt deadspin video cnn empty boston though bomb dropped oh http co nqkodgyd2s,2,1,2023-02-01 16:00:00,2023-02-01 16:00:00,195.0,193.0,,271.7
325379675943747585,"RT @Yousefzadeh: If the stay indoors order can be lifted even though Dzhokhar Tsarnaev hasn't been captured, what was the point of instit…",Outsiders,Other Useful Information,Related - but not informative,rt yousefzadeh stay indoors order lifted even though dzhokhar tsarnaev captured point instit,2,1,2023-02-01 17:00:00,2023-02-01 17:00:00,193.0,191.0,,322.3
325385854140940288,RT @Deadspin: VIDEO: CNN on an empty Boston: It's as though a bomb had dropped. Oh? http://t.co/NqkoDGYd2s,Media,Other Useful Information,Related and informative,rt deadspin video cnn empty boston though bomb dropped oh http co nqkodgyd2s,1,1,2023-02-01 18:00:00,2023-02-01 18:00:00,191.0,189.0,,312.4
325388756582543360,I will be so disappointed if Tsarnaev is killed.,Outsiders,Other Useful Information,Related - but not informative,disappointed tsarnaev killed,2,1,2023-02-01 19:00:00,2023-02-01 19:00:00,189.0,280.0,,420.9
325392887980363776,RT @mclarkhamilton BOMB SQUAD has arrived on scene of SWAT and POLICE engagement with suspect 2 #Watertown #Boston,Outsiders,Other Useful Information,Related and informative,rt mclarkhamilton bomb squad arrived scene swat police engagement suspect 2 watertown boston,1,1,2023-02-01 20:00:00,2023-02-01 20:00:00,280.0,279.0,,384.8
325393236111794177,"RT @ACSpollen: Tamerian Tsarnaev questioned in 2011 by the FBI and released? Well done FBI, well done. #BestOfTheBestOfTheBest",Outsiders,Other Useful Information,Related and informative,rt acspollen tamerian tsarnaev questioned 2011 fbi released well done fbi well done bestofthebestofthebest,1,1,2023-02-01 21:00:00,2023-02-01 21:00:00,279.0,140.0,,323.4
325393642950893569,RT @BuzzFeedNews: Chilling photo of Boston bombing suspects at the marathon (h/t @justinjm1) http://t.co/ews5O45fsg http://t.co/WKYmybuJuz,Media,Other Useful Information,Related and informative,rt buzzfeednews chilling photo boston bombing suspects marathon h justinjm1 http co ews5o45fsg http co wkymybujuz,1,1,2023-02-01 22:00:00,2023-02-01 22:00:00,140.0,187.0,,341.2
325396675428495361,"#MITshooting #BostonMarathon Chopper says flash bang are by the bow, suspect in stern, a good distance from the grenade",Eyewitness,Other Useful Information,Related and informative,mitshooting bostonmarathon chopper says flash bang bow suspect stern good distance grenade,1,1,2023-02-01 23:00:00,2023-02-01 23:00:00,187.0,186.0,,410.0
325397329756700674,El tío del sospechoso Dzhokhar: 'Entrégate y pide perdón' http://t.co/EiZdkzUTh6 vía @diarioas,Not labeled,Not labeled,Not applicable,el tío del sospechoso dzhokhar entrégate pide perdón http co eizdkzuth6 vía diarioas,3,0,2023-02-02 00:00:00,2023-02-02 00:00:00,186.0,296.0,,354.2
325399141679243264,RT @watertowntab: RT @PetesWire BREAKING: Better shot of boat where suspected #bostonmarathon bomber was hiding out. #wbz http://t.co/oBW3r…,Outsiders,Other Useful Information,Related and informative,rt watertowntab rt peteswire breaking better shot boat suspected bostonmarathon bomber hiding wbz http co obw3r,1,1,2023-02-02 01:00:00,2023-02-02 01:00:00,296.0,126.0,,367.6
325402018980188161,"If this were Grand Theft Auto, Dzhokhar Tsarnaev would definitely have 6 stars right now.",Outsiders,Not applicable,Related - but not informative,grand theft auto dzhokhar tsarnaev would definitely 6 stars right,2,7,2023-02-02 02:00:00,2023-02-02 02:00:00,126.0,182.0,,490.7
325402681684398080,"RT @RT_America: CISPA: Worse Than Patriot Act, Texas Blast Safety, Boston Bombing &amp; Overlooked Tragedies [VIDEO] http://t.co/CSGUlwvbBH…",Outsiders,Other Useful Information,Related - but not informative,rt rt_america cispa worse patriot act texas blast safety boston bombing amp overlooked tragedies video http co csgulwvbbh,2,1,2023-02-02 03:00:00,2023-02-02 03:00:00,182.0,248.0,,314.6
325403281486647298,"RT @OurGreatAmerica: Dzhokhar Tsarnaev,   I have bad news for you. We never lose at Hide and Seek, just ask Bin Laden and Saddam. Good Luck…",Outsiders,Not applicable,Related and informative,rt ourgreatamerica dzhokhar tsarnaev bad news never lose hide seek ask bin laden saddam good luck,1,7,2023-02-02 04:00:00,2023-02-02 04:00:00,248.0,25.0,,352.9
325405613511286785,RT @BuzzFeedAndrew: RT @CBSNews: FBI now acknowledges they interviewed Tsarnaev 2 years ago at the request of a foreign country about possi…,Media,Other Useful Information,Related and informative,rt buzzfeedandrew rt cbsnews fbi acknowledges interviewed tsarnaev 2 years ago request foreign country possi,1,1,2023-02-02 05:00:00,2023-02-02 05:00:00,25.0,178.0,,307.1
325406083256573954,"the suspect is normal kid, he used to hang out and smoke pot fox news guy just said about dzhokhar",Outsiders,Other Useful Information,Related and informative,suspect normal kid used hang smoke pot fox news guy said dzhokhar,1,1,2023-02-02 06:00:00,2023-02-02 06:00:00,178.0,142.0,,418.2
325407320605609984,"@DaynaOG yeah, Westboro Baptists bomb the Boston Marathon, WTC, and Pentagon, killing 1000s of Americans ... NEVER.",Outsiders,Other Useful Information,Related - but not informative,daynaog yeah westboro baptists bomb boston marathon wtc pentagon killing 1000s americans never,2,1,2023-02-02 07:00:00,2023-02-02 07:00:00,142.0,176.0,,341.3
325408398520750080,RT @BostonGlobe: BREAKING NEWS: Three people taken into custody in New Bedford as part of Boston Marathon terror bombing investigation.,Media,Affected individuals,Related and informative,rt bostonglobe breaking news three people taken custody new bedford part boston marathon terror bombing investigation,1,3,2023-02-02 08:00:00,2023-02-02 08:00:00,176.0,174.0,,344.9
325408549519896577,"RT @OurGreatAmerica: Dzhokhar Tsarnaev,   I have bad news for you. We never lose at Hide and Seek, just ask Bin Laden and Saddam. Good Luck…",Outsiders,Caution and advice,Related - but not informative,rt ourgreatamerica dzhokhar tsarnaev bad news never lose hide seek ask bin laden saddam good luck,2,6,2023-02-02 09:00:00,2023-02-02 09:00:00,174.0,113.0,,755.8
325408893440241664,RT @BostonGlobe: BREAKING NEWS: Three people taken into custody in New Bedford as part of Boston Marathon terror bombing investigation.,Media,Affected individuals,Related and informative,rt bostonglobe breaking news three people taken custody new bedford part boston marathon terror bombing investigation,1,3,2023-02-02 10:00:00,2023-02-02 10:00:00,113.0,124.0,,234.9
325409480672149505,RT @BIGGALLAGHER: They should put catch the terrorist mode in the next call of duty #boston,Outsiders,Other Useful Information,Related - but not informative,rt biggallagher put catch terrorist mode next call duty boston,2,1,2023-02-02 11:00:00,2023-02-02 11:00:00,124.0,253.0,,385.9
325409740693831681,RT @SoVeryAwkward: That awkward moment when Dzhokhar Tsarnaev doesn't realize that boats only work on water. #manhunt #BostonManhunt,Outsiders,Other Useful Information,Related - but not informative,rt soveryawkward awkward moment dzhokhar tsarnaev realize boats work water manhunt bostonmanhunt,2,1,2023-02-02 12:00:00,2023-02-02 12:00:00,253.0,30.0,,310.6
325410294367133697,RT @BostonGlobe: BREAKING NEWS: Boston Marathon terror bombing suspect has been arrested.,Media,Other Useful Information,Related and informative,rt bostonglobe breaking news boston marathon terror bombing suspect arrested,1,1,2023-02-02 13:00:00,2023-02-02 13:00:00,30.0,67.0,,358.9
325410327917371392,RT @taosecurity: “@BostonGlobe: Dzhokhar Tsarnaev IN CUSTODY!” Good work LE!!,Media,Other Useful Information,Related and informative,rt taosecurity bostonglobe dzhokhar tsarnaev custody good work le,1,1,2023-02-02 14:00:00,2023-02-02 14:00:00,67.0,164.0,,413.3
325410667643416576,RT @BostonDotCom: BREAKING NEWS: Boston Marathon terror bombing suspect has been arrested.,Media,Other Useful Information,Related and informative,rt bostondotcom breaking news boston marathon terror bombing suspect arrested,1,1,2023-02-02 15:00:00,2023-02-02 15:00:00,164.0,119.0,,387.3
325410688610742273,"RT @UberFacts: Boston bomber, Dzhokhar Tsarnaev has finally been arrested and is in custody.",Media,Other Useful Information,Related and informative,rt uberfacts boston bomber dzhokhar tsarnaev finally arrested custody,1,1,2023-02-02 16:00:00,2023-02-02 16:00:00,119.0,120.0,,407.6
325410873147535360,Why Would his Name Ever Be Dzhokhar Tsarnaev. Tf,Outsiders,Other Useful Information,Related - but not informative,would name ever dzhokhar tsarnaev tf,2,1,2023-02-02 17:00:00,2023-02-02 17:00:00,120.0,61.0,,395.7
325411024142467073,RT @ABallPlayerLife: Boston Bombing suspect #2 #GotHeeeem,Outsiders,Other Useful Information,Related and informative,rt aballplayerlife boston bombing suspect 2 gotheeeem,1,1,2023-02-02 18:00:00,2023-02-02 18:00:00,61.0,19.0,,496.4
325411137388675075,All of the officers involved in taking Tsarnaev into custody will never have to buy their own drinks again.,Outsiders,Other Useful Information,Related - but not informative,officers involved taking tsarnaev custody never buy drinks,2,1,2023-02-02 19:00:00,2023-02-02 19:00:00,19.0,162.0,,412.1
325411166778171392,RT @PBandJenelley_1: GOT HIM!!!!!! #PrayForBoston,Outsiders,Other Useful Information,Related - but not informative,rt pbandjenelley_1 got prayforboston,2,1,2023-02-02 20:00:00,2023-02-02 20:00:00,162.0,51.0,,472.2
325411292586319872,RT @_Snape_: Dzhokhar Tsarnaev is in custody. Bring him to Azkaban! #BostonManhunt #Manhunt,Outsiders,Other Useful Information,Related and informative,rt _snape_ dzhokhar tsarnaev custody bring azkaban bostonmanhunt manhunt,1,1,2023-02-02 21:00:00,2023-02-02 21:00:00,51.0,160.0,,440.1
325412223734394880,"RT @UberFacts: Boston bomber, Dzhokhar Tsarnaev has finally been arrested and is in custody.",Media,Other Useful Information,Related and informative,rt uberfacts boston bomber dzhokhar tsarnaev finally arrested custody,1,1,2023-02-02 22:00:00,2023-02-02 22:00:00,160.0,159.0,,434.5
325412848673112064,"RT @BostonDotCom: State official: Tsarnaev is Alive, conscious, captured.''",Government,Other Useful Information,Related and informative,rt bostondotcom state official tsarnaev alive conscious captured,1,1,2023-02-02 23:00:00,2023-02-02 23:00:00,159.0,64.0,,378.4
325413066806263809,"RT @ABC: #Breaking: Boston Bomb Suspect Taken into Custody, Police Say http://t.co/qMngWbjfBl http://t.co/vc3hnqmG1q",Media,Other Useful Information,Related and informative,rt abc breaking boston bomb suspect taken custody police say http co qmngwbjfbl http co vc3hnqmg1q,1,1,2023-02-03 00:00:00,2023-02-03 00:00:00,64.0,287.0,,353.1
325415650463989762,Boston police: The second suspect in this week's Boston Marathon bombings is in custody after an extensive manhunt -- CNN,Government,Other Useful Information,Related and informative,boston police second suspect week boston marathon bombings custody extensive manhunt cnn,1,1,2023-02-03 01:00:00,2023-02-03 01:00:00,287.0,267.0,,375.5
325416636158971904,"RT @_Snape_: Dzhokhar Tsarnaev's name rearranged is Hazard Over, Thanks. You know who else had a rearranged name? Lord Voldemort. #Boston…",Outsiders,Other Useful Information,Related - but not informative,rt _snape_ dzhokhar tsarnaev name rearranged hazard thanks know else rearranged name lord voldemort boston,2,1,2023-02-03 02:00:00,2023-02-03 02:00:00,267.0,288.0,,369.7
325416682266963970,"RT @_Snape_: Dzhokhar Tsarnaev's name rearranged is Hazard Over, Thanks. You know who else had a rearranged name? Lord Voldemort. #Boston…",Not labeled,Not labeled,Not related,rt _snape_ dzhokhar tsarnaev name rearranged hazard thanks know else rearranged name lord voldemort boston,0,0,2023-02-03 03:00:00,2023-02-03 03:00:00,288.0,283.0,,376.8
325417898606731264,RT @DvllGxd: Sir are you Terroist? DZHOKHAR replies BITCH I MIGHT BE,Outsiders,Other Useful Information,Related and informative,rt dvllgxd sir terroist dzhokhar replies bitch might,1,1,2023-02-03 04:00:00,2023-02-03 04:00:00,283.0,281.0,,392.2
325419341480878081,"As punishment for the suspect in the Boston bombings,they should shove a bomb up his ass",Outsiders,Sympathy and support,Related - but not informative,punishment suspect boston bombings shove bomb ass,2,2,2023-02-03 05:00:00,2023-02-03 05:00:00,281.0,282.0,,360.2
325420784287891457,"RT @Honest_Southern: Hey Dzhokhar Tsarnaev, I have one word for you: America 🇺🇸",Outsiders,Other Useful Information,Related - but not informative,rt honest_southern hey dzhokhar tsarnaev one word america,2,1,2023-02-03 06:00:00,2023-02-03 06:00:00,282.0,156.0,,384.4
325420805288755201,"RT @TheFPShow: We can rest easy now, it appears that Spiderman himself has joined the search for the Boston Marathon bomber! http://t.co/MB…",Outsiders,Other Useful Information,Related - but not informative,rt thefpshow rest easy appears spiderman joined search boston marathon bomber http co mb,2,1,2023-02-03 07:00:00,2023-02-03 07:00:00,60.0,38.0,,394.1
325421740601774080,Shots fired three doors down from my house on Franklin. Tsarnaev captured. Surreal! @cnnbrk  http://t.co/yFIgB2Czcn,Media,Affected individuals,Related and informative,shots fired three doors house franklin tsarnaev captured surreal cnnbrk http co yfigb2czcn,1,3,2023-02-03 08:00:00,2023-02-03 08:00:00,38.0,65.0,,415.0
325424999567605760,"RT @AfricanDad: So @CNN and @FoxNews can pronounce Dzhokar Tsarnaev correctly, but can't pronounce Emeka Okafor right? See America",Outsiders,Other Useful Information,Related - but not informative,rt africandad cnn foxnews pronounce dzhokar tsarnaev correctly pronounce emeka okafor right see america,2,1,2023-02-03 09:00:00,2023-02-03 09:00:00,65.0,230.0,,435.8
325427449066319872,So glad the standoff in #watertown is over. Kudos to all of the law enforcement officers involved. #ripseancollier #PrayForBoston,Outsiders,Sympathy and support,Related - but not informative,glad standoff watertown kudos law enforcement officers involved ripseancollier prayforboston,2,2,2023-02-03 10:00:00,2023-02-03 10:00:00,230.0,47.0,,353.0
325431240696152064,RT @PetesWire: BREAKING: Better shot of boat where suspected #bostonmarathon bomber was hiding out. #wbz http://t.co/HsVqIDbMMd,Media,Other Useful Information,Related and informative,rt peteswire breaking better shot boat suspected bostonmarathon bomber hiding wbz http co hsvqidbmmd,1,1,2023-02-03 11:00:00,2023-02-03 11:00:00,47.0,265.0,,341.8
325436525510815745,Tonight's tweeting of capture of #Boston bombing suspect showed how twitter,Outsiders,Other Useful Information,Related and informative,tonight tweeting capture boston bombing suspect showed twitter,1,1,2023-02-03 12:00:00,2023-02-03 12:00:00,265.0,264.0,,334.1
325438631068184576,RT @kevinbinversie: Who said smoking doesn't save lives? Boat owner found Tsarnaev while stepping outside to have a cigarette. http://t.co/…,Outsiders,Other Useful Information,Related and informative,rt kevinbinversie said smoking save lives boat owner found tsarnaev stepping outside cigarette http co,1,1,2023-02-03 13:00:00,2023-02-03 13:00:00,99.0,53.0,,248.3
325441269289590785,RT @JohnFugelsang: Reminder - 45 Senators just voted to let Dzhokhar Tsarnaev buy weapons at gun shows w/no inconvenient background checks.,Outsiders,Other Useful Information,Related - but not informative,rt johnfugelsang reminder 45 senators voted let dzhokhar tsarnaev buy weapons gun shows w inconvenient background checks,2,1,2023-02-03 14:00:00,2023-02-03 14:00:00,53.0,45.0,,389.9
325449443971325952,Boston Marathon Bombing — COPS KILL SUSPECT #1 … Hunting for Suspect #2 http://t.co/5x8877OEI2,Media,Other Useful Information,Related and informative,boston marathon bombing cops kill suspect 1 hunting suspect 2 http co 5x8877oei2,1,1,2023-02-03 15:00:00,2023-02-03 15:00:00,45.0,12.0,,404.3
325450542883151874,RT @Baseball_Jesus_: Dzhokhar Tsarnaev should have to take multiple Aroldis Chapman fastballs to the nuts as punishment. #Merica,Outsiders,Sympathy and support,Related - but not informative,rt baseball_jesus_ dzhokhar tsarnaev take multiple aroldis chapman fastballs nuts punishment merica,2,2,2023-02-03 16:00:00,2023-02-03 16:00:00,12.0,41.0,,378.3
325453105611284480,"RT @cnnbrk: Boston Marathon suspect in custody, Boston police say. http://t.co/qFpywu2cIG",Media,Affected individuals,Related and informative,rt cnnbrk boston marathon suspect custody boston police say http co qfpywu2cig,1,3,2023-02-03 17:00:00,2023-02-03 17:00:00,41.0,272.0,,365.0
325458499486244865,"Irmãos Tsarnaev: os suspeitos de um atentado cercado de dúvidas: Boston (EUA), 19 abr (EFE).- Os irmãos Tamerl... http://t.co/MylYIsO3v2",Not labeled,Not labeled,Not applicable,irmãos tsarnaev os suspeitos de um atentado cercado de dúvidas boston eua 19 abr efe os irmãos tamerl http co mylyiso3v2,3,0,2023-02-03 18:00:00,2023-02-03 18:00:00,272.0,106.0,,366.7
325475838734774272,"RT @OurGreatAmerica: Dzhokhar Tsarnaev,   I have bad news for you. We never lose at Hide and Seek, just ask Bin Laden and Saddam. Good Luck…",Outsiders,Other Useful Information,Related and informative,rt ourgreatamerica dzhokhar tsarnaev bad news never lose hide seek ask bin laden saddam good luck,1,1,2023-02-03 19:00:00,2023-02-03 19:00:00,106.0,17.0,,360.6
325480821580505089,FBI released photos of Boston marathon bomber suspects. #manhunt http://t.co/6cY7R7rwWb,Government,Other Useful Information,Related and informative,fbi released photos boston marathon bomber suspects manhunt http co 6cy7r7rwwb,1,1,2023-02-03 20:00:00,2023-02-03 20:00:00,17.0,63.0,,424.4
325541332808515585,RT @rolandparis: How crowd-sourcing went wrong. In Boston: http://t.co/adho71ff3x (via @davelee). And after Norway attack: http://t.co/4Ikp…,Outsiders,Other Useful Information,Related and informative,rt rolandparis crowd sourcing went wrong boston http co adho71ff3x via davelee norway attack http co 4ikp,1,1,2023-02-03 21:00:00,2023-02-03 21:00:00,63.0,202.0,,389.6
325551894049210368,#Sketch @JessieExclusive: @CNN Predicted Dzhokhar Tsarnaev would be found Friday?  #Conspiracy #BostonBombing #  http://t.co/qzmZBCf0AF,Media,Other Useful Information,Related - but not informative,sketch jessieexclusive cnn predicted dzhokhar tsarnaev would found friday conspiracy bostonbombing http co qzmzbcf0af,2,1,2023-02-03 22:00:00,2023-02-03 22:00:00,202.0,16.0,,328.2
325554364481675264,"RT @AJELive: Kremlin says #Russia, #US agreed to step up counter-terrorism co-operation following #BostonMarathon bombings | http://t.co/3q…",Media,Other Useful Information,Related - but not informative,rt ajelive kremlin says russia us agreed step counter terrorism co operation following bostonmarathon bombings http co 3q,2,1,2023-02-03 23:00:00,2023-02-03 23:00:00,16.0,40.0,,328.8
325570655162601472,"RT @OurGreatAmerica: Dzhokhar Tsarnaev,   I have bad news for you. We never lose at Hide and Seek, just ask Bin Laden and Saddam. Good Luck…",Outsiders,Other Useful Information,Related - but not informative,rt ourgreatamerica dzhokhar tsarnaev bad news never lose hide seek ask bin laden saddam good luck,2,1,2023-02-04 00:00:00,2023-02-04 00:00:00,40.0,105.0,,355.1
325574845289074689,Drake Relays Ban Bags in wake of Boston Marathon Attack - KCRG http://t.co/rDqHfvFl79,Media,Other Useful Information,Related and informative,drake relays ban bags wake boston marathon attack kcrg http co rdqhfvfl79,1,1,2023-02-04 01:00:00,2023-02-04 01:00:00,21.0,233.0,,332.0
325601063862403073,JUST IN: Boston bombing latest: Father or Tamerlan and Dzhokhar Tsarnaev denies 'angelic sons' actions http://t.co/ct8ZJ2vmd4,Media,Other Useful Information,Related and informative,boston bombing latest father tamerlan dzhokhar tsarnaev denies angelic sons actions http co ct8zj2vmd4,1,1,2023-02-04 02:00:00,2023-02-04 02:00:00,233.0,277.0,,399.4
325601298768621569,"@BRSurabaya broh,ada menit diam u/ (alm) anne williams dan korban boston marathon?",Not applicable,Not applicable,Related - but not informative,brsurabaya broh ada menit diam u alm anne williams dan korban boston marathon,2,7,2023-02-04 03:00:00,2023-02-04 03:00:00,257.0,275.0,,363.3
325614393377304577,RT @OfficialLFC_ID: Tribut bagi Anne Williams &amp; korban Marathon Boston akan dilakukan dgn tepuk tangan satu menit sebelum laga v Chelse…,Not labeled,Not labeled,Not applicable,rt officiallfc_id tribut bagi anne williams amp korban marathon boston akan dilakukan dgn tepuk tangan satu menit sebelum laga v chelse,3,0,2023-02-04 04:00:00,2023-02-04 04:00:00,235.0,264.0,,168.6
325622115082584064,RT @arthur_read8: Dzhokhar Tsarnaev has been captured! Now the FBI can focus on finding DW's snowball.,Outsiders,Other Useful Information,Related and informative,rt arthur_read8 dzhokhar tsarnaev captured fbi focus finding dw snowball,1,1,2023-02-04 05:00:00,2023-02-04 05:00:00,264.0,163.0,,293.4
325636841292316672,RT @marcomartucci77: I can definitely see the whole Boston marathon story turned into a movie,Outsiders,Other Useful Information,Related - but not informative,rt marcomartucci77 definitely see whole boston marathon story turned movie,2,1,2023-02-04 06:00:00,2023-02-04 06:00:00,19.0,266.0,,87.7
325642830754217985,2nd suspect found! #BostonStrong #PrayForBoston,Outsiders,Other Useful Information,Related and informative,2nd suspect found bostonstrong prayforboston,1,1,2023-02-04 07:00:00,2023-02-04 07:00:00,266.0,162.0,,327.4
325643074015490048,David Remnick: The Brothers Tsarnaev http://t.co/ndUcBd0SEY via @NewYorker,Media,Other Useful Information,Related - but not informative,david remnick brothers tsarnaev http co nducbd0sey via newyorker,2,1,2023-02-04 08:00:00,2023-02-04 08:00:00,122.0,70.0,,313.4
325662749508116480,"RT @MEAN_MARINE: Time to Stone liberal media for accusing Christians, Tea Party, White Guys of  Boston Bombing with the millstone of Muslim…",Outsiders,Other Useful Information,Related - but not informative,rt mean_marine time stone liberal media accusing christians tea party white guys boston bombing millstone muslim,2,1,2023-02-04 09:00:00,2023-02-04 09:00:00,70.0,252.0,,129.3
325670009844146176,RT @LemieuxLGM: Why Tsarnaev Should Be Read His Miranda Rights http://t.co/5VqnvSDjMs,Media,Other Useful Information,Related - but not informative,rt lemieuxlgm tsarnaev read miranda rights http co 5vqnvsdjms,2,1,2023-02-04 10:00:00,2023-02-04 10:00:00,164.0,70.0,,93.4
325688510906519552,UMass players’ jerseys during Saturday’s spring game will bear the name of those killed in Boston attacks -- http://t.co/Ao37xrGOJk,Media,Other Useful Information,Related and informative,umass players jerseys saturday spring game bear name killed boston attacks http co ao37xrgojk,1,1,2023-02-04 11:00:00,2023-02-04 11:00:00,70.0,119.0,,385.3
325696555598356480,RT @FoxNews: Watch: Fenway faithful sing 'National Anthem' day after Boston Bomb suspect's arrest http://t.co/qRiJa1QQCV,Media,Sympathy and support,Related and informative,rt foxnews watch fenway faithful sing national anthem day boston bomb suspect arrest http co qrija1qqcv,1,2,2023-02-04 12:00:00,2023-02-04 12:00:00,122.0,1.0,,265.2
325703019033403393,RT @ErnestFarrow: Report: Saudi National DHS File Says Individual is “Linked to the Boston Bombing”  http://t.co/MOAWMM778T via @wordpressd…,Media,Other Useful Information,Related and informative,rt ernestfarrow report saudi national dhs file says individual linked boston bombing http co moawmm778t via wordpressd,1,1,2023-02-04 13:00:00,2023-02-04 13:00:00,1.0,252.0,,275.9
325708958155284480,Photos: Boston ‘bomber’ captured ALIVE: The Massachusetts college student wanted in the Boston Marathon bombin... http://t.co/Xlx6aV5ZOe,Media,Other Useful Information,Related and informative,photos boston bomber captured alive massachusetts college student wanted boston marathon bombin http co xlx6av5zoe,1,1,2023-02-04 14:00:00,2023-02-04 14:00:00,252.0,46.0,,271.5
325726779765567488,"RT @MarathonKoach: As 1 among 1st stopped at #BostonMarathon at 25.7, Troubles me seeing '13 medals on eBay up to $1100.  Am I wrong? #fb",Not labeled,Not labeled,Not related,rt marathonkoach 1 among 1st stopped bostonmarathon 25 7 troubles seeing 13 medals ebay 1100 wrong fb,0,0,2023-02-04 15:00:00,2023-02-04 15:00:00,164.0,1.0,,221.0
325730000991035394,RT @21Februari2013: #14Mei1997 Tersangka Bom Boston Tamerlan Tsarnaev Pernah Menetap 6 Bulan di Rusia  #14Mei1997,Not labeled,Not labeled,Not applicable,rt 21februari2013 14mei1997 tersangka bom boston tamerlan tsarnaev pernah menetap 6 bulan di rusia 14mei1997,3,0,2023-02-04 16:00:00,2023-02-04 16:00:00,1.0,119.0,,319.9
