399491089834704896,"At least 10,000 people dead #Philippines #Typhoon Haiyan 😔😔😔",Outsiders,Affected individuals,Related and informative,least 10 000 people dead philippines typhoon haiyan,2,6
399493765825855488,"RT @typhoonfury: Brief footage of aftermath today in Tacloban, main camera dead so shot GoPro #YokandaPH #Haiyan http://t.co/YqcaqLgMmz",Media,Affected individuals,Related and informative,rt typhoonfury brief footage aftermath today tacloban main camera dead shot gopro yokandaph haiyan http co yqcaqlgmmz,2,6
399503957963603968,PE Dyneema Braided Fishing Line 300M Green 12LB 0.14mm 328 Yard Spectra Braid http://t.co/148DGll1Q2 #philippines #filipina,Not labeled,Not labeled,Not related,pe dyneema braided fishing line 300m green 12lb 0 14mm 328 yard spectra braid http co 148dgll1q2 philippines filipina,1,1
399504838771232768,"RT @ANCALERTS: MT @TeamAFP PAF Nomad flew over Guiuan, East Samar to survey the damage wreaked by #TyphoonYolanda http://t.co/HuoyODLufc",Media,Donations and volunteering,Related and informative,rt ancalerts mt teamafp paf nomad flew guiuan east samar survey damage wreaked typhoonyolanda http co huoyodlufc,2,7
399507376337731585,"RT @JoaquinKuchar: #USA Official: Over 10,000 feared dead in Typhoon Haiyan: The typhoon is among the most powerful storms ever r... http:/…",Outsiders,Affected individuals,Related and informative,rt joaquinkuchar usa official 10 000 feared dead typhoon haiyan typhoon among powerful storms ever r http,2,6
399513462243483649,"Typhoon Haiyan: 10,000 feared dead in Philippines http://t.co/0hvwSj8iBc",Media,Affected individuals,Related and informative,typhoon haiyan 10 000 feared dead philippines http co 0hvwsj8ibc,2,6
399513701327597568,"RT @govph: View our crowdsourced map of crisis areas, evacuation centers, relief drop zones: http://t.co/9ZTp7QQC5I #YolandaPH http://t.co/…",Government,Donations and volunteering,Related and informative,rt govph view crowdsourced map crisis areas evacuation centers relief drop zones http co 9ztp7qqc5i yolandaph http co,2,7
399518621249974272,"#TracingPH Renato Yana and Marina Yana, aqua fry brgy 89 baybay san jose Tacloban @philredcross",Not labeled,Not labeled,Not related,tracingph renato yana marina yana aqua fry brgy 89 baybay san jose tacloban philredcross,1,1
399518629634801665,RT @CarmelaRios: Desde el corazón de #Haiyan la crónica (almohada en la cabeza) del corresponsal de @cctvnews https://t.co/qHLk29TKxa http:…,Not labeled,Not labeled,Not applicable,rt carmelarios desde el corazón de haiyan la crónica almohada en la cabeza del corresponsal de cctvnews https co qhlk29tkxa http,3,1
399519170703798273,Sense of hope for #TyphoonYolanda victims. 🙏,Outsiders,Sympathy and support,Related - but not informative,sense hope typhoonyolanda victims,0,0
399519921484206080,"RT @TunisNewz: Typhoon Haiyan: 600,000 people evacuated in Vietnam as typhoon nears - http://t.co/Nv2QwTmMxn #Vietnam",Media,Affected individuals,Related and informative,rt tunisnewz typhoon haiyan 600 000 people evacuated vietnam typhoon nears http co nv2qwtmmxn vietnam,2,6
399521402098696192,"RT @ANCALERTS: NOW ON ANC: Energy Sec. Jericho Petilla: If there's one thing we can give typhoon victims, it's a sense of hope #YolandaPH",Media,Sympathy and support,Related and informative,rt ancalerts anc energy sec jericho petilla one thing give typhoon victims sense hope yolandaph,2,0
399523180483600385,RT @LonePercy: Typhoon Haiyan: what really alarms Filipinos is the rich world ignoring climate change | John Vidal http://t.co/RFnpOeu1Y6 v…,Outsiders,Other Useful Information,Related and informative,rt lonepercy typhoon haiyan really alarms filipinos rich world ignoring climate change john vidal http co rfnpoeu1y6 v,2,3
399527513191620608,RT @Ulkoministerio: UM jatkaa suomalaisten tavoittamista. Ilmoittautumiset UM konsulipäivystykseen puh. +358-9-1605 5551 #Haiyan #YolandaPH,Government,Not applicable,Related and informative,rt ulkoministerio um jatkaa suomalaisten tavoittamista ilmoittautumiset um konsulipäivystykseen puh 358 9 1605 5551 haiyan yolandaph,2,4
399527810995601409,O CORREIO DE DEUS: URGÊNTE:O número de mortes ao longo das Filipinas Super Typhoon Haiyan... http://t.co/v82vhOBNGe,Not labeled,Not labeled,Not applicable,correio de deus urgênte número de mortes ao longo das filipinas super typhoon haiyan http co v82vhobnge,3,1
399528654046130178,RT @ANCALERTS: RT @ABSCBN_Fdn: Sagip Kapamilya bank accounts for #YolandaPH http://t.co/3RqCsN7jpx,Media,Donations and volunteering,Related and informative,rt ancalerts rt abscbn_fdn sagip kapamilya bank accounts yolandaph http co 3rqcsn7jpx,2,7
399533179683360768,It's heart-breaking to see all the pictures and videos of the destruction caused by Typhoon #YolandaPH. Be strong #Philippines!,Outsiders,Sympathy and support,Related - but not informative,heart breaking see pictures videos destruction caused typhoon yolandaph strong philippines,0,0
399538435158851584,"#YolandaPH #Biliran: 10,000 Filipinos left homeless in Biliran. (Source: ANC)",Outsiders,Affected individuals,Related and informative,yolandaph biliran 10 000 filipinos left homeless biliran source anc,2,6
399540582621536256,Devastation Feared Across Central Philippines in Typhoon’s Wake http://t.co/ZoLEMTpjS8,Outsiders,Infrastructure and utilities,Related and informative,devastation feared across central philippines typhoon wake http co zolemtpjs8,2,5
399543334101712896,In Photos: Survivors pass two large boats after Typhoon #Haiyan washed them ashore http://t.co/09100l1fj3 http://t.co/ZckoLc72HS,Outsiders,Other Useful Information,Related and informative,photos survivors pass two large boats typhoon haiyan washed ashore http co 09100l1fj3 http co zckolc72hs,2,3
399544823092228097,"RT @ohboywhatashot: 10,000 killed in Philippines by super typhoon Haiyan... and counting [PICTURES] ─► http://t.co/27UaAbBa40",Outsiders,Affected individuals,Related and informative,rt ohboywhatashot 10 000 killed philippines super typhoon haiyan counting pictures http co 27uaabba40,2,6
399545322210619392,RT @OIenMadrid: Oxfam envía un grupo de expertos en ayuda humanitaria a las zonas más afectadas por el tifón #Haiyan en Filipinas http://t.…,Not labeled,Not labeled,Not applicable,rt oienmadrid oxfam envía un grupo de expertos en ayuda humanitaria las zonas más afectadas por el tifón haiyan en filipinas http,3,1
399545452208480256,"RT @WorldVisionPH: To all individual sponsors of @WorldVisionDe ,THANK YOU for the immediate response for #TyphoonHaiyan survivors http://t…",NGOs,Sympathy and support,Related and informative,rt worldvisionph individual sponsors worldvisionde thank immediate response typhoonhaiyan survivors http,2,0
399546899268526081,"BBC News - Typhoon #Haiyan: UK commits aid for 500,000 in #Philippines http://t.co/XFX81WsaGS",Media,Donations and volunteering,Related and informative,bbc news typhoon haiyan uk commits aid 500 000 philippines http co xfx81wsags,2,7
399561826792644608,"RT @28storms: Via @Ormoc City, Leyte: Help is needed across the Philippines right now #Haiyan #Yolanda http://t.co/xhT3Ywdt5n",Media,Donations and volunteering,Related and informative,rt 28storms via ormoc city leyte help needed across philippines right haiyan yolanda http co xht3ywdt5n,2,7
399564922180214785,Latest updates on #Typhoon #Haiyan #YolandaPH in Situation Report #4: http://t.co/plyNeQex6G,Outsiders,Caution and advice,Related and informative,latest updates typhoon haiyan yolandaph situation report 4 http co plyneqex6g,2,2
399569636561154048,"RT @AP: The Philippines has had it's share of deadly storms, but Typhoon Haiyan's devastation shocks officials: http://t.co/TrmOWMXGb7 -SS",Media,Other Useful Information,Related and informative,rt ap philippines share deadly storms typhoon haiyan devastation shocks officials http co trmowmxgb7 ss,2,3
399573612774309888,How to help Typhoon Haiyan survivors http://t.co/pLjZGSsMtW,Outsiders,Donations and volunteering,Related and informative,help typhoon haiyan survivors http co pljzgssmtw,2,7
399575336616493056,"RT @philredcross: Pls RT: If you are looking for a family or friend, use #TracingPH or fill up http://t.co/SB5mTqW2qS http://t.co/yoZGxGGwJw",NGOs,Affected individuals,Related and informative,rt philredcross pls rt looking family friend use tracingph fill http co sb5mtqw2qs http co yozgxggwjw,2,6
399575856709767168,RT @BBCWorld: Four million people thought to have been affected by Typhoon #Haiyan in the Philippines http://t.co/4CWaqdv95Y,Media,Affected individuals,Related and informative,rt bbcworld four million people thought affected typhoon haiyan philippines http co 4cwaqdv95y,2,6
399579027607801856,RT @BuzzFeed: 27 Devastating Images From Typhoon Haiyan’s Destruction http://t.co/vyGtiRPEeF http://t.co/EXddf9gTYx,Media,Other Useful Information,Related and informative,rt buzzfeed 27 devastating images typhoon haiyan destruction http co vygtirpeef http co exddf9gtyx,2,3
399582529880997889,RT @RichStearns: As you worship this morning please pray for those in the Philippines affected by Typhoon #Haiyan. More than 1000 have died…,Outsiders,Affected individuals,Related and informative,rt richstearns worship morning please pray philippines affected typhoon haiyan 1000 died,2,6
399584731870003200,"RT @mrmedina: 10,000 people feared dead as the Philippines reels from catastrophic damage of Typhoon Haiyan. | http://t.co/zzBinGJ1Nh",Outsiders,Affected individuals,Related and informative,rt mrmedina 10 000 people feared dead philippines reels catastrophic damage typhoon haiyan http co zzbingj1nh,2,6
399602096292392960,"Photoset: cornersoftheworld: 10,000 are believed to have died in the Philippines after Typhoon Haiyan hit... http://t.co/JieLr7O17j",Outsiders,Affected individuals,Related and informative,photoset cornersoftheworld 10 000 believed died philippines typhoon haiyan hit http co jielr7o17j,2,6
399603434287947777,RT @SStoneABC30: Prayers for #Haiyan at Valley Springs Filipino American Church #Fresno. Many here cannot locate family/friends @ABC30 http…,Outsiders,Sympathy and support,Related - but not informative,rt sstoneabc30 prayers haiyan valley springs filipino american church fresno many locate family friends abc30 http,0,0
399606173177225216,Red Cross Deploys Delegates to Assist Typhoon Haiyan Response - http://t.co/QGlucaUKr4,Outsiders,Donations and volunteering,Related and informative,red cross deploys delegates assist typhoon haiyan response http co qglucaukr4,2,7
399609377587732480,RT @selenagomez: Support UNICEF’s emergency relief efforts for kids in the #Philippines. How to help:http://t.co/VfenyR2QUl #Haiyan http://…,Outsiders,Donations and volunteering,Related and informative,rt selenagomez support unicef emergency relief efforts kids philippines help http co vfenyr2qul haiyan http,2,7
399610082251796480,"RT @BBCBreaking: As if tsunami hit - and in many ways it has - BBC reporter in Tacloban, Philippines http://t.co/G6YkEc5UpU #Haiyan http:…",Media,Caution and advice,Related and informative,rt bbcbreaking tsunami hit many ways bbc reporter tacloban philippines http co g6ykec5upu haiyan http,2,2
399613370577735681,RT @bethangsioco: Pls. show more respect to those who passed away due to #YolandaPH. Do not post their pictures.,Outsiders,Sympathy and support,Related and informative,rt bethangsioco pls show respect passed away due yolandaph post pictures,2,0
399615052518408192,RT @cnnbrk 'Worse than hell' in typhoon-ravaged Philippines. http://t.co/dzUYIzHzj3,Media,Other Useful Information,Related and informative,rt cnnbrk worse hell typhoon ravaged philippines http co dzuyizhzj3,2,3
399616814097121280,RT @SaveChildrenIT: Il super #tifone #Haiyan minaccia 10mln di abitanti delle #Filippine. Si prevedono raffiche di vento fino a 250km/h htt…,NGOs,Donations and volunteering,Related and informative,rt savechildrenit il super tifone haiyan minaccia 10mln di abitanti delle filippine si prevedono raffiche di vento fino 250km h htt,2,7
399617468429512705,"More incredible video showing #Haiyan #Yolanda's violent winds impacting Giporlos, Eastern Samar! http://t.co/KablGelQ4l",Outsiders,Other Useful Information,Related and informative,incredible video showing haiyan yolanda violent winds impacting giporlos eastern samar http co kablgelq4l,2,3
399625198535593984,RT @9NewsAUS: If you have family travelling abroad &amp; worry for their safety contact DFAT- ready to help. #Haiyan @thetodayshow http://t.co/…,Media,Caution and advice,Related and informative,rt 9newsaus family travelling abroad amp worry safety contact dfat ready help haiyan thetodayshow http co,2,2
399628956615180288,How you can help Typhoon Haiyan survivors http://t.co/1M5sCagkxa,Outsiders,Other Useful Information,Related and informative,help typhoon haiyan survivors http co 1m5scagkxa,2,3
399633545183756288,Typhoon Yolanda (Haiyan) - Full Coverage Wiki Page http://t.co/GUOXBsgcT6,Media,Other Useful Information,Related and informative,typhoon yolanda haiyan full coverage wiki page http co guoxbsgct6,2,3
399639027160453120,"RT @denverpost: Typhoon deaths climb into thousands in Philippines, one of the worst storms ever recorded http://t.co/3p5KDbXJix via @AP",Media,Affected individuals,Related and informative,rt denverpost typhoon deaths climb thousands philippines one worst storms ever recorded http co 3p5kdbxjix via ap,2,6
399643984827404288,RT @guardiannews: Typhoon Haiyan: desperate survivors and destruction in flattened city http://t.co/X4BVLcZvbU,Media,Affected individuals,Related and informative,rt guardiannews typhoon haiyan desperate survivors destruction flattened city http co x4bvlczvbu,2,6
399644613973385216,People in the U.S. wanting to help Guiuan... Introducing...  Philippine Samar Disaster Relief Fund :-) #YolandaPH http://t.co/18hm8SgkQb,NGOs,Donations and volunteering,Related and informative,people u wanting help guiuan introducing philippine samar disaster relief fund yolandaph http co 18hm8sgkqb,2,7
399648359486472192,RT @BuzzFeed: 27 Devastating Images From Typhoon Haiyan’s Destruction http://t.co/vyGtiRPEeF http://t.co/EXddf9gTYx,Media,Affected individuals,Related and informative,rt buzzfeed 27 devastating images typhoon haiyan destruction http co vygtirpeef http co exddf9gtyx,2,6
399648820838928385,"#asia Typhoon deaths climb into thousands in Philippines: TACLOBAN, Philippines (AP) — Corpses hung from trees... http://t.co/DoaAZJ1zpX",Media,Affected individuals,Related and informative,asia typhoon deaths climb thousands philippines tacloban philippines ap corpses hung trees http co doaazj1zpx,2,6
399649521291915264,I just donated to the @britishredcross #Typhoon Haiyan Appeal. Please donate at http://t.co/lYtRcdczGV,NGOs,Donations and volunteering,Related and informative,donated britishredcross typhoon haiyan appeal please donate http co lytrcdczgv,2,7
399653036106076160,"RT @WFP: If you're in the US, you can donate $10 to our emergency operation in the Philippines by texting AID to 27722 #Haiyan http://t.co/…",NGOs,Donations and volunteering,Related and informative,rt wfp us donate 10 emergency operation philippines texting aid 27722 haiyan http co,2,7
399662230045601792,"Respect, Philippines. If even half the strength of that typhoon hit your town, you'd already be screaming for Jesus. #PrayForThePhilippines",Outsiders,Sympathy and support,Related - but not informative,respect philippines even half strength typhoon hit town already screaming jesus prayforthephilippines,0,0
399670736090320896,RT @KontingKowts: 1 RETWEET = 1 PRAYER  #PrayForThePhilippines  #YolandaPH #TyphoonHaiyan http://t.co/V9Lu9YA1fI,Outsiders,Sympathy and support,Related - but not informative,rt kontingkowts 1 retweet 1 prayer prayforthephilippines yolandaph typhoonhaiyan http co v9lu9ya1fi,0,0
399676612297633792,RT @BBCWorld: International NYT: Philippines reels in typhoon's aftermath http://t.co/54PliiCDm3 - via @suttonnick #TomorrowsPapersToday …,Media,Other Useful Information,Related and informative,rt bbcworld international nyt philippines reels typhoon aftermath http co 54pliicdm3 via suttonnick tomorrowspaperstoday,2,3
399680626237779969,Relief Effort Begins After #Philippine #Typhoon - ABC News http://t.co/mL0ntP0eRt (via @ABC),Outsiders,Donations and volunteering,Related and informative,relief effort begins philippine typhoon abc news http co ml0ntp0ert via abc,2,7
399680647213891584,RT @ICRC: #Philippines: terrible destruction complicates relief efforts after #typhoon. Latest from our team http://t.co/rcsCNl8wkm #Yoland…,NGOs,Donations and volunteering,Related and informative,rt icrc philippines terrible destruction complicates relief efforts typhoon latest team http co rcscnl8wkm yoland,2,7
399686208848023552,"After #YolandaPH (Haiyan) the Philippines is bracing for another one ZoraydaPH. Same path, slower but heavy rains http://t.co/OGHhJBuXYq",Media,Caution and advice,Related and informative,yolandaph haiyan philippines bracing another one zoraydaph path slower heavy rains http co oghhjbuxyq,2,2
399697474748960768,"ELEGANT NATURAL OCTAGON AMETHYST,TOPAZ,LEMON QUARTZ STERLING 925 SILVER EARRINGS http://t.co/dI4FOG42ms #philippines #filipino",Not labeled,Not labeled,Not related,elegant natural octagon amethyst topaz lemon quartz sterling 925 silver earrings http co di4fog42ms philippines filipino,1,1
399698842108456960,"RT @KeriHilson: CNN reports the Philippines typhoon death toll could possibly end up in 10,000's. May our prayers be with the Philippines...",Media,Affected individuals,Related and informative,rt kerihilson cnn reports philippines typhoon death toll could possibly end 10 000 may prayers philippines,2,6
399701174145671168,"RT @JeremiahBrent: Beyond devastated at the aftermath of the typhoon in Philippines. Sending love, prayers and strength to everyone.",Outsiders,Sympathy and support,Related and informative,rt jeremiahbrent beyond devastated aftermath typhoon philippines sending love prayers strength everyone,2,0
399708614824574976,RT @JaimeKailani: My heart and prayers going out to all the typhoon victims of the Philippines. @4mamaearth @thelylas… http://t.co/XBPgT2c0…,Outsiders,Sympathy and support,Related - but not informative,rt jaimekailani heart prayers going typhoon victims philippines 4mamaearth thelylas http co xbpgt2c0,0,0
399709206254583808,"RT @krizzy_kalerQUI: ‘In the #Philippines, our hands may be empty at times, but our hearts are full most of the time.’  http://t.co/fsOdyJQ…",Outsiders,Other Useful Information,Related - but not informative,rt krizzy_kalerqui philippines hands may empty times hearts full time http co fsodyjq,0,3
399713677349105664,"@slimsammierocks Latest: Three days after Super Typhoon Haiyan ripped through the Philippines, the country is just beginn...  #icametwice",Outsiders,Other Useful Information,Related and informative,slimsammierocks latest three days super typhoon haiyan ripped philippines country beginn icametwice,2,3
399713916453797888,Joins the nation in prayer for the family of the victims of #YolandaPH,Outsiders,Sympathy and support,Related - but not informative,joins nation prayer family victims yolandaph,0,0
399714906313732096,Earth Uncut TV: Horrific Aftermath Super Typhoon Yolanda / Haiyan in Tacloban Philippine...: http://t.co/NWWpYby2km,Media,Other Useful Information,Related and informative,earth uncut tv horrific aftermath super typhoon yolanda haiyan tacloban philippine http co nwwpyby2km,2,3
399719171887726592,Typhoon Haiyan: thousands dead as devastation hampers aid efforts http://t.co/y86LeTeQ3J,Outsiders,Affected individuals,Related and informative,typhoon haiyan thousands dead devastation hampers aid efforts http co y86leteq3j,2,6
399719331291877377,Job Opening:  SAP MM/PP Team Head: Job Qualification is expected to know MM/WM/PP/PM/QM and... http://t.co/GjII3wyMer #jobs #philippines,Not labeled,Not labeled,Not related,job opening sap mm pp team head job qualification expected know mm wm pp pm qm http co gjii3wymer jobs philippines,1,1
399719742308503552,"19 of 22 interactions in my timeline make absolutely no sense to me, so -- time for bed.  Many prayers for those affected by #TyphoonHaiyan",Outsiders,Sympathy and support,Related - but not informative,19 22 interactions timeline make absolutely sense time bed many prayers affected typhoonhaiyan,0,0
399729242415833088,Read about #GlobalMedic's Super Typhoon Haiyan Philippines Response http://t.co/f584XdxdsM,Outsiders,Donations and volunteering,Related and informative,read globalmedic super typhoon haiyan philippines response http co f584xdxdsm,2,7
399733751317409792,Please pray for the victims of Super Typhoon Haiyan! #PrayForThePhilippines #Haiyan #ReliefPH,Outsiders,Sympathy and support,Related - but not informative,please pray victims super typhoon haiyan prayforthephilippines haiyan reliefph,0,0
399733944226037760,RT @aliciakeys: To the people of the Philippines my heart is with you #prayers #Haiyan,Outsiders,Sympathy and support,Related - but not informative,rt aliciakeys people philippines heart prayers haiyan,0,0
399735177351819265,"RT @cdrc1984: Our friends in the U.S., Agnes and Stefan, are raising funds for CDRC's Typhoon Yolanda response. Just click the... http://t.…",Outsiders,Donations and volunteering,Related and informative,rt cdrc1984 friends u agnes stefan raising funds cdrc typhoon yolanda response click http,2,7
399741695320805377,RT @SMARTCares: Filipinos abroad may donate to the #YolandaPH fund via Paypal through PDRF's #BrickByBrick Program. Learn more here: http:/…,NGOs,Donations and volunteering,Related and informative,rt smartcares filipinos abroad may donate yolandaph fund via paypal pdrf brickbybrick program learn http,2,7
399753581957353473,"@elmoticons: WHAT: JuliElmo Kaagapay for Typhoon Yolanda Victims.  WHEN: November 16, Saturday. WHERE: To be announced.",Outsiders,Caution and advice,Related and informative,elmoticons julielmo kaagapay typhoon yolanda victims november 16 saturday announced,2,2
399757465887068160,RT @1rgcruz: Monday: Anderson Cooper Anchors AC360 Live from #Philippines – CNN Press Room - http://t.co/8k2FP8j92H,Media,Other Useful Information,Related and informative,rt 1rgcruz monday anderson cooper anchors ac360 live philippines cnn press room http co 8k2fp8j92h,2,3
399760905220521984,"RT @CAAP_Operations: CAAP Update 11:10am, 12 Nov: For donations to specific areas affected by #YolandaPH, pls course donations thru NDRRMC …",Outsiders,Donations and volunteering,Related and informative,rt caap_operations caap update 11 10am 12 nov donations specific areas affected yolandaph pls course donations thru ndrrmc,2,7
399763988046573568,RT @nbcsandiego: A San Diegan living in the Philippines describes the destruction from the typhoon &gt;&gt;&gt; http://t.co/A1vCa0sqAn,Media,Other Useful Information,Related and informative,rt nbcsandiego san diegan living philippines describes destruction typhoon gt gt gt http co a1vca0sqan,2,3
399777825034493952,RT @chrisducker: So many have asked me how they can help the Philippines recover from #TyphoonHaiyan. Here's my small way: http://t.co/TmPo…,Outsiders,Donations and volunteering,Related and informative,rt chrisducker many asked help philippines recover typhoonhaiyan small way http co tmpo,2,7
399780949820735488,RT @Palmecenter: I dag startar vi en kampanj till stöd för våra partners hjälpinsats efter #Haiyan: http://t.co/Ju1btG5Iob Plusgiro 570-2 m…,Not labeled,Not labeled,Not applicable,rt palmecenter dag startar vi en kampanj till stöd för våra partners hjälpinsats efter haiyan http co ju1btg5iob plusgiro 570 2,3,1
399788474368532480,"RT @indiebreakfast: It's #VeteransDay &amp; over 10,000 ppl are dead from #TyphoonHaiyan and you filths are trending #StayStrongJustin you are …",Media,Affected individuals,Related and informative,rt indiebreakfast veteransday amp 10 000 ppl dead typhoonhaiyan filths trending staystrongjustin,2,6
399789074170404864,An estimated 4.5 million are affected by Typhoon #Haiyan . Donate here to help @WFP emergency response: http://t.co/PlZvtlW0RH,Outsiders,Donations and volunteering,Related and informative,estimated 4 5 million affected typhoon haiyan donate help wfp emergency response http co plzvtlw0rh,2,7
399794413527777280,"RT @ABSCBNNews: If you're looking for someone who's displaced because of #YolandaPH, go to: http://t.co/ih5xwlIQlM To donate: http://t.co/l…",Media,Donations and volunteering,Related and informative,rt abscbnnews looking someone displaced yolandaph go http co ih5xwliqlm donate http co l,2,7
399794916832075776,Pray for Philippines #Pray #Philippines #grateful #Jesus #Christ #instagram #Instalife #Instadaily… http://t.co/tuZddomehx,Outsiders,Sympathy and support,Related - but not informative,pray philippines pray philippines grateful jesus christ instagram instalife instadaily http co tuzddomehx,0,0
399798461018931200,Telstra announces free calls to #Philippines - Media Announcement – About Telstra http://t.co/VL9JIwrEPQ #AU #freecall #PHL,Business,Donations and volunteering,Related and informative,telstra announces free calls philippines media announcement telstra http co vl9jiwrepq au freecall phl,2,7
399800923071188992,"RT @DrinkFuckSpew: thousands and thousands of people died from typhoon Haiyan and #StayStrongJustin trends, just because he has food poison…",Outsiders,Affected individuals,Related and informative,rt drinkfuckspew thousands thousands people died typhoon haiyan staystrongjustin trends food poison,2,6
399803305443856384,The typhoon in the Philippines really hit my mom &amp; the fam.,Outsiders,Affected individuals,Related and informative,typhoon philippines really hit mom amp fam,2,6
