324737758671294464,"Authorities: Fertilizer plant explodes near Waco, Texas - Apr 18 @ 12:14 AM ET http://t.co/Mo9aaSVjkd",Government,Infrastructure and utilities,Related and informative,authorities fertilizer plant explodes near waco texas apr 18 12 14 et http co mo9aasvjkd,1,2
324737897070723073,RT @bosshogswife: Prayers for all the people in Boston and West Texas tonight! #liftthemup,Outsiders,Sympathy and support,Related - but not informative,rt bosshogswife prayers people boston west texas tonight liftthemup,0,1
324737905497092097,Just now finding out that wasn't an earthquake I felt tonight. So freakin' sad. Sending prayers out tonight for #WestTX #pray,Outsiders,Sympathy and support,Related - but not informative,finding earthquake felt tonight freakin sad sending prayers tonight westtx pray,0,1
324738022937620480,RT @SorryNotSoorry: View from the sky after the explosion. Crazy. #PrayForTexas. http://t.co/eKNdQlXv7Q,Outsiders,Sympathy and support,Related - but not informative,rt sorrynotsoorry view sky explosion crazy prayfortexas http co ekndqlxv7q,0,1
324738232619245568,"Another terrible explosions occurred today in Waco, Texas. #prayfortexas",Outsiders,Sympathy and support,Related - but not informative,another terrible explosions occurred today waco texas prayfortexas,0,1
324738320733188097,"RT @CalebQuickstep3: CAUGHT ON CAMERA: Fertilizer Plant Explosion Near Waco, Texas http://t.co/eOtvaiOqt5 via @youtube You have to be ki ...",Eyewitness,Other Useful Information,Related and informative,rt calebquickstep3 caught camera fertilizer plant explosion near waco texas http co eotvaioqt5 via youtube ki,1,0
324738433975209984,"“@SorryNotSoorry: I have no words. This is terrifying. #PrayForTexas. http://t.co/vdl4kOE9Up” speechless, this is so scary #PrayersForTexas",Outsiders,Sympathy and support,Related - but not informative,sorrynotsoorry words terrifying prayfortexas http co vdl4koe9up speechless scary prayersfortexas,0,1
324738580771647488,"RT @AwZaynMalik: i literally wanna cry this is so sad and scary, my heart dropped https://t.co/06WLkW2Mh1 please #prayfortexas",Outsiders,Sympathy and support,Related - but not informative,rt awzaynmalik literally wan na cry sad scary heart dropped https co 06wlkw2mh1 please prayfortexas,0,1
324738656248147968,RT @kristahakk: #PrayForTexas 💕,Outsiders,Sympathy and support,Related - but not informative,rt kristahakk prayfortexas,0,1
324738689831956480,"70 dead peoples? i literally crying, my thoughts and prayers goes for those victims #prayfortexas",Outsiders,Sympathy and support,Related and informative,70 dead peoples literally crying thoughts prayers goes victims prayfortexas,1,1
324738773697048576,"Mayor of #West, Texas:  Please send us your prayers.  There's a lot of people who won't be here tomorrow.",Government,Sympathy and support,Related - but not informative,mayor west texas please send us prayers lot people tomorrow,0,1
324738794655993856,The blast flattened homes in a five block radius according to Mayor Muska. #westtx,Government,Infrastructure and utilities,Related and informative,blast flattened homes five block radius according mayor muska westtx,1,2
324738844987621376,"Explosion hits fertilizer plant north of Waco, Texas http://t.co/QxEYTLy8aI",Media,Other Useful Information,Related and informative,explosion hits fertilizer plant north waco texas http co qxeytly8ai,1,0
324738844996014080,RT @9NEWS: Video captures Texas fertilizer plant explosion http://t.co/Ia2wyD0PUB #9NEWS,Media,Other Useful Information,Related and informative,rt 9news video captures texas fertilizer plant explosion http co ia2wyd0pub 9news,1,0
324738874364538881,"CAUGHT ON CAMERA: Fertilizer Plant Explosion Near Waco, Texas http://t.co/TkyfLST8QS via @youtube @imarlenequinto",Eyewitness,Other Useful Information,Related and informative,caught camera fertilizer plant explosion near waco texas http co tkyflst8qs via youtube imarlenequinto,1,0
324738891120791552,Praying for the families in the Great State of Texas that were involved in the Fertilizer Plant explosion.,Outsiders,Sympathy and support,Related - but not informative,praying families great state texas involved fertilizer plant explosion,0,1
324738937295863808,"RT @stealingsand: rt @[..] To add to the worry, this is an environmental disaster. Anhydrous ammonia can be deadly. #prayforwest http:// ...",Outsiders,Caution and advice,Related and informative,rt stealingsand rt add worry environmental disaster anhydrous ammonia deadly prayforwest http,1,6
324739012780752896,RT @kaylc1: #West #prayforwest This is a picture of the West Fire Dept Please pray for them and the families in this small town http://t ...,Outsiders,Sympathy and support,Related and informative,rt kaylc1 west prayforwest picture west fire dept please pray families small town http,1,1
324739147002691584,Texas Waco bombed blows up,Outsiders,Other Useful Information,Related - but not informative,texas waco bombed blows,0,0
324739159581417472,"RT @awireman: You can feel the force of the explosion in this video out of Waco, Texas; just tough to watch really... http://t.co/BTkhwq0J5z",Outsiders,Other Useful Information,Related and informative,rt awireman feel force explosion video waco texas tough watch really http co btkhwq0j5z,1,0
324739235091447810,@cnnbrk: At least 2 people are dead in an explosion at a fertilizer plant in Texas. http://t.co/CdjWnVDD3N Holy Shit Fire,Media,Affected individuals,Related and informative,cnnbrk least 2 people dead explosion fertilizer plant texas http co cdjwnvdd3n holy shit fire,1,3
324739323171840000,"RT @LazUhhhBro: Smh, people acting like Texas was bombed... False. A Fertilizer plant exploded... So quit overreacting and saying otherwise.",Outsiders,Other Useful Information,Related and informative,rt lazuhhhbro smh people acting like texas bombed false fertilizer plant exploded quit overreacting saying otherwise,1,0
324739532849299456,Seriously?? #Liberals already using #westexplosion for political chatter! You people have no compassion #PrayForWest,Outsiders,Sympathy and support,Related - but not informative,seriously liberals already using westexplosion political chatter people compassion prayforwest,0,1
324739566407913472,“@nickels_sarah: My heart is beating so fast...#prayfortexas #texasexplosion  https://t.co/VqizbMlXrw” wow,Outsiders,Sympathy and support,Related - but not informative,nickels_sarah heart beating fast prayfortexas texasexplosion https co vqizbmlxrw wow,0,1
324739620933873665,"RT @RobertAnthonyyy: Pray for Waco, not Texas. The other day we were, and still are, praying for Boston. Not Massachusetts, just saying.",Outsiders,Sympathy and support,Related - but not informative,rt robertanthonyyy pray waco texas day still praying boston massachusetts saying,0,1
324739801314103296,"RT @MikeElk: There are only 2,200 OSHA inspectors for 8 million workplaces in the US http://t.co/03urg0mq1a #westexplosion",Outsiders,Other Useful Information,Related and informative,rt mikeelk 2 200 osha inspectors 8 million workplaces us http co 03urg0mq1a westexplosion,1,0
324739855814901762,RT @JCassidyMusic: Please keep the town of West Texas and all surrounding areas in your prayers tonight. God be with everyone involved.  ...,Outsiders,Sympathy and support,Related - but not informative,rt jcassidymusic please keep town west texas surrounding areas prayers tonight god everyone involved,0,1
324739906163318784,Just saw Waco explosion....can't even imagine this place in comparison if it went,Outsiders,Sympathy and support,Related - but not informative,saw waco explosion even imagine place comparison went,0,1
324739931308187649,"Been a rough week for this country. Remember, no matter how bad it seems, continue to trust in the Lord. #prayforwest&amp;boston #keepfaith",Outsiders,Sympathy and support,Related - but not informative,rough week country remember matter bad seems continue trust lord prayforwest amp boston keepfaith,0,1
324739956490780674,That explosion in Texas is so scary,Outsiders,Sympathy and support,Related - but not informative,explosion texas scary,0,1
324740040376848384,Amen. I'm about 40 miles south of West. Driven past the fertilizer plant many times. #Heartbroken @GayPatriot @dminor85,Outsiders,Affected individuals,Related - but not informative,amen 40 miles south west driven past fertilizer plant many times heartbroken gaypatriot dminor85,0,3
324740048769658880,RT @ExJon: The West fertilizer plant was next door to two schools. Thank God this didn't happen earlier in the day.,Outsiders,Infrastructure and utilities,Related and informative,rt exjon west fertilizer plant next door two schools thank god happen earlier day,1,2
324740233302245376,RT @samvalera: “@blacklipbastard: #prayfortexas #prayforboston #prayforshutthefuckup” lmaooo,Outsiders,Sympathy and support,Related - but not informative,rt samvalera blacklipbastard prayfortexas prayforboston prayforshutthefuckup lmaooo,0,1
324740287836614656,RT @LoniLove: Prayers for West Texas...,Outsiders,Sympathy and support,Related - but not informative,rt lonilove prayers west texas,0,1
324740413657325569,This is one of the scariest things I've ever watched. #prayfortexas http://t.co/thG9m3op9a,Eyewitness,Sympathy and support,Related - but not informative,one scariest things ever watched prayfortexas http co thg9m3op9a,0,1
324740505932017664,Primero Boston y ahora Texas.  ¿a donde vamos a parar?   #prayfortexas,Not labeled,Not labeled,Not applicable,primero boston ahora texas donde vamos parar prayfortexas,2,4
324740547908603904,Another explosion? Smh.. I hope those people in Texas are alright.,Outsiders,Sympathy and support,Related - but not informative,another explosion smh hope people texas alright,0,1
324740635980599296,"RT @CNN: Explosion hits fertilizer plant north of Waco, Texas. Dozens hurt. http://t.co/2p7iMgqRET",Media,Affected individuals,Related and informative,rt cnn explosion hits fertilizer plant north waco texas dozens hurt http co 2p7imgqret,1,3
324740677923635200,Prayers for everyone in that community in West Texas. That's just unreal.,Outsiders,Sympathy and support,Related - but not informative,prayers everyone community west texas unreal,0,1
324740774401036288,RT @WhiteBoyPosts: Omfg watch this whole video through.. #PrayForTexas 😱😱😱http://t.co/YQskpsrjra,Outsiders,Sympathy and support,Related - but not informative,rt whiteboyposts omfg watch whole video prayfortexas http co yqskpsrjra,0,1
324740803748560896,RT @davidlorr: Holy shit.... Watch it all. #PrayForTexas http://t.co/yCYJahbkm3,Outsiders,Sympathy and support,Related - but not informative,rt davidlorr holy shit watch prayfortexas http co ycyjahbkm3,0,1
324740904424468481,RT @blisscon: just watched the explosion. thoughts and sympathies to West.,Outsiders,Sympathy and support,Related - but not informative,rt blisscon watched explosion thoughts sympathies west,0,1
324740967326445568,this is the scariest and saddest thing I've ever seen #prayfortexas https://t.co/w5rBw4aNBi I can't even seeing hear this.,Outsiders,Sympathy and support,Related - but not informative,scariest saddest thing ever seen prayfortexas https co w5rbw4anbi even seeing hear,0,1
324741005079367680,"RT @michrod: WOW! Video of the explosion: Fertilizer Plant Explosion Near Waco, Texas http://t.co/30b1nr3IcR",Outsiders,Infrastructure and utilities,Related and informative,rt michrod wow video explosion fertilizer plant explosion near waco texas http co 30b1nr3icr,1,2
324741101523181568,Another awful thing happend. &lt;/3 #PrayForTexas #Waco #Texas,Outsiders,Sympathy and support,Related - but not informative,another awful thing happend lt 3 prayfortexas waco texas,0,1
324741252547493890,#prayfortexas 🙏🙏🙏,Outsiders,Sympathy and support,Related - but not informative,prayfortexas,0,1
324741479031521280,Now a Texas explosion? My heart goes out to these people,Outsiders,Sympathy and support,Related - but not informative,texas explosion heart goes people,0,1
324741575496310784,“@shelbynhousman: Holy shit this video scared the shit out of me #prayfortexas http://t.co/HwIBjnc6GI” Holy fuck.... Watch this,Outsiders,Sympathy and support,Related - but not informative,shelbynhousman holy shit video scared shit prayfortexas http co hwibjnc6gi holy fuck watch,0,1
324741755851382784,"RT @bravesandbeer: A lot of the firefighters that are battling the Texas fires are volunteer firefighters from the small town of West, T ...",Outsiders,Affected individuals,Related and informative,rt bravesandbeer lot firefighters battling texas fires volunteer firefighters small town west,1,3
324741764223217664,Waco is just a bad place first that massacre  now an explosion,Outsiders,Other Useful Information,Related - but not informative,waco bad place first massacre explosion,0,0
324741860721565696,RT @TheSportsFreak: Discretion advised - but this video is somewhat chilling #Waco #Texas RT @Aki_DT: Waco Explosion http://t.co/N5obdFzPqJ,Business,Other Useful Information,Related and informative,rt thesportsfreak discretion advised video somewhat chilling waco texas rt aki_dt waco explosion http co n5obdfzpqj,1,0
324741936189698050,RT @CNN: At least two people have died after explosion at Texas fertilizer plant: http://t.co/QssJr1tVbW Details live on @CNN TV now.,Media,Affected individuals,Related and informative,rt cnn least two people died explosion texas fertilizer plant http co qssjr1tvbw details live cnn tv,1,3
324742011687145473,Mass Injuries Reported in Texas Fertilizer Plant Blast: The massive fire and explosion outside of Waco damaged... http://t.co/j8YWlYHYj8,Outsiders,Affected individuals,Related and informative,mass injuries reported texas fertilizer plant blast massive fire explosion outside waco damaged http co j8ywlyhyj8,1,3
324742217224835072,RT @RT_America: Numbers continue to change after Texas explosion. Confirmed for certain is an explosion leveled several blocks http://t. ...,Media,Infrastructure and utilities,Related and informative,rt rt_america numbers continue change texas explosion confirmed certain explosion leveled several blocks http,1,2
324742309486923776,RT @michellemalkin: These ghouls never stop. MT @TwitchyTeam Prof Erik Loomis blames #WestTx explosion on lack of unions &amp; bad zonin ...,Outsiders,Other Useful Information,Related and informative,rt michellemalkin ghouls never stop mt twitchyteam prof erik loomis blames westtx explosion lack unions amp bad zonin,1,0
324742389208072192,"La explosión no fue en Waco, fue en West, Texas! Waco esta muy cerca de West!",Not labeled,Not labeled,Not applicable,la explosión fue en waco fue en west texas waco esta muy cerca de west,2,4
324742426952609793,My heart breaks for West Texas. &lt;/3,Outsiders,Sympathy and support,Related - but not informative,heart breaks west texas lt 3,0,1
324742456304340993,The news coming out of #WestTx is horrifying,Media,Sympathy and support,Related - but not informative,news coming westtx horrifying,0,1
324742456312729601,"RT @orgsapiensa: Se registra súper explosión en una Planta de Fertilizantes en Waco, Texas, hasta el momento se reportan 60 muertos y má ...",Not applicable,Not applicable,Related and informative,rt orgsapiensa se registra súper explosión en una planta de fertilizantes en waco texas hasta el momento se reportan 60 muertos má,1,7
324742481461792769,RT @CountryDarliin: #prayfortexas #prayforboston #prayforeveryone 🙏,Outsiders,Sympathy and support,Related - but not informative,rt countrydarliin prayfortexas prayforboston prayforeveryone,0,1
324742519193743361,"What about effects of toxic ammonia fumes in #West, #Texas - for first responders, locals, and the environment?",Outsiders,Caution and advice,Related and informative,effects toxic ammonia fumes west texas first responders locals environment,1,6
324742577913999361,Explosion at a Texas plant :-(,Outsiders,Sympathy and support,Related and informative,explosion texas plant,1,1
324742582125072384,OhGosh . Just saw a video from the explosion in TX . 😟 So crazy ! 100 people injured &amp; 2 fatalities . #PrayForTexas ❤,Outsiders,Affected individuals,Related and informative,ohgosh saw video explosion tx crazy 100 people injured amp 2 fatalities prayfortexas,1,3
324742716359593984,#prayforwest #prayforboston #PrayForAmerica my thoughts go out to Texas and Boston !!!!!,Outsiders,Sympathy and support,Related - but not informative,prayforwest prayforboston prayforamerica thoughts go texas boston,0,1
324742913483493376,"RT @KSRAGER44: When we all wake up and see the real damage that this Texas explosion caused, that is gonna be terrible. #PrayforTexas",Media,Sympathy and support,Related - but not informative,rt ksrager44 wake see real damage texas explosion caused gon na terrible prayfortexas,0,1
324742930264883200,RT @MisterPryor35: I can't believe this happened prayers go out to everyone affected by the explosion God be with them. #prayfortexas ht ...,Outsiders,Sympathy and support,Related - but not informative,rt misterpryor35 believe happened prayers go everyone affected explosion god prayfortexas ht,0,1
324743047684431872,"RT @DFWscanner: West, TX Explosion *UPDATE - Frisco FD is sending their Multi-Patient Vehicle ambulance bus to West. They are responding ...",Media,Donations and volunteering,Related and informative,rt dfwscanner west tx explosion update frisco fd sending multi patient vehicle ambulance bus west responding,1,5
324743119012765696,RT @ZachsMind: ...they used water to try to put out a chemical fire? Really? You have GOT to be kidding me! #WestTX #WestExplosion #Texa ...,Outsiders,Affected individuals,Related and informative,rt zachsmind used water try put chemical fire really got kidding westtx westexplosion texa,1,3
324743332901306372,"Facebook Friends &amp; Customers in Texas: If you are wondering how you can best help out with the tragedy in West,... http://t.co/YkDKnkgXPD",Outsiders,Sympathy and support,Related - but not informative,facebook friends amp customers texas wondering best help tragedy west http co ykdknkgxpd,0,1
324743471334301696,“@cnnbrk: At least 2 people are dead in an explosion at a fertilizer plant in Texas. http://t.co/fwJCTHpSEX” 👈👈👈@KeepItReal_3,Media,Affected individuals,Related and informative,cnnbrk least 2 people dead explosion fertilizer plant texas http co fwjcthpsex keepitreal_3,1,3
324743546831790080,RT @davidlorr: Holy shit.... Watch it all. #PrayForTexas http://t.co/yCYJahbkm3,Outsiders,Sympathy and support,Related - but not informative,rt davidlorr holy shit watch prayfortexas http co ycyjahbkm3,0,1
324743609750523904,@SavvAssBriana: #prayfortexas  #prayfortexas  #prayfortexas  !!!!!!! #DEAD lmao,Outsiders,Sympathy and support,Related - but not informative,savvassbriana prayfortexas prayfortexas prayfortexas dead lmao,0,1
324743672635723776,RT @BBCBreaking: VIDEO: Fire rages after explosion in Texas town of #West - dozens badly hurt &amp; buildings flattened http://t.co/iXXw ...,Media,Affected individuals,Related and informative,rt bbcbreaking video fire rages explosion texas town west dozens badly hurt amp buildings flattened http co ixxw,1,3
324743735575449600,#PrayForTexas What is this world coming to 😞,Outsiders,Sympathy and support,Related - but not informative,prayfortexas world coming,0,1
324743865594687489,RT @sidneylococo: http://t.co/t5HD3j4Ar3 this scared me shitless. #prayforTexas,Outsiders,Sympathy and support,Related - but not informative,rt sidneylococo http co t5hd3j4ar3 scared shitless prayfortexas,0,1
324744125616365568,"Waco, Texas explosion too??? Jesus is coming sooner than we think!",Outsiders,Sympathy and support,Related - but not informative,waco texas explosion jesus coming sooner think,0,1
324744238896136192,RT @ChrisGeneroso: My thoughts and prayers go out to those affected in West Texas. Another horrible tragedy.. This is too much in a week ...,Outsiders,Sympathy and support,Related - but not informative,rt chrisgeneroso thoughts prayers go affected west texas another horrible tragedy much week,0,1
324744276611325952,"#prayforwest for all those who are injured, everyone who is out there helping saving lives and the families who lost loved ones today ....",Outsiders,Sympathy and support,Related - but not informative,prayforwest injured everyone helping saving lives families lost loved ones today,0,1
324744289202626560,RT @Ratchet2English: So far this week - #prayfortexas  - #prayforboston  - two 14 year olds killed a homeless man as a dare - bomb threa ...,Outsiders,Sympathy and support,Related - but not informative,rt ratchet2english far week prayfortexas prayforboston two 14 year olds killed homeless man dare bomb threa,0,1
324744532463861760,No sleep tonight. “@andrs_mr  CAUGHT ON CAMERA: Fertilizer plant explosion near Waco (KWKT)  http://t.co/K3ra38dzWL”,Media,Infrastructure and utilities,Related and informative,sleep tonight andrs_mr caught camera fertilizer plant explosion near waco kwkt http co k3ra38dzwl,1,2
324744557659037697,"RT @JustNataliie: WOw i just woke up, came on tt and i saw this  #PrayForTexas  :O WHAT IS GOING ON WITH THIS FUCKING WORLD ?! :/",Outsiders,Sympathy and support,Related - but not informative,rt justnataliie wow woke came tt saw prayfortexas going fucking world,0,1
324744687665684480,RT @CommonWhiteGirI: So far this week - #prayfortexas  - #prayforboston  - two 14 year olds killed a homeless man as a dare - bomb threa ...,Not labeled,Not labeled,Not related,rt commonwhitegiri far week prayfortexas prayforboston two 14 year olds killed homeless man dare bomb threa,3,4
324744809313075200,Prayers go out to everyone affected by the explosion in Texas #prayfortexas,Outsiders,Sympathy and support,Related - but not informative,prayers go everyone affected explosion texas prayfortexas,0,1
324744847070208001,RT @HuffingtonPost: WATCH: Horrifying video of Texas fertilizer plant explosion http://t.co/8RGalQkRE9,Media,Other Useful Information,Related and informative,rt huffingtonpost watch horrifying video texas fertilizer plant explosion http co 8rgalqkre9,1,0
324745010643861504,"RT @fuccyoudis2o9: This explosion was serious, please #PrayForWest #WestTX 😔🙏 http://t.co/xLTV5hJX5u",Outsiders,Sympathy and support,Related - but not informative,rt fuccyoudis2o9 explosion serious please prayforwest westtx http co xltv5hjx5u,0,1
324745052561756160,RT @laurenonizzle: This iPhone video of the fertilizer plant explosion near #Waco will send chills up your spine. Surreal. http://t.co/O ...,Outsiders,Other Useful Information,Related and informative,rt laurenonizzle iphone video fertilizer plant explosion near waco send chills spine surreal http co,1,0
324745052574343168,"RT @subailey: “@startelegram: Population of West, Tx: 2,849. But it's every Texan's hometown tonight. #prayforWest.",Outsiders,Sympathy and support,Related - but not informative,rt subailey startelegram population west tx 2 849 every texan hometown tonight prayforwest,0,1
324745094504796160,I'm about to leave this country!   #prayfortexas,Outsiders,Sympathy and support,Related - but not informative,leave country prayfortexas,0,1
324745094508969985,RT @CNN: At least two people have died after explosion at Texas fertilizer plant: http://t.co/QssJr1tVbW Details live on @CNN TV now.,Media,Affected individuals,Related and informative,rt cnn least two people died explosion texas fertilizer plant http co qssjr1tvbw details live cnn tv,1,3
324745102897586176,"RT @kfcr: Our thoughts and prayers are with the community of West, Texas tonight.",Outsiders,Sympathy and support,Related - but not informative,rt kfcr thoughts prayers community west texas tonight,0,1
324745207771959297,"Thoughts are with the people of Waco, Texas. Horrible news to hear.",Outsiders,Sympathy and support,Related - but not informative,thoughts people waco texas horrible news hear,0,1
324745262272757760,that explosion in Texas is absolutely crazy.. hopefully people evacuated early enough #jeez,Outsiders,Sympathy and support,Related - but not informative,explosion texas absolutely crazy hopefully people evacuated early enough jeez,0,1
324745446822117376,"MT@DrewTumaABC3: Explosion in #West, TX registered BIG TIME on seismograph in Amarillo (~400mi from blast) http://t.co/FJnKgbWZwq",Media,Other Useful Information,Related and informative,mt drewtumaabc3 explosion west tx registered big time seismograph amarillo 400mi blast http co fjnkgbwzwq,1,0
324745639755923456,RT @EcheMadubuike: Didn't realize how serious this explosion was😳.  RT to spread the word. #WestTX http://t.co/LIhdA0s1HG,Outsiders,Sympathy and support,Related and informative,rt echemadubuike realize serious explosion rt spread word westtx http co lihda0s1hg,1,1
324745836888211456,RT @YourAnonNews: Houston's KHOU has removed a tweet claiming that 70 have been confirmed dead in west texas.,Media,Affected individuals,Related and informative,rt youranonnews houston khou removed tweet claiming 70 confirmed dead west texas,1,3
324745845285220352,Hundreds feared hurt in Texas plant blast: The explosion near Waco damaged or destroyed numerous buildings inc... http://t.co/DhTSLXPPQ8,Outsiders,Affected individuals,Related and informative,hundreds feared hurt texas plant blast explosion near waco damaged destroyed numerous buildings inc http co dhtslxppq8,1,3
324746117923344387,RT @MisterPryor35: I can't believe this happened prayers go out to everyone affected by the explosion God be with them. #prayfortexas ht ...,Outsiders,Sympathy and support,Related - but not informative,rt misterpryor35 believe happened prayers go everyone affected explosion god prayfortexas ht,0,1
324746252124307456,Prayers tonight for those in West Tx in the wake of Explosion there. Tragic week so far.,Outsiders,Sympathy and support,Related - but not informative,prayers tonight west tx wake explosion tragic week far,0,1
