Tweet ID, Tweet Text, Information Source, Information Type, Informativeness,cleaned_text,informativeness_encoded,information_type_encoded
324681353662709760,"@MontesCb7 Waco, Texas!! I use to live near there, ilived in McKinney, tx near Plano where the D is made lol",Not applicable,Other Useful Information,Related - but not informative,montescb7 waco texas use live near ilived mckinney tx near plano made lol,0,0
324693550694543361,"Really? Another explosion, now in Texas? What the hell is wrong with people nowadays? Goddamn...",Outsiders,Sympathy and support,Related - but not informative,really another explosion texas hell wrong people nowadays goddamn,0,1
324694339240460289,"Explosion reported at fertilizer plant in West, McLennan Co.",Outsiders,Other Useful Information,Related and informative,explosion reported fertilizer plant west mclennan co,1,0
324694565753851904,RT @Donna4843: triage for injured at Reagan st in West Tx due to plt explosion  Multiple areas on fire including a school. http://t.co/t ...,Outsiders,Infrastructure and utilities,Related and informative,rt donna4843 triage injured reagan st west tx due plt explosion multiple areas fire including school http co,1,2
324694993551884288,RT @911BUFF: TEXAS: MASSIVE EXPLOSION U/D - LOCAL HOSPITALS NOTIFIED. EVERY AVAILABLE AMBULANCE DISPATCHED. REPORTS OF CASUALTIES. http: ...,Media,Affected individuals,Related and informative,rt 911buff texas massive explosion u local hospitals notified every available ambulance dispatched reports casualties http,1,3
324695182303961089,"RT @firehat: Now tuned in to the massive explosion near Waco. Multiple buildings afire, including a school. Hospital in burning area. Un ...",Outsiders,Infrastructure and utilities,Related and informative,rt firehat tuned massive explosion near waco multiple buildings afire including school hospital burning area un,1,2
324698151875407872,"RT @BreakingNews: Large explosion reported at fertilizer plant near Waco, Texas - @CBSDFW http://t.co/xOIyCyuxFD",Media,Other Useful Information,Related and informative,rt breakingnews large explosion reported fertilizer plant near waco texas cbsdfw http co xoiycyuxfd,1,0
324700123173122049,RT @OccupyCarlisle: Scanner traffic reports people are trapped in a building near Waco TX after explosion reported at fertilizer plant,Media,Affected individuals,Related and informative,rt occupycarlisle scanner traffic reports people trapped building near waco tx explosion reported fertilizer plant,1,3
324700584571711488,"RT @brianstelter: A big explosion at a fertilizer plant in West, TX tonight. Most dramatic photo from the scene, by @AndyBartee: http:// ...",Outsiders,Affected individuals,Related and informative,rt brianstelter big explosion fertilizer plant west tx tonight dramatic photo scene andybartee http,1,3
324702421668487169,RT @sudixitca: MT @RT_com BREAKING: Multiple casualties in #Texas fertilizer plant explosion - reports http://t.co/CXHwhVpdVk,Media,Affected individuals,Related and informative,rt sudixitca mt rt_com breaking multiple casualties texas fertilizer plant explosion reports http co cxhwhvpdvk,1,3
324702723675144192,"@wfaachannel8 McLennan co. dispatch asking more resources rescue trapped people in apartment #explosion at fertilizer plant in West, TX",Media,Affected individuals,Related and informative,wfaachannel8 mclennan co dispatch asking resources rescue trapped people apartment explosion fertilizer plant west tx,1,3
324702774006775809,#waco #explosion http://t.co/4KzHKAsPop,Outsiders,Other Useful Information,Related - but not informative,waco explosion http co 4kzhkaspop,0,0
324704627859791873,RT @alexanderhall: RT @YourAnonNews: WACO TEXAS. FERTILIZER PLANT EXPLOSION. ALL UNITS REQUESTED. http://t.co/8VNtIGKtwk,Media,Affected individuals,Related and informative,rt alexanderhall rt youranonnews waco texas fertilizer plant explosion units requested http co 8vntigktwk,1,3
324705017925861376,"Their was another explosion in west texas, wth!",Outsiders,Other Useful Information,Related - but not informative,another explosion west texas wth,0,0
324705521242353666,"#EEUU.: Explosión en planta de fertilizantes cerca de Waco, Texas, provoca numerosos heridos. Foto @1ventura1  http://t.co/TbHtgiJBBy",Not labeled,Not labeled,Not applicable,eeuu explosión en planta de fertilizantes cerca de waco texas provoca numerosos heridos foto 1ventura1 http co tbhtgijbby,2,4
324706162983448576,"RT @AP: BREAKING: Authorities: Fertilizer plant explodes near Waco, Texas, causing numerous injuries",Media,Affected individuals,Related and informative,rt ap breaking authorities fertilizer plant explodes near waco texas causing numerous injuries,1,3
324706708247154690,"RT @nycjim: Dallas Morning News reports part of town of West, Tex., was leveled in fertilizer plant explosion. http://t.co/XtLj5qA5Nx",Media,Infrastructure and utilities,Related and informative,rt nycjim dallas morning news reports part town west tex leveled fertilizer plant explosion http co xtlj5qa5nx,1,2
324707538736132096,RT @AsiaBrown: RT @i__Cam: RT @NewsBreaker: BREAKING PHOTO: Building ablaze after explosion near Waco http://t.co/igcmAaL6hr,Media,Infrastructure and utilities,Related and informative,rt asiabrown rt i__cam rt newsbreaker breaking photo building ablaze explosion near waco http co igcmaal6hr,1,2
324707635196743680,RT @YourAnonNews: WACO TEXAS. FERTILIZER PLANT EXPLOSION. ALL UNITS REQUESTED. http://t.co/MSwGbnmT1l,Media,Other Useful Information,Related and informative,rt youranonnews waco texas fertilizer plant explosion units requested http co mswgbnmt1l,1,0
324707987501494272,"AUDIO AS IT HAPPENED.  HORRIBLE EXPLOSION! WACO, TX. Fertilizer Plant Explodes, Rest Home Damaged, To Much More... http://t.co/1R8ZGEQMGZ",Media,Other Useful Information,Related and informative,audio happened horrible explosion waco tx fertilizer plant explodes rest home damaged much http co 1r8zgeqmgz,1,0
324708104937820160,RT @CBSNews: Explosion reported at a Texas fertilizer plant http://t.co/JPbI8sHlDl,Media,Other Useful Information,Related and informative,rt cbsnews explosion reported texas fertilizer plant http co jpbi8shldl,1,0
324708251763605505,"Man, that explosion in Waco, pray and hope everyone's not severely injured. :s",Outsiders,Sympathy and support,Related - but not informative,man explosion waco pray hope everyone severely injured,0,1
324709166121877504,RT @Afterseven: WACO EXPLOSION DISPATCH: People trapped IN the Fire  I need anybody and everybody you can send. http://t.co/8pMJsSwunm,Outsiders,Donations and volunteering,Related and informative,rt afterseven waco explosion dispatch people trapped fire need anybody everybody send http co 8pmjsswunm,1,5
324709329666183168,"Explosion rips Texas fertilizer plant: An explosion ripped through a fertilizer plant Wednesday night in West,... http://t.co/vqrbOHGFDE",Media,Infrastructure and utilities,Related and informative,explosion rips texas fertilizer plant explosion ripped fertilizer plant wednesday night west http co vqrbohgfde,1,2
324709631681253376,RT @krisleeph: Injuries Building Damage in Fertilizer Plant Explosion - Dallas News | http://t.co/22O4K7bntG http://t.co/Gb66Xuei0r,Media,Affected individuals,Related and informative,rt krisleeph injuries building damage fertilizer plant explosion dallas news http co 22o4k7bntg http co gb66xuei0r,1,3
324710432772345856,"RT @AP: MORE: Authorities: Those injured in plant explosion near Waco, Texas, being taken to hospitals by troopers: http://t.co/fPPEpiHl ...",Media,Affected individuals,Related and informative,rt ap authorities injured plant explosion near waco texas taken hospitals troopers http co fppepihl,1,3
324710575399649283,RT @BreakingNews: Multiple injuries reported at Texas fertilizer plant explosion - @AP http://t.co/GwkDfSkqXR,Media,Affected individuals,Related and informative,rt breakingnews multiple injuries reported texas fertilizer plant explosion ap http co gwkdfskqxr,1,3
324710772523560961,"RT @BreakingNews: Large explosion reported at fertilizer plant near Waco, Texas - @CBSDFW http://t.co/xOIyCyuxFD",Media,Infrastructure and utilities,Related and informative,rt breakingnews large explosion reported fertilizer plant near waco texas cbsdfw http co xoiycyuxfd,1,2
324711393297313792,"RT @zaidbenjamin: #Breaking: Explosion, injuries reported at fertilizer plant near #Waco, #Texas http://t.co/jnvuMEpYRp",Media,Affected individuals,Related and informative,rt zaidbenjamin breaking explosion injuries reported fertilizer plant near waco texas http co jnvumepyrp,1,3
324711640744460288,RT @BreakingNews: Multiple injuries reported at Texas fertilizer plant explosion - @AP http://t.co/GwkDfSkqXR,Media,Affected individuals,Related and informative,rt breakingnews multiple injuries reported texas fertilizer plant explosion ap http co gwkdfskqxr,1,3
324711959515783170,"@nestorflecha #news  more photo about the #explosion in Waco, #Texas http://t.co/tfcMKGvzr3",Outsiders,Other Useful Information,Related and informative,nestorflecha news photo explosion waco texas http co tfcmkgvzr3,1,0
324712173404299266,Praying for West Texas❤,Outsiders,Sympathy and support,Related - but not informative,praying west texas,0,1
324712651588530176,RT @FoxNews: #BREAKING: Numerous injuries reported in large explosion at #Texas fertilizer plant http://t.co/oH93niFiAS,Media,Affected individuals,Related and informative,rt foxnews breaking numerous injuries reported large explosion texas fertilizer plant http co oh93nifias,1,3
324712861278556160,"@countmystars What the fuck is WITH this week. Between this, Boston, the explosion tonight in Waco...",Outsiders,Other Useful Information,Related - but not informative,countmystars fuck week boston explosion tonight waco,0,0
324713054245904385,RT @AhmedMedien: Multiple injuries reported at #Texas #fertilizer plant explosion - http://t.co/Vyx44Pgka4,Outsiders,Affected individuals,Related and informative,rt ahmedmedien multiple injuries reported texas fertilizer plant explosion http co vyx44pgka4,1,3
324713159090921472,"RT @RealTonyRocha: #TopStories Breaking news: Explosion, injuries reported at fertilizer plant near Waco in … http://t.co/SZMi3LLOfT #To ...",Media,Affected individuals,Related and informative,rt realtonyrocha topstories breaking news explosion injuries reported fertilizer plant near waco http co szmi3lloft,1,3
324713222009651200,Prayers #Waco #Texas #tx,Outsiders,Sympathy and support,Related - but not informative,prayers waco texas tx,0,1
324713381376434176,RT @posh_jeterson: So many bad things happening this week. #boston #collinsvillewhitesboro #west,Outsiders,Sympathy and support,Related - but not informative,rt posh_jeterson many bad things happening week boston collinsvillewhitesboro west,0,1
324713712730660864,"LIVE VIDEO of situation in West, Texas from @CBSDFW - http://t.co/SIRFvkbChG",Media,Other Useful Information,Related and informative,live video situation west texas cbsdfw http co sirfvkbchg,1,0
324713976980189185,RT @SafeFamiliesDFW: Please join us in praying for those injured &amp; effected by the fertilizer plant explosion in Waco #prayforwaco,Outsiders,Sympathy and support,Related - but not informative,rt safefamiliesdfw please join us praying injured amp effected fertilizer plant explosion waco prayforwaco,0,1
324715289801531393,Official: Several injured in Texas plant explosion http://t.co/c9PTjgIvQ4,Government,Affected individuals,Related and informative,official several injured texas plant explosion http co c9ptjgivq4,1,3
324715566625611776,Sending hope and prayers to the people in Waco Texas.,Outsiders,Sympathy and support,Related - but not informative,sending hope prayers people waco texas,0,1
324716342550880258,RT @la_la_laura15: Live for today cause tomorrow isn't promised. #PrayForBoston #PrayForWest #PrayForTheWorld,Outsiders,Sympathy and support,Related - but not informative,rt la_la_laura15 live today cause tomorrow promised prayforboston prayforwest prayfortheworld,0,1
324716539712532481,Another explosion in Waco TX omg whyyy,Outsiders,Sympathy and support,Related - but not informative,another explosion waco tx omg whyyy,0,1
324716732637921280,RT @AC360: #Breaking: reports of an explosion at #Texas fertilizer plant #AC360,Media,Other Useful Information,Related and informative,rt ac360 breaking reports explosion texas fertilizer plant ac360,1,0
324716795531505664,"Explosion in Waco, Texas... things are getting real!",Media,Other Useful Information,Related and informative,explosion waco texas things getting real,1,0
324716816523993088,Explosion In Waco :o Thats About 2 Hours From Here/.\,Outsiders,Other Useful Information,Related - but not informative,explosion waco thats 2 hours,0,0
324716921369022465,"RT @garytx: Anhydrous ammonia tank now on fire at West, TX fertilizer plant. That's bad stuff. #txfire",Outsiders,Infrastructure and utilities,Related and informative,rt garytx anhydrous ammonia tank fire west tx fertilizer plant bad stuff txfire,1,2
324717336600915969,"RT @CNN: Explosion hits fertilizer plant north of Waco, Texas. Dozens hurt. http://t.co/2p7iMgqRET",Media,Affected individuals,Related and informative,rt cnn explosion hits fertilizer plant north waco texas dozens hurt http co 2p7imgqret,1,3
324717542151159810,"RT @rosemaryCNN: Aeiral shots on #CNN right now of aftermath of massive explsion at Texas fertilizer plant, north of Waco. About 100ppl  ...",Media,Affected individuals,Related and informative,rt rosemarycnn aeiral shots cnn right aftermath massive explsion texas fertilizer plant north waco 100ppl,1,3
324717571477737472,Texas is in HiGh Alert there was a Waco explosion I'm sooo scared pray people this is soo freighting omg I'm scared,Outsiders,Sympathy and support,Related - but not informative,texas high alert waco explosion sooo scared pray people soo freighting omg scared,0,1
324717705716457472,Another explosion in Texas?? What's going on ? 😱😱,Outsiders,Sympathy and support,Related - but not informative,another explosion texas going,0,1
324717915423248384,"RT @BreakingNews: Large explosion reported at fertilizer plant near Waco, Texas - @CBSDFW http://t.co/xOIyCyuxFD",Media,Other Useful Information,Related and informative,rt breakingnews large explosion reported fertilizer plant near waco texas cbsdfw http co xoiycyuxfd,1,0
324717944795979776,#instacollage #prayforwest #prayforboston #sad http://t.co/DpYgyhiY6o,Outsiders,Sympathy and support,Related - but not informative,instacollage prayforwest prayforboston sad http co dpygyhiy6o,0,1
324717982532132864,RT @AC360: #Breaking: explosion at #Texas fertilizer plant. Stay with us for the latest details. #AC360,Media,Other Useful Information,Related and informative,rt ac360 breaking explosion texas fertilizer plant stay us latest details ac360,1,0
324718158701285377,I heard storms might be moving through Texas tonight? I hope they skip over Waco. Storms won't do the situation any good.,Not labeled,Not labeled,Not related,heard storms might moving texas tonight hope skip waco storms situation good,3,4
324718515204521984,"RT @MiguelAJ: Sending thoughts and prayers to the people of West, TX. #westexplosion damn. :(",Outsiders,Sympathy and support,Related - but not informative,rt miguelaj sending thoughts prayers people west tx westexplosion damn,0,1
324718703948214272,RT @911BUFF: TEXAS EXPLOSION: ANOTHER CHEMICAL TANK ON FIRE AT FERTILIZER PLANT. POLICE URGING EVERYONE IN 30 MILE RADIUS TO EVACUATE NO ...,Media,Caution and advice,Related and informative,rt 911buff texas explosion another chemical tank fire fertilizer plant police urging everyone 30 mile radius evacuate,1,6
324718867530268672,"Holy shit... ANOTHER EXPLOSION in Waco, TX?!?!  Come on @BarackObama - can't you just make explosions illegal?",Outsiders,Other Useful Information,Related - but not informative,holy shit another explosion waco tx come barackobama make explosions illegal,0,0
324719039484133377,RT @ovo_xo: Crazy.. #Waco #Texas http://t.co/7hkDeCckq7,Outsiders,Other Useful Information,Related - but not informative,rt ovo_xo crazy waco texas http co 7hkdecckq7,0,0
324719106622365696,RT @h3yvawn: what the fuck is happening in texas? what explosion? the world is getting crazier and crazier by the day man 😔,Outsiders,Infrastructure and utilities,Related - but not informative,rt h3yvawn fuck happening texas explosion world getting crazier crazier day man,0,2
324719601529270273,RT @NewsBreaker: BREAKING: CBS 11: Entire town of West Texas under evacuation; toxic fumes may be spreading south,Media,Affected individuals,Related and informative,rt newsbreaker breaking cbs 11 entire town west texas evacuation toxic fumes may spreading south,1,3
324720117424472064,Cientos de personas heridas en explosion de planta de fertilizantes en Texas,Not labeled,Not labeled,Not applicable,cientos de personas heridas en explosion de planta de fertilizantes en texas,2,4
324720142586089472,Here's our web story for the latest #WestExplosion http://t.co/9iRMHnrmXH,Media,Affected individuals,Related and informative,web story latest westexplosion http co 9irmhnrmxh,1,3
324720461349023745,RT @NewsBreaker: BREAKING: CBS 11: Entire town of West Texas under evacuation; toxic fumes may be spreading south,Media,Caution and advice,Related and informative,rt newsbreaker breaking cbs 11 entire town west texas evacuation toxic fumes may spreading south,1,6
324720583004786689,RT @PoliceClips: Getting report out of Waco Texas of an explosion at a fertilizer plant with multiple injuries.1st responders injured2 h ...,Media,Affected individuals,Related and informative,rt policeclips getting report waco texas explosion fertilizer plant multiple injuries 1st responders injured2 h,1,3
324720616546631680,RT @911BUFF: BREAKING NEWS - TEXAS EXPLOSION U/D - ENTIRE TOWN OF WEST TEXAS UNDER EVACUATION. TOXIC FUMES SPREADING. EMS COMMAND POST E ...,Media,Infrastructure and utilities,Related and informative,rt 911buff breaking news texas explosion u entire town west texas evacuation toxic fumes spreading ems command post e,1,2
324721056952750080,Fertilizer plant explosion near Waco caught on camera http://t.co/wg5tRbmTL9,Media,Other Useful Information,Related and informative,fertilizer plant explosion near waco caught camera http co wg5trbmtl9,1,0
324721283440971776,RT @reyna6467: @MariaESalinas //WACO Texas explotion!!! http://t.co/V687GKwB6Q,Outsiders,Other Useful Information,Related - but not informative,rt reyna6467 mariaesalinas waco texas explotion http co v687gkwb6q,0,0
324721463804444672,"Praying for TX friends in West (15 min. N. of my hometown, Waco) as they fight to survive and recover from explosions at fertilizer plant",Outsiders,Sympathy and support,Related - but not informative,praying tx friends west 15 min n hometown waco fight survive recover explosions fertilizer plant,0,1
324721769984425985,UPDATE: Explosion at West plant injures firefighters http://t.co/AgU1Kp2GfL vía @wacotrib,Media,Affected individuals,Related and informative,update explosion west plant injures firefighters http co agu1kp2gfl vía wacotrib,1,3
324721916776693760,"Correction: explosion occurred in #West, #TX, 18 miles north of #Waco. #westexplosion",Outsiders,Infrastructure and utilities,Related and informative,correction explosion occurred west tx 18 miles north waco westexplosion,1,2
324723137319149568,RT @YourAnonNews: Incredible still image taken from video capturing West Texas fertizlier plant explosion - (FOX 44) | http://t.co/PAAIz ...,Media,Other Useful Information,Related and informative,rt youranonnews incredible still image taken video capturing west texas fertizlier plant explosion fox 44 http co paaiz,1,0
324724093628870657,@CauseIM_OB West Texas fertilizer plant exploded destroying every building for a mile,Outsiders,Infrastructure and utilities,Related and informative,causeim_ob west texas fertilizer plant exploded destroying every building mile,1,2
324724198494855168,RT @foxaustin: An explosion at a fertilizer plant near Waco caused numerous injuries and sent flames into the sky http://t.co/2DZpZlsRi4,Media,Other Useful Information,Related and informative,rt foxaustin explosion fertilizer plant near waco caused numerous injuries sent flames sky http co 2dzpzlsri4,1,0
324724462736011267,"RT @NewsBreaker: DEVELOPING: Scanner: Another chemical tank now on fire at the fertilizer explosion, fire dispatch … advising crews to p ...",Media,Infrastructure and utilities,Related and informative,rt newsbreaker developing scanner another chemical tank fire fertilizer explosion fire dispatch advising crews p,1,2
324724676637106176,"Ok universe, jokes over now. 2 ricin letters, Boston bombing, and fertilizer explosion now?!?",Outsiders,Sympathy and support,Related - but not informative,ok universe jokes 2 ricin letters boston bombing fertilizer explosion,0,1
324724680839806976,"Getting live updates from @911BUFF on this Waco, Texas explosion #crazy",Media,Affected individuals,Related and informative,getting live updates 911buff waco texas explosion crazy,1,3
324725008008093697,RT @911BUFF: TEXAS EXPLOSION: HALF OF THE TOWN LEVELED! FERTILIZER THAT EXPLODED MOST DANGEROUS ONE IN THE PLANT. AT LEAST 5 DEAD! #911BUFF,Media,Affected individuals,Related and informative,rt 911buff texas explosion half town leveled fertilizer exploded dangerous one plant least 5 dead 911buff,1,3
324725096054931457,"“@BreakingNews: Texas authorities advise West, Texas, residences to leave town immediately following explosion. My god what's happening",Media,Affected individuals,Related and informative,breakingnews texas authorities advise west texas residences leave town immediately following explosion god happening,1,3
324725280621084672,@Viridiana_bm todas las casas de al menos 4 manzanas resultaro averiada por explosion en texas,Not labeled,Not labeled,Not applicable,viridiana_bm todas las casas de al menos 4 manzanas resultaro averiada por explosion en texas,2,4
324725712626008064,"RT @junkgypsy: texas, our texas. 4 west, 4 emergency workers, 4 loved ones...let us pray. #westexplosion",Eyewitness,Sympathy and support,Related - but not informative,rt junkgypsy texas texas 4 west 4 emergency workers 4 loved ones let us pray westexplosion,0,1
324726010421592065,What's going on with the world right now? #prayfortexas,Outsiders,Sympathy and support,Related - but not informative,going world right prayfortexas,0,1
324726035583209472,Omg #prayfortexas .. OMG  @wanknoskians UM HELLO WHERE WHAT IS THIS WHERE R U DORA !,Outsiders,Sympathy and support,Related - but not informative,omg prayfortexas omg wanknoskians um hello r u dora,0,1
324726190785060866,RT @yonkersoem40: RT @WestISD: Law enforcement is advising residents to leave town immediately  #WestExplosion #txfire #Waco #TX,Government,Caution and advice,Related and informative,rt yonkersoem40 rt westisd law enforcement advising residents leave town immediately westexplosion txfire waco tx,1,6
324726211764961280,"RT @NewsBreaker: BREAKING: KXXV-TV reporting five firefighters, one police officer dead due to explosion at fertilizer plant in West, TX ...",Media,Affected individuals,Related and informative,rt newsbreaker breaking kxxv tv reporting five firefighters one police officer dead due explosion fertilizer plant west tx,1,3
324726610211270657,"RT @YourAnonNews: Blair's Cove Apartments are offering housing, they have +25 units available. Their number is 254-447-0810 #WestExplosion",Media,Donations and volunteering,Related and informative,rt youranonnews blair cove apartments offering housing 25 units available number 254 447 0810 westexplosion,1,5
324726660547104770,"RT @cnnbrk: People in West, Texas, being evacuated over fear that fertilizer tank may explode, after major blast at same plant. http://t ...",Media,Affected individuals,Related and informative,rt cnnbrk people west texas evacuated fear fertilizer tank may explode major blast plant http,1,3
324726975132495874,@cass_lc that was an explosion a few hours ago in the town of West near Waco. Hundreds injured. At least 60 dead http://t.co/FVkmwnvnNV,Outsiders,Affected individuals,Related and informative,cass_lc explosion hours ago town west near waco hundreds injured least 60 dead http co fvkmwnvnnv,1,3
324726996099817472,RT @wacotrib: News from Hillcrest hospital CEO on West explosion: 61 patients treated so far. No deaths at this time.,Media,Affected individuals,Related and informative,rt wacotrib news hillcrest hospital ceo west explosion 61 patients treated far deaths time,1,3
324727176446500864,"RT @YourAnonNews: KWTV reporting 5 dead so far in #West, #Texas as a result of a fertilizer factory explosion. Over 60 injuries. #Waco # ...",Media,Affected individuals,Related and informative,rt youranonnews kwtv reporting 5 dead far west texas result fertilizer factory explosion 60 injuries waco,1,3
324727180661764096,RT @pushingyayo: #prayforboston #prayfortexas #prayforhumanity,Outsiders,Sympathy and support,Related - but not informative,rt pushingyayo prayforboston prayfortexas prayforhumanity,0,1
324727314850144256,RT @CNN: Explosion at a Texas fertilizer plant may have injured more than 100. Details and video live on @CNN TV.,Media,Affected individuals,Related and informative,rt cnn explosion texas fertilizer plant may injured 100 details video live cnn tv,1,3
324727587509239809,"RT @jessicadpeters: After seeing news on West explosion, @SusanPeters85 calls her closest friends &amp; goes 2 the hospital. So thankful ...",Outsiders,Affected individuals,Related - but not informative,rt jessicadpeters seeing news west explosion susanpeters85 calls closest friends amp goes 2 hospital thankful,0,3
324727742681731073,"RT @KshaClark: A fertilizer plant exploded.... believing to have injured or killed hundreds. That's what I read, #PrayForTexas",Outsiders,Affected individuals,Related and informative,rt kshaclark fertilizer plant exploded believing injured killed hundreds read prayfortexas,1,3
