380748745945919488,RT @Cal_OES: RT @femaregion8: 9/19 How Colorado state agencies are supporting #COflood response http://t.co/6jp94ZYUGD (via @COEmergency),Government,Donations and volunteering,Related and informative,rt cal_oes rt femaregion8 9 19 colorado state agencies supporting coflood response http co 6jp94zyugd via coemergency,2,6
380751463854911488,RT @denverpost: ALERT: Larimer County adds to number of people presumed killed in flood: http://t.co/XPFW37QVXL #coflood,Media,Affected individuals,Related and informative,rt denverpost alert larimer county adds number people presumed killed flood http co xpfw37qvxl coflood,2,5
380755918226354177,"RT @RedCrossDenver: Thank you, Colorado!! We raised over $1 million tonight for #COFloodRelief! Now, lots of work in the days, weeks &amp; mont…",NGOs,Donations and volunteering,Related - but not informative,rt redcrossdenver thank colorado raised 1 million tonight cofloodrelief lots work days weeks amp mont,1,6
380757004530507776,Colorado Floods: What Happens to All That Water? http://t.co/IpdpfMKlHK via @LiveScience,Media,Other Useful Information,Related and informative,colorado floods happens water http co ipdpfmklhk via livescience,2,2
380761307882217472,"#COFlood Are you in #Evans, Colo. and need a place to shower due to the no flush order in your city? Here's a... http://t.co/L3IkZdRPwY",Government,Donations and volunteering,Related and informative,coflood evans colo need place shower due flush order city http co l3ikzdrpwy,2,6
380764248088924160,RT @tishaschuller: .@RedCrossDenver briefing on #coflood: Need to raise at least $5M.  Join us here http://t.co/sovoiNmPU3 #COGAResponds,NGOs,Donations and volunteering,Related and informative,rt tishaschuller redcrossdenver briefing coflood need raise least 5m join us http co sovoinmpu3 cogaresponds,2,6
380767234450145280,RT @Accu_Jesse: Cloud seeding did NOT cause Colorado Flooding #coflood #goodtoknow http://t.co/QZiXYi3i2U,Media,Other Useful Information,Related and informative,rt accu_jesse cloud seeding cause colorado flooding coflood goodtoknow http co qzixyi3i2u,2,2
380768358507220993,RT @BeerAdvocate: In #Denver tonight? Swing by @StarBar_Denver for a #Colorado Flood Relief Fundraiser http://t.co/KQ3k3odqiP #COflood #cra…,Outsiders,Donations and volunteering,Related - but not informative,rt beeradvocate denver tonight swing starbar_denver colorado flood relief fundraiser http co kq3k3odqip coflood cra,1,6
380770929644556288,RT @jfleck: Why the #coflood fracking freakout is misplaced - there's *all kinds* of bad shit in urban/suburban flood water: http://t.co/gI…,Outsiders,Other Useful Information,Related - but not informative,rt jfleck coflood fracking freakout misplaced kinds bad shit urban suburban flood water http co gi,1,2
380777229459808256,"RT @TimesCall: #Longmont under state of emergency until Oct. 10. City manager can order evacuations, curfews. #longmontflood  http://t.co…",Government,Caution and advice,Related and informative,rt timescall longmont state emergency oct 10 city manager order evacuations curfews longmontflood http co,2,4
380777984455475200,RT @SenBennetCO Suffered damage from #coflood? Register w/ FEMA for disaster assistance http://t.co/Lti7AeKB8a or call 1-800-621-FEMA Plz RT,Government,Caution and advice,Related and informative,rt senbennetco suffered damage coflood register w fema disaster assistance http co lti7aekb8a call 1 800 621 fema plz rt,2,4
380784292688719873,MT @CleanWaterCO1: #Colorado now tracking 10 #OilGas #spills in #COFlood zone #CoPolitics #fracking http://t.co/wGRjSrJJav @AFPcolorado,Media,Infrastructure and utilities,Related and informative,mt cleanwaterco1 colorado tracking 10 oilgas spills coflood zone copolitics fracking http co wgrjsrjjav afpcolorado,2,3
380792354112012288,Very helpful resource from ESRI - Colorado Flooding Maps and Images | Esri Disaster Map http://t.co/jlAUhsRVzQ,Media,Other Useful Information,Related and informative,helpful resource esri colorado flooding maps images esri disaster map http co jlauhsrvzq,2,2
380794426135941122,RT @denverchannel: #GoodNews after #COFlood: @AshleighWalters reports horses stranded in Estes Park now have transport and a place to go...,Media,Other Useful Information,Related and informative,rt denverchannel goodnews coflood ashleighwalters reports horses stranded estes park transport place go,2,2
380794547753598977,Nebraska braces for overflow from Colorado flooding http://t.co/8g0q7yzDTb,Media,Other Useful Information,Related and informative,nebraska braces overflow colorado flooding http co 8g0q7yzdtb,2,2
380796468728045568,"$CLF Factbox: Floods shut oil, gas operations in Colorado http://t.co/oJ7zthpTIp",Media,Infrastructure and utilities,Related and informative,clf factbox floods shut oil gas operations colorado http co oj7zthptip,2,3
380798914007285760,Animal Rescue - Pet Shop - Colorado Flooding - Help Animals Now https://t.co/Ulzp0AcVMy,Business,Donations and volunteering,Related and informative,animal rescue pet shop colorado flooding help animals https co ulzp0acvmy,2,6
380805515875745793,The likely death toll from Colorado flooding caused by torrential rains has risen to at least nine.,Media,Affected individuals,Related and informative,likely death toll colorado flooding caused torrential rains risen least nine,2,5
380808204420014080,Wow- plowing out the mud from the bike path I use everyday #boulderflood http://t.co/CzRPk5AqIq,Eyewitness,Infrastructure and utilities,Related - but not informative,wow plowing mud bike path use everyday boulderflood http co czrpk5aqiq,1,3
380812511974420481,RT @DamienGillis: Stunning new aerial pics of #coloradoflood #fracking damage. Citizens call for moratorium http://t.co/2vYPOMS8e1 @gasland…,Media,Infrastructure and utilities,Related and informative,rt damiengillis stunning new aerial pics coloradoflood fracking damage citizens call moratorium http co 2vypoms8e1 gasland,2,3
380819063464660992,RT @mikemangas: A Redding woman describes her Granddaughter's escape from disaster in the Colorado flooding. Tonight on KRCR News Channel 7.,Media,Affected individuals,Related and informative,rt mikemangas redding woman describes granddaughter escape disaster colorado flooding tonight krcr news channel 7,2,5
380820032332107776,"Hard to imagine 19,000 homes destroyed. #Coloradoflood",Outsiders,Infrastructure and utilities,Related and informative,hard imagine 19 000 homes destroyed coloradoflood,2,3
380824675451826176,RT @finleybruce: Scenes from St. Vrain south of Miliken. #cowx #COflood http://t.co/20kuPmKIRE,Outsiders,Infrastructure and utilities,Related and informative,rt finleybruce scenes st vrain south miliken cowx coflood http co 20kupmkire,2,3
380836192993828864,This Heartbreaking Video Brings Humanity to Colorado Flooding Disaster http://t.co/ZNHckrv66C,Media,Other Useful Information,Related and informative,heartbreaking video brings humanity colorado flooding disaster http co znhckrv66c,2,2
380851036652834816,They said #DEATH! Likely death toll in Colorado floods rises to at least nine - Reuters http://t.co/exzGPu4K0V #Follow,Media,Affected individuals,Related and informative,said death likely death toll colorado floods rises least nine reuters http co exzgpu4k0v follow,2,5
380862973608087553,"Colorado Flooding Imperils Oil and Gas Sites, Causes Spill http://t.co/KPND9tVvIP  via @NatGeo",Media,Infrastructure and utilities,Related and informative,colorado flooding imperils oil gas sites causes spill http co kpnd9tvvip via natgeo,2,3
380864475198259200,RT @BirdingMagazine: Here's coverage in Audubon magazine of the effects on birdlife of the recent flooding in northeastern Colorado: http:/…,Media,Other Useful Information,Related and informative,rt birdingmagazine coverage audubon magazine effects birdlife recent flooding northeastern colorado http,2,2
380866853348061184,The Disaster Distress Helpline 1-800-985-5990 provides crisis counseling to people affected by flooding. #coflood http://t.co/w9w4gwpkkS,Government,Donations and volunteering,Related and informative,disaster distress helpline 1 800 985 5990 provides crisis counseling people affected flooding coflood http co w9w4gwpkks,2,6
380872947667566592,"RT @SamaritansPurse: Volunteers began helping victims of the #COflood yesterday. We still need volunteers, you can sign up here: http://t.c…",Media,Donations and volunteering,Related and informative,rt samaritanspurse volunteers began helping victims coflood yesterday still need volunteers sign http c,2,6
380875954987356160,BBC: Colorado flood death toll rises: The death toll from the historic flooding that hit Colorado last week ri... http://t.co/VBvpZOEcW8,Media,Affected individuals,Related and informative,bbc colorado flood death toll rises death toll historic flooding hit colorado last week ri http co vbvpzoecw8,2,5
380876428964671489,"Colorado flood death toll rises: The death toll from the historic flooding that hit Colorado last week rises to seven, as state offic...",Media,Affected individuals,Related and informative,colorado flood death toll rises death toll historic flooding hit colorado last week rises seven state offic,2,5
380876445737697283,#TEAMFOLLoWASAP* Colorado flood death toll rises: The death toll from the historic flooding that h... http://t.co/topDcqQghk  @Manzie_iCe,Media,Affected individuals,Related and informative,teamfollowasap colorado flood death toll rises death toll historic flooding h http co topdcqqghk manzie_ice,2,5
380881982202601472,RT @zfird: @NurandiNafisal Colorado flood death toll rises: The death toll from the historic flooding that hit C... http://t.co/NgFGg4bpzP …,Media,Affected individuals,Related and informative,rt zfird nurandinafisal colorado flood death toll rises death toll historic flooding hit c http co ngfgg4bpzp,2,5
380884779811753984,RT @AllieCatress: Silent auction &amp; awesome support for #coflood relief! W/@starbar_denver @oskarblues @alliecatress @… http://t.co/WNJ0tZ0M…,NGOs,Donations and volunteering,Related and informative,rt alliecatress silent auction amp awesome support coflood relief w starbar_denver oskarblues alliecatress http co wnj0tz0m,2,6
380885417358524416,"RT @SamaritansPurse: Volunteers began helping victims of the #COflood yesterday. We still need volunteers, sign up: http://t.co/0TTfjw60xv",NGOs,Donations and volunteering,Related and informative,rt samaritanspurse volunteers began helping victims coflood yesterday still need volunteers sign http co 0ttfjw60xv,2,6
380890362442563584,RT @SensorsSystems: DigitalGlobe Takes a Close Look at Colorado Floods  http://t.co/Q46JKURHr5,Business,Other Useful Information,Related and informative,rt sensorssystems digitalglobe takes close look colorado floods http co q46jkurhr5,2,2
380902047773884416,RT @YourAnonNews: MT @CBS4Mark: Toppled oil tanks spill into Colorado rivers #COflood http://t.co/RiWj9Erc3P,Media,Infrastructure and utilities,Related and informative,rt youranonnews mt cbs4mark toppled oil tanks spill colorado rivers coflood http co riwj9erc3p,2,3
380907122881351681,Please check out opportunities to volunteer tomorrow (Friday) in Boulder and Longmont: http://t.co/4CLVcMf6mt #BoulderFlood,NGOs,Donations and volunteering,Related and informative,please check opportunities volunteer tomorrow friday boulder longmont http co 4clvcmf6mt boulderflood,2,6
380915150770823169,"Officials: Some #Boulder roads will be closed for weeks, months, longer. #Boulderflood http://t.co/wnbp2REdTi via @JoeCarmenRubino",Government,Infrastructure and utilities,Related and informative,officials boulder roads closed weeks months longer boulderflood http co wnbp2redti via joecarmenrubino,2,3
380922981523804160,watch: estes park business affected by #coflood. #cowx  http://t.co/h9Dng1ZTR5,Media,Infrastructure and utilities,Related and informative,watch estes park business affected coflood cowx http co h9dng1ztr5,2,3
380924868952215552,RT @YourAnonNews: A message from @ColoradoOilGas- Welcome To The Climate That Changed Colorado! http://t.co/mZtJS9Osay #COflood via @remsta…,Media,Other Useful Information,Related - but not informative,rt youranonnews message coloradooilgas welcome climate changed colorado http co mztjs9osay coflood via remsta,1,2
380958335320588288,Another person presumed dead in Colorado flooding http://t.co/UY3vYys1jn,Media,Affected individuals,Related and informative,another person presumed dead colorado flooding http co uy3vyys1jn,2,5
380998751651131392,"The death toll from historic flooding that hit Colorado has risen to seven people, as the state faces 10 oil spills caused by the deluge.",Media,Affected individuals,Related and informative,death toll historic flooding hit colorado risen seven people state faces 10 oil spills caused deluge,2,5
381044092051787776,RT @EI_Climate: #climate Epic Flooding Deals Colorado Drought Crippling Blow: Climate Central http://t.co/lAenKKEVsI  MAP: http://t.co/4wuN…,Media,Other Useful Information,Related and informative,rt ei_climate climate epic flooding deals colorado drought crippling blow climate central http co laenkkevsi map http co 4wun,2,2
381044117217611776,RT @NASA: Colorado flooding near Greeley: comparison view from Landsat 8. http://t.co/r8wS1SXk60 @NASA_Landsat @USGSLandsat @NASA_EO,Government,Infrastructure and utilities,Related and informative,rt nasa colorado flooding near greeley comparison view landsat 8 http co r8ws1sxk60 nasa_landsat usgslandsat nasa_eo,2,3
381044595389247488,RT @NASA: Colorado flooding near Greeley: comparison view from Landsat 8. http://t.co/r8wS1SXk60 @NASA_Landsat @USGSLandsat @NASA_EO,Government,Other Useful Information,Related and informative,rt nasa colorado flooding near greeley comparison view landsat 8 http co r8ws1sxk60 nasa_landsat usgslandsat nasa_eo,2,2
381048261186191361,RT @NASA: Colorado flooding near Greeley: comparison view from Landsat 8. http://t.co/r8wS1SXk60 @NASA_Landsat @USGSLandsat @NASA_EO,Government,Other Useful Information,Related and informative,rt nasa colorado flooding near greeley comparison view landsat 8 http co r8ws1sxk60 nasa_landsat usgslandsat nasa_eo,2,2
381050559698309120,RT @BoulderFlood: Touching story from a #BoulderFlood Relief volunteer. This is what its all about: http://t.co/WoirHeMPSc,Media,Donations and volunteering,Related - but not informative,rt boulderflood touching story boulderflood relief volunteer http co woirhempsc,1,6
381052384220160000,thinking of everyone in CO RT! @GlutenFreeDee The First Step: Tell Us You Need #GlutenFree Food #COFlood #Celiac #GF http://t.co/dSEBLFEnC3,Not labeled,Not labeled,Not related,thinking everyone co rt glutenfreedee first step tell us need glutenfree food coflood celiac gf http co dseblfenc3,0,0
381055156625764355,Colorado..... We feel your pain ☔️☔️☔️☔️☔️☔️☔️☔️☔️☔️☔️☔️☔️☔️☔️☔️☔️☔️☔️☔️☔️☔️☔️☔️☔️☔️☔️☔️☔️☔️ #flooding #rain,Outsiders,Sympathy and support,Related - but not informative,colorado feel pain flooding rain,1,1
381063545250938880,VOLUNTEERS: Clean Up in Longmont 9am to 5pm! Meeting @ Twin Peaks Mall parking lot across from Schlotsky’s: http://t.co/Li8yM180Li #Coflood,NGOs,Donations and volunteering,Related and informative,volunteers clean longmont 9am 5pm meeting twin peaks mall parking lot across schlotsky http co li8ym180li coflood,2,6
381064585429516289,'No pets left behind' after Colorado flooding | Nation &amp; World | The Seattle Times http://t.co/yk4be5l7iD,Media,Affected individuals,Related and informative,pets left behind colorado flooding nation amp world seattle times http co yk4be5l7id,2,5
381071879336783872,RT @NASA: Colorado flooding near Greeley: comparison view from Landsat 8. http://t.co/r8wS1SXk60 @NASA_Landsat @USGSLandsat @NASA_EO,Government,Other Useful Information,Related and informative,rt nasa colorado flooding near greeley comparison view landsat 8 http co r8ws1sxk60 nasa_landsat usgslandsat nasa_eo,2,2
381074672718073856,Proud of @Code3Associates' efforts in Colorado. They're working w/ American Humane Assoc rescuing animals in aftermath of record floods.,Outsiders,Donations and volunteering,Related and informative,proud code3associates efforts colorado working w american humane assoc rescuing animals aftermath record floods,2,6
381075197010272257,RT @NASA: Colorado flooding near Greeley: comparison view from Landsat 8. http://t.co/r8wS1SXk60 @NASA_Landsat @USGSLandsat @NASA_EO,Government,Other Useful Information,Related and informative,rt nasa colorado flooding near greeley comparison view landsat 8 http co r8ws1sxk60 nasa_landsat usgslandsat nasa_eo,2,2
381085347251494912,Colorado Flood Damage  This image shows one of many scenes of damage from the flooding in Colorado that we... http://t.co/ItAGCxd0f8,Eyewitness,Infrastructure and utilities,Related and informative,colorado flood damage image shows one many scenes damage flooding colorado http co itagcxd0f8,2,3
381102510322499584,RT @TotalTrafficDEN: #Longmont closed on Hwy 287 SB at CO-52 and CO-7 in #Boulder #COtraffic http://t.co/V8oA4oBJqC,Media,Caution and advice,Related and informative,rt totaltrafficden longmont closed hwy 287 sb co 52 co 7 boulder cotraffic http co v8oa4objqc,2,4
381103118512951296,Colorado colleges pick up the pieces after flooding http://t.co/I9NedJfUiD,Media,Infrastructure and utilities,Related and informative,colorado colleges pick pieces flooding http co i9nedjfuid,2,3
381106918556585984,We're ready to have a good time whilst raising money to aid the #coloradoflood victims. Join us!  http://t.co/lXZDPmuXBM,NGOs,Donations and volunteering,Related - but not informative,ready good time whilst raising money aid coloradoflood victims join us http co lxzdpmuxbm,1,6
381110169117011968,RT @JERutter: MT @audubonmagazine -- Read about how the #coloradoflood affected #birds and wildlife in the area. http://t.co/6NxH3wr30v,Media,Other Useful Information,Related and informative,rt jerutter mt audubonmagazine read coloradoflood affected birds wildlife area http co 6nxh3wr30v,2,2
381117639193423872,"Help Jonathan, Cailey &amp; The Doggie Depot recover from #boulderflood  http://t.co/7PKQVlX7Fm via @gofundme",Eyewitness,Affected individuals,Related - but not informative,help jonathan cailey amp doggie depot recover boulderflood http co 7pkqvlx7fm via gofundme,1,5
381125650305667072,"This is 2013. A Christian commentator blames the floods in Colorado on....the Gays: http://t.co/vVH2qmAEc8  Religion, I told you !!!!",Outsiders,Not applicable,Related and informative,2013 christian commentator blames floods colorado gays http co vvh2qmaec8 religion told,2,7
381130872209960960,"A Devastating Before/After Comparison of the Colorado Floods, Captured by Satellite http://t.co/pWmdFxQ922",Media,Infrastructure and utilities,Related and informative,devastating comparison colorado floods captured satellite http co pwmdfxq922,2,3
381131081908371457,Evacuee Sadie and her new best friend Cook enjoying the sunny #estespark day! #COPets #COFloodRelief http://t.co/5sQ5jySX0T,Eyewitness,Other Useful Information,Related - but not informative,evacuee sadie new best friend cook enjoying sunny estespark day copets cofloodrelief http co 5sq5jysx0t,1,2
381131472003821568,RT @latimes: Colorado flooding: Environmental toll compounds the troubles http://t.co/ABF4DU9H3l,Media,Infrastructure and utilities,Related and informative,rt latimes colorado flooding environmental toll compounds troubles http co abf4du9h3l,2,3
381132537348632576,RT @HerzMuses: The #ColoradoFlood has craft breweries rallying to help. Here is a short list from @craftbeerdotcom  http://t.co/TBPIHuvhpf,Business,Donations and volunteering,Related and informative,rt herzmuses coloradoflood craft breweries rallying help short list craftbeerdotcom http co tbpihuvhpf,2,6
381133543989972992,Don’t get Pulled Under: Tips for Spotting a Flood-Damaged Car http://t.co/qpiKHCMYt1 #COFlood #Flood #Insurance,Media,Caution and advice,Related and informative,get pulled tips spotting flood damaged car http co qpikhcmyt1 coflood flood insurance,2,4
381136010253320192,"RT @ABCWorldNews: Thousands of pets, including fish, rescued from Colorado floods as rescue teams promise no pets left behind: http://t.c…",Media,Other Useful Information,Related and informative,rt abcworldnews thousands pets including fish rescued colorado floods rescue teams promise pets left behind http c,2,2
381141601231593474,"In Milliken, disaster relief remains busy a week after flood.  @denverpost #coflood #milliken  http://t.co/4GENQ2Fukl",Media,Donations and volunteering,Related and informative,milliken disaster relief remains busy week flood denverpost coflood milliken http co 4genq2fukl,2,6
381156012851347456,RT @COEmergency: Gov. Hickenlooper announces additional $20 million... http://t.co/dkhCNdS9Fd #coflood,Media,Donations and volunteering,Related and informative,rt coemergency gov hickenlooper announces additional 20 million http co dkhcnds9fd coflood,2,6
381169300427395073,A couple days to rest and now back covering #coflood aftermath. Headed to #Larimerflood area to get latest at evacuee meeting tonight,Not applicable,Other Useful Information,Related - but not informative,couple days rest back covering coflood aftermath headed larimerflood area get latest evacuee meeting tonight,1,2
381176367808655360,@LongmontHumane thank you for the offer of #COPets donations here in #estespark if anyone down there is coming up pls let me know #COFlood,NGOs,Donations and volunteering,Related and informative,longmonthumane thank offer copets donations estespark anyone coming pls let know coflood,2,6
381190473261408256,in the recent devastating floods in Boulder and Denver Colorado. Your friends here at...,Eyewitness,Not applicable,Related - but not informative,recent devastating floods boulder denver colorado friends,1,7
381203785973907456,Colorado Fracking Site Flooding   September 2013 HD: http://t.co/nFodFMEguo via @youtube,Outsiders,Infrastructure and utilities,Related and informative,colorado fracking site flooding september 2013 hd http co nfodfmeguo via youtube,2,3
381204939441065984,Hundreds of Cats Needing Help From Colorado Floods! Please help... : http://t.co/XL34jaCqB2 via @LuAnnSmithGCM #cats #catrescue,NGOs,Other Useful Information,Related and informative,hundreds cats needing help colorado floods please help http co xl34jacqb2 via luannsmithgcm cats catrescue,2,2
381210744358182912,All evacuation shelters will be consolidated into one location: The YMCA in Boulder. Get the details http://t.co/fp9jWg7mEn #boulderflood,Outsiders,Other Useful Information,Related and informative,evacuation shelters consolidated one location ymca boulder get details http co fp9jwg7men boulderflood,2,2
381232391143972865,"Colorado floods: Deluged Boulder restaurants struggle back to service: With bright skies and dry streets,... http://t.co/YBp2WtvxKL",Media,Infrastructure and utilities,Related and informative,colorado floods deluged boulder restaurants struggle back service bright skies dry streets http co ybp2wtvxkl,2,3
381234974831038464,Check out the latest article on the recent historical rainfall and flooding in Colorado.http://t.co/Xl6j1g41HK #COwx #coflood,Media,Other Useful Information,Related and informative,check latest article recent historical rainfall flooding colorado http co xl6j1g41hk cowx coflood,2,2
381236526710919168,Obama FEMA mysteriously grounded private drones helping to map the damage in Colorado..  http://t.co/P5CAVKum8n #COflood,Media,Other Useful Information,Related and informative,obama fema mysteriously grounded private drones helping map damage colorado http co p5cavkum8n coflood,2,2
381239148184485888,RT @TwitchyTeam: Barbi twins looking out for lost pets in Colorado floods; Rescues underway http://t.co/JkUgr6kr4M,Media,Other Useful Information,Related and informative,rt twitchyteam barbi twins looking lost pets colorado floods rescues underway http co jkugr6kr4m,2,2
381239227847278592,RT @TwitchyTeam: Barbi twins looking out for lost pets in Colorado floods; Rescues underway http://t.co/JkUgr6kr4M,Media,Affected individuals,Related and informative,rt twitchyteam barbi twins looking lost pets colorado floods rescues underway http co jkugr6kr4m,2,5
381239286575542272,"RT @Michelle9647: More spilled oil found in #COflood aftermath, brings total to about 22,000 gallons released: http://t.co/gSt1COY0Sz",Media,Infrastructure and utilities,Related and informative,rt michelle9647 spilled oil found coflood aftermath brings total 22 000 gallons released http co gst1coy0sz,2,3
381239387226247168,"Our @Tide Loads of Hope truck is located at Loveland's Laundromat, 266 E 29th St Loveland, CO 80538: http://t.co/VoDKZSF7Gd #COFloodRelief",NGOs,Donations and volunteering,Related and informative,tide loads hope truck located loveland laundromat 266 e 29th st loveland co 80538 http co vodkzsf7gd cofloodrelief,2,6
381248547594567680,"Oil spills, floods, airlifts in Colorado: Efforts continued Friday to cope with fallout from flooding that''s ... http://t.co/Z4viy8KwWS",Outsiders,Other Useful Information,Related and informative,oil spills floods airlifts colorado efforts continued friday cope fallout flooding http co z4viy8kwws,2,2
381268151771492352,RT @COEmergency: .@FloodDSS: Summary of Federal Aid for Private Water Infrastructure. http://t.co/uC5GXF41Vx #coflood,Government,Donations and volunteering,Related and informative,rt coemergency flooddss summary federal aid private water infrastructure http co uc5gxf41vx coflood,2,6
381270538343051264,I voted for #PorkGreenChili for #USFoodsNTP in the southwest to support #COFloodRelief. Join me: http://t.co/1xJukTjAoN,Not labeled,Not labeled,Not related,voted porkgreenchili usfoodsntp southwest support cofloodrelief join http co 1xjuktjaon,0,0
