380001136419164160,"RT @GlobalNational: The Colorado floods, responsible for the evacuation of almost 12,000, and the death of seven, are seen from space. http…",Media,Affected individuals,Related and informative,rt globalnational colorado floods responsible evacuation almost 12 000 death seven seen space http,2,5
380001702671548416,"RT @DenverChannel: #COflood update in @LarimerCounty - Looking to use smaller aircraft for rescues in tight areas - Chuck Russell, Incident…",Media,Affected individuals,Related and informative,rt denverchannel coflood update larimercounty looking use smaller aircraft rescues tight areas chuck russell incident,2,5
380002847686799360,COLORADO FLOODS - CALIFORNIA FIRES ?,Outsiders,Other Useful Information,Related - but not informative,colorado floods california fires,1,2
380003518779650048,#COflood update in @LarimerCounty: We have optimism today... that we'll be able to go at the same rate as yesterday. Incident Command Team,Government,Other Useful Information,Related and informative,coflood update larimercounty optimism today able go rate yesterday incident command team,2,2
380003913060990976,Colorado Office of Emergency Management downgrades to 648 unaccounted for people http://t.co/vQZwMzXAPf #COflood,Government,Affected individuals,Related and informative,colorado office emergency management downgrades 648 unaccounted people http co vqzwmzxapf coflood,2,5
380009273377308674,#COflood update in @bouldercounty: Re-entry passes available for Lyons residents tomorrow-- dawn to dusk entry,Government,Affected individuals,Related and informative,coflood update bouldercounty entry passes available lyons residents tomorrow dawn dusk entry,2,5
380009973826064384,"RT @9NEWS: #BoulderFlood: up to 12,000 structures are currently threatened. #COFlood",Media,Infrastructure and utilities,Related and informative,rt 9news boulderflood 12 000 structures currently threatened coflood,2,3
380011475391107074,"#COflood update on @bouldercolorado: Crews have cleared a large amount of debris - at max capacity at water treatment plant, per Huntley",Government,Infrastructure and utilities,Related and informative,coflood update bouldercolorado crews cleared large amount debris max capacity water treatment plant per huntley,2,3
380026155463876608,Want to help #COFlood victims? Here's how: http://t.co/8CULqhGxob,Outsiders,Donations and volunteering,Related - but not informative,want help coflood victims http co 8culqhgxob,1,6
380028181299732480,Check out Colorado frack-site flooding - September 2013 http://t.co/4RvEODvaQw #colorado #fracking #flood #wells #well #oil #gas #fracked,Media,Infrastructure and utilities,Related and informative,check colorado frack site flooding september 2013 http co 4rveodvaqw colorado fracking flood wells well oil gas fracked,2,3
380033877185552384,RT @CUBoulder: Flood resource table for students &amp; the #cuboulder community 10-4 today &amp; Wed. @CU_UMC in front of @CUBookStore #boulderflood,NGOs,Caution and advice,Related and informative,rt cuboulder flood resource table students amp cuboulder community 10 4 today amp wed cu_umc front cubookstore boulderflood,2,4
380035592651681792,RT @YoungCons: Harry Reid blames global warming for the Colorado floods. I guess there had never been a flood before we started driving car…,Outsiders,Other Useful Information,Related and informative,rt youngcons harry reid blames global warming colorado floods guess never flood started driving car,2,2
380043050111598592,"#Aurora water officials said Aurora received about 15 inches of rainfall in a week, the same average yearly amount. #cowx #coflood",Government,Other Useful Information,Related and informative,aurora water officials said aurora received 15 inches rainfall week average yearly amount cowx coflood,2,2
380045080150544384,Colorado Statewide rainfall from the #coflood published by @ColoradoClimate here; http://t.co/HBIvB6y9ZQ @FloodsOrg @FloodPolicyWonk,Media,Other Useful Information,Related and informative,colorado statewide rainfall coflood published coloradoclimate http co hbivb6y9zq floodsorg floodpolicywonk,2,2
380046804009504768,RT @BreakingMemo: Death Toll From Colorado Floods Rises To Eight http://t.co/V9D9K7eF7r,Media,Affected individuals,Related and informative,rt breakingmemo death toll colorado floods rises eight http co v9d9k7ef7r,2,5
380051870732939264,RT @CodyCrouch: Cleared into Estes Park. Video and pics to come. #CoFlood,Media,Other Useful Information,Related - but not informative,rt codycrouch cleared estes park video pics come coflood,1,2
380051916870258688,RT @fractivist: #toxic tanks leak carcinogens in water way #coflood    @txsharon @AnarchoAnon http://t.co/jPneL0DKDA,Outsiders,Infrastructure and utilities,Related and informative,rt fractivist toxic tanks leak carcinogens water way coflood txsharon anarchoanon http co jpnel0dkda,2,3
380054227915005952,The Colorado flooding death toll has risen to 8 &amp; thousands still displaced. See the latest photos of the aftermath http://t.co/Z1MXHWsO8l,Media,Affected individuals,Related and informative,colorado flooding death toll risen 8 amp thousands still displaced see latest photos aftermath http co z1mxhwso8l,2,5
380056438334185472,RT @WheatRidgePD: Pls RT this info! People in Colorado have been victimized enough. They don’t need to be scammed too! #coflood http://t.co…,Outsiders,Caution and advice,Related and informative,rt wheatridgepd pls rt info people colorado victimized enough need scammed coflood http co,2,4
380061303735611392,Drones can be cool “@ThomasFrey: Drones provide Colorado flooding assistance until FEMA grounded them http://t.co/LoqT0Mji0c”,Outsiders,Other Useful Information,Related and informative,drones cool thomasfrey drones provide colorado flooding assistance fema grounded http co loqt0mji0c,2,2
380062608159559680,.RT @bouldercounty: See tags/flags at home? LEAVE THEM IN PLACE. They're 4 search &amp; rescue http://t.co/2YNQ9y6Pav #boulderflood #COFlood,Government,Caution and advice,Related and informative,rt bouldercounty see tags flags home leave place 4 search amp rescue http co 2ynq9y6pav boulderflood coflood,2,4
380067553219194880,Colorado floods: How to talk to kids and stay strong amid disaster http://t.co/WsClQfk53O,Media,Caution and advice,Related and informative,colorado floods talk kids stay strong amid disaster http co wsclqfk53o,2,4
380068580831666176,An Interactive Map of the Colorado Floods http://t.co/9a0TdtZK4c,Media,Infrastructure and utilities,Related and informative,interactive map colorado floods http co 9a0tdtzk4c,2,3
380070380183904257,An Interactive Map of the Colorado Floods http://t.co/I6rTySiEtc,Media,Other Useful Information,Related and informative,interactive map colorado floods http co i6rtysietc,2,2
380071084856709120,Media Ignores Damaged Oil &amp; Gas Tanks from Colorado Flooding http://t.co/wI5mQ3oIzu,Media,Infrastructure and utilities,Related and informative,media ignores damaged oil amp gas tanks colorado flooding http co wi5mq3oizu,2,3
380073483981451264,@tishaschuller CEO of @ColoradoOilGas is tweeting about the industry response to Colorado flooding at #COGAResponds,Business,Other Useful Information,Related and informative,tishaschuller ceo coloradooilgas tweeting industry response colorado flooding cogaresponds,2,2
380074125726711808,RT @SarCharLand: Interested in continued updates on #oilandgas and #coflood? Visit http://t.co/V6ACD2LJ55 or email info@coga.org - thanks #…,Government,Donations and volunteering,Related and informative,rt sarcharland interested continued updates oilandgas coflood visit http co v6acd2lj55 email info coga org thanks,2,6
380074301858537472,His house was wrecked in the #BoulderFlood. So he decided to play his piano. (via @Upworthy) http://t.co/vxMBjTDteG,Outsiders,Infrastructure and utilities,Related - but not informative,house wrecked boulderflood decided play piano via upworthy http co vxmbjtdteg,1,3
380075455308525568,RT @COpetpantry: We're partnering w/ @HumaneBoulder to help displaced #boulderflood/#coflood victims feed #pets. To help: plz donate: https…,NGOs,Donations and volunteering,Related and informative,rt copetpantry partnering w humaneboulder help displaced boulderflood coflood victims feed pets help plz donate https,2,6
380081197289725953,RT @COpetpantry: We're partnering w/ @HumaneBoulder to help displaced #boulderflood/#coflood victims feed #pets. To help: plz donate: https…,NGOs,Donations and volunteering,Related and informative,rt copetpantry partnering w humaneboulder help displaced boulderflood coflood victims feed pets help plz donate https,2,6
380084338856955904,@CBSDenver @mariancall is hosting a live+online concert benefit tonight for the #COFlood! Pls share! #MCCOrelief http://t.co/6FRLtzcH4T,Media,Donations and volunteering,Related and informative,cbsdenver mariancall hosting live online concert benefit tonight coflood pls share mccorelief http co 6frltzch4t,2,6
380085634872139776,South Boulder Road fully open in both directions #COflood #boulderflood,Eyewitness,Infrastructure and utilities,Related and informative,south boulder road fully open directions coflood boulderflood,2,3
380088717672579072,RT @denverpost: LATEST PHOTOS: Rescues near #Jamestown continue for #CoFlood http://t.co/YuJ1CwaQay http://t.co/BGreaOmD28,Media,Affected individuals,Related and informative,rt denverpost latest photos rescues near jamestown continue coflood http co yuj1cwaqay http co bgreaomd28,2,5
380090542228377601,"CNN: Homes destroyed in Colorado floods: The skies have improved over Colorado, allowing some evacuated ... http://t.co/7TSNYpXwZg #news",Media,Other Useful Information,Related and informative,cnn homes destroyed colorado floods skies improved colorado allowing evacuated http co 7tsnypxwzg news,2,2
380092689691443200,RT @fractivist: UPDATE II  #coflood  Image from weld county - #oil #gas wellpad under water | #colorado   @AnarchoAnon http://t.co/Ie6D720R…,Outsiders,Infrastructure and utilities,Related and informative,rt fractivist update ii coflood image weld county oil gas wellpad water colorado anarchoanon http co ie6d720r,2,3
380099014697304064,RT @COEmergency: .RT @AuroraGov: Good health advice from Aurora's own University of Colorado Hospital! http://t.co/73Ji17FjR5 #COFlood #COP…,Government,Caution and advice,Related and informative,rt coemergency rt auroragov good health advice aurora university colorado hospital http co 73ji17fjr5 coflood cop,2,4
380100025532964864,7 photos that show how destructive the Colorado flooding has been... http://t.co/YlIcVO1mio,Media,Other Useful Information,Related and informative,7 photos show destructive colorado flooding http co ylicvo1mio,2,2
380103045440237569,"RT @denverpost: People refusing to leave their Larimer County homes, only 100 rescued Tuesday http://t.co/Uznxh1DhWZ #COFlood",Media,Affected individuals,Related and informative,rt denverpost people refusing leave larimer county homes 100 rescued tuesday http co uznxh1dhwz coflood,2,5
380105306157895680,Aftermath of our day. #ColoradoFlood @jujub_14 carrieramz http://t.co/gd3ioHwyxP,Eyewitness,Affected individuals,Related - but not informative,aftermath day coloradoflood jujub_14 carrieramz http co gd3iohwyxp,1,5
380109655659139072,RT @Colorado: Our thoughts are with those who have been impacted by the recent flooding in Colorado. Resource info. here: http://t.co/b7YAi…,Government,Sympathy and support,Related - but not informative,rt colorado thoughts impacted recent flooding colorado resource info http co b7yai,1,1
380110762946985984,RT @KDVR: Building a bridge in #EstesPark. http://t.co/RadAfv1QPz #cowx #coflood http://t.co/Gd7EvAoziP,Not labeled,Not labeled,Not related,rt kdvr building bridge estespark http co radafv1qpz cowx coflood http co gd7evaozip,0,0
380114227437912064,"Colorado Floods: Thousands of Gas, Oil Wells May Contaminate Water http://t.co/AaT8sXni14",Media,Infrastructure and utilities,Related and informative,colorado floods thousands gas oil wells may contaminate water http co aat8sxni14,2,3
380121823339220993,RT @coolmompicks: Here's how you can help the Colorado flooding victims: http://t.co/3Wit38OU5a,Outsiders,Donations and volunteering,Related and informative,rt coolmompicks help colorado flooding victims http co 3wit38ou5a,2,6
380123027079307264,"Reorganized stats from @COEmergency now classify 6 #COFlood deaths and the 2 missing, presumed dead are listed under missing.",Media,Affected individuals,Related and informative,reorganized stats coemergency classify 6 coflood deaths 2 missing presumed dead listed missing,2,5
380127972180905984,"Donate to #COflood recovery efforts at http://t.co/sW8YGs6Ph8. Please consider donating money, as funds are most easily put to greatest need",NGOs,Donations and volunteering,Related and informative,donate coflood recovery efforts http co sw8ygs6ph8 please consider donating money funds easily put greatest need,2,6
380130409054339072,"How can we help? #Colorado towns still surrounded by water, residents using refrigerators as 'life rafts': http://t.co/ufRNwjvBEW #COFlood",Outsiders,Affected individuals,Related and informative,help colorado towns still surrounded water residents using refrigerators life rafts http co ufrnwjvbew coflood,2,5
380130451014553600,Noble Energy: Flooding closes 5-10 percent of Colorado wells http://t.co/y36rgD1P6R,Business,Infrastructure and utilities,Related and informative,noble energy flooding closes 5 10 percent colorado wells http co y36rgd1p6r,2,3
380132401357135873,RT @5280Magazine: Our thoughts are with Colorado flooding victims. Share why you love CO on Instagram with #5280is20. #coloradoflood #risea…,Outsiders,Sympathy and support,Related - but not informative,rt 5280magazine thoughts colorado flooding victims share love co instagram 5280is20 coloradoflood risea,1,1
380133995213643776,"Deadly Colorado Floods - http://t.co/ylAu3rPKjG.  #watchmemes,#Weather, #viralvideos http://t.co/AoBzHhzJ9P",Media,Infrastructure and utilities,Related and informative,deadly colorado floods http co ylau3rpkjg watchmemes weather viralvideos http co aobzhhzj9p,2,3
380134951519154176,RT @TwitchyTeam: Barbi twins looking out for lost pets in Colorado floods; Rescues underway http://t.co/JkUgr6kr4M,Media,Affected individuals,Related and informative,rt twitchyteam barbi twins looking lost pets colorado floods rescues underway http co jkugr6kr4m,2,5
380141700129488896,RT @5280Magazine: Our thoughts are with Colorado flooding victims. Share why you love CO on Instagram with #5280is20. #coloradoflood #risea…,Media,Sympathy and support,Related - but not informative,rt 5280magazine thoughts colorado flooding victims share love co instagram 5280is20 coloradoflood risea,1,1
380145907024404483,RT @CBSDenver: Please help with the #CoFloodRelief: https://t.co/3CtPCvzZPv #coflood How to help now: http://t.co/giyRlLXDzw http://t.co/Ho…,Media,Donations and volunteering,Related - but not informative,rt cbsdenver please help cofloodrelief https co 3ctpcvzzpv coflood help http co giyrllxdzw http co ho,1,6
380147035288006656,"RT @meltzere: 'Weeks, months, years to recover' Every #Boulder department head using this phrase. #boulderflood",Outsiders,Other Useful Information,Related and informative,rt meltzere weeks months years recover every boulder department head using phrase boulderflood,2,2
380147811221647360,"RT @BigGigantic: 9.27 &amp; 9.28 CO shows BOTH #ColoradoFlood Relief Benefit Shows. Portion of proceeds donated &amp; food, clothing &amp; household it…",Media,Donations and volunteering,Related and informative,rt biggigantic 9 27 amp 9 28 co shows coloradoflood relief benefit shows portion proceeds donated amp food clothing amp household,2,6
380148855603343360,Hundreds missing in Colorado floods: Emergency teams are searching for hundreds of people missing after Colora... http://t.co/2ZKwObdrdX,Media,Affected individuals,Related and informative,hundreds missing colorado floods emergency teams searching hundreds people missing colora http co 2zkwobdrdx,2,5
380152781488664576,RT @SEBHEUPDATE: Hundreds missing in Colorado floods http://t.co/kfUoHwkBbO #SEBHEUPDATE,Media,Affected individuals,Related and informative,rt sebheupdate hundreds missing colorado floods http co kfuohwkbbo sebheupdate,2,5
380156849980321792,"Colorado Towns Are Left Stranded in Deadly Floods -  “This is not your ordinary disaster,” said Joe Pelle, the... http://t.co/KcGg1Yg6Kl",Media,Other Useful Information,Related and informative,colorado towns left stranded deadly floods ordinary disaster said joe pelle http co kcgg1yg6kl,2,2
380161870550011904,Colorado floods http://t.co/79SJ3ug2pD,Media,Affected individuals,Related and informative,colorado floods http co 79sj3ug2pd,2,5
380164953367265281,RT @freekibble: 100% of the kibble raised @Freekibble today goes to homeless pets impacted by the flooding in Colorado! Spread word! http:/…,Business,Donations and volunteering,Related and informative,rt freekibble 100 kibble raised freekibble today goes homeless pets impacted flooding colorado spread word http,2,6
380168916976144384,"In honor of #s17, good time to check out #COflood (ff: @boulderflood) &amp; start building local crews to come help #occupy the recovery/rebuild",Outsiders,Donations and volunteering,Related and informative,honor s17 good time check coflood ff boulderflood amp start building local crews come help occupy recovery rebuild,2,6
380175774667386880,RT @DrBradHolland: A Wile E. Coyote moment.  The Zephyr tracks near Moffat Tunnel suspended in Air. #coflood #boulderflood http://t.co/Wcpw…,Outsiders,Other Useful Information,Related and informative,rt drbradholland wile e coyote moment zephyr tracks near moffat tunnel suspended air coflood boulderflood http co wcpw,2,2
380176844223287296,"RT @InterOcc: In honor of #s17, good time to check out #COflood (ff: @boulderflood) &amp; start building local crews to come help #occupy the r…",Media,Donations and volunteering,Related - but not informative,rt interocc honor s17 good time check coflood ff boulderflood amp start building local crews come help occupy r,1,6
380179243365597184,RT @sustainabilitst: Fracking Flooding in Colorado. The secret pollution that media isn't covering. http://t.co/id7HTQgSzM,Media,Other Useful Information,Related and informative,rt sustainabilitst fracking flooding colorado secret pollution media covering http co id7htqgszm,2,2
380179994129207296,Colorado emergency officials fear increased risk of West Nile virus amid flooding http://t.co/8FBFLbw9vA,Outsiders,Caution and advice,Related and informative,colorado emergency officials fear increased risk west nile virus amid flooding http co 8fbflbw9va,2,4
380195894760448000,Text REBUILD to 27722 to donate $10 to Colorado Flood Relief through Lefthand Brewing Co. http://t.co/xRgLUXTmC1 #coflood #longmontflood,Business,Donations and volunteering,Related and informative,text rebuild 27722 donate 10 colorado flood relief lefthand brewing co http co xrgluxtmc1 coflood longmontflood,2,6
380197757031440384,Fracking and Colorado Flooding Don’t Mix http://t.co/1f9LJfWVev,Media,Other Useful Information,Related and informative,fracking colorado flooding mix http co 1f9ljfwvev,2,2
380199145325084673,BBC News - Colorado floods: Hundreds still missing http://t.co/kklZKVFEJd,Media,Affected individuals,Related and informative,bbc news colorado floods hundreds still missing http co kklzkvfejd,2,5
380203381584707584,RT @ZackMalitz: It's hard to find words for how awful the flooding of CO's #fracking fields is: http://t.co/up8EcFIhP2 #coflood #boulderflo…,Media,Sympathy and support,Related and informative,rt zackmalitz hard find words awful flooding co fracking fields http co up8ecfihp2 coflood boulderflo,2,1
380207777194717184,Hundreds missing in Colorado floods http://t.co/3KtlpzQbhy,Media,Affected individuals,Related and informative,hundreds missing colorado floods http co 3ktlpzqbhy,2,5
380209131962920960,@crissstaaaaal they need more of that Colorado flooding,Outsiders,Affected individuals,Related - but not informative,crissstaaaaal need colorado flooding,1,5
380214509048037377,His house was wrecked in the #BoulderFlood. So he decided to play his piano. (via @Upworthy) http://t.co/hd2qfHa00p,Outsiders,Infrastructure and utilities,Related - but not informative,house wrecked boulderflood decided play piano via upworthy http co hd2qfha00p,1,3
380220527899467776,Breaking News: #Aurora Colorado floods: Rescuers strongly advise residents to evacuate http://t.co/1XOG9sQOLC,Outsiders,Caution and advice,Related and informative,breaking news aurora colorado floods rescuers strongly advise residents evacuate http co 1xog9sqolc,2,4
380224516661596160,7 shocking photos of Colorado's flash floods http://t.co/tjxxN2ipr5,Media,Infrastructure and utilities,Related and informative,7 shocking photos colorado flash floods http co tjxxn2ipr5,2,3
380227272344489984,RT @AP: Focus shifts from airlifts to trying to find hundreds still unaccounted for after Colorado floods: http://t.co/c8ohuGzuL4 -CJ,Media,Affected individuals,Related and informative,rt ap focus shifts airlifts trying find hundreds still unaccounted colorado floods http co c8ohugzul4 cj,2,5
380272600162648064,Bid now on this one of a kind SIGNED canvas print of our @RedRocksOnline poster. ALL proceeds go to #Coflood relief: http://t.co/uygoDvxS5l,Business,Donations and volunteering,Related - but not informative,bid one kind signed canvas print redrocksonline poster proceeds go coflood relief http co uygodvxs5l,1,6
380276836409679872,RT @thelumineers: Bid now on this one of a kind SIGNED canvas print of our @RedRocksOnline poster. ALL proceeds go to #Coflood relief: http…,Not labeled,Not labeled,Not related,rt thelumineers bid one kind signed canvas print redrocksonline poster proceeds go coflood relief http,0,0
380284360999456769,"U.S. floods roll toward Nebraska: As Colorado copes with the aftermath of deadly floods, the high waters rolled... http://t.co/ARj2I2Su6H",Media,Caution and advice,Related and informative,u floods roll toward nebraska colorado copes aftermath deadly floods high waters rolled http co arj2i2su6h,2,4
380288316249092096,RT @DenverChannel: #COFloodRelief fundraiser today! Please retweet! Details: http://t.co/EGSW50RAzT http://t.co/5WPmwRiXiG,NGOs,Donations and volunteering,Related and informative,rt denverchannel cofloodrelief fundraiser today please retweet details http co egsw50razt http co 5wpmwrixig,2,6
380303973582114816,Colorado floods: Hundreds still missing - BBC News http://t.co/qiUNBCpoGw,Media,Affected individuals,Related and informative,colorado floods hundreds still missing bbc news http co qiunbcpogw,2,5
380307136078548992,"Flood waters have hit Sedgwick County, up to 15 homes now in danger on SW side of the town of Ovid. #coflood @TubbsKOA @AprilZesbaugh",Eyewitness,Infrastructure and utilities,Related and informative,flood waters hit sedgwick county 15 homes danger sw side town ovid coflood tubbskoa aprilzesbaugh,2,3
380307245134643200,RT @chriscmooney: Did climate change worsen the Colorado floods? http://t.co/Re1FQW4CBL via @motherjones,Media,Other Useful Information,Related and informative,rt chriscmooney climate change worsen colorado floods http co re1fqw4cbl via motherjones,2,2
380311644967948291,An Interactive Map of the Colorado Floods http://t.co/kJRs4tsZ3f via @mashable,Media,Other Useful Information,Related and informative,interactive map colorado floods http co kjrs4tsz3f via mashable,2,2
380314362856357888,i360SLGov: FEMA Continues to Support Response to Colorado Flooding http://t.co/oQpftTu3yJ,Government,Donations and volunteering,Related and informative,i360slgov fema continues support response colorado flooding http co oqpfttu3yj,2,6
380317298851971072,#Presbyterian Disaster Assistance responds to the #Colorado flooding. Learn what you can do to help: http://t.co/AZTWbHTD3z,NGOs,Donations and volunteering,Related and informative,presbyterian disaster assistance responds colorado flooding learn help http co aztwbhtd3z,2,6
380337729331933184,RT @EnviroAction: Colorado #fracking site featured in @gaslandmovie now under water thanks to biblical floods. http://t.co/aQCq4giGd6,NGOs,Infrastructure and utilities,Related and informative,rt enviroaction colorado fracking site featured gaslandmovie water thanks biblical floods http co aqcq4gigd6,2,3
380348735189835776,#BREAKING #COflood: Helicopters from Ft. Carson and @CONG1860 have evacuated 1162 people in  @bouldercounty - per Mitch Utterback,Government,Affected individuals,Related and informative,breaking coflood helicopters ft carson cong1860 evacuated 1162 people bouldercounty per mitch utterback,2,5
380351474079125504,Every time I come to this place. Specs1962 #Apple #wreckingball #storm #america #neverforget #boulderflood 😂 https://t.co/jfXMtfUKNK,Not labeled,Not labeled,Not related,every time come place specs1962 apple wreckingball storm america neverforget boulderflood https co jfxmtfuknk,0,0
380361167111061504,10 choppers on scene today in @LarimerSheriff . Drawing down resources in @TownofEstesPark . Access opening up along Highway 7 #coflood,Government,Infrastructure and utilities,Related and informative,10 choppers scene today larimersheriff drawing resources townofestespark access opening along highway 7 coflood,2,3
380361385189707776,RT @downtownboulder: We know you're all concerned about damage to #PearlStreetMall from the #boulderflood. We're happy to report that it wa…,Media,Infrastructure and utilities,Related and informative,rt downtownboulder know concerned damage pearlstreetmall boulderflood happy report wa,2,3
380364107284619264,"RT @Salon: Please, stop futzing around on Twitter and Facebook, and pay attention to the Colorado floods. We need your help http://t.co/Xlr…",Media,Other Useful Information,Related - but not informative,rt salon please stop futzing around twitter facebook pay attention colorado floods need help http co xlr,1,2
