379300591182557185,RT @SurvivorShape: TY for the calls our studio&amp;staff survived the #coloradoflood - Hoping all our friends @FIRSTDESCENTS and @mylifelineorg…,Business,Sympathy and support,Related and informative,rt survivorshape ty calls studio amp staff survived coloradoflood hoping friends firstdescents mylifelineorg,2,1
379302008873689088,RT @EricHolthaus: This is nearly unfathomable: the Big Thompson River has spent nearly 60hrs at record levels. #boulderflood ongoing. http:…,Eyewitness,Other Useful Information,Related and informative,rt ericholthaus nearly unfathomable big thompson river spent nearly 60hrs record levels boulderflood ongoing http,2,2
379302440899600384,RT @DenverChannel: Flooding at Red Rocks Amphitheatre - about 30 rows under water! Photo via http://t.co/b414RHRZbh #COwx #COflood http://t…,Media,Infrastructure and utilities,Related and informative,rt denverchannel flooding red rocks amphitheatre 30 rows water photo via http co b414rhrzbh cowx coflood http,2,3
379302940000792576,RT @Calgonaway: My prayers go out to all the flooding victims in Colorado right now.,Outsiders,Sympathy and support,Related - but not informative,rt calgonaway prayers go flooding victims colorado right,1,1
379303514607849472,"RT @denverpost: Colorado floods relief: How to help victims, those affected http://t.co/fdTZOoNUe9 #coflood",Media,Donations and volunteering,Related and informative,rt denverpost colorado floods relief help victims affected http co fdtzoonue9 coflood,2,6
379304550630715392,"RT @BoulderRelief: NEEDED: New towels, new blankets, new socks, dry shoes, packaged food for #BoulderFlood relief! Bring to 2850 Mapleton A…",NGOs,Donations and volunteering,Related and informative,rt boulderrelief needed new towels new blankets new socks dry shoes packaged food boulderflood relief bring 2850 mapleton,2,6
379306224140812288,RT @DenverChannel: Flooding at Red Rocks Amphitheatre - about 30 rows under water! Photo via http://t.co/b414RHRZbh #COwx #COflood http://t…,Media,Infrastructure and utilities,Related and informative,rt denverchannel flooding red rocks amphitheatre 30 rows water photo via http co b414rhrzbh cowx coflood http,2,3
379306253501341696,#COflood Releases from Olympus Dam have increased to 1100 cfs. We have seen rain at Estes. Rain inflows to Lake... http://t.co/aoKTSgyyQn,Government,Other Useful Information,Related and informative,coflood releases olympus dam increased 1100 cfs seen rain estes rain inflows lake http co aoktsgyyqn,2,2
379311844516585473,Just talked with folks at @CUBoulder. Chancellor's decision about whether to close campus Monday is coming soon. #boulderflood,Outsiders,Infrastructure and utilities,Related and informative,talked folks cuboulder chancellor decision whether close campus monday coming soon boulderflood,2,3
379313027297710080,"General Contractor Serving, #COFlood #Evergreen #Jeffco",Not labeled,Not labeled,Not related,general contractor serving coflood evergreen jeffco,0,0
379313346060644352,RT @9NEWS: INCREDIBLE IMAGE: A soldier rescues a woman with a walker via helicopter from Longmont Dam Rd. in Lyons. #coflood http://t.co/Ff…,Media,Affected individuals,Related and informative,rt 9news incredible image soldier rescues woman walker via helicopter longmont dam rd lyons coflood http co ff,2,5
379314377876189184,"RT @W00PIGS000IE: BREAKING:  Experts have determined Colorado Flooding was caused by tears of Badger fans, FEMA is sending trucks loaded w/…",Outsiders,Other Useful Information,Related - but not informative,rt w00pigs000ie breaking experts determined colorado flooding caused tears badger fans fema sending trucks loaded w,1,2
379315556479807488,"RT @Richard_H: Just reading about the floods in Colorado - we've spent a fair bit of time there over the years, hope it stops raining soon …",Outsiders,Sympathy and support,Related - but not informative,rt richard_h reading floods colorado spent fair bit time years hope stops raining soon,1,1
379316609258496001,"RT @9NEWS: We just spoke with Red Rocks. Their seats are not underwater, just wet. Lumineers show tonight is still on as planned. #coflood",Media,Infrastructure and utilities,Related and informative,rt 9news spoke red rocks seats underwater wet lumineers show tonight still planned coflood,2,3
379319536878510082,"RT @femaregion8: If it's not safe for you, it's not safe for your pets.  Take them with you. #COpets #COflood",Government,Caution and advice,Related and informative,rt femaregion8 safe safe pets take copets coflood,2,4
379322103763185664,"RT @femaregion8: If it's not safe for you, it's not safe for your pets.  Take them with you. #COpets #COflood",Government,Caution and advice,Related and informative,rt femaregion8 safe safe pets take copets coflood,2,4
379323030733733888,"RT @latimes: Colorado flooding: 6 likely dead, more than 700 missing. http://t.co/Iwj1g4zuXN",Media,Affected individuals,Related and informative,rt latimes colorado flooding 6 likely dead 700 missing http co iwj1g4zuxn,2,5
379324788138721282,"Boulder, CO has received app. 20 in of rain this year so far. That's 20% of what our rainforests get every year. #COflood",Not applicable,Other Useful Information,Related and informative,boulder co received app 20 rain year far 20 rainforests get every year coflood,2,2
379324934935162881,"RT @DenverChannel: 30 state highway bridges destroyed, 20 damaged - @ColoradoDOT's Amy Ford (partial assessment) #COFlood #BreakingNews",Media,Infrastructure and utilities,Related and informative,rt denverchannel 30 state highway bridges destroyed 20 damaged coloradodot amy ford partial assessment coflood breakingnews,2,3
379325207543947264,"RT @KD0FHS: Environmental damage occurring in #Colorado #flood, media turning a blind eye. #coflood http://t.co/dBQT0AJBAR",Media,Other Useful Information,Related and informative,rt kd0fhs environmental damage occurring colorado flood media turning blind eye coflood http co dbqt0ajbar,2,2
379325744440041472,"RT @indigojourney: You dont have 2 ask permission, U see problem &amp; solution...encourage leaderhsip roles #occupy #floodrelief #coflood ht…",Outsiders,Other Useful Information,Related and informative,rt indigojourney dont 2 ask permission u see problem amp solution encourage leaderhsip roles occupy floodrelief coflood ht,2,2
379326998541107200,"Flooding by #UCCS has moved traffic cones into middle of traffic on Austin Bluffs by Union, stay safe out there!  #coflood",Government,Caution and advice,Related and informative,flooding uccs moved traffic cones middle traffic austin bluffs union stay safe coflood,2,4
379328139379638273,Fires cause flooding and death in Colorado http://t.co/hvTtjc1vW9,Media,Affected individuals,Related and informative,fires cause flooding death colorado http co hvttjc1vw9,2,5
379334183392251904,RT @mchastain81: You can do so much to help those who lost everything in the #COflood http://t.co/NsEhKW3Spu,Outsiders,Donations and volunteering,Related and informative,rt mchastain81 much help lost everything coflood http co nsehkw3spu,2,6
379334258856194049,#lyons #boulderflood Here is what is left of Shelly's Cabins off of 36 West of Lyons. http://t.co/wwvGLAt75C,Eyewitness,Infrastructure and utilities,Related and informative,lyons boulderflood left shelly cabins 36 west lyons http co wwvglat75c,2,3
379339841508356096,Floods Transform Colorado's 'Gore-Tex Vortex',Not labeled,Not labeled,Not related,floods transform colorado gore tex vortex,0,0
379341879927504896,Floods Transform Colorado's 'Gore-Tex Vortex': Residents return to find Colorado's 'Gore-Tex Vortex' transform... http://t.co/iPBhMMWYfq,Media,Infrastructure and utilities,Related and informative,floods transform colorado gore tex vortex residents return find colorado gore tex vortex transform http co ipbhmmwyfq,2,3
379345407337172992,RT @KellySommariva: Streets buckling like taffy. Viewer pic from Lee Hill Dr. and Lefthand Canyon Dr. #coflood #boulderflood http://t.co/KK…,Eyewitness,Infrastructure and utilities,Related and informative,rt kellysommariva streets buckling like taffy viewer pic lee hill dr lefthand canyon dr coflood boulderflood http co kk,2,3
379347017949925376,RT @Muffissness: DONATE BY TEXT TO HELP #COLORADO #FLOOD VICTIMS. MT @9NEWS Colorado #floods: How you can help http://t.co/NBtzFvicNb #COFl…,Media,Donations and volunteering,Related - but not informative,rt muffissness donate text help colorado flood victims mt 9news colorado floods help http co nbtzfvicnb cofl,1,6
379347533828325376,“@denverpost: UPDATE: Federal aid begins to flow to flood ravaged Colorado http://t.co/7W2MnfSsVY #coflood”,Media,Donations and volunteering,Related and informative,denverpost update federal aid begins flow flood ravaged colorado http co 7w2mnfssvy coflood,2,6
379348204925366273,"RT @Ascrazyasmyhair: Leaving Sterling, driving past Fort Morgan #coflood @9NEWS http://t.co/HTwvmdFqgm",Eyewitness,Other Useful Information,Related and informative,rt ascrazyasmyhair leaving sterling driving past fort morgan coflood 9news http co htwvmdfqgm,2,2
379348485965090816,RT @Trenton_Hoshiko: I started a T-Shirt campaign to benefit the #coloradoflood victims. http://t.co/p9WUBC0mWB    More info at http://t.co…,Media,Donations and volunteering,Related and informative,rt trenton_hoshiko started shirt campaign benefit coloradoflood victims http co p9wubc0mwb info http co,2,6
379348678898499584,RT @HazNotification: 85 Denver 5th graders &amp; teachers stranded 4 days near get a ride home in a chopper! #cowx #boulderflood #coflood http:…,Media,Affected individuals,Related and informative,rt haznotification 85 denver 5th graders amp teachers stranded 4 days near get ride home chopper cowx boulderflood coflood http,2,5
379349148664725504,RT @CherylPreheim: Rescues in Broomfield #coflood http://t.co/Zl0VrIAmAA,Outsiders,Donations and volunteering,Related and informative,rt cherylpreheim rescues broomfield coflood http co zl0vriamaa,2,6
379353099686903809,"RT @breakingstorm: 5 people confirmed dead in Colorado flooding, and 1,254 people unaccounted for statewide, official says - @NBCNews http:…",Media,Affected individuals,Related and informative,rt breakingstorm 5 people confirmed dead colorado flooding 1 254 people unaccounted statewide official says nbcnews http,2,5
379354483823616000,RT @geopolytica: Colorado flooding rescue continues http://t.co/sUpfvph2bN,Media,Affected individuals,Related and informative,rt geopolytica colorado flooding rescue continues http co supfvph2bn,2,5
379356052493312000,@cyclist_lawyer 100$ raised so far and just four hours in! #coflood,Outsiders,Donations and volunteering,Related and informative,cyclist_lawyer 100 raised far four hours coflood,2,6
379357990261755904,Help #coloradoflood http://t.co/tTRZoDCaJL,Outsiders,Donations and volunteering,Related and informative,help coloradoflood http co ttrzodcajl,2,6
379358808134254592,"RT @DisasterTechLab: OK, the decison has been made. We're sending a core team to Boulder to provide Internet access and comms. #coflood #bo…",Business,Donations and volunteering,Related and informative,rt disastertechlab ok decison made sending core team boulder provide internet access comms coflood bo,2,6
379360347431268353,"RT @breakingstorm: 5 people confirmed dead in Colorado flooding, and 1,254 people unaccounted for statewide, official says - @NBCNews http:…",Media,Affected individuals,Related and informative,rt breakingstorm 5 people confirmed dead colorado flooding 1 254 people unaccounted statewide official says nbcnews http,2,5
379361337278988288,"Colorado flooding: Evacuations, broken oil pipeline in Weld County #fraccident  http://t.co/d1FMyLx1qg",Outsiders,Infrastructure and utilities,Related and informative,colorado flooding evacuations broken oil pipeline weld county fraccident http co d1fmylx1qg,2,3
379361807070425088,Another woman missing and feared dead in Colorado floods http://t.co/HiEejveFjF,Media,Affected individuals,Related and informative,another woman missing feared dead colorado floods http co hieejvefjf,2,5
379362016793604096,A #fracking disaster? http://t.co/jmD69KAwN4 #coflood,Not applicable,Not applicable,Related and informative,fracking disaster http co jmd69kawn4 coflood,2,7
379363098915647488,Another #CoFlood today #ugh #omg I wish this #weather get nice tomorrow,Outsiders,Sympathy and support,Related - but not informative,another coflood today ugh omg wish weather get nice tomorrow,1,1
379363761603481600,RT @RednockGeog: “@guardian: Colorado floods: rescuers rush to evacuate stranded communities:  http://t.co/tq82PT6efp” yr12 world at risk,Media,Donations and volunteering,Related and informative,rt rednockgeog guardian colorado floods rescuers rush evacuate stranded communities http co tq82pt6efp yr12 world risk,2,6
379366060077498368,Floods transform Colorado's 'Gore-Tex Vortex' http://t.co/KEVwIbJfBT,Media,Infrastructure and utilities,Related and informative,floods transform colorado gore tex vortex http co kevwibjfbt,2,3
379366240428384256,RT @YuriHiranuma: Death toll rises in Colorado floods with another feared dead http://t.co/OSoDTAWiAw via @reuters  コロラドの歴史的な洪水の現時点での死者4人、行…,Not applicable,Affected individuals,Related and informative,rt yurihiranuma death toll rises colorado floods another feared dead http co osodtawiaw via reuters コロラドの歴史的な洪水の現時点での死者4人 行,2,5
379367024784203776,"On the bright side though, the apartment has never been cleaner #boulderflood",Eyewitness,Not applicable,Related - but not informative,bright side though apartment never cleaner boulderflood,1,7
379367666500108288,RT @Cosmic_Surfer: Colorado burns then floods but deniers still deny climate change http://t.co/oBI5D9LyFF,Outsiders,Other Useful Information,Related and informative,rt cosmic_surfer colorado burns floods deniers still deny climate change http co obi5d9lyff,2,2
379370296337113088,this has been an emotionally exhausting last 4 days #boulderflood,Eyewitness,Other Useful Information,Related - but not informative,emotionally exhausting last 4 days boulderflood,1,2
379370464121876480,RT @garretdoll: I'm sad - @cabelas #thornton #colorado #flood #coloradoflood #whollstoptherain http://t.co/K8OArwnbT5,Outsiders,Sympathy and support,Related - but not informative,rt garretdoll sad cabelas thornton colorado flood coloradoflood whollstoptherain http co k8oarwnbt5,1,1
379370682217271296,Floods destroy or damage more than 50 bridges in Colorado: WELD COUNTY — Thirty bridges have been reported... http://t.co/Mk4PlK5lXw,Media,Infrastructure and utilities,Related and informative,floods destroy damage 50 bridges colorado weld county thirty bridges reported http co mk4plk5lxw,2,3
379371030315159552,RT @HHDavisPix: The damage to the small town of #Jamestown of #Boulder from the #coflood is jaw dropping. Follow here for more photos http:…,Media,Infrastructure and utilities,Related and informative,rt hhdavispix damage small town jamestown boulder coflood jaw dropping follow photos http,2,3
379371923722878977,RT @A_Long_Bear: Btw it just blows me away that over 1200 people are still unaccounted for from the floods that have hit Colorado. #unthink…,Outsiders,Affected individuals,Related and informative,rt a_long_bear btw blows away 1200 people still unaccounted floods hit colorado unthink,2,5
379373546901749760,RT @jaclynloraine: Hardworking power crews work to repair lines downed by a #mudslide. #boulderflood http://t.co/7eq4ngAU1H,Media,Infrastructure and utilities,Related and informative,rt jaclynloraine hardworking power crews work repair lines downed mudslide boulderflood http co 7eq4ngau1h,2,3
379375786681049089,@JZ_Blue Thanks for the Love Bro. I'll be fine however many are not and our best wishes and prayers go out to them all. #COFlood,Eyewitness,Sympathy and support,Related - but not informative,jz_blue thanks love bro fine however many best wishes prayers go coflood,1,1
379377925767700480,RT @Wildcat0037: #Colorado floods: Over 500 unaccounted for as 'devastating' rain looms http://t.co/JRdYS5jmL7,Media,Affected individuals,Related and informative,rt wildcat0037 colorado floods 500 unaccounted devastating rain looms http co jrdys5jml7,2,5
379378101924278273,The University of Northern Colorado will be closed Monday due to flooding in the area - @9NEWS http://t.co/wXaLVfubmQ,Media,Infrastructure and utilities,Related and informative,university northern colorado closed monday due flooding area 9news http co wxalvfubmq,2,3
379378227774754816,"RT @BreitbartNews: Over 1,200 Missing in Colorado Flooding: A large area of Colorado, primarily Boulder County, has experienced e... http:/…",Media,Affected individuals,Related and informative,rt breitbartnews 1 200 missing colorado flooding large area colorado primarily boulder county experienced e http,2,5
379378525557383169,"The Colorado Office of Emergency Management estimates nearly 19,000 homes are damaged or destroyed. #coloradoflood",Government,Infrastructure and utilities,Related and informative,colorado office emergency management estimates nearly 19 000 homes damaged destroyed coloradoflood,2,3
379379666412249088,"Someone needs to tell NBC they don't need to be camped in front of my.apartment still, as they.have been for 3 days #boulderflood #headsup",Outsiders,Other Useful Information,Related - but not informative,someone needs tell nbc need camped front apartment still 3 days boulderflood headsup,1,2
379380798882709504,"RT @CherylPreheim: Heart wrenching @COEmergency reports 11,700 evacuated.  17,494 housing structures damaged, 1502 homes destroyed. #coflood",Government,Affected individuals,Related and informative,rt cherylpreheim heart wrenching coemergency reports 11 700 evacuated 17 494 housing structures damaged 1502 homes destroyed coflood,2,5
379381461561782273,#COFlood coverage continues on CH20 and live stream: http://t.co/bbpTYjr77F,Media,Caution and advice,Related and informative,coflood coverage continues ch20 live stream http co bbptyjr77f,2,4
379382791143571456,RT @OhMyJet: RT @KDVR: RT @CJose Viewer pic of Fairgrounds Park in Loveland. Railroad has shifted; heavy damage #COflood http://t.co/IBi2br…,Media,Infrastructure and utilities,Related and informative,rt ohmyjet rt kdvr rt cjose viewer pic fairgrounds park loveland railroad shifted heavy damage coflood http co ibi2br,2,3
379385865597775872,"Flooding Brings Tales of Rescues, Improvisation: Flooding in Colorado Rockies brings tales of rescues, improvi... http://t.co/MmggUh5W59",Media,Affected individuals,Related and informative,flooding brings tales rescues improvisation flooding colorado rockies brings tales rescues improvi http co mmgguh5w59,2,5
379385957843083264,"Flooding Brings Tales of Rescues, Improvisation: Flooding in Colorado Rockies brings tales of rescues, improvi... http://t.co/lxTmoXcI3u",Media,Affected individuals,Related and informative,flooding brings tales rescues improvisation flooding colorado rockies brings tales rescues improvi http co lxtmoxci3u,2,5
379387736253161472,RT @msnbcDisrupt: Pres. Obama has declared a state of emergency in Colorado after record flooding. To find out how you can  help go to: htt…,Media,Other Useful Information,Related and informative,rt msnbcdisrupt pres obama declared state emergency colorado record flooding find help go htt,2,2
379387966948257792,.RT @CUBoulderPolice: #BREAKING: Raw sewage flowing from pipe north of Space Sciences (East CU Campus) near footpaths. Avoid area. #COflood,Government,Other Useful Information,Related and informative,rt cuboulderpolice breaking raw sewage flowing pipe north space sciences east cu campus near footpaths avoid area coflood,2,2
379388977775513600,Amen. #boulderflood #hope #love http://t.co/qhfG21EXXT,Outsiders,Sympathy and support,Related - but not informative,amen boulderflood hope love http co qhfg21exxt,1,1
379388998742843392,Concerned family and friends use social media to spread word about #BoulderFlood unaccounted for: There are re... http://t.co/0o8YmosQ2Z,Outsiders,Affected individuals,Related - but not informative,concerned family friends use social media spread word boulderflood unaccounted http co 0o8ymosq2z,1,5
379391708271620096,"RT @breakingstorm: 5 people confirmed dead in Colorado flooding, and 1,254 people unaccounted for statewide, official says - @NBCNews http:…",Media,Affected individuals,Related and informative,rt breakingstorm 5 people confirmed dead colorado flooding 1 254 people unaccounted statewide official says nbcnews http,2,5
379393608278736897,"@TheStalwart @PIMCO I live in Boulder, Colorado.  This is trivia compared to what we're dealing with here.  #BoulderFlood",Eyewitness,Other Useful Information,Related - but not informative,thestalwart pimco live boulder colorado trivia compared dealing boulderflood,1,2
379396951113859072,RT @anthonywx: BEFORE &amp; AFTER FLOOD: Big Thompson Canyon entr. (Photographers not known) #boulderflood #coflood http://t.co/TSlVL6fW0I,Outsiders,Sympathy and support,Related and informative,rt anthonywx amp flood big thompson canyon entr photographers known boulderflood coflood http co tslvl6fw0i,2,1
379399283163664384,Interesting holiday experience: buying bottled water in Colorado because maybe the tap water is contaminated by the enormous floods.,Eyewitness,Affected individuals,Related - but not informative,interesting holiday experience buying bottled water colorado maybe tap water contaminated enormous floods,1,5
379404760924688385,"RT @jaredpolis: Well, at least we're not being over-run by Herpes infested monkeys #coloradoflood #boulderflood  http://t.co/Bu4a1KyOhm",Not labeled,Not labeled,Not related,rt jaredpolis well least run herpes infested monkeys coloradoflood boulderflood http co bu4a1kyohm,0,0
379406849671319553,"RT @BrianBledsoe: 11,700 people evacuated, 17,494 homes damaged, 1,502 homes destroyed, 1,253 people unaccounted for...#cowx #coflood",Media,Affected individuals,Related and informative,rt brianbledsoe 11 700 people evacuated 17 494 homes damaged 1 502 homes destroyed 1 253 people unaccounted cowx coflood,2,5
379409471140675585,"RT @SaraMegibow: ...is wet. Evacuations north, west and east of us. Still raining. Roads are shredded. #coloradoflood",Eyewitness,Infrastructure and utilities,Related and informative,rt saramegibow wet evacuations north west east us still raining roads shredded coloradoflood,2,3
379410108675289088,RT @BoulderRelief: Can you help with long-term housing of #BoulderFlood victims? Please let us know: boulderfloodrelief at gmail dot com,NGOs,Donations and volunteering,Related and informative,rt boulderrelief help long term housing boulderflood victims please let us know boulderfloodrelief gmail dot com,2,6
379410586817527808,RT @realstevem: Does anyone know of some vacant warehouse space near central Boulder for @Boulderrelief Flood relief efforts? #boulderflood,Outsiders,Donations and volunteering,Related and informative,rt realstevem anyone know vacant warehouse space near central boulder boulderrelief flood relief efforts boulderflood,2,6
379411652178755585,"RT @9NEWS: Colorado floods: 11,700 evacuated  #9NEWSHeadlines http://t.co/Nk0Lyf8Jls",Media,Affected individuals,Related and informative,rt 9news colorado floods 11 700 evacuated 9newsheadlines http co nk0lyf8jls,2,5
379411664765865984,RT @denverpost: FORECAST: More showers for Colorado's Front Range on Monday http://t.co/jCQdMnGJVY via @lynn_bartels #Cowx #coflood,Not labeled,Not labeled,Not related,rt denverpost forecast showers colorado front range monday http co jcqdmngjvy via lynn_bartels cowx coflood,0,0
379412537185275904,#climate Colorado floods: rescuers rush to evacuate stranded communities: AP http://t.co/s89lZOd0L2 *death VIDEO: http://t.co/zYLDxRiafn,Media,Donations and volunteering,Related and informative,climate colorado floods rescuers rush evacuate stranded communities ap http co s89lzod0l2 death video http co zyldxriafn,2,6
379412612653387776,Flooding at Cactus Jacks in #Evergreen #COFlood #cowx photo by @crossroads2007 http://t.co/K7K8g67utf,Media,Other Useful Information,Related and informative,flooding cactus jacks evergreen coflood cowx photo crossroads2007 http co k7k8g67utf,2,2
379414286185267200,RT @EI_Climate: #climate Colorado floods: rescuers rush to evacuate stranded communities: AP http://t.co/s89lZOd0L2 *death VIDEO: http://t.…,Media,Donations and volunteering,Related and informative,rt ei_climate climate colorado floods rescuers rush evacuate stranded communities ap http co s89lzod0l2 death video http,2,6
379415850660687872,Colorado flooding turns deadly http://t.co/90EKnRAsgM,Media,Affected individuals,Related and informative,colorado flooding turns deadly http co 90eknrasgm,2,5
379416379150987264,New look at the St Vrain in #Longmont via @Dougherty7NEWS Look how high river is flowing at Hover/3rd. http://t.co/xYbdNxy5Hl,Media,Other Useful Information,Related and informative,new look st vrain longmont via dougherty7news look high river flowing hover 3rd http co xybdnxy5hl,2,2
379416429482606593,"RT @9NEWS: Colorado floods: 11,700 evacuated http://t.co/f2FGpQYOiC #9NEWS",Media,Affected individuals,Related and informative,rt 9news colorado floods 11 700 evacuated http co f2fgpqyoic 9news,2,5
379421118697725953,"Rain is still pouring down in #Colorado. 500 unaccounted for by the #floods, hopefully rescue efforts are successful.",Outsiders,Affected individuals,Related and informative,rain still pouring colorado 500 unaccounted floods hopefully rescue efforts successful,2,5
379422980998045696,"RT @AccuracyInMedia: Colorado Floods Rise, Many Feared Dead or Missing! Please Retweet if you wish the best for those affected! http://t.co…",Media,Affected individuals,Related and informative,rt accuracyinmedia colorado floods rise many feared dead missing please retweet wish best affected http co,2,5
