360387790766219264,"RT @UltimaHoracom: [VIDEO] Impactante video del descarrilamiento de tren en Santiago de Compostela, España http://t.co/r7uQapBvOh",Media,Other Useful Information,Related and informative,rt ultimahoracom video impactante video del descarrilamiento de tren en santiago de compostela españa http co r7uqapbvoh,1,1,2023-01-20 08:00:00
360387824329039872,Que punteria @RandazzoF ir a españa a los talleres de la renfe y q descarrile un tren. #yeta,Outsiders,Other Useful Information,Related - but not informative,que punteria randazzof ir españa los talleres de la renfe q descarrile un tren yeta,2,1,2023-01-20 09:00:00
360387824350015488,RT @OroNoticias: Aquí un video del momento exacto en que el tren Alvia 730 se descarrila cerca de Santiago de Compostela http://t.co/69ZzoK…,Media,Other Useful Information,Related and informative,rt oronoticias aquí un video del momento exacto en que el tren alvia 730 se descarrila cerca de santiago de compostela http co 69zzok,1,1,2023-01-20 10:00:00
360388067594469376,RT @CP24: VIDEO: Spain train derailment caught on tape at moment of impact. WARNING: Video may be disturbing to some viewers. http://t.co/Z…,Media,Other Useful Information,Related and informative,rt cp24 video spain train derailment caught tape moment impact warning video may disturbing viewers http co z,1,1,2023-01-20 11:00:00
360388298285395969,"Video: Así fue el descarrilamiento del tren en Galicia, España http://t.co/QntyWiBlX7",Outsiders,Other Useful Information,Related and informative,video así fue el descarrilamiento del tren en galicia españa http co qntywiblx7,1,1,2023-01-20 12:00:00
360388302492278784,RT @Violater92: RIP to the 77 people who were killed this morning in a big train disaster in Spain,Outsiders,Sympathy and support,Related - but not informative,rt violater92 rip 77 people killed morning big train disaster spain,2,3,2023-01-20 13:00:00
360388549964611586,Vamos a intentar que todo españa guarde un minuto a las 20:00 de silencio por los afectados en el dramatico acidente de tren  en santiago.,Outsiders,Sympathy and support,Related - but not informative,vamos intentar que todo españa guarde un minuto las 20 00 de silencio por los afectados en el dramatico acidente de tren en santiago,2,3,2023-01-20 14:00:00
360389015523962880,"Así fue el accidente de tren en España con 80 muertos, 130 heridos y hay 20 muy graves  http://t.co/5ucUIZkNkb",Media,Affected individuals,Related and informative,así fue el accidente de tren en españa con 80 muertos 130 heridos hay 20 muy graves http co 5ucuizknkb,1,2,2023-01-20 15:00:00
360389221049044993,RT @Todo__LigaBBVA: Cristiano Ronaldo viajará a Santiago de Compostela para donar sangre por lo ocurrido en el accidente de tren ¡Grandísim…,Media,Donations and volunteering,Related - but not informative,rt todo__ligabbva cristiano ronaldo viajará santiago de compostela para donar sangre por lo ocurrido en el accidente de tren grandísim,2,4,2023-01-20 16:00:00
360389678228193280,Cristiano Ronaldo viajará a Santiago de Compostela para donar sangre por lo ocurrido en el accidente de tren ¡Grandísimo detalle! Chapeau,Outsiders,Donations and volunteering,Related and informative,cristiano ronaldo viajará santiago de compostela para donar sangre por lo ocurrido en el accidente de tren grandísimo detalle chapeau,1,4,2023-01-20 17:00:00
360389980192911361,RT @CNN: 78 dead after train derails and splits apart in Spain - video released of the crash: http://t.co/oQuOQ9L3v4,Media,Affected individuals,Related and informative,rt cnn 78 dead train derails splits apart spain video released crash http co oquoq9l3v4,1,2,2023-01-20 18:00:00
360390114435796993,SON AL MENOS 78 LOS MUERTOS TRAS EL ACCIDENTE DE TREN EN ESPAÑA: Agencia Noticias: En el lugar del siniestro en... http://t.co/GfLhy81R3K,Media,Affected individuals,Related and informative,son al menos 78 los muertos tras el accidente de tren en españa agencia noticias en el lugar del siniestro en http co gflhy81r3k,1,2,2023-01-20 19:00:00
360390718407184384,RT @M0tivacionesF: Cristiano Ronaldo viajará a Santiago de Compostela para donar sangre por lo ocurrido en el accidente de tren.,Media,Donations and volunteering,Related and informative,rt m0tivacionesf cristiano ronaldo viajará santiago de compostela para donar sangre por lo ocurrido en el accidente de tren,1,4,2023-01-20 20:00:00
360390789710356480,"RT @_CapitalDF: Estudiante mexicana, entre pasajeros de tren que se descarriló en España http://t.co/6f4IVCDYW0 #YOLANDADELFINORTEGA http:/…",Media,Affected individuals,Related and informative,rt _capitaldf estudiante mexicana entre pasajeros de tren que se descarriló en españa http co 6f4ivcdyw0 yolandadelfinortega http,1,2,2023-01-20 21:00:00
360390831674376192,RT @guardianworld: Spain's Rajoy includes reference to China earthquake in cut &amp; paste message of condolence to train crash victims http:…,Media,Other Useful Information,Related - but not informative,rt guardianworld spain rajoy includes reference china earthquake cut amp paste message condolence train crash victims http,2,1,2023-01-20 22:00:00
360390982631563264,"After a terrible train accident last night, this was the line to donate blood at 2am in Santiago de Compostela,... http://t.co/ErHEaxhTrK",Eyewitness,Donations and volunteering,Related and informative,terrible train accident last night line donate blood 2am santiago de compostela http co erheaxhtrk,1,4,2023-01-20 23:00:00
360391016223752196,Seen that train derail in Spain. Not cool!,Outsiders,Other Useful Information,Related - but not informative,seen train derail spain cool,2,1,2023-01-21 00:00:00
360391691477319680,RT @InfoLigaBBVA: Cristiano Ronaldo viajará a Santiago de Compostela para donar sangre por lo ocurrido en el accidente de tren.,Outsiders,Donations and volunteering,Related and informative,rt infoligabbva cristiano ronaldo viajará santiago de compostela para donar sangre por lo ocurrido en el accidente de tren,1,4,2023-01-21 01:00:00
360393176252547072,España: 36 de los heridos están en estado critico tras accidente de tren #Internacional,Eyewitness,Affected individuals,Related and informative,españa 36 de los heridos están en estado critico tras accidente de tren internacional,1,2,2023-01-21 02:00:00
360393591509618691,RT @Cristiano: Es con gran tristeza que me enteré de la noticia del accidente de tren en España. #animogalicia,Outsiders,Sympathy and support,Related - but not informative,rt cristiano es con gran tristeza que enteré de la noticia del accidente de tren en españa animogalicia,2,3,2023-01-21 03:00:00
360393969005375490,Momentos en que se descarrila el tren en Santiago de Compostela,Outsiders,Other Useful Information,Related and informative,momentos en que se descarrila el tren en santiago de compostela,1,1,2023-01-21 04:00:00
360394979815858176,"“@UltimaHoracom: Impactante video del descarrilamiento de tren en Santiago de Compostela, España http://t.co/CTvsXKM6Bh” @DarwinWarkentin",Media,Other Useful Information,Related and informative,ultimahoracom impactante video del descarrilamiento de tren en santiago de compostela españa http co ctvsxkm6bh darwinwarkentin,1,1,2023-01-21 05:00:00
360395156001800193,"RT @guardian: Train crash in Santiago de Compostela, Spain: seven days of mourning declared for victims http://t.co/81b205OECP",Media,Other Useful Information,Related and informative,rt guardian train crash santiago de compostela spain seven days mourning declared victims http co 81b205oecp,1,1,2023-01-21 06:00:00
360396544303837184,RT @SIN24Horas: #VIDEO: Alta funcionaria dominicana entre los fallecidos durante accidente de tren ayer en #España. http://t.co/Mr26a1u3Jt,Media,Affected individuals,Related and informative,rt sin24horas video alta funcionaria dominicana entre los fallecidos durante accidente de tren ayer en españa http co mr26a1u3jt,1,2,2023-01-21 07:00:00
360396603007311872,RT @SandraBaierl: Spain Train CRASH Video http://t.co/zRCuaAJHIE,Outsiders,Other Useful Information,Related - but not informative,rt sandrabaierl spain train crash video http co zrcuaajhie,2,1,2023-01-21 08:00:00
360397517357195264,RT @patri97ronda: Vmos a intntar qe toda España guarde 1 min a las 8:0 de silencio por los afectados en el dramatico acidente de tren en sa…,Outsiders,Sympathy and support,Related - but not informative,rt patri97ronda vmos intntar qe toda españa guarde 1 min las 8 0 de silencio por los afectados en el dramatico acidente de tren en sa,2,3,2023-01-21 09:00:00
360398020694650881,RT @NoticiasCaracol: Este es el video del accidente de tren en España en el que murieron 78 personas http://t.co/YPGqhwICnP,Media,Affected individuals,Related and informative,rt noticiascaracol este es el video del accidente de tren en españa en el que murieron 78 personas http co ypgqhwicnp,1,2,2023-01-21 10:00:00
360398213611659264,RT @Cristiano: Es con gran tristeza que me enteré de la noticia del accidente de tren en España. #animogalicia,Outsiders,Sympathy and support,Related - but not informative,rt cristiano es con gran tristeza que enteré de la noticia del accidente de tren en españa animogalicia,2,3,2023-01-21 11:00:00
360398616281628674,RT @GMA: At least 77 dead in Spain train accident: http://t.co/ZTTvOGHszn,Media,Affected individuals,Related and informative,rt gma least 77 dead spain train accident http co zttvoghszn,1,2,2023-01-21 12:00:00
360398691795865600,RT @DavidJimenezTW: Al fin una cola en España de la que sentirse orgulloso: donantes de sangre tras el accidente de tren https://t.co/K2Rj9…,Outsiders,Donations and volunteering,Related - but not informative,rt davidjimeneztw al fin una cola en españa de la que sentirse orgulloso donantes de sangre tras el accidente de tren https co k2rj9,2,4,2023-01-21 13:00:00
360398733722136577,Todavía no ha sido confirmado @ElCaribeRD: Funcionaria dominicana murió en accidente de tren en España http://t.co/HjHXH3eeGv,Media,Affected individuals,Related and informative,todavía ha sido confirmado elcariberd funcionaria dominicana murió en accidente de tren en españa http co hjhxh3eegv,1,2,2023-01-21 14:00:00
360398826005217281,"At least 80 people have died and 168 are injured after a train derailed near Santiago de Compostela, Spain http://t.co/s59MzuASu0",Media,Affected individuals,Related and informative,least 80 people died 168 injured train derailed near santiago de compostela spain http co s59mzuasu0,1,2,2023-01-21 15:00:00
360399413182603264,"78 dead after train derails, splits apart in Spain http://t.co/CUQUrv4SIf - #pray",Media,Affected individuals,Related and informative,78 dead train derails splits apart spain http co cuqurv4sif pray,1,2,2023-01-21 16:00:00
360399723594645508,Vídeo inédito del momento del accidente de Tren de Santiago de Compostela http://t.co/HoL1Qkv18A 今朝？のスペインの列車事故。11秒ながら悪夢のような映像(´Д` ),Media,Other Useful Information,Related and informative,vídeo inédito del momento del accidente de tren de santiago de compostela http co hol1qkv18a 今朝 のスペインの列車事故 11秒ながら悪夢のような映像 д,1,1,2023-01-21 17:00:00
360399849407004672,RT @guardianworld: Spain's Rajoy includes reference to China earthquake in cut &amp; paste message of condolence to train crash victims http:…,Media,Other Useful Information,Related and informative,rt guardianworld spain rajoy includes reference china earthquake cut amp paste message condolence train crash victims http,1,1,2023-01-21 18:00:00
360399853609680896,"RT @soydelbierzo: Están buscando a esta chica, iba en el tren y está sola en España. Si sabes algo contacta con @Luisledesma8 http://t.co/A…",Outsiders,Affected individuals,Related - but not informative,rt soydelbierzo están buscando esta chica iba en el tren está sola en españa si sabes algo contacta con luisledesma8 http co,2,2,2023-01-21 19:00:00
360400122045153284,@NiallOfficial 80 people die in a train accident in Spain! Pray for all the victims and families! #animogalicia x4,Outsiders,Affected individuals,Related and informative,niallofficial 80 people die train accident spain pray victims families animogalicia x4,1,2,2023-01-21 20:00:00
360400994447798272,Funcionaria dominicana que falleció en accidente de tren en España iba a visitar  familiares. Video del accidente en: http://t.co/nlCtWbgHDb,Media,Affected individuals,Related and informative,funcionaria dominicana que falleció en accidente de tren en españa iba visitar familiares video del accidente en http co nlctwbghdb,1,2,2023-01-21 21:00:00
360401615217369088,"RT @BBCBreaking: Dramatic video of moment train crashed in #Galicia, Spain (warning: disturbing images) http://t.co/e10AT8W7Ji http://t.co/…",Media,Other Useful Information,Related and informative,rt bbcbreaking dramatic video moment train crashed galicia spain warning disturbing images http co e10at8w7ji http co,1,1,2023-01-21 22:00:00
360401908797673472,@NiallOfficial spain train crush. 80 people have died.,Media,Affected individuals,Related and informative,niallofficial spain train crush 80 people died,1,2,2023-01-21 23:00:00
360402093351243778,RT @AP: RAW VIDEO: Security footage of a train derailment in Spain suggests it went too fast around a turn: http://t.co/azqmIr93YE -MM,Media,Other Useful Information,Related and informative,rt ap raw video security footage train derailment spain suggests went fast around turn http co azqmir93ye mm,1,1,2023-01-22 00:00:00
360402760274944000,* Cinco estadounidenses figuran entre los heridos de accidente de tren ocurrido en Santiago de Compostela.,Outsiders,Affected individuals,Related and informative,cinco estadounidenses figuran entre los heridos de accidente de tren ocurrido en santiago de compostela,1,2,2023-01-22 01:00:00
360404911931928577,RT @_PullMyStrings_: Toda nuestra solidaridad con las familias de las víctimas del accidente del tren de Santiago de Compostela #ÁnimoSanti…,Outsiders,Sympathy and support,Related - but not informative,rt _pullmystrings_ toda nuestra solidaridad con las familias de las víctimas del accidente del tren de santiago de compostela ánimosanti,2,3,2023-01-22 02:00:00
360404970668961792,que todo españa guarde 5 minuto a las 20:00 de silencio por los afectados en el dramatico acidente de tren  en santiago porfavor pasarlo!,Outsiders,Sympathy and support,Related - but not informative,que todo españa guarde 5 minuto las 20 00 de silencio por los afectados en el dramatico acidente de tren en santiago porfavor pasarlo,2,3,2023-01-22 03:00:00
360405721453576194,Más víctimas por el descarrilamiento del tren en España | El Diario de Buenos Aires http://t.co/w8WapJZEiN,Media,Affected individuals,Related and informative,más víctimas por el descarrilamiento del tren en españa el diario de buenos aires http co w8wapjzein,1,2,2023-01-22 04:00:00
360406006645260289,“@cnni: Spain's deadly train crash: Watch shocking video of the moment of impact: http://t.co/2y8hCe2AmE” God bless these poor people :'(,Media,Sympathy and support,Related and informative,cnni spain deadly train crash watch shocking video moment impact http co 2y8hce2ame god bless poor people,1,3,2023-01-22 05:00:00
360407378195255298,Autoridades concluyen búsqueda de víctimas del tren accidentado en España   http://t.co/5wrYfKezuZ,Government,Other Useful Information,Related and informative,autoridades concluyen búsqueda de víctimas del tren accidentado en españa http co 5wryfkezuz,1,1,2023-01-22 06:00:00
360407504024379392,:( @el_pais: VÍDEO: Así descarriló el tren de Santiago de Compostela http://t.co/chQiplbkBc #galiciadeluto #animogalicia,Media,Other Useful Information,Related and informative,el_pais vídeo así descarriló el tren de santiago de compostela http co chqiplbkbc galiciadeluto animogalicia,1,1,2023-01-22 07:00:00
360407944401125376,Re: Spain Train Crash Kills and Injures Dozens &amp; Video Footage of crash It certainly will evoke the Madrid bomb... http://t.co/PgHvA5FHcG,Media,Other Useful Information,Related and informative,spain train crash kills injures dozens amp video footage crash certainly evoke madrid bomb http co pghva5fhcg,1,1,2023-01-22 08:00:00
360408087036833792,Argentina firma acuerdo con España para mejorar sus trenes. Al otro día descarrila un tren en España. 78 muertos. No hay remate. Mufados.,Outsiders,Other Useful Information,Related - but not informative,argentina firma acuerdo con españa para mejorar sus trenes al otro día descarrila un tren en españa 78 muertos hay remate mufados,2,1,2023-01-22 09:00:00
360408091218542592,Train crash in Spain leaves 78 dead:   Train crash in Spain leaves 78 dead  At least 78 people were k... http://t.co/BmOwwhyhsl #euwatch,Media,Affected individuals,Related and informative,train crash spain leaves 78 dead train crash spain leaves 78 dead least 78 people k http co bmowwhyhsl euwatch,1,2,2023-01-22 10:00:00
360409202692341761,RT @rauldemolina: Mariano Rajoy decreta tres días de luto oficial en España tras accidente de tren en Santiago de Compostela http://t.co/Lb…,Outsiders,Other Useful Information,Related and informative,rt rauldemolina mariano rajoy decreta tres días de luto oficial en españa tras accidente de tren en santiago de compostela http co lb,1,1,2023-01-22 11:00:00
360410591036325889,I wanna show my support to all the families of the victims of the train accident that took place yesterday night in Santiago de Compostela.,Outsiders,Sympathy and support,Related - but not informative,wan na show support families victims train accident took place yesterday night santiago de compostela,2,3,2023-01-22 12:00:00
360410842690367491,Me voy enterando del accidente de tren en España #MalPlan y condolencias a toda la sociedad española. Aquí la nota: http://t.co/50TSe03srJ,Outsiders,Sympathy and support,Related - but not informative,voy enterando del accidente de tren en españa malplan condolencias toda la sociedad española aquí la nota http co 50tse03srj,2,3,2023-01-22 13:00:00
360411471819177985,RT @AixinaEs: no és trajecte→trayecte El tren que descarrilà ahir a pocs quilómetros de Santiago de Compostela cobria el trayecte  Madr…,Outsiders,Other Useful Information,Related and informative,rt aixinaes és trajecte trayecte el tren que descarrilà ahir pocs quilómetros de santiago de compostela cobria el trayecte madr,1,1,2023-01-22 14:00:00
360411933209399297,RT @LuciaPinedaUbau: Impactantes magenes del descarrilamiento de tren en #España http://t.co/3MPG85jH9O,Outsiders,Other Useful Information,Related and informative,rt luciapinedaubau impactantes magenes del descarrilamiento de tren en españa http co 3mpg85jh9o,1,1,2023-01-22 15:00:00
360412671394316288,RT @Papitoelmioo: Vamos a intentar que toda españa guarde un minuto de silencio a las 20:00 por las víctimas de el accidente de tren.Pasalo…,Outsiders,Sympathy and support,Related - but not informative,rt papitoelmioo vamos intentar que toda españa guarde un minuto de silencio las 20 00 por las víctimas de el accidente de tren pasalo,2,3,2023-01-22 16:00:00
360412772040843265,Video of a train derailing in Spain. Holy shitttt... http://t.co/tLPk2Ip8Wg,Media,Other Useful Information,Related and informative,video train derailing spain holy shitttt http co tlpk2ip8wg,1,1,2023-01-22 17:00:00
360414160389033984,"78 dead, 178 hurt after train derailment in Spain http://t.co/TjvTYXf2BO #KSATnews http://t.co/TC4xN1U3hu",Media,Affected individuals,Related and informative,78 dead 178 hurt train derailment spain http co tjvtyxf2bo ksatnews http co tc4xn1u3hu,1,2,2023-01-22 18:00:00
360414248448434177,Spain train crash: Death toll rises to 60 http://t.co/A4lbeUtIa7,Media,Other Useful Information,Related and informative,spain train crash death toll rises 60 http co a4lbeutia7,1,1,2023-01-22 19:00:00
360415368327610368,Todo mi apoyo a las familias del accidente del tren de santiago de compostela (galicia) D.E.P,Outsiders,Sympathy and support,Related - but not informative,todo mi apoyo las familias del accidente del tren de santiago de compostela galicia e p,2,3,2023-01-22 20:00:00
360415502541127680,Al menos 80 muertos tras descarrilar tren de pasajeros cerca de Santiago de Compostela  Texto completo en: http://t.co/GfrgiO6X7M,Media,Affected individuals,Related and informative,al menos 80 muertos tras descarrilar tren de pasajeros cerca de santiago de compostela texto completo en http co gfrgio6x7m,1,2,2023-01-22 21:00:00
360415653531885569,"RT @CNNMex: Testigos relatan cómo fue el descarrilamiento en #España: el tren se quebró a la mitad, fue muy impactante http://t.co/ZlCwbm…",Media,Other Useful Information,Related and informative,rt cnnmex testigos relatan cómo fue el descarrilamiento en españa el tren se quebró la mitad fue muy impactante http co zlcwbm,1,1,2023-01-22 22:00:00
360416920245256196,RT @KT15203F: スペイン脱線事故の瞬間の映像。こんな映像見たこと無い　Raw Footage: Spain Train CRASH Near Santiago De Compostela | Accidente T...: http://t.co/kgNYkdNfho,Media,Other Useful Information,Related and informative,rt kt15203f スペイン脱線事故の瞬間の映像 こんな映像見たこと無い raw footage spain train crash near santiago de compostela accidente http co kgnykdnfho,1,1,2023-01-22 23:00:00
360418178502889472,"Dramatic video of moment train crashed in #Galicia, Spain (warning: disturbing images) http://t.co/4SDsk59Crk http://t.co/XMpIKDPUSi”",Outsiders,Other Useful Information,Related and informative,dramatic video moment train crashed galicia spain warning disturbing images http co 4sdsk59crk http co xmpikdpusi,1,1,2023-01-23 00:00:00
360418254004559873,RT @GamboaStore: Mis Condolencias a los Familiares del Accidente de Tren en España Galicia.. Has RT para dar  #ÁnimoAespaña,Outsiders,Sympathy and support,Related - but not informative,rt gamboastore mis condolencias los familiares del accidente de tren en españa galicia rt para dar ánimoaespaña,2,3,2023-01-23 01:00:00
360420040786464768,"80 killed, over 140 injured in Spain's worst train crash yesterday. #PrayForSpain http://t.co/uRtaAJN4Jg",Outsiders,Affected individuals,Related and informative,80 killed 140 injured spain worst train crash yesterday prayforspain http co urtaajn4jg,1,2,2023-01-23 02:00:00
360420560867569666,RT @M0tivacionesF: Cristiano Ronaldo viajará a Santiago de Compostela para donar sangre por lo ocurrido en el accidente de tren.,Outsiders,Donations and volunteering,Related and informative,rt m0tivacionesf cristiano ronaldo viajará santiago de compostela para donar sangre por lo ocurrido en el accidente de tren,1,4,2023-01-23 03:00:00
360422330863853568,Three days of mourning after Spain train crash. 78 people died. http://t.co/5RkvqULnm6,Media,Affected individuals,Related and informative,three days mourning spain train crash 78 people died http co 5rkvqulnm6,1,2,2023-01-23 04:00:00
360422825812705280,@thalia una oracion para los 78 fallecidos en el descarrilamiento de tren ayer en Santiago (España) 🙏,Outsiders,Other Useful Information,Related and informative,thalia una oracion para los 78 fallecidos en el descarrilamiento de tren ayer en santiago españa,1,1,2023-01-23 05:00:00
360423488487571457,Vamos a intentar q todo España guarde un minuto d silencio a las 20:00 x los afectados en el dramatico acidente de tren en Santiago porfavor,Outsiders,Sympathy and support,Related - but not informative,vamos intentar q todo españa guarde un minuto silencio las 20 00 x los afectados en el dramatico acidente de tren en santiago porfavor,2,3,2023-01-23 06:00:00
360425317208309762,No automatic speed/positive train control? &gt;&gt; Spain train crash under investigation; death toll hits 80 http://t.co/G39eA6EKYx @NBCNewsWorld,Media,Affected individuals,Related and informative,automatic speed positive train control gt gt spain train crash investigation death toll hits 80 http co g39ea6ekyx nbcnewsworld,1,2,2023-01-23 07:00:00
360425359151333379,RT @el_pais: VÍDEO: Así descarriló el tren de Santiago de Compostela http://t.co/gTgo5EjuTl  #galiciadeluto #animogalicia   #AccidenteSanti…,Media,Other Useful Information,Related and informative,rt el_pais vídeo así descarriló el tren de santiago de compostela http co gtgo5ejutl galiciadeluto animogalicia accidentesanti,1,1,2023-01-23 08:00:00
360426055439360000,Spain crash driver faces probe: One of the drivers of a train which derailed in north-western Spain killing at... http://t.co/JXQNexjdLP,Media,Other Useful Information,Related and informative,spain crash driver faces probe one drivers train derailed north western spain killing http co jxqnexjdlp,1,1,2023-01-23 09:00:00
360426537771737088,RT @MinETSII: Queremos mandar toda la fuerza y apoyo del mundo a las víctimas del accidente de tren en Santiago de Compostela. #animogalicia,Outsiders,Sympathy and support,Related - but not informative,rt minetsii queremos mandar toda la fuerza apoyo del mundo las víctimas del accidente de tren en santiago de compostela animogalicia,2,3,2023-01-23 10:00:00
360427137540423681,RT @hesham786: Cristiano Ronaldo went out of his way to travel to Spain to donate blood for the train accident victims. What a man. #VivaRo…,Outsiders,Donations and volunteering,Related - but not informative,rt hesham786 cristiano ronaldo went way travel spain donate blood train accident victims man vivaro,2,4,2023-01-23 11:00:00
360427359846932482,RT @servusimaculata: Let us pray for the victims of the train crash in Spain on this feast of Saint James the Apostle who first evangelized…,Outsiders,Sympathy and support,Related - but not informative,rt servusimaculata let us pray victims train crash spain feast saint james apostle first evangelized,2,3,2023-01-23 12:00:00
360427678609842177,Spain train crash: 'No words for what I saw' - CNN,Media,Other Useful Information,Related and informative,spain train crash words saw cnn,1,1,2023-01-23 13:00:00
